label,tweet,perturbed_text,perturbed_semantic_sim,pred_label,pred_proba,perturbed_label,perturbed_proba,translated_word(s),adv_pred,adv_pred_on_orig,running_time(s),before_attack_acc,after_attack_acc,avg_semantic_sim,avg_running_time(s),adv_training,delta_acc,delta_adv,acc_adv_training_on_orig,best_epoch
4,"Tapi walopun doi buka sekolah, isi video ignya tuh pengetahuan buat modelling semua. Wonder hasn't she think about all the pro model that could look into her profile instead and stole all the knowledge? Emang beda lah ya kalo orang humble","Tapi walopun doi buka sekolah, isi video ignya tuh pengetahuan buat modelling semua. Wonder hasn't she think about all the pro model that could look into her profile instead and stole all the knowledge? Emang beda lah ya kalo orang humble",1.0,0,[0.5569 0.4019 0.0022 0.0209 0.018 ],0,[0.5569 0.4019 0.0022 0.0209 0.018 ],,0,0,0.02,,,,,,,,,
4,"Saat itu, kami selalu optimis akan bisa bersaing dgn tim manapun, melihat persiapan dan panjangnya perjalanan yg sudah kami lalui. Terlebih melihat hasil pertandingan hari pertama dan kedua yang baru saja kami jalani.",Saat kami selalu optimis akan bisa bersaing dgn tim melihat persiapan dan panjangnya perjalanan quale sudah kami Terlebih melihat risultati pertandingan hari pertama dan kedua yang baru saja kami,0.9608383178710938,4,[0.0304 0.0026 0.0123 0.0095 0.9453],4,[0.0684 0.0046 0.0096 0.0193 0.8981],"{'optimis': 'optimis', 'tim': 'tim', 'dgn': 'dgn', 'yg': 'quale', 'bersaing': 'bersaing', 'persiapan': 'persiapan', 'saat': 'saat', 'hasil': 'risultati', 'perjalanan': 'perjalanan'}",4,4,0.0851,,,,,,,,,
3,Jadi gue ga berani masuk dari gerbang rumah plz itu serem bgt diliatin ayam jago nya gede bgt,Jadi io ga coraggioso masuk dari gerbang rumah plz itu allarmante grande diliatin pollo jago nya gede grande,0.840772271156311,3,[0.0093 0.011  0.0061 0.9685 0.005 ],1,[0.0197 0.9125 0.0017 0.0624 0.0038],"{'serem': 'allarmante', 'bgt': 'grande', 'gerbang': 'gerbang', 'ayam': 'pollo', 'masuk': 'masuk', 'jago': 'jago', 'diliatin': 'diliatin', 'gue': 'io', 'berani': 'coraggioso', 'ga': 'ga', 'plz': 'plz'}",1,3,0.0697,,,,,,,,,
0,"Cemburu melihat dia tengah bahagia dan membahagiakan kekasihnya, itu rasa yang salah. Kamu cukup paham, beberapa perasaan terpaksa harus kau sudahi sendiri",Cemburu melihat dia tengah bahagia dan membahagiakan itu rasa yang Kamu cukup beberapa sensazione costretto harus kau sudahi sendiri,0.9405653476715088,0,[0.948  0.0143 0.0151 0.0196 0.003 ],0,[0.9275 0.0163 0.032  0.0178 0.0064],"{'cemburu': 'cemburu', 'sudahi': 'sudahi', 'kau': 'kau', 'perasaan': 'sensazione', 'terpaksa': 'costretto', 'kamu': 'voi'}",0,0,0.0708,,,,,,,,,
0,"Di Dm Marco Simic pake kata-kata senonoh marah, tapi aku ngeDm udah lama minta kenalan aja gapernah dibalas, duh mbak Via Vallen mah gitu orangnya huhu","Di Dm Marco Simic pake kata-kata senonoh marah, tapi aku ngeDm udah lama minta kenalan aja gapernah dibalas, duh mbak Via Vallen mah gitu orangnya huhu",1.0,1,[0.0253 0.9618 0.0014 0.0077 0.0037],1,[0.0253 0.9618 0.0014 0.0077 0.0037],,1,1,0.02,,,,,,,,,
2,"Sebenernya gue sayang, di stiap kali berpapasan.",Sebenernya gue di stiap kali,0.8391698002815247,2,[0.0104 0.0019 0.9773 0.0039 0.0065],0,[0.8818 0.026  0.0266 0.0378 0.0277],{'stiap': 'stiap'},0,2,0.0532,,,,,,,,,
4,"keinget dulu smnggu sblum kompre tiap malam nangis trus seminggu sblum ukmmpd nangis cemas takut, gak tau apa2, minder sama kawan2skrng doa sudah terjawab, terimakasih yesusku","keinget dulu smnggu sblum kompre tiap malam nangis trus seminggu sblum ukmmpd nangis cemas takut, gak tau apa2, minder sama kawan2skrng doa sudah terjawab, terimakasih yesusku",1.0,3,[0.0353 0.0043 0.0061 0.9493 0.005 ],3,[0.0353 0.0043 0.0061 0.9493 0.005 ],,3,3,0.02,,,,,,,,,
1,[USERNAME] [USERNAME] Sy ga krj krn hrs merawat ibu sy yg sdh pikun hanya jualan di rmh krn km hanya ber2.kl kln bl tega merampok cashback cmn sbgai uang mkn km jg ibu n anak buat apa kalian puasa?,Sy ga krj krn minerale merawat ibu sy quale Gi pikun hanya jualan di rmh krn km hanya kln bl tega merampok rimborsare cmn sbgai uang mkn km jg ibu n bambino buat apa kalian,0.8828438520431519,1,[0.143  0.8312 0.0022 0.0189 0.0047],1,[0.0812 0.8989 0.002  0.0138 0.0042],"{'tega': 'tega', 'rmh': 'rmh', 'cmn': 'cmn', 'cashback': 'rimborsare', 'mkn': 'mkn', 'km': 'km', 'uang': 'uang', 'jualan': 'jualan', 'anak': 'bambino', 'yg': 'quale', 'sy': 'sy', 'n': 'n', 'bl': 'bl', 'merawat': 'merawat', 'krn': 'krn', 'sdh': 'Gi', 'kln': 'kln', 'hrs': 'minerale'}",1,1,0.1055,,,,,,,,,
4,[USERNAME] [USERNAME] Ini price list yang ada dari facebook nya mereka. Web nya di [URL] semoga membantu :)) Anyway ini myday yang biasanya sering karaoke disana [USERNAME] :)) [URL],Ini price list yang ada dari Facebook nya Web nya di auspicabilmente membantu Anyway ini myday yang biasanya sering karaoke la,0.8451541662216187,4,[0.0199 0.0066 0.0074 0.0079 0.9583],4,[0.0966 0.0126 0.0102 0.0199 0.8608],"{'anyway': 'comunque', 'nya': 'nya', 'facebook': 'Facebook', 'web': 'web', 'karaoke': 'karaoke', 'myday': 'myday', 'disana': 'la', 'semoga': 'auspicabilmente', 'membantu': 'membantu'}",4,4,0.4225,,,,,,,,,
0,"Bukan ku menghindar atau tidak bijak dalam menyikapi masalah, namu hanya saja ingin menengankan pikiran sejenak dan tak ingin mementingkan ego tersendiri~",Bukan ku menghindar atau tidak bijak dalam affrontare namu hanya saja ingin calmante pikiran sejenak dan tak ingin mementingkan ego,0.978733777999878,0,[0.9588 0.0098 0.0078 0.0183 0.0053],0,[0.9536 0.0115 0.0087 0.0148 0.0114],"{'menengankan': 'calmante', 'bijak': 'bijak', 'menyikapi': 'affrontare', 'namu': 'namu', 'ego': 'ego', 'bukan': 'No'}",0,0,0.0841,,,,,,,,,
0,"[USERNAME] ya gimana ya lin, coba deh mbok pikir aja km sbnre msh sayang bgt sama mantanmu trs dia jg smpe dtk ini msh memperlakukan km sama seperti pas dia msh jd pacar mu, kan jd memupuk rasa lagi nek gt :(",S venire S coba deh mbok pensare aja km sbnre msh Metodo grande sama mantanmu trs dia jg smpe dtk ini msh memperlakukan km sama seperti pas dia msh jd fidanzato kan jd memupuk rasa lagi nek gt,0.9130744338035583,0,[0.8589 0.0472 0.0295 0.0612 0.0032],1,[0.3608 0.47   0.0074 0.1567 0.0051],"{'sayang': 'Metodo', 'msh': 'msh', 'gimana': 'venire', 'coba': 'coba', 'km': 'km', 'ya': 'S', 'pikir': 'pensare', 'nek': 'nek', 'aja': 'aja', 'pacar': 'fidanzato', 'pas': 'pas', 'bgt': 'grande', 'sbnre': 'sbnre', 'jd': 'jd'}",0,0,0.1206,,,,,,,,,
3,"Makin serem ya dunia ini... ga seindah yg gue bayangkan waktu kecil.. terlalu banyak org jahat, atau mungkin gue yg terlalu naif menganggap semua orang itu baik..",Makin serem S dunia ga seindah quale io bayangkan waktu terlalu banyak org atau mungkin io quale terlalu naif menganggap semua orang itu,0.8639672994613647,3,[0.0092 0.0061 0.0043 0.9774 0.0029],3,[0.195  0.0124 0.0081 0.7762 0.0083],"{'ya': 'S', 'makin': 'makin', 'seindah': 'seindah', 'yg': 'quale', 'gue': 'io', 'naif': 'naif', 'ga': 'ga', 'menganggap': 'menganggap', 'bayangkan': 'bayangkan', 'org': 'org'}",3,3,0.1331,,,,,,,,,
2,"Kau tak terganti, Kau yang selalu kunanti, Takkan ku lepas lagi. Pegang tanganku Bersama jatuh cinta Kali kedua pada yang sama Sama indahnya.. [URL]",Kau tak Kau yang selalu Takkan mio gratuito Pegang tanganku Bersama jatuh cinta Kali kedua pada yang sama Sama,0.9192799925804138,2,[0.0202 0.0018 0.9696 0.003  0.0054],2,[0.4619 0.0132 0.5011 0.0157 0.0081],"{'lepas': 'gratuito', 'sama': 'sama', 'ku': 'mio', 'pegang': 'pegang', 'kau': 'kau', 'takkan': 'takkan', 'kali': 'voltaico'}",2,2,0.2269,,,,,,,,,
1," ""Mka.a jgn ngatain org klu gmau dikatain...jaga tuh ocehanmu.. Giliran dikatain bla bla bla.."" dibaca tuh sapa yg ngatain",jgn ngatain org klu gmau tuh Giliran disse bla bla dibaca tuh sapa quale ngatain,0.8334154486656189,1,[0.0149 0.9554 0.0014 0.0244 0.0039],1,[0.0126 0.9571 0.0012 0.025  0.0041],"{'ngatain': 'ngatain', 'jgn': 'jgn', 'giliran': 'giliran', 'tuh': 'tuh', 'gmau': 'gmau', 'yg': 'quale', 'dikatain': 'disse', 'sapa': 'sapa', 'bla': 'bla', 'dibaca': 'dibaca', 'klu': 'klu'}",1,1,0.2113,,,,,,,,,
2,"Mbak mau bawa barang bapak apa? Baju bapak? Tapi nnt tdk bisa dipake Mbak kalo baju ya. Sarung bapak mau? Sarung aja ya, yg biasa bapak pake ke masjid. Biar kalo kangen bisa dipake. Ibu ambilkan. Bu, semoga bisa ketemu lagi secepatnya ya. Ada cinta bapak di senyum ibu.",Mbak mau portare barang bapak Baju Tapi nn tdk bisa logoro Mbak Se baju Sarung bapak Sarung aja quale biasa bapak pake ke Biar Se kangen bisa Ibu auspicabilmente bisa ketemu lagi secepatnya Ada cinta bapak di senyum,0.9221069812774658,2,[0.2534 0.0048 0.7034 0.0187 0.0197],2,[0.101  0.0095 0.8479 0.0134 0.0282],"{'sarung': 'sarung', 'pake': 'pake', 'aja': 'aja', 'mbak': 'Perdere', 'bawa': 'portare', 'semoga': 'auspicabilmente', 'biar': 'biar', 'yg': 'quale', 'barang': 'barang', 'baju': 'baju', 'tdk': 'tdk', 'kalo': 'Se', 'tapi': 'tapi', 'nnt': 'nn', 'dipake': 'logoro', 'ibu': 'ibu'}",2,0,0.2953,,,,,,,,,
2,"Aku bahagia bersama Pisces, dan mencintai dengan tulus. Mencintai dengan apa adanya. Dan hanya dengan Pisces ku tak ingin lepas, apapun yang terjadi. Bahkan dulu jika ku disebut 'bodoh' pun aku rela. hahaha. memang cinta membuat buta.",Aku bahagia bersama e mencintai dengan Mencintai dengan apa Dan hanya dengan Pisces mio tak ingin apapun yang Bahkan dulu jika mio disebut pun aku memang amore membuat,0.8530941009521484,2,[0.0123 0.0017 0.9694 0.0038 0.0128],2,[0.0173 0.0017 0.9661 0.003  0.0119],"{'cinta': 'amore', 'apapun': 'apapun', 'dan': 'e', 'bahkan': 'anche', 'ku': 'mio', 'bahagia': 'bahagia', 'pisces': 'Pesci'}",2,2,0.4946,,,,,,,,,
2,Penyemangat hidup aku adalah Ayah dan Ibu atau Keluargaku Terima kasih atas keluargaku Tak akan aku lupakan semua Dengan perkataan Keluargaku yang ku sayang,Penyemangat vita aku adalah Ayah dan Ibu atau Keluargaku Terima amore atas keluargaku Tak akan aku lupakan semua Dengan perkataan Keluargaku yang mio Metodo,0.9155002236366272,2,[0.0176 0.002  0.8869 0.0032 0.0902],4,[0.0489 0.0048 0.2616 0.0076 0.6771],"{'sayang': 'Metodo', 'perkataan': 'perkataan', 'ku': 'mio', 'tak': 'non', 'dengan': 'dengan', 'hidup': 'vita', 'keluargaku': 'keluargaku', 'lupakan': 'lupakan', 'kasih': 'amore', 'ayah': 'padre', 'ibu': 'ibu'}",2,2,0.2663,,,,,,,,,
0,"Iya aku baru ingat dia dulu pernah lelah menunggu aku yang menganggapnya hanya teman, dan saat ini aku yang lelah menunggumu untuk kembali memelukku lagi.",Iya aku baru ingat dia dulu pernah lelah aspettare aku yang menganggapnya hanya dan saat ini aku yang lelah menunggumu untuk kembali memelukku,0.9839184880256652,0,[0.528  0.0052 0.4458 0.0146 0.0063],0,[0.8278 0.0064 0.1435 0.0165 0.0057],"{'iya': 'S', 'menunggumu': 'menunggumu', 'menganggapnya': 'menganggapnya', 'lelah': 'lelah', 'menunggu': 'aspettare'}",0,2,0.0781,,,,,,,,,
4,"Haha ga sih, kalo ditanya kapan nikah sih aku bakal jawab ""yah nanti dulu om/tante/bude/pakde/mas/mbak, baru kerja juga kok ya mau nabung dulu, nyiapin bekal buat berkeluarga dl hehe""","Haha ga sih, kalo ditanya kapan nikah sih aku bakal jawab ""yah nanti dulu om/tante/bude/pakde/mas/mbak, baru kerja juga kok ya mau nabung dulu, nyiapin bekal buat berkeluarga dl hehe""",1.0,0,[0.4524 0.0091 0.2285 0.1028 0.2072],0,[0.4524 0.0091 0.2285 0.1028 0.2072],,0,0,0.02,,,,,,,,,
1,Kalau begal bagaimana pak polisi ? Terus pelaku nya kerusuhan tersebut apa hanya di bubarkan saja ? Kenapa tidak tembak mati saja. Agar jera tidak lakukan lagi.trims [URL],Kalau begal bagaimana pak polisi Terus autore nya kerusuhan tersebut apa hanya di disperdere saja Kenapa tidak ricambio mati Agar jera tidak lakukan,0.9650248289108276,1,[0.0214 0.9445 0.0013 0.028  0.0048],1,[0.0151 0.948  0.0012 0.0319 0.0038],"{'kenapa': 'perche', 'lakukan': 'lakukan', 'mati': 'mati', 'kalau': 'Se', 'agar': 'agar', 'tembak': 'ricambio', 'nya': 'nya', 'terus': 'Continuare', 'bubarkan': 'disperdere', 'polisi': 'polisi', 'pelaku': 'autore'}",1,1,0.0808,,,,,,,,,
4,duh sumpe ngakak hahaha jaman kalo ngetweet terus keliatan 'via blekberi' itu lo udah masuk kategori anak gaul tingkat international ya duh susah sih kalo knalpot dikasi nyawa mah begitu jadinya,duh sumpe ngakak hahaha jaman kalo ngetweet terus keliatan 'via blekberi' itu lo udah masuk kategori anak gaul tingkat international ya duh susah sih kalo knalpot dikasi nyawa mah begitu jadinya,1.0,0,[0.4215 0.1132 0.0063 0.416  0.043 ],0,[0.4215 0.1132 0.0063 0.416  0.043 ],,4,4,0.02,,,,,,,,,
2,"suka sama sifat protective-nya, bawelnya, manjanya, terus dia yg sayang banget sama Nako, cemburuan as always wkwk tapi ndapapa daddy Nako selalu sayang daddy kok ehehe",suka sama sifat terus dia quale Metodo molto sama cemburuan as spray wkwk tapi ndapapa daddy Nako selalu Metodo daddy kok ehehe,0.7800782918930054,2,[0.0155 0.0026 0.9483 0.0035 0.0302],2,[0.0286 0.0068 0.6384 0.006  0.3203],"{'always': 'spray', 'sayang': 'Metodo', 'nako': 'nako', 'daddy': 'daddy', 'banget': 'molto', 'as': 'as', 'sifat': 'sifat', 'suka': 'suka', 'yg': 'quale', 'ndapapa': 'ndapapa'}",2,2,0.0744,,,,,,,,,
4,"Nikmat dunia hanya sementara, Indahnya cinta hanya seketika, Indahnya mimpi itu belum pasti, Tetapi eratnya silaturahim, insyaallah dibawa sampai mati. Dari teman saya Prof. Rifai. Selamat malam tweeps. Jangan lupa berdoa sebelum tidur.","Nikmat dunia hanya sementara, Indahnya cinta hanya seketika, Indahnya mimpi itu belum pasti, Tetapi eratnya silaturahim, insyaallah dibawa sampai mati. Dari teman saya Prof. Rifai. Selamat malam tweeps. Jangan lupa berdoa sebelum tidur.",1.0,2,[0.0516 0.0021 0.6991 0.008  0.2392],2,[0.0516 0.0021 0.6991 0.008  0.2392],,2,2,0.02,,,,,,,,,
1,"Karena yang komen julid begichu 1. juga pengen di DM sama si pelaku 2. Uda pernah di DM dan hayuk hayuk aja diajak enak enak  3. Otaknya kagak dipake, bayangin aja anak ente yang kena begitu Udalaah, susah nanggepin otak isinya dengkul cebong",Karena yang komen Giulia begichu juga pengen di DM sama si autore Uda pernah di DM dan Dai Dai aja invito enak enak Otaknya non bayangin aja anak ente yang kena begitu susah nanggepin otak isinya ginocchio girino,0.8958711624145508,1,[0.1015 0.8635 0.0014 0.0294 0.0041],1,[0.1241 0.7948 0.0019 0.072  0.0072],"{'ente': 'ente', 'diajak': 'invito', 'begichu': 'begichu', 'nanggepin': 'nanggepin', 'pelaku': 'autore', 'kagak': 'non', 'dengkul': 'ginocchio', 'otaknya': 'otaknya', 'aja': 'aja', 'dm': 'dm', 'enak': 'enak', 'komen': 'komen', 'isinya': 'isinya', 'cebong': 'girino', 'bayangin': 'bayangin', 'julid': 'Giulia', 'hayuk': 'Dai', 'uda': 'uda', 'kena': 'kena'}",1,1,0.1096,,,,,,,,,
1,Fisik? Apa itu yg kalian cari? Apa Kalo lu mati ditanya seberapa ganteng lu atau seberapa ganteng muka pacar lu? #menyedihkan sekali nasib anda,Fisik? Apa itu yg kalian cari? Apa Kalo lu mati ditanya seberapa ganteng lu atau seberapa ganteng muka pacar lu? #menyedihkan sekali nasib anda,1.0,3,[0.092  0.0298 0.0091 0.8612 0.0079],3,[0.092  0.0298 0.0091 0.8612 0.0079],,3,3,0.02,,,,,,,,,
0,Jadi Agustus itu 1. Jadwal pulang karena teman menikah 2. Agenda jalan bareng sama rekan kantor Dua pilihan yang sama-sama ingin ikut tapi gimanaaaaaaaaa... Padahal jarang banget aku nemu waktu pas dan hati mau ikut.,Jadi Agustus itu Jadwal pulang karena teman spore Agenda Strada bareng sama rekan kantor Dua scelta yang ingin ikut tapi Padahal jarang molto aku nemu waktu pas dan cuore mau,0.9115587472915648,0,[0.9375 0.0073 0.0069 0.0272 0.0211],0,[0.8    0.0171 0.0095 0.0361 0.1373],"{'padahal': 'nonostante', 'pilihan': 'scelta', 'banget': 'molto', 'nemu': 'nemu', 'dua': 'dua', 'jalan': 'Strada', 'hati': 'cuore', 'kantor': 'kantor', 'pas': 'pas', 'menikah': 'spore', 'pulang': 'pulang', 'jadwal': 'jadwal', 'agenda': 'agenda', 'jarang': 'jarang', 'bareng': 'bareng'}",0,0,0.0881,,,,,,,,,
1,"Ini!!! Banyak yang bilang milih sopir mobil harus yang bener, karena bisa membawamu masuk jurang. Lah kamu mau disopirin sama orang yang hafal 30 jus apa sama orang yang punya SIM A dan jam terbang tinggi? [URL]",Banyak yang bilang milih sopir mobil harus yang karena bisa membawamu masuk Lah kamu mau disopirina sama orang yang hafal 30 jus apa sama orang yang punya SIM A dan minerale volare,0.969513773918152,1,[0.0221 0.9632 0.0011 0.0102 0.0033],1,[0.1179 0.8587 0.0014 0.016  0.006 ],"{'disopirin': 'disopirina', 'orang': 'orang', 'mobil': 'mobil', 'sim': 'sim', 'masuk': 'masuk', 'jus': 'jus', 'a': 'a', 'terbang': 'volare', 'jam': 'minerale', 'bilang': 'bilang', 'sopir': 'sopir', 'hafal': 'hafal'}",1,1,0.198,,,,,,,,,
0,Level kangen tertinggi cewek itu suka ngambek g jelas. Kalo sering2 ngambek berarti lagi kangen kangennya. Tapi sayang cowok itu kadang g peka.....,Level kangen tertinggi cewek itu suka ngambek g jelas. Kalo sering2 ngambek berarti lagi kangen kangennya. Tapi sayang cowok itu kadang g peka.....,1.0,2,[0.3844 0.0075 0.579  0.0242 0.005 ],2,[0.3844 0.0075 0.579  0.0242 0.005 ],,2,2,0.07,,,,,,,,,
0,Secret admirer mah gitu Instagram difollback doi aja langsung bikin pengumuman ke temen temen. Padahal mah doi emang begitu orangnya. Suka follback siapapun yang follow dia. Ampe olshop pun mungkin juga difollback :( [URL],Secret ammiratore mah gitu Instagram difollback doi aja langsung bikin pengumuman ke temen Padahal mah doi infatti begitu Suka follback siapapun yang follow Ampe olshop pun mungkin juga difollback,0.936883270740509,0,[0.7034 0.2127 0.0061 0.0686 0.0093],1,[0.0238 0.9617 0.0014 0.0083 0.0049],"{'emang': 'infatti', 'ampe': 'ampe', 'admirer': 'ammiratore', 'olshop': 'olshop', 'doi': 'doi'}",1,0,0.2814,,,,,,,,,
4,"Mencuci termos ala orang malas. Isi penuh dgn air mendidih. Tutup rapat 30 menit, buang airnya. Isi termos dgn air es. Termos dapat digunakan lagi seperti biasa",Mencuci termos ala orang Isi completare dgn air Tutup rapat 30 buang Isi termos dgn air Termos dapat digunakan lagi seperti biasa,0.943642795085907,4,[0.3473 0.0369 0.0347 0.0982 0.4829],4,[0.0506 0.0111 0.0098 0.0184 0.91  ],"{'orang': 'orang', 'isi': 'isi', 'termos': 'termos', 'dgn': 'dgn', 'tutup': 'tutup', 'ala': 'ala', 'rapat': 'rapat', 'buang': 'buang', 'penuh': 'completare', 'air': 'air'}",4,4,0.2295,,,,,,,,,
4,"Makasih yang udah kasih info buat ini. Lemah teles, Gusti Allah sing mbales. Kayanya mau ke Musium BI atau PRJ aja sesuai info [USERNAME] [URL]","Makasih yang udah kasih info buat ini. Lemah teles, Gusti Allah sing mbales. Kayanya mau ke Musium BI atau PRJ aja sesuai info [USERNAME] [URL]",1.0,0,[0.4182 0.1047 0.004  0.4069 0.0662],0,[0.4182 0.1047 0.004  0.4069 0.0662],,0,0,0.05,,,,,,,,,
0,"200 mubalig versi Menag,sdh ditatar.Bahan ceramah hrs sesuai dgn Menag.Lucu juga.Ceramah terkendali.Jika para mubalig menolak Menag mundur.Iya dong,kalo [USERNAME] punya harga diri. [URL]","200 mubalig versi Menag,sdh ditatar.Bahan ceramah hrs sesuai dgn Menag.Lucu juga.Ceramah terkendali.Jika para mubalig menolak Menag mundur.Iya dong,kalo [USERNAME] punya harga diri. [URL]",1.0,1,[0.0365 0.9479 0.0017 0.0079 0.006 ],1,[0.0365 0.9479 0.0017 0.0079 0.006 ],,1,1,0.08,,,,,,,,,
0,"Maafkan segala kekhilafan beliau semasa hidupnya. Beliau berpulang di bulan yang baik, semoga almarhum di tempatkan di tempat yang terbaik. Insyaallah Khusnul khatimah. Aamiin",Maafkan segala kekhilafan beliau semasa Beliau berpulang di bulan yang auspicabilmente almarhum di posto di tempat yang Insyaallah Khusnul Aamiin,0.9381195306777954,0,[0.8594 0.0071 0.018  0.0342 0.0812],0,[0.9031 0.0101 0.0108 0.0322 0.0438],"{'beliau': 'beliau', 'semoga': 'auspicabilmente', 'maafkan': 'spiacevole', 'almarhum': 'almarhum', 'khusnul': 'solenne', 'aamiin': 'aamiin', 'tempatkan': 'posto'}",0,0,0.6947,,,,,,,,,
2,"Selamat ulang tahun idolaku,masku sekaligus ebesku tercinta walaupun jarang ketemu tetep terselip doa untukmu semoga senantiasa diberi kesehatan,rezeki & kerendahan hati",Selamat ulang tahun sekaligus ebesku tercinta walaupun jarang incontrario ristabilire terselip doa untukmu auspicabilmente senantiasa diberi umltà cuore,0.8970378637313843,2,[0.0173 0.0022 0.7978 0.0053 0.1774],2,[0.0226 0.0019 0.835  0.0053 0.1353],"{'tercinta': 'tercinta', 'untukmu': 'untukmu', 'ketemu': 'incontrario', 'ebesku': 'ebesku', 'tetep': 'ristabilire', 'senantiasa': 'senantiasa', 'hati': 'cuore', 'semoga': 'auspicabilmente', 'jarang': 'jarang', 'ulang': 'ulang', 'kerendahan': 'umltà'}",2,2,0.2313,,,,,,,,,
0,"[USERNAME] [USERNAME] [USERNAME] Orang-orang PSI itu termasuk juga si [USERNAME] adalah ""anak baru"" di dunia politik yang ingin cepat populer dengan cara memancing orang-orang yang sudah populer untuk ber-interaksi dengan mereka. Kasihan deh ...... ","[USERNAME] [USERNAME] [USERNAME] Orang-orang PSI itu termasuk juga si [USERNAME] adalah ""anak baru"" di dunia politik yang ingin cepat populer dengan cara memancing orang-orang yang sudah populer untuk ber-interaksi dengan mereka. Kasihan deh ...... ",1.0,1,[0.0396 0.9451 0.0026 0.0067 0.006 ],1,[0.0396 0.9451 0.0026 0.0067 0.006 ],,1,1,0.07,,,,,,,,,
3,"Tapi lebi goblo lagi pas Egi meninggal, pas masuk kelas mau pamit tementemen taunya yang gaada Mbak Sisil, uda pada syok keknya, ku yang mimbik-mimbik tapi pengen ngekek juga, ini aku yang goblo si",Tapi lebi goblo lagi pas Egi pas masuk kelas mau pamit tementemen taunya yang gaada Mbak uda pada syok ku yang tapi pengen ngekek ini aku yang goblo si,0.9748841524124146,3,[0.1132 0.0136 0.0062 0.8565 0.0105],1,[0.3998 0.4192 0.007  0.1599 0.0142],"{'lebi': 'lebi', 'mbak': 'Perdere', 'goblo': 'goblo', 'pamit': 'pamit', 'si': 'si', 'taunya': 'taunya'}",1,0,0.2993,,,,,,,,,
3,Ketika lo punya trust issues berlebihan terhadap sesuatu yg berbau cinta dan akhirnya cinta life lo gapernah berjalan mulus karena hanya penuh dengan ketidak percayaan.,Ketika lo punya trust issues berlebihan terhadap sesuatu yg berbau cinta dan akhirnya cinta life lo gapernah berjalan mulus karena hanya penuh dengan ketidak percayaan.,1.0,0,[0.7234 0.0138 0.0816 0.1775 0.0037],0,[0.7234 0.0138 0.0816 0.1775 0.0037],,0,0,0.09,,,,,,,,,
4,Bismillah.. Pagi2 semangat berolahraga plus memberikan layanan kesehatan Gratis.. carfreedaycirebon .,Pagi2 semangat berolahraga plus memberikan servizio Saluto carfreedaycirebon,0.5717921853065491,4,[0.0224 0.0053 0.0159 0.0079 0.9485],4,[0.0201 0.0048 0.0096 0.0061 0.9593],"{'semangat': 'semangat', 'plus': 'plus', 'layanan': 'servizio', 'kesehatan': 'Saluto'}",4,4,0.2072,,,,,,,,,
1,"Nelfon cs [USERNAME] disuruh tunggu untuk buat pelaporan, 7 menit and still go on tanpa kabar dari cs, cuma disuruh tunggu. Ngapain? Lama banget. Aneh",Nelfon cs disuruh tunggu untuk buat 7 menit e still go on tanpa Avviso dari cuma disuruh Lama Aneh,0.86952805519104,1,[0.103  0.7261 0.002  0.1625 0.0065],1,[0.0875 0.7964 0.0014 0.1098 0.0048],"{'cs': 'cs', 'menit': 'menit', 'and': 'e', 'nelfon': 'nelfon', 'kabar': 'Avviso', 'still': 'still', 'disuruh': 'disuruh', 'lama': 'lama', 'aneh': 'aneh'}",1,1,0.3182,,,,,,,,,
3,di kantor baru ditantang bikin marketing plan dan harus bisa bikin co-branding sama bank biru. takut ga bisa. belum tau gimana strateginya. dan gue udah kepalang resign di kantor sekarang. ,di kantor baru ditantang bikin marketing plan dan harus bisa bikin sama bank takut ga belum sapere venire dan io già kepalang dimensione di kantor,0.8951859474182129,3,[0.0109 0.0046 0.0053 0.9761 0.0031],3,[0.0167 0.0172 0.0058 0.9547 0.0056],"{'bikin': 'bikin', 'kepalang': 'kepalang', 'udah': 'già', 'resign': 'dimensione', 'kantor': 'kantor', 'marketing': 'marketing', 'tau': 'sapere', 'gimana': 'venire', 'gue': 'io', 'ditantang': 'ditantang'}",3,3,0.2214,,,,,,,,,
1,"[USERNAME] Ya Allah...apa2 kok yg disalahin pres [USERNAME] ... Kayak presiden kurang kerjaan ya gaes, urusin sebuah foto...hadweehhh. Tp apa penting to foto itu? Bukan 'jimat' to?",Ya kok quale disalahin pres Kayak presiden kurang kerjaan S urusin sebuah Tp apa penting un foto Bukan,0.8496596813201904,1,[0.0196 0.969  0.0015 0.0061 0.0039],1,[0.0334 0.9517 0.0022 0.0061 0.0067],"{'ya': 'S', 'to': 'un', 'bukan': 'No', 'kerjaan': 'kerjaan', 'yg': 'quale', 'tp': 'tp', 'kayak': 'kayak', 'disalahin': 'disalahin', 'foto': 'foto'}",1,1,0.293,,,,,,,,,
1,"Yth DP BPIP [USERNAME] Sangat berat menyandang gelar ""Pancasilais"".. Klo ""saya berusaha jadi Pancasilais"" itu baru oyeeee Seseorang bisa disebut ""Pancasilais"" bila dapat melaksanakan 36 butir nilai Pancasila dengan benar dan mendekati sempurna.","Yth DP BPIP [USERNAME] Sangat berat menyandang gelar ""Pancasilais"".. Klo ""saya berusaha jadi Pancasilais"" itu baru oyeeee Seseorang bisa disebut ""Pancasilais"" bila dapat melaksanakan 36 butir nilai Pancasila dengan benar dan mendekati sempurna.",1.0,3,[0.4035 0.1091 0.0042 0.4731 0.0101],3,[0.4035 0.1091 0.0042 0.4731 0.0101],,3,3,0.05,,,,,,,,,
2,[USERNAME] gue sayang banget banget banget kenapa ya kalo sama iKON baru kali ini rasanya ngestan yang bener bener sayang banget tapi kek kerasa disayaaaang balik banget sama merekanya. jadi aku makin sayang dan gabisa lepas. GIMANA JELASINNYA YA TAPI,io Metodo molto molto molto kenapa S Se sama iKON baru voltaico ini rasanya ngestan yang bener bener Metodo molto tapi torta kerasa disayaaaang balik molto sama jadi aku makin Metodo dan gabisa GIMANA JELASINNYA YA TAPI,0.7865159511566162,2,[0.014  0.0018 0.9745 0.0037 0.0059],0,[0.8933 0.0133 0.0107 0.0667 0.0159],"{'sayang': 'Metodo', 'banget': 'molto', 'gue': 'io', 'bener': 'bener', 'kali': 'voltaico', 'kalo': 'Se', 'ya': 'S', 'kek': 'torta', 'ikon': 'icona', 'tapi': 'tapi', 'gimana': 'venire'}",0,2,0.2841,,,,,,,,,
