text,sentiment,perturbed_text,perturbed_semantic_sim,pred_label,pred_proba,perturbed_label,perturbed_proba,translated_word(s),adv_pred,adv_pred_on_orig,running_time(s),before_attack_acc,after_attack_acc,avg_semantic_sim,avg_running_time(s),adv_training,delta_acc,delta_adv,acc_adv_training_on_orig,best_epoch
"saya suwandi sudah pesan tiket pak - cengkareng tuk penerbangan tanggal 20 jam 06.46 via pesawat nam air . namun sampai dengan hari ini tanggal 17 juli , saya belum terima info apa pun , transfer dari bri syariah ke bank mandiri . mohon bantuan nya untuk diinformasi kembali . terima kasih .",1,saya suwandi sudah message tiket pak cengkareng tuk penerbangan tanggal 20 jam via pesawat nam air namun sampai dengan hari ini tanggal 17 juli saya belum terima info apa pun transfer dari bri syariah ke bank mandiri mohon bantuan nya untuk diinformasi kembali terima kasih,0.9892499446868896,1,[0.0069 0.7966 0.1966],1,[0.0025 0.9593 0.0382],"{'cengkareng': 'cengkareng', 'tuk': 'tuk', 'tanggal': 'tanggal', 'mohon': 'mohon', 'pesan': 'message'}",1,1,0.5091,,,,,,,,,
daftar harga dispenser 2018 terbaik yang ada di blibli.com memuat banyak produk . salah satu nya adalah miyako wdp - 200 dispenser . produk ini merupakan dispenser dengan penempatan galon di bawah sehingga anda tidak perlu mengangkat galon saat akan mengisi air .,1,liste harga dispenser 2018 terbaik yang ada di memuat banyak produk salah satu nya adalah miyako wdp 200 dispenser produk ini merupakan dispenser dengan penempatan galon di bawah sehingga anda tidak perlu mengangkat galon saat akan mengisi air,0.9852694272994996,1,[0.0926 0.9014 0.006 ],1,[0.0959 0.8962 0.0079],"{'daftar': 'liste', 'harga': 'harga'}",1,1,0.4366,,,,,,,,,
"samsung , panasonic , sharp dan berbagai produsen lainnya telah memasarkan berbagai macam jenis mesin cuci dengan fungsi yang beragam .",1,samsung panasonic sharp dan berbagai produsen lainnya telah memasarkan berbagai macam jenis mesin cuci dengan fungsi yang beragam,1.0,1,[0.0077 0.9886 0.0038],1,[0.0069 0.9895 0.0036],"{'samsung': 'samsung', 'mesin': 'mesin'}",1,1,0.4268,,,,,,,,,
kami segenap direksi dan karyawan pt smartplus consulting indonesia mengucapkan selamat hari raya idul fitri 1439 h .,1,kami segenap direksi dan karyawan pt smartplus consulting Indonésie mengucapkan selamat hari raya idul fitri 1439 h,0.9858931303024292,1,[0.0121 0.9816 0.0063],1,[0.0165 0.9764 0.0072],"{'smartplus': 'smartplus', 'indonesia': 'Indonésie'}",1,1,0.3566,,,,,,,,,
sudahlah . ini negara demokrasi . jangan saling membual . masing-masing punya pilihan . pilih prabowo minggu . tidak mau pilih jokowi juga tidak apa-apa . bebas .,2,sudahlah ini negara demokrasi jangan saling membual punya pilihan pilih prabowo minggu tidak mau pilih jokowi juga tidak bebas,0.9842931032180786,2,[0.0042 0.003  0.9928],2,[0.005  0.0026 0.9925],"{'minggu': 'minggu', 'pilih': 'pilih'}",2,1,0.3733,,,,,,,,,
"kami bukan dalam kapasitas menentukan jangan / nyapres , mbk .",1,kami bukan dalam kapasitas menentukan jangan nyapres mbk,1.0000001192092896,1,[0.0164 0.7786 0.205 ],2,[0.0055 0.0157 0.9787],{'kapasitas': 'kapasitas'},2,1,0.3648,,,,,,,,,
"adab di media sosial itu jelas , kok . suka silakan like , mengikuti . tidak suka , unfoll / block , simpel . dan kita memiliki hak yang sama untuk melakukan nya .",1,"adab di media sosial itu jelas , kok . suka silakan like , mengikuti . tidak suka , unfoll / block , simpel . dan kita memiliki hak yang sama untuk melakukan nya .",1.0,2,[0.0577 0.1723 0.77  ],2,[0.0577 0.1723 0.77  ],,1,1,0.15,,,,,,,,,
"kalau tidak suka gaperlu didukung mas , dukung saja yang menurut mas daus itu bisa bawa indonesia jauh lebih baik . yang penting kita harus menomorsatukan asas etika .",1,"kalau tidak suka gaperlu didukung mas , dukung saja yang menurut mas daus itu bisa bawa indonesia jauh lebih baik . yang penting kita harus menomorsatukan asas etika .",1.0,0,[0.5403 0.0541 0.4056],0,[0.5403 0.0541 0.4056],,0,0,0.1,,,,,,,,,
"kamu bisa punya koleksi bts dengan membeli smartphone lagi k9 . selain tersedia wallpaper dan tema di dalam nya , kamu juga dapat poster dan postcard bts .",1,kamu bisa punya koleksi bts dengan membeli smartphone lagi k9 selain tersedia wallpaper dan tema di dalam nya kamu juga dapat poster dan postcard bts,1.0,1,[0.1398 0.8549 0.0052],1,[0.1054 0.8891 0.0054],"{'smartphone': 'smartphone', 'poster': 'poster'}",1,1,0.3807,,,,,,,,,
siarin bola asian games lewat parabola dong . puluhan juta pasang mata di luar jawa yang pakai parabola pasti kecewa kalau tidak bisa menonton .,2,diffuseur bola asian games lewat parabola dong puluhan juta pasang mata di luar jawa yang pakai parabola pasti kecewa kalau tidak bisa menonton,0.9939924478530884,2,[0.0045 0.0041 0.9914],2,[0.0076 0.013  0.9794],"{'siarin': 'diffuseur', 'kecewa': 'kecewa'}",2,2,0.484,,,,,,,,,
ada tiga tahap . pertama harus unlock bootloader terus pasang twrp terus robot deh xiaomi kamu tipe berapa ya ? soal nya suka beda gitu loh,1,ada tiga tahap . pertama harus unlock bootloader terus pasang twrp terus robot deh xiaomi kamu tipe berapa ya ? soal nya suka beda gitu loh,1.0,2,[0.0316 0.2702 0.6983],2,[0.0316 0.2702 0.6983],,1,1,0.11,,,,,,,,,
"maaf ini oot . yang hape nya xiaomi , bisa bantu aku tidak . ini kalau aku lagi buka twit atau saya begitu suka menang . nah yang aku lingkarkan merah itu aplikasi yang menghilang begitu . ada yang tahu kenapa dan bagaimana cara menyembuhkan nya :",1,"maaf ini oot . yang hape nya xiaomi , bisa bantu aku tidak . ini kalau aku lagi buka twit atau saya begitu suka menang . nah yang aku lingkarkan merah itu aplikasi yang menghilang begitu . ada yang tahu kenapa dan bagaimana cara menyembuhkan nya :",1.0,2,[0.0187 0.1545 0.8268],2,[0.0187 0.1545 0.8268],,1,1,0.1,,,,,,,,,
di indonesia pilihan brand smartphone kan melimpah . kalau tidak suka cara xiaomi menjalankan bisnis nya ya tinggal pilih brand lain . dibawa santai saja .,1,di indonesia pilihan brand smartphone kan melimpah . kalau tidak suka cara xiaomi menjalankan bisnis nya ya tinggal pilih brand lain . dibawa santai saja .,1.0,2,[0.0799 0.0106 0.9096],2,[0.0799 0.0106 0.9096],,2,2,0.1,,,,,,,,,
pendaftar towel-towel lagi g7 thinq membludak hingga 3x kapasitas tempat . ke depan nya bakal segera ada towel-towel huawei nova 3i dan mungkin samsung galaxy note 9 .,1,pendaftar lagi g7 thinq membludak hingga 3x kapasitas tempat ke depan nya bakal segera ada huawei nova 3i dan mungkin samsung galaxy note 9,0.9864088892936708,1,[0.0137 0.9754 0.011 ],1,[0.0049 0.9666 0.0285],"{'nova': 'nova', 'samsung': 'samsung'}",1,1,0.5295,,,,,,,,,
di depan sana masih ada kompetisi foto dengan tema morning feel .,1,di depan sana masih ada kompetisi foto dengan tema morning feel,1.0,1,[0.2135 0.7772 0.0094],1,[0.1969 0.7951 0.0081],{'tema': 'tema'},1,1,0.3617,,,,,,,,,
oke . saya akan segera menuju ke cabang bca terdekat .,1,oke saya akan segera menuju ke cabang bca terdekat,1.0,1,[0.0042 0.9844 0.0114],1,[0.0037 0.9901 0.0062],{'oke': 'oke'},1,1,0.4133,,,,,,,,,
"isi pulsa via atm bca tadi jam 17.48 sampai sekarang belum masuk , boleh tolong dicek ? terima kasih",1,isi impulsion via atm bca tadi jam sampai sekarang belum masuk boleh tolong dicek terima kasih,0.9690850973129272,1,[0.0047 0.822  0.1733],1,[0.0026 0.9028 0.0946],"{'via': 'via', 'pulsa': 'impulsion'}",1,1,0.3449,,,,,,,,,
mau tanya apa nomer ini 622129265555 benar nomer kantor bca jakarta yang menangani kartu kredit ? saya tunggu jawaban nya ya,1,mau tanya apa nomer ini 622129265555 benar nomer kantor bca jakarta yang menangani kartu kredit saya tunggu jawaban nya ya,1.0000001192092896,1,[0.0045 0.9795 0.0159],1,[0.0036 0.983  0.0135],{'tunggu': 'tunggu'},1,1,0.4556,,,,,,,,,
"hai mas cepy . saya sudah ke bank bca terdekat untuk langsung diproses pergantian kartu , ya",1,hai mas cepy saya sudah ke bank bca terdekat untuk langsung diproses pergantian kartu ya,1.0,1,[0.0033 0.9857 0.0111],1,[0.0031 0.9871 0.0098],"{'bca': 'bca', 'pergantian': 'pergantian'}",1,1,0.3581,,,,,,,,,
"hai , ken . saat ini isi e-money flazz dari bca belum bisa di jenius , ya . kamu bisa menyampaikan saran kamu melalui bagian dari kami di jenius co . create , info lengkap bisa ku njungi : . terima kasih .",1,hai ken saat ini isi flazz dari bca belum bisa di jenius ya kamu bisa menyampaikan saran kamu melalui bagian dari kami di jenius co create info lengkap bisa ku njungi terima kasih,0.9950262308120728,1,[0.0039 0.9836 0.0125],1,[0.0038 0.9845 0.0117],"{'bca': 'bca', 'isi': 'isi', 'jenius': 'jenius'}",1,1,0.4451,,,,,,,,,
selamat siang . kamu bisa menggunakan tarif ramai-ramai untuk rombongan serta memanfat promo cashback dari rekanan bank seperti bank bri dan bca .,1,sûr siang kamu bisa menggunakan tarif untuk rombongan serta memanfat promo cashback dari rekanan banquet seperti banquet bri dan bca,0.8001015186309814,1,[0.1191 0.876  0.0049],1,[0.0608 0.9322 0.007 ],"{'bank': 'banquet', 'selamat': 'sûr'}",1,1,0.382,,,,,,,,,
"di pesona festival pasar terapung , ada juga permainan tradisional balogo , festival kain tradisional sasirangan , kompetisi chef hotel dan restoran terbaik , festival kuliner desa banjar , lomba hias perahu jukung , lomba fotografi , dan masih banyak lagi yang lainnya .",1,"di pesona festival pasar terapung , ada juga permainan tradisional balogo , festival kain tradisional sasirangan , kompetisi chef hotel dan restoran terbaik , festival kuliner desa banjar , lomba hias perahu jukung , lomba fotografi , dan masih banyak lagi yang lainnya .",1.0,0,[0.8267 0.1673 0.006 ],0,[0.8267 0.1673 0.006 ],,0,0,0.11,,,,,,,,,
"asisten pelatih pskc cimahi , nurjati merasa tim nya sangat bangga bertemu dengan tim sebesar persib bandung di babak 128 besar piala indonesia 2018 .",0,"asisten pelatih pskc cimahi , nurjati merasa tim nya sangat bangga bertemu dengan tim sebesar persib bandung di babak 128 besar piala indonesia 2018 .",1.0,1,[0.1322 0.8415 0.0263],1,[0.1322 0.8415 0.0263],,1,1,0.1,,,,,,,,,
"selamat siang . jika selama 6 bulan tidak terdapat saldo rp . 0 tidak ada transaksi , maka sudah otomatis closed . namun untuk pengecekan status rekening anda dapat menghubungi bni call 1500046 .",1,selamat siang jika selama 6 bulan tidak terdapat saldo rp 0 tidak ada transaksi maka sudah otomatis closed namun untuk pengecekan status rekening anda dapat menghubungi bni call 1500046,1.0,1,[0.003  0.9825 0.0145],1,[0.0026 0.9877 0.0096],"{'closed': 'closed', 'menghubungi': 'menghubungi', 'status': 'status'}",1,1,0.3902,,,,,,,,,
"selamat pagi , untuk melihat tagihan dapat menghubungi bni call 1500046 , kemudian tekan 0 untuk berbicara dengan bni call officer lalu tekan 2 untuk berbicara dengan bni call officer layanan kartu kredit . nanti petugas kami akan membantu anda .",1,selamat pagi untuk melihat tagihan dapat menghubungi bni call 1500046 kemudian tekan 0 untuk berbicara dengan bni call officer lalu tekan 2 untuk berbicara dengan bni call officer layanan kartu kredit nanti petugas kami akan membantu anda,1.0,1,[0.0131 0.9817 0.0052],1,[0.0089 0.984  0.0071],"{'layanan': 'layanan', 'officer': 'officer', 'kartu': 'kartu'}",1,1,0.4276,,,,,,,,,
"selamat pagi . silakan hubungi bni call 1500046 untuk melakukan pemblokiran . setelah itu , silakan datang ke kantor cabang bni terdekat dengan membawa ktp , surat keterangan hilang dari kepolisian , dan buku tabungan untuk penggantian kartu nya ya .",1,selamat pagi silakan hubungi bni call 1500046 untuk melakukan pemblokiran setelah itu silakan datang ke kantor cabang bni terdekat dengan membawa ktp surat keterangan hilang dari kepolisian dan buku tabungan untuk penggantian kartu nya ya,1.0000001192092896,1,[0.0062 0.9623 0.0315],1,[0.0032 0.9917 0.0051],"{'hilang': 'hilang', 'bni': 'bni', 'cabang': 'cabang'}",1,1,0.4337,,,,,,,,,
"tadi sore saya baru cek email dan sudah transfer kekurangan 30.000 , tapi belum ada balasan lagi . apakah transferan nya sudah masuk ? atas nama ellena saufika , no. cust 253360 , tf via mbanking bni .",1,tadi sore saya baru cek email dan sudah transfer kekurangan tapi belum ada balasan lagi apakah transferan nya sudah masuk atas nama ellena saufika cust 253360 tf via mbanking bni,0.9877141118049622,1,[0.0028 0.9664 0.0308],1,[0.0018 0.991  0.0072],"{'saufika': 'saufika', 'cust': 'cust', 'tf': 'tf'}",1,1,0.4027,,,,,,,,,
"jakarta , 29 november 2017 di hotel ibis kramat 100 jakarta pusat , balai ksda jakarta mengadakan bimtek web - based integrated system peredaran tsl secara online e - permit untuk mengenalkan sebuah aplikasi pelayanan pemanfaatan tsl yang dinamai si pinter sistem perijinan terpadu .",1,jakarta 29 november 2017 di hotel ibis kramat 100 jakarta pusat balai ksda jakarta mengadakan bimtek web based integrated system peredaran tsl secara online e permit untuk mengenalkan sebuah aplikasi pelayanan utilisation tsl yang dinamai si pinter sistem perijinan terpadu,0.99022775888443,1,[0.0069 0.9881 0.0051],1,[0.0064 0.9894 0.0042],"{'ksda': 'ksda', 'pemanfaatan': 'utilisation', 'perijinan': 'perijinan', 'web': 'web', 'online': 'online', 'si': 'si', 'tsl': 'tsl'}",1,1,0.478,,,,,,,,,
"dalam kunjungan kerja nya ke provinsi jawa barat , presiden meninjau pelayanan bpjs dan kartu indonesia sehat kis di rumah sakit umum pendidikan rsup dari . hasan sadikin rshs , kota bandung , kamis siang , 22 februari 2018 .",1,dalam kunjungan kerja nya ke provinsi jawa barat presiden meninjau pelayanan bpjs dan kartu indonesia sehat kis di rumah malade umum pendidikan rsup dari hasan sadikin RSH kota bandung kamis siang 22 februari 2018,0.9863721132278442,1,[0.0057 0.9893 0.0049],1,[0.0062 0.9889 0.0049],"{'kartu': 'kartu', 'rshs': 'RSH', 'rsup': 'rsup', 'sadikin': 'sadikin', 'sakit': 'malade'}",1,1,0.4512,,,,,,,,,
hari ini rshs berusia 89 tahun .,1,hari ini RSH berusia 89 tahun,0.916084051132202,1,[0.0034 0.9714 0.0253],1,[0.0029 0.9793 0.0178],{'rshs': 'RSH'},1,1,0.3454,,,,,,,,,
"pada tanggal 16 februari 2018 esok poliklinik rawat jalan rshs tidak melakukan pelayanan dikarenakan hari libur nasional . poli kembali buka hari senin , 19 februari 2018 .",1,pada tanggal 16 februari 2018 esok poliklinik rawat jalan rshs tidak melakukan pelayanan dikarenakan hari libur nationale poli kembali buka hari senin 19 februari 2018,0.9688156843185424,1,[0.0056 0.9853 0.0091],1,[0.0054 0.985  0.0096],"{'nasional': 'nationale', 'buka': 'buka'}",1,1,0.3891,,,,,,,,,
kami ingin mengumumkan bahwa mal bom kini hadir di shopee mal !,1,kami ingin mengumumkan bahwa mal bombe kini hadir di shopee mal,0.8603525757789612,1,[0.007  0.9883 0.0046],1,[0.0099 0.9865 0.0036],{'bom': 'bombe'},1,1,0.3521,,,,,,,,,
"hari ini periode submission xpresound telah ditutup , ya . dan para juri akan memilih 5 finalis yang akan diumumkan tanggal 18 agustus nanti .",1,hari ini periode submission xpresound telah ditutup ya dan para juri akan memilih 5 finalis yang akan diumumkan tanggal 18 agustus nanti,1.0000001192092896,1,[0.0035 0.9908 0.0058],1,[0.004  0.9907 0.0054],"{'agustus': 'agustus', 'xpresound': 'xpresound'}",1,1,0.3649,,,,,,,,,
"informasi tambahan bahwa untuk pembayaran rp 2 juta yang bapak lakukan tidak menjadikan limit menjadi rp 7 juta , melainkan pembayaran tersebut akan mengurangi tagihan yang sedang berjalan . jika kartu kredit dalam keadaan berlebihan limit maka akan dikenakan biaya rp 40 ribu .",1,renseignements tambahan bahwa untuk Paiement rp 2 juta yang bapak lakukan tidak menjadikan limit menjadi rp 7 juta melainkan Paiement tersebut akan mengurangi tagihan yang sedang berjalan jika kartu kredit dalam keadaan berlebihan limit maka akan dikenakan biaya rp 40 ribu,0.9559420347213744,1,[0.0143 0.9403 0.0454],1,[0.0045 0.9834 0.0121],"{'tagihan': 'tagihan', 'informasi': 'renseignements', 'kartu': 'kartu', 'pembayaran': 'Paiement'}",1,1,0.4171,,,,,,,,,
sebentar lagi asian games 2018 dimulai nih ! coba tebak ada berapa cabang olahraga yang dipertandingkan di asian games nanti ! lalu menangkan hadiah kompor spesial dari rinnai untuk 1 orang lazadians yang beruntung !,1,sebentar lagi asian games 2018 dimulai nih coba tebak ada berapa cabang olahraga yang dipertandingkan di asian games nanti lalu menangkan hadiah kompor spesial dari rinnai untuk 1 orang lazadians yang beruntung,1.0000001192092896,1,[0.2281 0.7605 0.0115],1,[0.1236 0.8681 0.0083],"{'orang': 'orang', 'spesial': 'spesial'}",1,1,0.4234,,,,,,,,,
"saat kunjungan ke hotel , menag banyak menerima apresiasi atas layanan haji tahun ini .",0,saat kunjungan ke hotel menag banyak menerima apresiasi atas layanan haji tahun ini,1.0,0,[0.506  0.4645 0.0295],1,[0.3045 0.6721 0.0234],{'kunjungan': 'kunjungan'},1,0,0.3303,,,,,,,,,
pagi ini pemkab pemalang melalui menyelenggarakan kegiatan launching sistem layanan informasi publik secara online dan rakor ppid di salah satu hotel di pemalang 10 / 7 / 2018 .,1,pagi ini pemkab pemalang melalui menyelenggarakan kegiatan launching sistem layanan informasi publik secara online dan rakor ppid di salah satu hotel di pemalang 10 7 2018,1.0,1,[0.0051 0.9903 0.0046],1,[0.0053 0.9908 0.004 ],"{'pemkab': 'pemkab', 'pagi': 'pagi'}",1,1,0.4006,,,,,,,,,
"kemnaker ri menyelenggarakan pameran kesempatan kerja job fair nasional tahun 2018 di balairung hotel bumiwiyata depok , jawa barat tanggal 4 - 5 juli 2018 . job fair ini tidak dipungut biaya / gratis .",1,kemnaker ri menyelenggarakan pameran kesempatan kerja travailler fair nasional tahun 2018 di balairung hotel Bumiwiyata dépôt jawa Ouest tanggal 4 5 juli 2018 travailler fair ini tidak dipungut biaya gratis,0.9079073667526244,1,[0.02   0.9752 0.0048],1,[0.0159 0.9791 0.005 ],"{'bumiwiyata': 'Bumiwiyata', 'ri': 'ri', 'job': 'travailler', 'barat': 'Ouest', 'depok': 'dépôt'}",1,1,0.4332,,,,,,,,,
"gelaran jateng wow 2018 telah usai pada 31 maret lalu . dari pelaksanaan selama dua bulan penuh , kegiatan ini telah meningkatkan hunian hotel mendatangkan ribuan kunjungan wisatawan mancanegara ke jawa tengah .",0,"gelaran jateng wow 2018 telah usai pada 31 maret lalu . dari pelaksanaan selama dua bulan penuh , kegiatan ini telah meningkatkan hunian hotel mendatangkan ribuan kunjungan wisatawan mancanegara ke jawa tengah .",1.0,1,[0.112  0.8782 0.0099],1,[0.112  0.8782 0.0099],,0,0,0.1,,,,,,,,,
presiden harapkan menpar ri dan menko untuk mengajak pelaku pariwisata baik hotel maupun maskapai penerbangan untuk juga diajak memberikan informasi mempromosikan wisata di indonesia khusus nya bali .,1,presiden harapkan Menpar ri dan menko untuk mengajak pelaku pariwisata baik hotel maupun maskapai penerbangan untuk juga diajak memberikan informasi mempromosikan wisata di indonesia khusus nya bali,1.0,1,[0.1911 0.7855 0.0234],1,[0.2431 0.7341 0.0228],"{'presiden': 'presiden', 'menpar': 'Menpar', 'ri': 'ri'}",1,1,0.39,,,,,,,,,
gubernur dki jakarta anies baswedan membentuk tim evaluasi tata kelola air minum . pembentukan tim ini tertuang dalam keputusan gubernur nomor 1149 tahun 2018 yang ditandatangani 10 agustus 2018 . tim ini diketuai sekretaris daerah saefullah dengan wakil ketua asisten pembangunan dan lingkungan hidup yusmada faizal .,1,gubernur dki jakarta anies baswedan membentuk tim evaluasi tata kelola air minum pembentukan tim ini verset dalam keputusan gubernur nomor 1149 tahun 2018 yang ditandatangani 10 agustus 2018 tim ini diketuai sekretaris daerah saefullah dengan wakil ketua asisten pembangunan dan lingkungan hidup yusmada faizal,0.9907681345939636,1,[0.0039 0.99   0.0061],1,[0.005  0.9881 0.0069],"{'ditandatangani': 'ditandatangani', 'tertuang': 'verset', 'baswedan': 'baswedan', 'kelola': 'kelola', 'air': 'air', 'yusmada': 'yusmada', 'tim': 'tim'}",1,1,0.5053,,,,,,,,,
"tujuh pemain real madrid akan menyamai rekor paolo maldini dan dani alves yang sampai saat ini masih menyandang predikat raja di piala super eropa . ketujuh pemain yang dimaksud adalah dani carvajal , sergio ramos , marcelo , luka modric , karim benzema , isco , dan toni kroos . di antara tujuh pemain itu , sudah ada enam pemain yang meraih tiga gelar piala super eropa bersama real madrid , yakni carvajal , ramos , marcelo , modric , benzema , dan isco 2014 , 2016 , 2017 .",1,tujuh pemain real Madrid akan menyamai rekor paolo maldini dan dani alves yang sampai saat ini masih menyandang prédicat raja di Trophée super eropa ketujuh pemain yang dimaksud adalah dani carvajal sergio ramos marcelo luka modrique karim benzema isco dan toni kroos di antara tujuh pemain itu sudah ada enam pemain yang meraih tiga gelar Trophée super eropa bersama real Madrid yakni carvajal ramos marcelo modrique benzema dan isco 2014 2016 2017,0.9828993082046508,1,[0.0294 0.957  0.0136],1,[0.0166 0.9712 0.0122],"{'piala': 'Trophée', 'kroos': 'kroos', 'marcelo': 'marcelo', 'modric': 'modrique', 'eropa': 'eropa', 'predikat': 'prédicat', 'super': 'super', 'madrid': 'Madrid', 'tujuh': 'tujuh'}",1,1,0.6848,,,,,,,,,
"keberadaan peraturan presiden nomor 54 tahun 2018 tentang strategi nasional pencegahan korupsi yang telah diteken oleh presiden joko widodo pada 20 juli 2018 silam diharapkan mampu menghasilkan perubahan mendasar , khusus nya terkait tiga aspek . ketiga aspek itu menyangkut perizinan dan tata niaga , keuangan negara , dan penegakan hukum serta reformasi birokrasi .",1,keberadaan peraturan presiden nomor 54 tahun 2018 tentang strategi nasional pencegahan korupsi yang telah diteken oleh presiden joko widodo pada 20 juli 2018 silam diharapkan mampu menghasilkan perubahan mendasar khusus nya terkait tiga aspek ketiga aspek itu menyangkut perizinan dan tata niaga keuangan paie dan penegakan hukum serta reformasi birokrasi,0.9901939630508424,1,[0.0088 0.9798 0.0114],1,[0.0141 0.9704 0.0155],"{'diharapkan': 'diharapkan', 'pencegahan': 'pencegahan', 'negara': 'paie', 'strategi': 'strategi', 'keuangan': 'keuangan', 'diteken': 'diteken', 'perizinan': 'perizinan'}",1,1,0.5468,,,,,,,,,
"beberapa fungsi layanan kami membutuhkan pendaftaran akun dengan memilih identifikasi pengguna id pengguna dan kata sandi unik , serta memberikan informasi pribadi tertentu . apabila anda memilih id pengguna yang dianggap tidak sopan atau tidak pantas oleh shopee atas kebijakan nya sendiri , shopee berhak untuk menangguhkan atau mengakhiri akun anda .",1,beberapa fungsi layanan kami membutuhkan pendaftaran akun dengan memilih identification pengguna id pengguna dan kata sandi unik serta memberikan informasi pribadi tertentu apabila anda memilih id pengguna yang dianggap tidak sopan atau tidak pantas oleh shopee atas kebijakan nya sendiri shopee berhak untuk menangguhkan atau mengakhiri akun anda,0.9871572256088256,1,[0.006  0.9325 0.0615],1,[0.0129 0.8915 0.0957],"{'menangguhkan': 'menangguhkan', 'identifikasi': 'identification', 'fungsi': 'fungsi', 'sandi': 'sandi', 'dianggap': 'dianggap'}",1,1,0.5706,,,,,,,,,
"sebuah musibah baru saja menimpa kampung adat megalitikum gurusina di bajawa , flores . kebakaran hebat yang terjadi pada senin 13 / 8 sore hampir menghanguskan seluruh kampung . total 27 dari 33 rumah adat yang ada habis dilalap api bersama semua cerita dan sejarah nya .",1,"sebuah musibah baru saja menimpa kampung adat megalitikum gurusina di bajawa , flores . kebakaran hebat yang terjadi pada senin 13 / 8 sore hampir menghanguskan seluruh kampung . total 27 dari 33 rumah adat yang ada habis dilalap api bersama semua cerita dan sejarah nya .",1.0,2,[0.0298 0.0374 0.9327],2,[0.0298 0.0374 0.9327],,2,2,0.1,,,,,,,,,
"di usia 57 tahun , saat nya gerakan pramuka di tanah air menjawab tantangan zaman baru . anggota pramuka harus dididik bukan hanya bahasa morse , tetapi juga pengetahuan digital seperti coding , artificial intelligence , advance robotic , dan internet of things .",1,di usia 57 tahun saat nya gerakan pramuka di tanah air menjawab tantangan zaman baru anggota pramuka harus dididik bukan hanya bahasa morse tetapi juga pengetahuan digital seperti coding artificial intelligence advance robotique dan internet of things,0.9890276193618774,1,[0.1698 0.7703 0.0599],1,[0.0802 0.8832 0.0366],"{'robotic': 'robotique', 'intelligence': 'intelligence', 'digital': 'digital', 'coding': 'coding'}",1,1,0.4787,,,,,,,,,
"dalam paparan nya , menkeu smi menekankan penting nya menjaga integritas taxmin sebagai penyalur utama informasi perpajakan agar menyampaikan informasi yang baik dan benar kepada masyarakat melalui media sosial yang dimiliki nya .",1,dalam paparan nya menkeu smi menekankan penting nya menjaga integritas taxmin sebagai penyalur utama informasi perpajakan agar menyampaikan informasi yang baik dan benar kepada masyarakat melalui media sosial yang dimiliki nya,1.0,1,[0.0107 0.9834 0.0059],1,[0.013  0.9793 0.0078],"{'perpajakan': 'perpajakan', 'menkeu': 'menkeu', 'menekankan': 'menekankan'}",1,1,0.4364,,,,,,,,,
"sahabat mido , untuk kenyamanan pemohon paspor dan menghindari praktik percaloan , direktorat jenderal imigrasi bekerjasama dengan kementerian keuangan melalui bank-bank yang tergabung dalam sistim informasi penerimaan negara bukan pajak online simponi .",1,sahabat mido untuk kenyamanan pemohon paspor dan menghindari praktik percaloan direktorat jenderal imigrasi bekerjasama dengan kementerian keuangan melalui yang tergabung dalam sistim informasi penerimaan negara bukan pajak online simponi,0.9942033886909484,1,[0.0032 0.9918 0.005 ],1,[0.0042 0.9912 0.0046],"{'jenderal': 'jenderal', 'percaloan': 'percaloan', 'pajak': 'pajak', 'mido': 'mido'}",1,1,0.4092,,,,,,,,,
"hai kak . saat ini jam opertional restoran pizza hut belum sampai 24 jam ya . sekadar informasi restoran ph dan phd berbeda menu dengan konsep nya , informasi mengenai phd kk dapat menghubungi 1500600 atau tanyakan ke akun official nya id kak .",1,"hai kak . saat ini jam opertional restoran pizza hut belum sampai 24 jam ya . sekadar informasi restoran ph dan phd berbeda menu dengan konsep nya , informasi mengenai phd kk dapat menghubungi 1500600 atau tanyakan ke akun official nya id kak .",1.0,0,[0.5769 0.3805 0.0426],0,[0.5769 0.3805 0.0426],,1,1,0.11,,,,,,,,,
