text,sentiment,perturbed_text,perturbed_semantic_sim,pred_label,pred_proba,perturbed_label,perturbed_proba,translated_word(s),adv_pred,adv_pred_on_orig,running_time(s),before_attack_acc,after_attack_acc,avg_semantic_sim,avg_running_time(s),adv_training,delta_acc,delta_adv,acc_adv_training_on_orig,best_epoch
"kenapa aku kok suka banget sama yang nama nya mi . apalagi mi indomie goreng dikasih kuah telur , berh ! rasanya mantap tjoy . pangsit di depan rumah gue aja kalah enak sama mi buatan aku sendiri .",0,kenapa aku kok Comme très sama yang nama nya mi apalagi mi indomie goreng dikasih kuah telur berh rasanya mantap tjoy pangsit di depan rumah gue aja kalah enak sama mi buatan aku sendiri,0.9816884398460388,0,[0.9927 0.0016 0.0058],0,[0.9085 0.0046 0.0869],"{'mantap': 'mantap', 'suka': 'Comme', 'berh': 'berh', 'buatan': 'buatan', 'kuah': 'kuah', 'banget': 'très', 'telur': 'telur', 'dikasih': 'dikasih'}",0,0,0.4218,,,,,,,,,
"sebenarnya lebih suka kari ayam sih kak , hehehe . tapi kalau label nya sudah indomie , apa saja masuk kok ke perut ku . karena aku penggemar berat indomie .",0,sebenarnya lebih Comme kari poulet sih kak hehehe tapi kalau label nya sudah indomie apa saja Entrer kok ke perut ku karena aku penggemar berat indomie,0.94046151638031,0,[0.9827 0.0065 0.0108],0,[0.8659 0.0201 0.114 ],"{'penggemar': 'penggemar', 'indomie': 'indomie', 'masuk': 'Entrer', 'suka': 'Comme', 'ayam': 'poulet'}",0,0,0.3985,,,,,,,,,
"iya enak banget soal nya ; iya dong indomie mah teh terbaik . iya , lalu aku juga tidak suka orang yang padahal jelas-jelas dia salah dan harus nya minta maaf , tapi adem ayem saja sedangkan aku nya sudah menderita .",0,"iya enak banget soal nya ; iya dong indomie mah teh terbaik . iya , lalu aku juga tidak suka orang yang padahal jelas-jelas dia salah dan harus nya minta maaf , tapi adem ayem saja sedangkan aku nya sudah menderita .",1.0,2,[0.3905 0.0095 0.6   ],2,[0.3905 0.0095 0.6   ],,2,2,0.11,,,,,,,,,
"yang terhormat , saya suka banget sama indomie . mau minta boleh tidak . inovasiin bungkus minyak nya biar gampang dibuka pakai tangan dong supaya tidak bleweran ketika tidak ada gunting . terima kasih .",0,yang terhormat saya Comme très sama indomie mau minta boleh tidak inovasiin bungkus essence nya biar gampang dibuka pakai tangan dong supaya tidak bleweran ketika tidak ada gunting terima kasih,0.9686604738235474,0,[0.9734 0.0129 0.0136],1,[0.2459 0.7277 0.0264],"{'suka': 'Comme', 'banget': 'très', 'gampang': 'gampang', 'nya': 'nya', 'terhormat': 'terhormat', 'minyak': 'essence'}",1,1,0.4047,,,,,,,,,
yang saya suka dari chitato indomie . konsistensi mereka meng - eksplore rasa lokal . kesan nya indonesia banget .,0,yang saya suka dari chitato indomie konsistensi mereka meng explorateur rasa lokal kesan nya indonesia banget,0.9861016273498536,0,[0.9971 0.0012 0.0017],0,[0.9971 0.0011 0.0018],"{'eksplore': 'explorateur', 'konsistensi': 'konsistensi', 'indomie': 'indomie', 'nya': 'nya'}",0,0,0.3539,,,,,,,,,
asus bagus . speaker - nya kencang kalau buat presentasi mayan . maka dari itu aku lebih milih asus dibanding yang lain .,0,asus bagus speaker nya kencang kalau buat presentasi mayan maka dari itu aku lebih milih asus dibanding yang lain,1.0000001192092896,0,[0.971  0.0037 0.0253],0,[0.9914 0.0031 0.0055],"{'kencang': 'kencang', 'asus': 'asus', 'nya': 'nya'}",0,2,0.3621,,,,,,,,,
"xiaomi redmi note 5 atau asus zenfone max pro m1 saja 2,5 jutaan . sudah pakai snapdragon636 , batre gede , update os terjamin , kamera bagus .",0,xiaomi redmi note 5 atau asus zenfone max pro m1 saja jutaan sudah pakai snapdragon636 batre gede update os terjamin kamera bagus,0.9927370548248292,0,[0.9961 0.0025 0.0014],0,[0.9892 0.008  0.0028],"{'terjamin': 'terjamin', 'xiaomi': 'xiaomi', 'bagus': 'bagus', 'batre': 'batre', 'kamera': 'kamera'}",0,0,0.3817,,,,,,,,,
"kalau mau minum kopi , datangkan journey kopi records . ini kedai kopi anak musik banget . jualan kaset tape , cd , sampai vinyl ! yang punya juga paham sekali musik . kopi nya enak pol . teh terbaik !",0,kalau mau minum kopi datangkan journey kopi records ini kedai kopi anak musique très jualan cassette tape cd sampai vinyl yang punya juga paham sekali musique kopi nya enak pol teh terbaik,0.9411468505859376,0,[0.9976 0.0013 0.0011],0,[0.9973 0.0015 0.0012],"{'enak': 'enak', 'nya': 'nya', 'datangkan': 'datangkan', 'kaset': 'cassette', 'musik': 'musique', 'kedai': 'kedai', 'teh': 'teh', 'banget': 'très', 'kopi': 'kopi'}",0,0,0.3986,,,,,,,,,
"aku lagi makan mangga potong ! aku suka banget buah mangga , besok kalau kepasar mau beli banyak-banyak lagi ah .",0,aku lagi makan mangga potong aku Comme banget buah mangga besok kalau kepasar mau beli lagi ah,0.9735625982284546,0,[0.9912 0.0045 0.0043],0,[0.9578 0.0237 0.0185],"{'suka': 'Comme', 'kepasar': 'kepasar', 'potong': 'potong', 'mangga': 'mangga'}",0,0,0.37,,,,,,,,,
"jaemin itu soft banget hati nya . mudah tersentuh begitu , sayang banget sama nctzen juga . inti nya dia itu suka sama yang nama nya kasih sayang . itu kenapa aku suka banget sama dia .",0,jaemin itu soft très hati nya mudah tersentuh begitu sayang très sama nctzen juga inti nya dia itu suka sama yang nom nya kasih sayang itu kenapa aku suka très sama dia,0.952408254146576,0,[0.9932 0.0025 0.0043],0,[0.9941 0.0021 0.0038],"{'tersentuh': 'tersentuh', 'jaemin': 'jaemin', 'mudah': 'mudah', 'nctzen': 'nctzen', 'soft': 'soft', 'banget': 'très', 'nama': 'nom'}",0,0,0.4069,,,,,,,,,
"ingin rekomendasi saja buat yang tertarik kuliner bandung , bacang yang ada di jalan naripan sebelah hotel ibis styles ibis yang warna hijau . sungguh , seenak itu ! buka dari jam 5 sore sampai jam 3 dinihari kalau belum sekali . harga 8 ribu . cocok buat ajak orang tersayang nya .",0,ingin rekomendasi saja buat yang tertarik culinaire bandung bacang yang ada di jalan naripan sebelah hotel ibis styles ibis yang warna hijau sungguh seenak itu buka dari jam 5 sore sampai jam 3 dinihari kalau belum sekali harga 8 ribu cocok buat ajak orang chère nya,0.9806561470031738,0,[0.9978 0.001  0.0011],0,[0.9978 0.0012 0.001 ],"{'cocok': 'cocok', 'sungguh': 'sungguh', 'naripan': 'naripan', 'kuliner': 'culinaire', 'hijau': 'hijau', 'bandung': 'bandung', 'styles': 'styles', 'seenak': 'seenak', 'tersayang': 'chère', 'ajak': 'ajak', 'bacang': 'bacang', 'ibis': 'ibis'}",0,0,0.4598,,,,,,,,,
"kuliner pertama yang harus dicoba itu ketan jompo . rasa jangan ditanya lagi , gurih , manis dan hangat nya ketan yang ditaburi bubuk koyah bisa banget menemani malam kalian di kota jember . harga nya juga murah , cuma tiga ribu . suka banget .",0,kuliner pertama yang harus dicoba itu ketan jompo rasa jangan ditanya lagi gurih manis dan hangat nya ketan yang ditaburi bubuk koyah bisa banget menemani malam kalian di kota jember harga nya juga murah cuma tiga mille suka banget,0.9957061409950256,0,[9.98e-01 9.00e-04 1.10e-03],0,[0.9976 0.001  0.0014],"{'murah': 'murah', 'ketan': 'ketan', 'kota': 'kota', 'menemani': 'menemani', 'harga': 'harga', 'dicoba': 'dicoba', 'nya': 'nya', 'ribu': 'mille', 'ditaburi': 'ditaburi'}",0,0,0.4391,,,,,,,,,
di jember itu ada tempat makan enak . nama nya warung bakaran mbak vivi . makanan nya enak-enak . bakaran nya itu pas banget matang nya . dan yang paling penting nya harga nya murah sekali untuk makanan seenak itu .,0,di jember itu ada tempat makan enak nama nya warung bakaran mbak vivi makanan nya bakaran nya itu pas très matang nya dan yang paling penting nya harga nya murah sekali untuk makanan seenak itu,0.9943724274635316,0,[9.978e-01 9.000e-04 1.300e-03],0,[0.9974 0.0011 0.0015],"{'murah': 'murah', 'pas': 'pas', 'banget': 'très', 'nya': 'nya', 'enak': 'enak', 'harga': 'harga'}",0,2,0.384,,,,,,,,,
"gue baru pertama kali ke tempat makan nama nya ayam rempah jember . rasanya bisa diadu sama makanan-makanan enak kelas atas . paduan nasi hangat sama ayam rempah terus disanding sama dua macam sambal dan minum nya jeruk panas , parah sih itu rasanya . ketagihan . bikin ingin lagi dan lagi dan lagi .",0,je baru pertama temps ke tempat makan nama nya ayam rempah jember rasanya bisa diadu sama enak kelas atas paduan nasi hangat sama ayam rempah terus disanding sama dua macam sambal dan minum nya jeruk chaud parah sih itu rasanya ketagihan bikin ingin lagi dan lagi dan lagi,0.9758472442626952,0,[0.8707 0.002  0.1273],0,[9.977e-01 9.000e-04 1.400e-03],"{'bikin': 'bikin', 'ketagihan': 'ketagihan', 'paduan': 'paduan', 'kali': 'temps', 'enak': 'enak', 'panas': 'chaud', 'gue': 'je', 'rempah': 'rempah', 'makan': 'makan', 'jember': 'jember'}",0,2,0.4753,,,,,,,,,
di jember ada juga makanan nama nya tahu telur bangka . waktu itu belum pernah nyobain makanan yang begituan . eh sekali nya mencoba gue langsung jatuh cinta . top !,0,di jember ada juga makanan nama nya tahu telur Animaux waktu itu belum pernah nyobain makanan yang begituan eh sekali nya mencoba je langsung jatuh cinta top,0.9740431308746338,0,[0.9959 0.002  0.0021],0,[0.9943 0.0031 0.0026],"{'nyobain': 'nyobain', 'begituan': 'begituan', 'bangka': 'Animaux', 'jember': 'jember', 'gue': 'je', 'jatuh': 'jatuh'}",0,0,0.3805,,,,,,,,,
pujasera okm semanggi itu salah satu tempat makan yang lagi populer di jember . asik banget buat nongkrong . wifi - nya juga kencang . kayak nya sih bakal sering-sering ke sana .,0,pujasera okm semanggi itu salah satu tempat makan yang lagi populer di jember asik banget buat entraîneur wifi nya juga kencang kayak nya sih bakal ke sana,0.9924230575561525,0,[0.998 0.001 0.001],0,[0.998 0.001 0.001],"{'nongkrong': 'entraîneur', 'okm': 'okm', 'semanggi': 'semanggi', 'asik': 'asik', 'kayak': 'kayak', 'kencang': 'kencang'}",0,2,0.3785,,,,,,,,,
haha . yang baru-baru sih sudah tidak begitu terlihat absurd nya . yang rog baru malah logo mata doang keren jadi nya . lenovo legion yang baru malah lebih-lebih lagi elegan nya . kalau saya pribadi sih suka .,0,haha yang sih sudah tidak begitu terlihat absurd nya yang rog baru malah logo mata doang keren jadi nya lenovo legion yang baru malah lagi élégant nya kalau saya pribadi sih Comme,0.9784843325614928,0,[0.9857 0.0029 0.0114],2,[0.3498 0.0153 0.635 ],"{'suka': 'Comme', 'elegan': 'élégant', 'sih': 'sih', 'absurd': 'absurd', 'nya': 'nya', 'pribadi': 'pribadi'}",2,0,0.394,,,,,,,,,
"buat gue kece banget lenovo itu . saking kece nya , layar laptop lenovo yoga 920 bisa ditekuk 360 derajat ! keren banget . memang benar sih , kadang different adalah lebih baik .",0,buat gue kece très lenovo itu saking kece nya layar laptop lenovo yoga 920 bisa ditekuk 360 derajat keren très memang benar sih kadang different adalah lebih baik,0.9696447849273682,0,[0.9897 0.0035 0.0069],0,[0.6735 0.0228 0.3037],"{'lenovo': 'lenovo', 'ditekuk': 'ditekuk', 'derajat': 'derajat', 'keren': 'keren', 'banget': 'très', 'kece': 'kece'}",2,0,0.3828,,,,,,,,,
"ultra milk ini luv banget ya . sekali nya ngeluarin flavor baru , dua-dua nya favorit ku . tapi ku lebih sayang sama yang karamel sih .",0,ultra milk ini amour très oui sekali nya ngeluarin flavor baru nya favorit ku tapi ku lebih sayang sama yang karamel sih,0.9586188197135924,0,[0.9834 0.0031 0.0135],0,[0.9362 0.0103 0.0535],"{'luv': 'amour', 'banget': 'très', 'karamel': 'karamel', 'ultra': 'ultra', 'ya': 'oui', 'milk': 'milk'}",0,2,0.363,,,,,,,,,
big cola itu enak banget . aku suka . dia tidak jauh beda enak nya dengan minuman cola lain . ditambah dia itu harga nya lebih murah . luv banget buat orang yang suka cola kayak aku .,0,big cola itu enak banget aku Comme dia tidak jauh beda enak nya dengan minuman cola lain ditambah dia itu harga nya lebih murah amour banget buat orang yang Comme cola kayak aku,0.980698823928833,0,[0.997  0.0014 0.0016],0,[0.9961 0.0016 0.0023],"{'minuman': 'minuman', 'beda': 'beda', 'nya': 'nya', 'luv': 'amour', 'cola': 'cola', 'suka': 'Comme', 'ditambah': 'ditambah', 'murah': 'murah'}",0,0,0.4025,,,,,,,,,
"dulu saya haus , setelah ke indomaret dan membeli big cola haus saya hilang , gila rasanya enak banget . sejak saat itu jadi keterusan suka minumkan big cola .",0,dulu saya haus setelah ke indomaret dan membeli big cola haus saya hilang gila rasanya enak très sejak saat itu jadi transmissivité Comme minumkan big cola,0.9657964706420898,0,[0.9766 0.0037 0.0197],0,[0.6235 0.0207 0.3557],"{'suka': 'Comme', 'banget': 'très', 'indomaret': 'indomaret', 'keterusan': 'transmissivité', 'minumkan': 'minumkan'}",0,2,0.3838,,,,,,,,,
"bca keren banget sih pelayanan nya . selain itu , dia mikirin karyawan nya banget . setiap hari saja karyawan nya dapat cemilan popcorn . salut sama pemimpinan nya . bukan cuma mikirin kenyamanan pelanggan , tapi juga karyawan .",0,bca keren très sih pelayanan nya selain itu dia mikirin karyawan nya très setiap hari saja karyawan nya dapat cemilan popcorn salut sama pemimpinan nya bukan cuma mikirin kenyamanan pelanggan tapi juga karyawan,0.9786821603775024,0,[0.9948 0.0016 0.0036],0,[0.9888 0.0034 0.0078],"{'cemilan': 'cemilan', 'keren': 'keren', 'pelayanan': 'pelayanan', 'salut': 'salut', 'bca': 'bca', 'banget': 'très', 'nya': 'nya'}",0,0,0.4237,,,,,,,,,
sumpah big cola jauh banget lebih enak daripada coca cola ! tidak terlalu manis dan tidak menyisakan pait di mulut seperti coke zero . wkwk norak ya gue baru mencoba . tapi asli enak banget .,0,sumpah big cola jauh très lebih enak daripada coca cola tidak terlalu manis dan tidak menyisakan pait di mulut seperti coke zéro wkwk norak oui je baru mencoba tapi original enak très,0.9265964031219482,0,[0.9585 0.002  0.0395],0,[0.9025 0.004  0.0935],"{'enak': 'enak', 'asli': 'original', 'gue': 'je', 'mulut': 'mulut', 'ya': 'oui', 'banget': 'très', 'zero': 'zéro', 'big': 'big'}",0,2,0.4177,,,,,,,,,
aku sayang banget sama susu ultramilk . rasanya tiap ke indomaret tidak pernah tidak beli susu itu . enak . ketagihan .,0,aku sayang banget sama susu ultramilk rasanya tiap ke indomaret tidak pernah tidak beli susu itu enak ketagihan,1.0000001192092896,0,[0.9958 0.0016 0.0025],0,[0.9971 0.0011 0.0019],"{'ultramilk': 'ultramilk', 'enak': 'enak', 'ketagihan': 'ketagihan'}",0,0,0.3712,,,,,,,,,
oppo f7 menurut gue mantap banget sih . mulai dari kamera depan nya yang bersih . terus layar nya penuh display pakai gorilla glass 5 . lalu kamera belakang nya naik tingkat banget dari yang sebelumnya . tidak menyesal gue beli ini hp .,0,oppo f7 menurut gue mantap banget sih mulai dari kamera depan nya yang bersih terus layar nya plein display pakai gorilla verre 5 lalu kamera belakang nya naik tingkat banget dari yang sebelumnya tidak menyesal gue beli ini hp,0.9951265454292296,0,[0.9966 0.0014 0.002 ],0,[0.9965 0.0014 0.0021],"{'menyesal': 'menyesal', 'mantap': 'mantap', 'bersih': 'bersih', 'penuh': 'plein', 'gorilla': 'gorilla', 'layar': 'layar', 'kamera': 'kamera', 'glass': 'verre', 'nya': 'nya'}",0,0,0.432,,,,,,,,,
sarapan nya enak dan pilihan nya lumayan banyak . kamar baik . ac - nya juga dingin . hotel aston gue rekomendasikan sih buat kalian-kalian yang mau menginap di hotel .,0,sarapan nya enak dan pilihan nya raisonnable banyak kamar baik ac nya juga dingin hotel aston gue recommandeur sih buat yang mau menginap di hotel,0.9803913235664368,0,[0.9976 0.001  0.0015],0,[9.98e-01 9.00e-04 1.10e-03],"{'sarapan': 'sarapan', 'pilihan': 'pilihan', 'enak': 'enak', 'lumayan': 'raisonnable', 'rekomendasikan': 'recommandeur', 'nya': 'nya'}",0,2,0.3956,,,,,,,,,
"ini , ya , menurut gue tentang hotel aston itu , pertama staf hotel tanggap , cepat dan ramah . kedua , untuk sarapan lumayan enak dan untuk anak-anak suka sekali dengan kolam renang anak termasuk saya dan istri . ketiga yang pasti bersih .",0,ini oui menurut gue tentang hotel aston itu pertama staf hotel tanggap cepat dan ramah kedua untuk sarapan lumayan enak dan untuk suka sekali dengan kolam renang anak termasuk saya dan istri ketiga yang pasti bersih,0.9863005876541138,0,[9.978e-01 9.000e-04 1.300e-03],0,[9.979e-01 9.000e-04 1.200e-03],"{'ketiga': 'ketiga', 'anak': 'anak', 'tanggap': 'tanggap', 'ramah': 'ramah', 'staf': 'staf', 'ya': 'oui', 'kolam': 'kolam'}",0,0,0.426,,,,,,,,,
kolam renang di hotel aston bikin tidak mau berenti berenang . nyaman banget . air nya bersih . tempat bilas nya nyaman .,0,kolam renang di hotel aston bikin tidak mau berenti berenang nyaman très air nya bersih tempat bilas nya nyaman,0.9781771302223206,0,[9.979e-01 9.000e-04 1.200e-03],0,[9.963e-01 8.000e-04 2.900e-03],"{'banget': 'très', 'nyaman': 'nyaman', 'bersih': 'bersih', 'hotel': 'hotel', 'aston': 'aston', 'kolam': 'kolam'}",0,0,0.3536,,,,,,,,,
wah keren ya persiapan bni . saya juga mendukung . semoga bisa berjalan lancar .,0,wah keren ya persiapan bni saya juga mendukung semoga bisa berjalan lancar,1.0000001192092896,0,[0.9796 0.0119 0.0085],0,[0.9923 0.0039 0.0037],"{'keren': 'keren', 'persiapan': 'persiapan', 'bni': 'bni'}",0,1,0.352,,,,,,,,,
lebih enak lagi kalau nasi padang oreo momogi chocolatos . terus semua itu di campur di aduk pakai tangan ? baru dimakan . enak banget .,0,lebih enak lagi kalau nasi padang oreo momogi chocolatos terus semua itu di campur di aduk pakai tangan baru gale enak très,0.9740182757377625,0,[0.9969 0.0014 0.0017],0,[0.9922 0.0039 0.0039],"{'dimakan': 'gale', 'enak': 'enak', 'campur': 'campur', 'banget': 'très', 'aduk': 'aduk'}",0,0,0.3701,,,,,,,,,
sudah lama tidak minum ultra milk rasa stroberi . pas sekarang minum merasa enak sekali tidak tahu kenapa . ketagihan . rasanya ingin beli sekardus gede buat diminum sendiri .,0,sudah lama tidak minum ultra milk rasa stroberi pas sekarang minum merasa enak sekali tidak tahu kenapa ketagihan rasanya ingin beli sekardus gede buat boissons sendiri,0.9834075570106506,0,[0.9889 0.0018 0.0093],0,[0.9711 0.0061 0.0228],"{'enak': 'enak', 'sekardus': 'sekardus', 'stroberi': 'stroberi', 'diminum': 'boissons'}",0,2,0.374,,,,,,,,,
"go jek makin sini makin keren deh . semoga makin baik ya dalam pelayanan dan aplikasi nya ya go car , go jek , dan go go lainnya . chiiiiirrs .",0,go jack makin sini makin keren deh semoga makin baik ya dalam pelayanan dan aplikasi nya ya go car go jack dan go go lainnya chiiiiirrs,0.9060804843902588,0,[0.9814 0.006  0.0126],0,[0.9854 0.0045 0.01  ],"{'chiiiiirrs': 'chiiiiirrs', 'jek': 'jack', 'deh': 'deh', 'keren': 'keren', 'go': 'go'}",0,0,0.3691,,,,,,,,,
"go jek . kalian harus tetap ada , karena kami bukan sekadar butuh angkutan . kami juga butuh pelayanan yang prima seperti biasanya . saya sangat mendukung kalian .",0,go jek kalian harus tetap ada karena kami bukan sekadar butuh angkutan kami juga butuh pelayanan yang prima seperti biasanya saya sangat mendukung kalian,1.0,0,[0.9734 0.0098 0.0167],0,[0.9732 0.0102 0.0166],"{'angkutan': 'angkutan', 'mendukung': 'mendukung', 'prima': 'prima'}",0,0,0.3723,,,,,,,,,
saya senang di bali bagus pelayanan go-jek - nya . sangat terbantu dengan keberadaan nya . memang harus ada terus supaya pelayanan nya semakin memuaskan .,0,saya senang di bali bagus pelayanan nya sangat terbantu dengan keberadaan nya memang harus ada terus supaya pelayanan nya semakin memuaskan,0.9952055215835572,0,[0.9949 0.0021 0.0031],0,[0.9962 0.0015 0.0023],"{'bali': 'bali', 'bagus': 'bagus', 'terbantu': 'terbantu', 'pelayanan': 'pelayanan'}",0,0,0.3629,,,,,,,,,
kalau driver go jek tidak pelayanan prima meminta bungkus acar untuk mengambil saos tambahan hilang nafsu makan saya . bravo driver go jek .,0,kalau driver go jek tidak pelayanan prima meminta bungkus acar untuk mengambil saos tambahan hilang nafsu makan saya . bravo driver go jek .,1.0,2,[0.0127 0.0034 0.9839],2,[0.0127 0.0034 0.9839],,2,2,0.12,,,,,,,,,
banyak alasan saya bisa merasa puas dengan pelayanan go jek . go jek tidak pernah lepas dari tanggung jawab . itu adalah nilai plus yang belum tentu dimiliki oleh perusahaan yang lain .,0,banyak alasan saya bisa merasa puas dengan pelayanan go jack go jack tidak pernah lepas dari tanggung jawab itu adalah nilai plus yang belum tentu dimiliki oleh perusahaan yang lain,0.9433504939079284,0,[0.9933 0.0028 0.004 ],0,[0.994  0.0024 0.0037],"{'pelayanan': 'pelayanan', 'jek': 'jack', 'puas': 'puas', 'lepas': 'lepas', 'go': 'go'}",0,0,0.378,,,,,,,,,
go jek selalu jadi inspirasi untuk perusahaan-perusahaan di indonesia . pelayanan nya bravo . selalu berkembang setiap waktu dan memberi kemudahan bagi pelanggan .,0,go jek selalu jadi inspirasi untuk di indonesia pelayanan nya bravo selalu berkembang setiap waktu dan memberi kemudahan bagi pelanggan,0.9916524291038512,0,[0.9962 0.0017 0.0021],0,[0.9961 0.0017 0.0022],"{'pelayanan': 'pelayanan', 'inspirasi': 'inspirasi', 'nya': 'nya', 'go': 'go'}",0,0,0.3683,,,,,,,,,
suka sama hotel ibis . dia selalu bikin inovasi buat menjaga kenyamanan pelanggan . selalu konsisten juga memberi pelayanan yang terbaik untuk tamu .,0,Comme sama hotel ibis dia selalu bikin inovasi buat menjaga kenyamanan pelanggan selalu konsisten juga memberi pelayanan yang terbaik untuk tamu,0.9765545129776,0,[0.9959 0.0018 0.0023],0,[0.9932 0.0033 0.0034],"{'suka': 'Comme', 'ibis': 'ibis', 'inovasi': 'inovasi', 'kenyamanan': 'kenyamanan'}",0,0,0.3692,,,,,,,,,
"kepada yang terhormat ibu dari ayi djembarsari . selamat menunaikan tugas , bu , sebagai dirut rshs . semoga pelayanan rshs semakin baik . saya bangga kepada ibu .",0,kepada yang terhormat ibu dari ayi djembarsari selamat menunaikan tugas bu sebagai dirut RSH semoga pelayanan RSH semakin baik saya féroce kepada ibu,0.9641335010528564,0,[0.9689 0.02   0.0111],0,[0.9486 0.0331 0.0183],"{'bangga': 'féroce', 'djembarsari': 'djembarsari', 'pelayanan': 'pelayanan', 'terhormat': 'terhormat', 'rshs': 'RSH'}",0,0,0.3751,,,,,,,,,
terima kasih atas saran yang kamu berikan kak . kami akan selalu berusaha untuk meningkatkan pelayanan kami untuk pengalaman belanja yang lebih menyenangkan ya .,0,terima kasih atas saran yang kamu berikan kak kami akan selalu berusaha untuk meningkatkan pelayanan kami untuk pengalaman achats yang lebih menyenangkan ya,0.9873047471046448,0,[0.9772 0.0172 0.0056],0,[0.9775 0.0168 0.0057],"{'belanja': 'achats', 'pengalaman': 'pengalaman', 'menyenangkan': 'menyenangkan', 'berusaha': 'berusaha'}",0,1,0.3748,,,,,,,,,
"hai kak , terima kasih atas masukan kamu ya . saran kamu sangat berharga bagi kami . kami akan berupaya meningkatkan performa aplikasi dan pelayanan kami untuk pengalaman jual - beli yang selalu menyenangkan untuk kamu dan semua sobat shopee ya kak :",0,hai soeurette terima kasih atas masukan kamu ya saran kamu sangat berharga bagi kami kami akan berupaya meningkatkan performa aplikasi dan pelayanan kami untuk pengalaman jual beli yang selalu menyenangkan untuk kamu dan semua sobat shopee ya soeurette,0.9780436158180236,0,[0.9704 0.0227 0.0069],0,[0.9813 0.0139 0.0048],"{'pengalaman': 'pengalaman', 'menyenangkan': 'menyenangkan', 'jual': 'jual', 'kak': 'soeurette', 'pelayanan': 'pelayanan', 'beli': 'beli', 'berharga': 'berharga', 'performa': 'performa'}",0,1,0.4225,,,,,,,,,
"keleveru terbaik memang , dari kualitas , kuantitas , pelayanan pun terbaik . tidak salah pilih aku .",0,keleveru terbaik memang dari kualitas kuantitas pelayanan pun terbaik tidak mauvais pilih aku,0.9209728240966796,0,[0.9913 0.0031 0.0057],0,[0.9914 0.002  0.0066],"{'salah': 'mauvais', 'keleveru': 'keleveru', 'kuantitas': 'kuantitas'}",0,0,0.3727,,,,,,,,,
cocok banget gue pakai shope . sudah mana ongkos kirim gratis . pengiriman juga aman dan lancar .,0,cocok très gue pakai shope sudah mana ongkos kirim libre pengiriman juga aman dan lancar,0.9304236769676208,0,[0.9978 0.0011 0.0011],0,[0.9973 0.0016 0.0011],"{'banget': 'très', 'ongkos': 'ongkos', 'cocok': 'cocok', 'gratis': 'libre'}",0,0,0.3646,,,,,,,,,
"alhamdulillah selama beli di lazada tidak pernah bermasalah . barang-barang nya lebih lucu-lucu . pelayanan juga lebih baik dari yang lain . sudah deh kalau beli apa-apa , aku mau beli di lazada saja .",0,alhamdulillah selama beli di lazada tidak pernah bermasalah nya lebih pelayanan juga lebih baik dari yang lain sudah deh kalau beli aku mau beli di lazada saja,0.98991596698761,0,[0.9947 0.0022 0.0032],0,[0.9911 0.0041 0.0048],"{'bermasalah': 'bermasalah', 'pelayanan': 'pelayanan', 'nya': 'nya', 'alhamdulillah': 'alhamdulillah'}",0,2,0.3828,,,,,,,,,
"karena shopee bukan barang shope , dia itu tempat belanjaan aku yang paling luar biasa ! pelayanan nya oke punya , disko nya banjir !",0,karena shopee bukan barang shope dia itu tempat belanjaan aku yang paling luar biasa pelayanan nya oke punya disko nya banjir,1.0000001192092896,0,[0.9017 0.0046 0.0937],0,[0.9862 0.0025 0.0113],"{'pelayanan': 'pelayanan', 'oke': 'oke', 'nya': 'nya'}",0,0,0.3677,,,,,,,,,
"harus belanja di shopee karena shopee itu memberikan bukti pelayanan yang baik , bukan sekadar janji doang , seperti mantan itu",0,harus belanja di shopee karena shopee itu memberikan bukti pelayanan yang baik bukan sekadar janji doang seperti mantan itu,1.0000001192092896,0,[0.5225 0.0121 0.4654],0,[0.9341 0.0118 0.0542],"{'shopee': 'shopee', 'pelayanan': 'pelayanan'}",0,0,0.3554,,,,,,,,,
harus belanja di shopee karena pelayanan dari shope itu benar benar memuaskan pelanggan dan takkan mengecewakan .,0,harus belanja di shopee karena pelayanan dari shope itu benar benar memuaskan pelanggan dan takkan mengecewakan,1.0000001192092896,0,[0.9929 0.0028 0.0043],0,[0.9946 0.0021 0.0033],"{'takkan': 'takkan', 'memuaskan': 'memuaskan', 'pelayanan': 'pelayanan'}",0,0,0.3453,,,,,,,,,
karena hanya shope yang pelayanan nya memuaskan . diskon besar-besaran . barang nya juga pasti nya bermerek . mantap .,0,karena hanya shope yang pelayanan nya memuaskan diskon barang nya juga pasti nya bermerek mantap,0.9920081496238708,0,[0.9974 0.0011 0.0015],0,[0.9974 0.0011 0.0015],"{'mantap': 'mantap', 'bermerek': 'bermerek', 'memuaskan': 'memuaskan', 'shope': 'shope'}",0,0,0.3504,,,,,,,,,
