text,sentiment,perturbed_text,perturbed_semantic_sim,pred_label,pred_proba,perturbed_label,perturbed_proba,translated_word(s),adv_pred,adv_pred_on_orig,running_time(s),before_attack_acc,after_attack_acc,avg_semantic_sim,avg_running_time(s),adv_training,delta_acc,delta_adv,acc_adv_training_on_orig,best_epoch
"selamat pagi , untuk melihat tagihan dapat menghubungi bni call 1500046 , kemudian tekan 0 untuk berbicara dengan bni call officer lalu tekan 2 untuk berbicara dengan bni call officer layanan kartu kredit . nanti petugas kami akan membantu anda .",1,selamat pagi untuk melihat tagihan dapat menghubungi bni call 1500046 kemudian tekan 0 untuk berbicara dengan bni call officer lalu tekan 2 untuk berbicara dengan bni call officer layanan kartu kredit nanti petugas kami akan membantu anda,1.0,1,[0.025 0.97  0.005],1,[0.0151 0.9764 0.0085],"{'officer': 'officer', 'layanan': 'layanan', 'berbicara': 'berbicara', 'kredit': 'kredit', 'call': 'call'}",1,1,0.5148,,,,,,,,,
"selamat pagi . silakan hubungi bni call 1500046 untuk melakukan pemblokiran . setelah itu , silakan datang ke kantor cabang bni terdekat dengan membawa ktp , surat keterangan hilang dari kepolisian , dan buku tabungan untuk penggantian kartu nya ya .",1,selamat pagi silakan hubungi bni call 1500046 untuk melakukan pemblokiran setelah itu silakan datang ke kantor cabang bni terdekat dengan appporter ktp surat keterangan hilang dari kepolisian dan buku tabungan untuk penggantian kartu nya ya,0.994964063167572,1,[0.0116 0.9801 0.0083],1,[0.005  0.9896 0.0054],"{'hilang': 'hilang', 'terdekat': 'terdekat', 'membawa': 'appporter', 'call': 'call', 'surat': 'surat', 'keterangan': 'keterangan', 'nya': 'nya', 'buku': 'buku', 'ktp': 'ktp', 'kartu': 'kartu'}",1,1,0.4353,,,,,,,,,
"tadi sore saya baru cek email dan sudah transfer kekurangan 30.000 , tapi belum ada balasan lagi . apakah transferan nya sudah masuk ? atas nama ellena saufika , no. cust 253360 , tf via mbanking bni .",1,tadi sore saya baru cek email dan sudah transfer kekurangan tapi belum ada balasan lagi apakah transferan nya sudah Entrer atas nom ellena saufika cust 253360 tf via mbanking bni,0.9731526374816896,1,[0.0028 0.9835 0.0137],1,[0.003  0.9883 0.0087],"{'kekurangan': 'kekurangan', 'masuk': 'Entrer', 'tf': 'tf', 'mbanking': 'mbanking', 'nya': 'nya', 'nama': 'nom', 'cust': 'cust'}",1,1,0.2583,,,,,,,,,
"jakarta , 29 november 2017 di hotel ibis kramat 100 jakarta pusat , balai ksda jakarta mengadakan bimtek web - based integrated system peredaran tsl secara online e - permit untuk mengenalkan sebuah aplikasi pelayanan pemanfaatan tsl yang dinamai si pinter sistem perijinan terpadu .",1,jakarta 29 november 2017 di hotel ibis kramat 100 jakarta centre balai ksda jakarta mengadakan bimtek web based integrated système circulation tsl secara online e pardon untuk mengenalkan sebuah aplikasi pelayanan pemanfaatan tsl yang dinamai si pinter sistem perijinan terpadu,0.9558225870132446,1,[0.0135 0.9832 0.0033],1,[0.0142 0.9827 0.0032],"{'pusat': 'centre', 'peredaran': 'circulation', 'pelayanan': 'pelayanan', 'online': 'online', 'system': 'système', 'permit': 'pardon', 'e': 'e', 'sistem': 'sistem', 'bimtek': 'bimtek', 'web': 'web', 'mengadakan': 'mengadakan', 'si': 'si', 'aplikasi': 'aplikasi'}",1,1,0.4087,,,,,,,,,
"dalam kunjungan kerja nya ke provinsi jawa barat , presiden meninjau pelayanan bpjs dan kartu indonesia sehat kis di rumah sakit umum pendidikan rsup dari . hasan sadikin rshs , kota bandung , kamis siang , 22 februari 2018 .",1,dalam kunjungan kerja nya ke provinsi jawa Ouest presiden meninjau pelayanan bpjs dan kartu indonesia sehat kis di rumah malade umum pendidikan rsup dari hasan sadikin rshs kota bandung kamis siang 22 februari 2018,0.9778692126274108,1,[0.0094 0.9874 0.0032],1,[0.0098 0.9862 0.004 ],"{'siang': 'siang', 'kis': 'kis', 'pendidikan': 'pendidikan', 'kartu': 'kartu', 'presiden': 'presiden', 'februari': 'februari', 'kota': 'kota', 'kerja': 'kerja', 'barat': 'Ouest', 'sakit': 'malade', 'pelayanan': 'pelayanan'}",1,1,0.4273,,,,,,,,,
hari ini rshs berusia 89 tahun .,1,hari ini RSH berusia 89 tahun,0.916084051132202,1,[0.0281 0.9287 0.0432],1,[0.0208 0.9534 0.0257],{'rshs': 'RSH'},1,1,0.3345,,,,,,,,,
"pada tanggal 16 februari 2018 esok poliklinik rawat jalan rshs tidak melakukan pelayanan dikarenakan hari libur nasional . poli kembali buka hari senin , 19 februari 2018 .",1,pada tanggal 16 februari 2018 esok poliklinik rawat Rue RSH tidak melakukan pelayanan dikarenakan hari libur nationale poli kembali buka hari senin 19 februari 2018,0.8993526697158813,1,[0.0151 0.9761 0.0089],1,[0.0128 0.9761 0.0111],"{'rshs': 'RSH', 'nasional': 'nationale', 'buka': 'buka', 'senin': 'senin', 'esok': 'esok', 'jalan': 'Rue'}",1,1,0.3768,,,,,,,,,
kami ingin mengumumkan bahwa mal bom kini hadir di shopee mal !,1,kami ingin annoncer bahwa mal bombe kini hadir di shopee mal,0.8118661642074585,1,[0.007  0.9862 0.0068],1,[0.0118 0.9825 0.0058],"{'bom': 'bombe', 'mengumumkan': 'annoncer'}",1,1,0.3605,,,,,,,,,
"hari ini periode submission xpresound telah ditutup , ya . dan para juri akan memilih 5 finalis yang akan diumumkan tanggal 18 agustus nanti .",1,hari ini periode submission xpresound telah fermé ya dan para juri akan memilih 5 finalis yang akan diumumkan tanggal 18 agustus nanti,0.968191623687744,1,[0.0165 0.9764 0.007 ],1,[0.0221 0.9667 0.0112],"{'agustus': 'agustus', 'periode': 'periode', 'memilih': 'memilih', 'ditutup': 'fermé'}",1,1,0.3848,,,,,,,,,
"informasi tambahan bahwa untuk pembayaran rp 2 juta yang bapak lakukan tidak menjadikan limit menjadi rp 7 juta , melainkan pembayaran tersebut akan mengurangi tagihan yang sedang berjalan . jika kartu kredit dalam keadaan berlebihan limit maka akan dikenakan biaya rp 40 ribu .",1,informasi tambahan bahwa untuk Paiement rp 2 million yang bapak lakukan tidak menjadikan limit menjadi rp 7 million melainkan Paiement tersebut akan mengurangi tagihan yang sedang marche jika kartu kredit dalam keadaan berlebihan limit maka akan dikenakan biaya rp 40 mille,0.8845690488815308,1,[0.0362 0.9477 0.0161],1,[0.0241 0.9552 0.0208],"{'biaya': 'biaya', 'dikenakan': 'dikenakan', 'limit': 'limit', 'pembayaran': 'Paiement', 'ribu': 'mille', 'berjalan': 'marche', 'juta': 'million'}",1,1,0.4419,,,,,,,,,
sebentar lagi asian games 2018 dimulai nih ! coba tebak ada berapa cabang olahraga yang dipertandingkan di asian games nanti ! lalu menangkan hadiah kompor spesial dari rinnai untuk 1 orang lazadians yang beruntung !,1,sebentar lagi asian games 2018 dimulai nih coba tebak ada berapa cabang sport yang dipertandingkan di asian games nanti lalu menangkan hadiah kompor spesial dari rinnai untuk 1 orang lazadians yang beruntung,0.9869590997695924,1,[0.3523 0.6407 0.007 ],1,[0.2562 0.7364 0.0074],"{'olahraga': 'sport', 'asian': 'asian', 'spesial': 'spesial', 'sebentar': 'sebentar', 'games': 'games'}",0,1,0.3872,,,,,,,,,
"saat kunjungan ke hotel , menag banyak menerima apresiasi atas layanan haji tahun ini .",0,saat kunjungan ke hotel menag banyak menerima apresiasi atas layanan haji tahun ini,1.0,0,[0.8959 0.095  0.0091],0,[0.9679 0.0265 0.0056],"{'layanan': 'layanan', 'menerima': 'menerima'}",0,0,0.3322,,,,,,,,,
pagi ini pemkab pemalang melalui menyelenggarakan kegiatan launching sistem layanan informasi publik secara online dan rakor ppid di salah satu hotel di pemalang 10 / 7 / 2018 .,1,pagi ini pemkab pemalang melalui menyelenggarakan activité launching sistem layanan informasi publik secara online dan rakor ppid di salah satu hotel di pemalang 10 7 2018,0.9761755466461182,1,[0.0096 0.9853 0.0051],1,[0.0112 0.9818 0.007 ],"{'sistem': 'sistem', 'hotel': 'hotel', 'kegiatan': 'activité', 'online': 'online', 'rakor': 'rakor', 'pagi': 'pagi'}",1,1,0.3777,,,,,,,,,
"kemnaker ri menyelenggarakan pameran kesempatan kerja job fair nasional tahun 2018 di balairung hotel bumiwiyata depok , jawa barat tanggal 4 - 5 juli 2018 . job fair ini tidak dipungut biaya / gratis .",1,kemnaker ri menyelenggarakan pameran kesempatan kerja travailler équitable nationale tahun 2018 di balairung hotel bumiwiyata depok jawa Ouest tanggal 4 5 juli 2018 travailler équitable ini tidak dipungut biaya gratis,0.8687623739242554,1,[0.0531 0.9425 0.0044],1,[0.0144 0.9819 0.0036],"{'job': 'travailler', 'pameran': 'pameran', 'barat': 'Ouest', 'nasional': 'nationale', 'kerja': 'kerja', 'hotel': 'hotel', 'ri': 'ri', 'fair': 'équitable'}",1,1,0.3812,,,,,,,,,
"gelaran jateng wow 2018 telah usai pada 31 maret lalu . dari pelaksanaan selama dua bulan penuh , kegiatan ini telah meningkatkan hunian hotel mendatangkan ribuan kunjungan wisatawan mancanegara ke jawa tengah .",0,gelaran jateng wow 2018 telah usai pada 31 maret lalu dari pelaksanaan selama dua bulan penuh kegiatan ini telah meningkatkan hunian hotel mendatangkan ribuan kunjungan wisatawan mancanegara ke jawa tengah,1.0000001192092896,0,[0.5571 0.433  0.0098],0,[0.728  0.2654 0.0067],"{'gelaran': 'gelaran', 'maret': 'maret', 'jawa': 'jawa', 'meningkatkan': 'meningkatkan', 'wisatawan': 'wisatawan', 'mancanegara': 'mancanegara'}",0,1,0.387,,,,,,,,,
presiden harapkan menpar ri dan menko untuk mengajak pelaku pariwisata baik hotel maupun maskapai penerbangan untuk juga diajak memberikan informasi mempromosikan wisata di indonesia khusus nya bali .,1,presiden harapkan Menpar ri dan menko untuk mengajak pelaku pariwisata baik hotel maupun maskapai penerbangan untuk juga diajak memberikan renseignements mempromosikan wisata di indonesia khusus nya bali,0.978010594844818,1,[0.1298 0.8649 0.0053],1,[0.2764 0.7135 0.01  ],"{'informasi': 'renseignements', 'presiden': 'presiden', 'penerbangan': 'penerbangan', 'menko': 'menko', 'menpar': 'Menpar', 'hotel': 'hotel', 'diajak': 'diajak'}",1,1,0.3775,,,,,,,,,
gubernur dki jakarta anies baswedan membentuk tim evaluasi tata kelola air minum . pembentukan tim ini tertuang dalam keputusan gubernur nomor 1149 tahun 2018 yang ditandatangani 10 agustus 2018 . tim ini diketuai sekretaris daerah saefullah dengan wakil ketua asisten pembangunan dan lingkungan hidup yusmada faizal .,1,gouverneur dki Jakarta anies baswedan membentuk tim evaluasi tata kelola air boissons formation tim ini tertuang dalam keputusan gouverneur nomor 1149 tahun 2018 yang ditandatangani 10 agustus 2018 tim ini diketuai sekretaris daerah saefullah dengan wakil ketua assistant pembangunan dan lingkungan hidup yusmada faizal,0.9319908618927002,1,[0.0068 0.9886 0.0047],1,[0.0049 0.9911 0.0041],"{'pembentukan': 'formation', 'evaluasi': 'evaluasi', 'membentuk': 'membentuk', 'gubernur': 'gouverneur', 'daerah': 'daerah', 'hidup': 'hidup', 'tata': 'tata', 'asisten': 'assistant', 'jakarta': 'Jakarta', 'air': 'air', 'tim': 'tim', 'keputusan': 'keputusan', 'minum': 'boissons'}",1,1,0.4528,,,,,,,,,
"tujuh pemain real madrid akan menyamai rekor paolo maldini dan dani alves yang sampai saat ini masih menyandang predikat raja di piala super eropa . ketujuh pemain yang dimaksud adalah dani carvajal , sergio ramos , marcelo , luka modric , karim benzema , isco , dan toni kroos . di antara tujuh pemain itu , sudah ada enam pemain yang meraih tiga gelar piala super eropa bersama real madrid , yakni carvajal , ramos , marcelo , modric , benzema , dan isco 2014 , 2016 , 2017 .",1,tujuh pemain real Madrid akan menyamai rekor paolo maldini dan dani alves yang sampai saat ini masih menyandang predikat raja di Trophée super eropa ketujuh pemain yang dimaksud adalah dani carvajal Sergio ramos marcelo luka modrique Karim benzema isco dan toni kroos di antara tujuh pemain itu sudah ada enam pemain yang meraih tiga gelar Trophée super eropa bersama real Madrid yakni carvajal ramos marcelo modrique benzema dan isco 2014 2016 2017,0.9856871366500854,1,[0.3507 0.603  0.0463],1,[0.1853 0.7891 0.0256],"{'modric': 'modrique', 'tujuh': 'tujuh', 'marcelo': 'marcelo', 'karim': 'Karim', 'sergio': 'Sergio', 'pemain': 'pemain', 'benzema': 'benzema', 'kroos': 'kroos', 'dani': 'dani', 'isco': 'isco', 'ramos': 'ramos', 'luka': 'luka', 'super': 'super', 'piala': 'Trophée', 'paolo': 'paolo', 'enam': 'enam', 'madrid': 'Madrid'}",1,1,0.6407,,,,,,,,,
"keberadaan peraturan presiden nomor 54 tahun 2018 tentang strategi nasional pencegahan korupsi yang telah diteken oleh presiden joko widodo pada 20 juli 2018 silam diharapkan mampu menghasilkan perubahan mendasar , khusus nya terkait tiga aspek . ketiga aspek itu menyangkut perizinan dan tata niaga , keuangan negara , dan penegakan hukum serta reformasi birokrasi .",1,keberadaan régulation presiden Numéro 54 tahun 2018 tentang strategi nasional pencegahan korupsi yang telah diteken oleh presiden joko widodo pada 20 juli 2018 silam diharapkan mampu menghasilkan perubahan mendasar khusus nya terkait tiga aspect ketiga aspect itu menyangkut perizinan dan tata niaga keuangan paie dan penegakan hukum serta reformasi birokrasi,0.9550366401672364,1,[0.0196 0.9754 0.0051],1,[0.0136 0.9824 0.004 ],"{'diharapkan': 'diharapkan', 'joko': 'joko', 'peraturan': 'régulation', 'perizinan': 'perizinan', 'negara': 'paie', 'presiden': 'presiden', 'pencegahan': 'pencegahan', 'strategi': 'strategi', 'tata': 'tata', 'nomor': 'Numéro', 'hukum': 'hukum', 'diteken': 'diteken', 'aspek': 'aspect'}",1,1,0.4815,,,,,,,,,
"beberapa fungsi layanan kami membutuhkan pendaftaran akun dengan memilih identifikasi pengguna id pengguna dan kata sandi unik , serta memberikan informasi pribadi tertentu . apabila anda memilih id pengguna yang dianggap tidak sopan atau tidak pantas oleh shopee atas kebijakan nya sendiri , shopee berhak untuk menangguhkan atau mengakhiri akun anda .",1,beberapa fungsi layanan kami membutuhkan pendaftaran akun dengan memilih identification pengguna id pengguna dan kata sandi unik serta memberikan informasi pribadi tertentu apabila anda memilih id pengguna yang dianggap tidak sopan atau tidak pantas oleh shopee atas kebijakan nya sendiri shopee berhak untuk menangguhkan atau mengakhiri akun anda,0.9871572256088256,1,[0.0081 0.9027 0.0893],1,[0.0096 0.9293 0.0611],"{'identifikasi': 'identification', 'menangguhkan': 'menangguhkan', 'dianggap': 'dianggap', 'membutuhkan': 'membutuhkan', 'sandi': 'sandi', 'id': 'id', 'unik': 'unik', 'fungsi': 'fungsi', 'pribadi': 'pribadi', 'pengguna': 'pengguna'}",1,1,0.461,,,,,,,,,
"sebuah musibah baru saja menimpa kampung adat megalitikum gurusina di bajawa , flores . kebakaran hebat yang terjadi pada senin 13 / 8 sore hampir menghanguskan seluruh kampung . total 27 dari 33 rumah adat yang ada habis dilalap api bersama semua cerita dan sejarah nya .",1,"sebuah musibah baru saja menimpa kampung adat megalitikum gurusina di bajawa , flores . kebakaran hebat yang terjadi pada senin 13 / 8 sore hampir menghanguskan seluruh kampung . total 27 dari 33 rumah adat yang ada habis dilalap api bersama semua cerita dan sejarah nya .",1.0,2,[0.0985 0.0637 0.8378],2,[0.0985 0.0637 0.8378],,0,0,0.11,,,,,,,,,
"di usia 57 tahun , saat nya gerakan pramuka di tanah air menjawab tantangan zaman baru . anggota pramuka harus dididik bukan hanya bahasa morse , tetapi juga pengetahuan digital seperti coding , artificial intelligence , advance robotic , dan internet of things .",1,di usia 57 tahun saat nya gerakan scout di tanah air menjawab tantangan zaman baru anggota scout harus dididik bukan hanya bahasa morse tetapi juga pengetahuan digital seperti coding artificial intelligence advance robotique dan internet of things,0.9299309849739076,1,[0.1593 0.7973 0.0434],1,[0.0333 0.9572 0.0095],"{'robotic': 'robotique', 'coding': 'coding', 'intelligence': 'intelligence', 'pramuka': 'scout', 'of': 'of', 'anggota': 'anggota', 'things': 'things', 'morse': 'morse', 'advance': 'advance'}",1,1,0.3983,,,,,,,,,
"dalam paparan nya , menkeu smi menekankan penting nya menjaga integritas taxmin sebagai penyalur utama informasi perpajakan agar menyampaikan informasi yang baik dan benar kepada masyarakat melalui media sosial yang dimiliki nya .",1,dalam paparan nya menkeu smi menekankan penting nya menjaga integritas taxmin sebagai penyalur directeur renseignements perpajakan agar menyampaikan renseignements yang baik dan benar kepada masyarakat melalui médias sosial yang dimiliki nya,0.92478609085083,1,[0.0264 0.9692 0.0044],1,[0.044  0.9487 0.0073],"{'masyarakat': 'masyarakat', 'informasi': 'renseignements', 'media': 'médias', 'utama': 'directeur', 'sosial': 'sosial', 'menjaga': 'menjaga'}",1,1,0.388,,,,,,,,,
"sahabat mido , untuk kenyamanan pemohon paspor dan menghindari praktik percaloan , direktorat jenderal imigrasi bekerjasama dengan kementerian keuangan melalui bank-bank yang tergabung dalam sistim informasi penerimaan negara bukan pajak online simponi .",1,Amy mido untuk kenyamanan pemohon paspor dan menghindari praktik percaloan direktorat jenderal imigrasi bekerjasama dengan kementerian keuangan melalui yang tergabung dalam sistim renseignements penerimaan paie bukan pajak online simponi,0.8852266669273376,1,[0.0045 0.9915 0.004 ],1,[0.005  0.9898 0.0053],"{'informasi': 'renseignements', 'negara': 'paie', 'bekerjasama': 'bekerjasama', 'online': 'online', 'pajak': 'pajak', 'sistim': 'sistim', 'direktorat': 'direktorat', 'sahabat': 'Amy'}",1,1,0.385,,,,,,,,,
"hai kak . saat ini jam opertional restoran pizza hut belum sampai 24 jam ya . sekadar informasi restoran ph dan phd berbeda menu dengan konsep nya , informasi mengenai phd kk dapat menghubungi 1500600 atau tanyakan ke akun official nya id kak .",1,"hai kak . saat ini jam opertional restoran pizza hut belum sampai 24 jam ya . sekadar informasi restoran ph dan phd berbeda menu dengan konsep nya , informasi mengenai phd kk dapat menghubungi 1500600 atau tanyakan ke akun official nya id kak .",1.0,0,[0.8674 0.1269 0.0056],0,[0.8674 0.1269 0.0056],,1,1,0.1,,,,,,,,,
"juru bicara komisi pemberantasan korupsi kpk febri diansyah mengungkapkan , laporan harta kekayaan calon presiden joko widodo telah terverifikasi lengkap . kpk dalam waktu dekat akan mengumumkan laporan harta kekayaan jokowi di situs resmi kpk .",1,juru bicara komisi pemberantasan korupsi kpk febri diansyah mengungkapkan laporan harta kekayaan calon presiden joko widodo telah terverifikasi Achevée kpk dalam waktu dekat akan annoncer laporan harta kekayaan jokowi di situs resmi kpk,0.9731643199920654,1,[0.0072 0.9865 0.0064],1,[0.0045 0.9882 0.0073],"{'lengkap': 'Achevée', 'joko': 'joko', 'mengumumkan': 'annoncer', 'laporan': 'laporan', 'kekayaan': 'kekayaan', 'presiden': 'presiden', 'calon': 'calon', 'bicara': 'bicara'}",1,1,0.3927,,,,,,,,,
dia tidak pantas jadi pemimpin negara ini .,2,dia tidak pantas jadi chef negara ini,0.9021556377410888,2,[0.0094 0.0051 0.9855],2,[0.0272 0.0074 0.9654],{'pemimpin': 'chef'},2,2,0.3006,,,,,,,,,
"tidak perlu diragukan lagi , semua orang memang membenci dia , aku pun sama .",2,tidak perlu diragukan lagi semua orang memang membenci dia aku pun sama,1.0000001192092896,2,[0.3665 0.0256 0.6079],2,[0.3239 0.0226 0.6535],{'diragukan': 'diragukan'},2,2,0.3442,,,,,,,,,
"selalu tidak suka sama cara dia ngomong , belepotan , dan sok paling mengerti sama masalah di negara ini .",2,selalu tidak suka sama cara dia ngomong belepotan dan sok paling mengerti sama masalah di negara ini,1.0000001192092896,2,[0.0135 0.0036 0.983 ],2,[0.0148 0.004  0.9812],"{'sok': 'sok', 'belepotan': 'belepotan'}",2,2,0.3495,,,,,,,,,
pelayanan di supermarket itu payah .,2,pelayanan di supermarket itu pouilleux,0.9381356239318848,2,[0.007  0.0022 0.9908],2,[0.038  0.0055 0.9565],{'payah': 'pouilleux'},2,2,0.2925,,,,,,,,,
"aku kecewa dengan pelayanan hotel yang semalam aku tempati , kamar mandi kotor , pelayan tidak ramah .",2,aku kecewa dengan pelayanan hotel yang semalam aku occuper kamar mandi kotor pelayan tidak ramah,0.9765462279319764,2,[0.014  0.0022 0.9838],2,[0.0162 0.0023 0.9815],"{'kotor': 'kotor', 'ramah': 'ramah', 'tempati': 'occuper', 'pelayan': 'pelayan'}",2,2,0.3361,,,,,,,,,
"parah , sih , bikin emosi naik ngobrol sama pelayanan pelanggan bank itu , songong setelah .",2,parah sih bikin emosi naik ngobrol sama pelayanan pelanggan bank itu songong setelah,1.0,2,[0.0249 0.0096 0.9655],2,[0.0116 0.0034 0.9851],"{'parah': 'parah', 'songong': 'songong', 'ngobrol': 'ngobrol'}",2,2,0.3343,,,,,,,,,
dia tidak cocok pakai baju mahal karena dari sana nya memang sudah kelihatan kayak orang miskin .,2,dia tidak cocok pakai baju mahal karena dari sana nya memang sudah kelihatan kayak orang miskin,1.0,2,[0.0173 0.0061 0.9766],2,[0.0201 0.0059 0.974 ],"{'miskin': 'miskin', 'kayak': 'kayak', 'cocok': 'cocok'}",2,2,0.3469,,,,,,,,,
"harga makanan di restoran tadi mahal banget , sudah begitu tidak enak lagi makanan nya .",2,harga makanan di restoran tadi mahal très sudah begitu tidak enak lagi makanan nya,0.9726725220680236,2,[0.0126 0.0022 0.9852],2,[0.0235 0.0031 0.9734],"{'enak': 'enak', 'mahal': 'mahal', 'banget': 'très'}",2,0,0.3303,,,,,,,,,
"nyesel deh beli baju di toko tadi , kualitas nya murahan banget .",2,nyesel deh beli baju di toko tadi kualitas nya murahan banget,1.0,2,[0.0088 0.0026 0.9887],2,[0.0075 0.0025 0.99  ],"{'murahan': 'murahan', 'nyesel': 'nyesel', 'deh': 'deh'}",2,2,0.3387,,,,,,,,,
"ipuh , pantesan tidak pernah didatangkan banyak orang , ternyata tempat makan di sana dalem nya kotor banget , sampah saja dibiarkan berserakan .",2,ipuh pantesan tidak pernah didatangkan banyak orang ternyata tempat makan di sana dalem nya kotor banget déchets saja dibiarkan berserakan,0.983555257320404,2,[0.021  0.0027 0.9763],2,[0.0178 0.0026 0.9796],"{'sampah': 'déchets', 'kotor': 'kotor', 'orang': 'orang', 'dibiarkan': 'dibiarkan'}",2,2,0.3486,,,,,,,,,
"tidak ada enak nya makan di sana , bakso tidak enak , teh manis nya rasanya aneh , mi ayam nya mie nya kelembekan , tidak mau lagi deh ke sana .",2,tidak ada enak nya makan di sana bakso tidak enak teh manis nya rasanya aneh mi ayam nya mie nya kelembekan tidak mau lagi deh ke sana,1.0000001192092896,2,[0.035  0.0027 0.9623],2,[0.0631 0.0044 0.9326],"{'aneh': 'aneh', 'enak': 'enak', 'teh': 'teh', 'nya': 'nya'}",2,0,0.379,,,,,,,,,
"benci banget sama pelayanan di rumah sakit itu , tidak ada adab nya .",2,benci banget sama pelayanan di rumah malade itu tidak ada adab nya,0.9736213684082032,2,[0.0129 0.0024 0.9847],2,[0.0142 0.0026 0.9831],"{'sakit': 'malade', 'nya': 'nya'}",2,2,0.3463,,,,,,,,,
saya tidak mau bicara lagi sama orang bodoh kayak dia .,2,saya tidak mau bicara lagi sama orang bodoh kayak dia,1.0,2,[0.0387 0.0205 0.9408],2,[0.1667 0.0291 0.8042],{'kayak': 'kayak'},2,2,0.3339,,,,,,,,,
"sampai kapan pun , saya tidak sudi berbagi sama orang yang tidak tahu terima kasih biarpun dia keluarga saya sendiri .",2,sampai kapan pun saya tidak sudi partager sama orang yang tidak tahu terima kasih biarpun dia keluarga saya sendiri,0.9799098372459412,2,[0.0078 0.0051 0.9871],2,[0.0306 0.0222 0.9472],"{'sudi': 'sudi', 'berbagi': 'partager'}",2,2,0.342,,,,,,,,,
"gue tidak puas sama pelayanan kerja di tempat kemarin , hak-hak karyawan dibatesin banget .",2,gue tidak puas sama pelayanan kerja di tempat kemarin karyawan dibatesin banget,0.9918891191482544,2,[0.0188 0.0027 0.9785],2,[0.0163 0.0025 0.9811],"{'dibatesin': 'dibatesin', 'kemarin': 'kemarin', 'karyawan': 'karyawan'}",2,2,0.338,,,,,,,,,
"gue sudah mengecap dia jelek sih , jadi mau sebaik apa pun sikap nya , gue tetap tidak suka dia .",2,je sudah mengecap dia jelek sih jadi mau sebaik apa pun sikap nya je tetap tidak suka dia,0.9669576287269592,2,[0.0237 0.0049 0.9714],2,[0.0211 0.0055 0.9734],"{'nya': 'nya', 'sikap': 'sikap', 'gue': 'je'}",2,0,0.3435,,,,,,,,,
"setelah diperhatikan , iklan di indonesia paling tidak kreatif dibanding negara lain , terutama thailand .",2,setelah diperhatikan iklan di indonesia paling tidak kreatif dibanding negara lain terutama thailand,1.0000001192092896,2,[0.0173 0.0069 0.9758],2,[0.0166 0.0071 0.9763],"{'iklan': 'iklan', 'dibanding': 'dibanding'}",2,2,0.3455,,,,,,,,,
"tidak mengerti lagi sama perfilman di indonesia , tidak berkualitas banget .",2,tidak mengerti lagi sama perfilman di indonesia tidak berkualitas banget,1.0,2,[0.0083 0.0029 0.9889],2,[0.011  0.0032 0.9857],"{'perfilman': 'perfilman', 'mengerti': 'mengerti'}",2,2,0.3397,,,,,,,,,
"gue enggak suka sama pelatih timnas yang sekarang , strategi yang dibikin nya tidak bisa dipakai buat mengalahkan lawan .",2,gue enggak suka sama pelatih timnas yang sekarang strategi yang fabriqué nya tidak bisa dipakai buat mengalahkan lawan,0.983249306678772,2,[0.0147 0.004  0.9813],2,[0.0105 0.0045 0.985 ],"{'strategi': 'strategi', 'dipakai': 'dipakai', 'dibikin': 'fabriqué', 'pelatih': 'pelatih'}",2,2,0.3492,,,,,,,,,
"orang-orang di indonesia itu memang begitu , kerjaan nya nethink terus sama pemimpin . tidak suka gue .",2,di indonesia itu memang begitu kerjaan nya nethink terus sama chef tidak Comme gue,0.9351232051849364,2,[0.0076 0.0024 0.99  ],2,[0.0292 0.008  0.9627],"{'suka': 'Comme', 'pemimpin': 'chef'}",2,2,0.3473,,,,,,,,,
"kadang bingung sih kenapa mulut netijen pada tidak bisa dijaga , bisa nya behina terus . aneh .",2,kadang bingung sih kenapa mulut netijen pada tidak bisa dijaga bisa nya behina terus aneh,1.0000001192092896,2,[0.0128 0.0034 0.9838],2,[0.0174 0.0052 0.9774],"{'aneh': 'aneh', 'dijaga': 'dijaga', 'mulut': 'mulut'}",2,2,0.3461,,,,,,,,,
ah persija mah cupu .,2,ah persija mah cupu,1.0,2,[0.3171 0.0406 0.6423],2,[0.4691 0.0424 0.4885],{'mah': 'mah'},2,2,0.2985,,,,,,,,,
persija cuma bisa mencari ribut saja kalau lagi main di lapangan . main nya tidak jago sama sekali .,2,persija cuma bisa chercher bruyant saja kalau lagi main di lapangan main nya tidak jago sama sekali,0.9706534147262572,2,[0.0283 0.0072 0.9645],2,[0.074  0.0238 0.9022],"{'jago': 'jago', 'ribut': 'bruyant', 'mencari': 'chercher'}",2,0,0.3413,,,,,,,,,
