perturbed_text,rating
sangat mbebayani saya sudah dhawuh dan membayar tetapi e tiket tidak ada juga padahal bukti pembayaran sudah jelas sudah menelepon pelayanan pelanggan berkali kali dan tidak ada solusi nya pulsa sudah habis ratusan ribu saya meminta kembalikan dhuwit juga sangat lama proses nya sangat mbebayani pengguna banyak kerugian dhuwit transport waktu penginapan,
pembayaran sudah dilakukan tetapi e tiket tidak malah dipesan diblang kadaluarsa titip cs nya jwaban nya tidak ada yang membantu dan tidak sinkron semua sampai sekarang belum jelas Bali uang ataupun penggantian tiket disarankan tidak usah memakai aplikasi ini,
serem melihat pengalaman yang sudah pesan di sini becik uninstal saja aplikasi ini becik pakai burung biru saja jelas,
baru sadar bahwa selama ini ternyata saya bukan apple penggemar saya adalah wong stevejob yang kuciwa karena apple kalah inovasi oleh samsung,
app ini sangat membantu sekali dengan memberikan kemudahan dalam pesan tiket to bepergian ke mana pun sehingga saya tidak harus keluar lagi to mmbli tiket semoga aplikasi ini selalu lncar ya setiap x melakukan pemesanan,
juru bicara komisi pemberantasan korupsi kpk febri diansyah mengungkapkan laporan bandha kekayaan calon presiden joko widodo telah terverifikasi lengkap kpk dalam waktu dekat akan mengumumkan laporan bandha kekayaan jokowi di situs resmi kpk,
benci banget sama pelayanan di rumah nyeri itu tidak ada adab nya,
sekarang makin banyak orang yang ora ku islami tapi akhlak kagak dijaga selalu merasa jadi orang paling benar,
di antara olah raga yang ada aku paling tidak suka sepak bola,
asli ya gue suka banget sama alur cerita film kafir polos tapi dapat makna nya,
menyesal pesan tiket pesawat di sudah di transfer dibilang transaksi kadaluwarsa pulsa habis banyak untuk telpon pelayanan pelanggan,
kfc chizza apa banget tidak jelas rasanya rasanya ingin buntut kfc buat mengembalikan uang aku kuciwa,
app ini sangat membantu sekali dengan memberikan kemudahan dalam pesen tiket to bepergian ke mana pun sehingga saya tidak harus keluar lagi to mmbli tiket semoga aplikasi ini selalu lncar ya setiap x melakukan pemesanan,
nuduhake kasih atas tanggapan dari 2 keluhan yang saya alami mengenai hilang nya kuota data saya nuduhake kasih xl karena sudah menanggapi dan memberikan solusi yang sangat memuaskan atas saya saya jadi merasa sangat terbantu,
terima kasih pelayanan mantap nih Bali dana cair kurang dari 12 jam rekomendasi banget traveloka,
e tiket sudah saya nuduhake mantap reservasi cepat harga murah nomor 1 tiketing online indonesia,
samsung panasonic sharp dan berbagai produsen lainnya telah memasarkan berbagai macam jinis mesin cuci dengan fungsi yang beragam,
juru bicara komisi pemberantasan korupsi kpk febri diansyah mengungkapkan laporan bandha kekayaan calon presiden joko widodo telah terverifikasi lengkap kpk dalam waktu dekat akan mengumumkan laporan bandha kekayaan jokowi di situs resmi kpk,
menurut aku sih Indonesia bakal susah bangkit kalau isi otak penduduk nya aja,
dulu pernah mencoba belajar renang tapi tenggelam terus sekarang tidak mau lagi deh aku renang trauma seram,
Jangan main2 dengan Mereka yang bermain dengan SARA apalagi mendekati tahun hampir dapat di pasti ujungnya,
jujur iya aku soalnya aku takut keciduk lulus dari mobil di suatu tempat om aku driver ojol takutnya beliau liat,
Lambat laun kok makin ga jelas dan semakin kurang Gw Jujur gw ga pernah dan ga mau scr frontal maki Gw blg Scr,
bukan soal idolamu yang bukan soal lebay si ini soal sexual harrasement yang dijadiin komentar bercanda dan dianggap biasa semoga bukan atau orang yang kamu kenal yang diperlakukan begitu baru kamu,
Banyak maba mereka tidak tau kalo kuliah itu gak kayak difilm pada sumringah Ntar sebulan langsung kusut,
Morningside Fazerdaze Lagu2nya begitu enaq didengerin lulus halodo alias summer jam 10 pagi sambil Enak didengerin lulus mood lagi bagus2nya bikin W suka Lucky Little Jennifer sm Bedroom Talks,
semenjak itu gw mulai ngerasa takut untuk menjalin hubungan Gw takut di boongin Trauma,
Sebelah mana dari pernyataan Coba siapa tahu saya salah Bagus dong yen banyak yang Semakin banyak makin terdengar suara untuk semakin Kalau benar tapi kalah keras sama yang itu yang harus,
Hanya orang yg berotak tai seperti anda yg mengatakan jakarta sekarang lebih bagus Makanya menilai sesuatu itu harus jauh dari kepentingan diri sendiri,
Aku bahagia bersama dan tresna dengan Mencintai dengan apa Dan hanya dengan Pisces ku tak ingin apapun yang Bahkan dulu jika ku disebut pun aku memang tresna membuat,
Orang yg tidak dewasa adalah wong yg membenci mantannya Mereka yg membenci mantan adalah yg tidak faham arti cinta dan kasih Malah gak jarang ada wong yg mantannya dulu kenapa mau pacaran sama Setan,
Hadir salam ane di segmen salsa icikiwir minta to long maca ya,
Mengapa hidup ini ada yang mengatakan Mungkin dia menganggap hidup ini sebagai pertarungan juga arena Kalau dia berfikir layaknya maka hidup ya seperti bercocok ia akan merasa diantara harapan ketakutan,
pasti mereka punya budaya TAPI KALAU PERKARA KELAHI DI KANDANG LAWAN ATAU DI KANDANG itu sudah udah dari NENEK MOYANG N,
jujur ya aku juga banci yang ngamen gitu pernah kejadian soalnya banci serem banget yen lahi marah marah sambil nodong piso,
Kalo yg di Jakarta kan jago nyembunyiin buktinya dia punya perusahaan offshore yg kerja namanya katon di Panama jadi harus jago banget untuk bisa temuin bukti,
aku merasa gagal menjadi aku tadi cuman mau bohong tapi jawaban mu seperti termakan sendiri sedih maaf yaa,
Ketika ada kegiatan kantor di Pusat yang bertepatan pada rencana tgl waras itu artinya adalah tiket waras gratis,
Pernah dikirimin kue sma temen pake seminggu ga trus diganti sma pihak Jne dikirim seminggu nyampe tapi basi kuenya sampe nyusut setelahnya gamau lagi pake,
Cinta sejati adalah ketika dia mencintai orang dan kamu masih mampu sambil aku turut bahagia Jika kita mencintai,
