text,sentiment,perturbed_text,perturbed_semantic_sim,pred_label,pred_proba,perturbed_label,perturbed_proba,translated_word(s),adv_pred,adv_pred_on_orig,running_time(s),before_attack_acc,after_attack_acc,avg_semantic_sim,avg_running_time(s),adv_training,delta_acc,delta_adv,acc_adv_training_on_orig,best_epoch
"selamat pagi . silakan hubungi bni call 1500046 untuk melakukan pemblokiran . setelah itu , silakan datang ke kantor cabang bni terdekat dengan membawa ktp , surat keterangan hilang dari kepolisian , dan buku tabungan untuk penggantian kartu nya ya .",1,selamat pagi silakan hubungi bni call 1500046 untuk melakukan pemblokiran setelah itu silakan datang ke kantor cabang bni terdekat dengan membawa ktp surat keterangan hilang dari kepolisian dan buku tabungan untuk penggantian kartu milik ya,0.9898312091827391,1,[0.0116 0.9801 0.0083],1,[0.0058 0.9891 0.005 ],"{'hilang': 'hilang', 'terdekat': 'terdekat', 'membawa': 'membawa', 'call': 'call', 'surat': 'surat', 'keterangan': 'keterangan', 'nya': 'milik', 'buku': 'buku', 'ktp': 'ktp', 'kartu': 'kartu'}",1,1,0.1117,,,,,,,,,
"tadi sore saya baru cek email dan sudah transfer kekurangan 30.000 , tapi belum ada balasan lagi . apakah transferan nya sudah masuk ? atas nama ellena saufika , no. cust 253360 , tf via mbanking bni .",1,tadi sore saya baru cek email dan sudah transfer kekurangan tapi belum ada balasan lagi apakah transferan milik sudah masuk atas fabrikasi ellena saufika cust 253360 tf via perbankan bni,0.9579733610153198,1,[0.0028 0.9835 0.0137],1,[0.0033 0.989  0.0076],"{'kekurangan': 'kekurangan', 'masuk': 'masuk', 'tf': 'tf', 'mbanking': 'perbankan', 'nya': 'milik', 'nama': 'fabrikasi', 'cust': 'cust'}",1,1,0.1299,,,,,,,,,
"jakarta , 29 november 2017 di hotel ibis kramat 100 jakarta pusat , balai ksda jakarta mengadakan bimtek web - based integrated system peredaran tsl secara online e - permit untuk mengenalkan sebuah aplikasi pelayanan pemanfaatan tsl yang dinamai si pinter sistem perijinan terpadu .",1,jakarta 29 november 2017 di hotel ibis kramat 100 jakarta pusat balai ksda jakarta mengadakan bimtek web based integrated system peredaran tsl secara online e permit untuk mengenalkan sebuah aplikasi pelayanan pemanfaatan tsl yang dinamai si pinter sistem perijinan terpadu,1.0,1,[0.0135 0.9832 0.0033],1,[0.012  0.9847 0.0033],"{'pusat': 'pusat', 'peredaran': 'peredaran', 'pelayanan': 'pelayanan', 'online': 'online', 'system': 'system', 'permit': 'permit', 'e': 'e', 'sistem': 'sistem', 'bimtek': 'bimtek', 'web': 'web', 'mengadakan': 'mengadakan', 'si': 'si', 'aplikasi': 'aplikasi'}",1,1,0.1479,,,,,,,,,
"dalam kunjungan kerja nya ke provinsi jawa barat , presiden meninjau pelayanan bpjs dan kartu indonesia sehat kis di rumah sakit umum pendidikan rsup dari . hasan sadikin rshs , kota bandung , kamis siang , 22 februari 2018 .",1,dalam kunjungan kerja nya ke provinsi jawa kulon presiden meninjau pelayanan bpjs dan kartu indonesia sehat kis di rumah garing umum pendidikan rsup dari hasan sadikin rshs kota bandung kamis siang 22 februari 2018,0.9845116138458252,1,[0.0094 0.9874 0.0032],1,[0.0088 0.9874 0.0038],"{'siang': 'siang', 'kis': 'kis', 'pendidikan': 'pendidikan', 'kartu': 'kartu', 'presiden': 'presiden', 'februari': 'februari', 'kota': 'kota', 'kerja': 'kerja', 'barat': 'kulon', 'sakit': 'garing', 'pelayanan': 'pelayanan'}",1,1,0.1051,,,,,,,,,
hari ini rshs berusia 89 tahun .,1,hari ini rshs berusia 89 tahun,1.0000001192092896,1,[0.0281 0.9287 0.0432],1,[0.019  0.9355 0.0456],{'rshs': 'rshs'},1,1,0.0566,,,,,,,,,
"pada tanggal 16 februari 2018 esok poliklinik rawat jalan rshs tidak melakukan pelayanan dikarenakan hari libur nasional . poli kembali buka hari senin , 19 februari 2018 .",1,pada tanggal 16 februari 2018 esok poliklinik rawat jalan rshs tidak melakukan pelayanan dikarenakan hari libur nasional poli kembali buka hari senin 19 februari 2018,1.0,1,[0.0151 0.9761 0.0089],1,[0.0102 0.982  0.0078],"{'rshs': 'rshs', 'nasional': 'nasional', 'buka': 'buka', 'senin': 'senin', 'esok': 'esok', 'jalan': 'jalan'}",1,1,0.0813,,,,,,,,,
kami ingin mengumumkan bahwa mal bom kini hadir di shopee mal !,1,kami ingin mengumumkan bahwa mal bom kini hadir di shopee mal,1.0,1,[0.007  0.9862 0.0068],1,[0.0093 0.9827 0.008 ],"{'bom': 'bom', 'mengumumkan': 'mengumumkan'}",1,1,0.0694,,,,,,,,,
"hari ini periode submission xpresound telah ditutup , ya . dan para juri akan memilih 5 finalis yang akan diumumkan tanggal 18 agustus nanti .",1,hari ini periode submission xpresound telah ditutup ya dan para juri akan memilih 5 finalis yang akan diumumkan tanggal 18 agustus nanti,1.0000001192092896,1,[0.0165 0.9764 0.007 ],1,[0.0206 0.9693 0.0101],"{'agustus': 'agustus', 'periode': 'periode', 'memilih': 'memilih', 'ditutup': 'ditutup'}",1,1,0.0831,,,,,,,,,
"informasi tambahan bahwa untuk pembayaran rp 2 juta yang bapak lakukan tidak menjadikan limit menjadi rp 7 juta , melainkan pembayaran tersebut akan mengurangi tagihan yang sedang berjalan . jika kartu kredit dalam keadaan berlebihan limit maka akan dikenakan biaya rp 40 ribu .",1,informasi tambahan bahwa untuk pembayaran rp 2 juta yang bapak lakukan tidak menjadikan wates menjadi rp 7 juta melainkan pembayaran tersebut akan mengurangi tagihan yang sedang lempang jika kartu kredit dalam keadaan berlebihan wates maka akan dikenakan biaya rp 40 sarébu,0.9525336027145386,1,[0.0362 0.9477 0.0161],1,[0.0233 0.9675 0.0092],"{'biaya': 'biaya', 'dikenakan': 'dikenakan', 'limit': 'wates', 'pembayaran': 'pembayaran', 'ribu': 'sarébu', 'berjalan': 'lempang', 'juta': 'juta'}",1,1,0.1145,,,,,,,,,
sebentar lagi asian games 2018 dimulai nih ! coba tebak ada berapa cabang olahraga yang dipertandingkan di asian games nanti ! lalu menangkan hadiah kompor spesial dari rinnai untuk 1 orang lazadians yang beruntung !,1,sebentar lagi asian games 2018 dimulai nih coba tebak ada berapa cabang olahraga yang dipertandingkan di asian games nanti lalu menangkan hadiah kompor spesial dari rinnai untuk 1 orang lazadians yang beruntung,1.0000001192092896,1,[0.3523 0.6407 0.007 ],1,[0.2795 0.7129 0.0077],"{'olahraga': 'olahraga', 'asian': 'asian', 'spesial': 'spesial', 'sebentar': 'sebentar', 'games': 'games'}",1,1,0.0964,,,,,,,,,
"saat kunjungan ke hotel , menag banyak menerima apresiasi atas layanan haji tahun ini .",0,saat kunjungan ke hotel menag banyak menerima apresiasi atas layanan haji tahun ini,1.0,0,[0.8959 0.095  0.0091],0,[0.9679 0.0265 0.0056],"{'layanan': 'layanan', 'menerima': 'menerima'}",0,0,0.0647,,,,,,,,,
pagi ini pemkab pemalang melalui menyelenggarakan kegiatan launching sistem layanan informasi publik secara online dan rakor ppid di salah satu hotel di pemalang 10 / 7 / 2018 .,1,pagi ini pemkab pemalang melalui menyelenggarakan kegiatan launching sistem layanan informasi publik secara online dan rakor ppid di salah satu hotel di pemalang 10 7 2018,1.0,1,[0.0096 0.9853 0.0051],1,[0.0089 0.9862 0.0049],"{'sistem': 'sistem', 'hotel': 'hotel', 'kegiatan': 'kegiatan', 'online': 'online', 'rakor': 'rakor', 'pagi': 'pagi'}",1,1,0.0867,,,,,,,,,
"kemnaker ri menyelenggarakan pameran kesempatan kerja job fair nasional tahun 2018 di balairung hotel bumiwiyata depok , jawa barat tanggal 4 - 5 juli 2018 . job fair ini tidak dipungut biaya / gratis .",1,kemnaker ri menyelenggarakan pameran kesempatan kerja job fair nasional tahun 2018 di balairung hotel bumiwiyata depok jawa kulon tanggal 4 5 juli 2018 job fair ini tidak dipungut biaya gratis,0.9867249727249146,1,[0.0531 0.9425 0.0044],1,[0.0194 0.9764 0.0042],"{'job': 'job', 'pameran': 'pameran', 'barat': 'kulon', 'nasional': 'nasional', 'kerja': 'kerja', 'hotel': 'hotel', 'ri': 'ri', 'fair': 'fair'}",1,1,0.0963,,,,,,,,,
"gelaran jateng wow 2018 telah usai pada 31 maret lalu . dari pelaksanaan selama dua bulan penuh , kegiatan ini telah meningkatkan hunian hotel mendatangkan ribuan kunjungan wisatawan mancanegara ke jawa tengah .",0,gelaran jateng wow 2018 telah usai pada 31 maret lalu dari pelaksanaan selama dua bulan penuh kegiatan ini telah meningkatkan hunian hotel mendatangkan ribuan kunjungan wisatawan mancanegara ke jawa tengah,1.0000001192092896,0,[0.5571 0.433  0.0098],0,[0.728  0.2654 0.0067],"{'gelaran': 'gelaran', 'maret': 'maret', 'jawa': 'jawa', 'meningkatkan': 'meningkatkan', 'wisatawan': 'wisatawan', 'mancanegara': 'mancanegara'}",0,0,0.0937,,,,,,,,,
presiden harapkan menpar ri dan menko untuk mengajak pelaku pariwisata baik hotel maupun maskapai penerbangan untuk juga diajak memberikan informasi mempromosikan wisata di indonesia khusus nya bali .,1,presiden harapkan menpar ri dan menko untuk mengajak pelaku pariwisata baik hotel maupun maskapai hiber untuk juga diajak memberikan informasi mempromosikan wisata di indonesia khusus nya bali,0.9862154722213744,1,[0.1298 0.8649 0.0053],1,[0.1954 0.7985 0.0061],"{'informasi': 'informasi', 'presiden': 'presiden', 'penerbangan': 'hiber', 'menko': 'menko', 'menpar': 'menpar', 'hotel': 'hotel', 'diajak': 'diajak'}",1,1,0.0847,,,,,,,,,
gubernur dki jakarta anies baswedan membentuk tim evaluasi tata kelola air minum . pembentukan tim ini tertuang dalam keputusan gubernur nomor 1149 tahun 2018 yang ditandatangani 10 agustus 2018 . tim ini diketuai sekretaris daerah saefullah dengan wakil ketua asisten pembangunan dan lingkungan hidup yusmada faizal .,1,gubernur dki jakarta anies baswedan membentuk tim evaluasi sistem kelola air minum pembentukan tim ini tertuang dalam keputusan gubernur nomor 1149 tahun 2018 yang ditandatangani 10 agustus 2018 tim ini diketuai sekretaris daerah saefullah dengan wakil ketua asisten pembangunan dan lingkungan hidup yusmada faizal,0.979882836341858,1,[0.0068 0.9886 0.0047],1,[0.0054 0.9902 0.0044],"{'pembentukan': 'pembentukan', 'evaluasi': 'evaluasi', 'membentuk': 'membentuk', 'gubernur': 'gubernur', 'daerah': 'daerah', 'hidup': 'hidup', 'tata': 'sistem', 'asisten': 'asisten', 'jakarta': 'jakarta', 'air': 'air', 'tim': 'tim', 'keputusan': 'keputusan', 'minum': 'minum'}",1,1,0.1413,,,,,,,,,
"tujuh pemain real madrid akan menyamai rekor paolo maldini dan dani alves yang sampai saat ini masih menyandang predikat raja di piala super eropa . ketujuh pemain yang dimaksud adalah dani carvajal , sergio ramos , marcelo , luka modric , karim benzema , isco , dan toni kroos . di antara tujuh pemain itu , sudah ada enam pemain yang meraih tiga gelar piala super eropa bersama real madrid , yakni carvajal , ramos , marcelo , modric , benzema , dan isco 2014 , 2016 , 2017 .",1,tujuh pemain real madrid akan menyamai rekor paolo maldini dan dani alves yang sampai saat ini masih menyandang predikat raja di piala super eropa ketujuh pemain yang dimaksud adalah dani carvajal sergio ramos marcelo rajah modric karim bénzéma isco dan toni kroos di antara tujuh pemain itu sudah ada genep pemain yang meraih tiga gelar piala super eropa bersama real madrid yakni carvajal ramos marcelo modric bénzéma dan isco 2014 2016 2017,0.9802324175834656,1,[0.3507 0.603  0.0463],1,[0.1746 0.8002 0.0252],"{'modric': 'modric', 'tujuh': 'tujuh', 'marcelo': 'marcelo', 'karim': 'karim', 'sergio': 'sergio', 'pemain': 'pemain', 'benzema': 'bénzéma', 'kroos': 'kroos', 'dani': 'dani', 'isco': 'isco', 'ramos': 'ramos', 'luka': 'rajah', 'super': 'super', 'piala': 'piala', 'paolo': 'paolo', 'enam': 'genep', 'madrid': 'madrid'}",1,1,0.2466,,,,,,,,,
"keberadaan peraturan presiden nomor 54 tahun 2018 tentang strategi nasional pencegahan korupsi yang telah diteken oleh presiden joko widodo pada 20 juli 2018 silam diharapkan mampu menghasilkan perubahan mendasar , khusus nya terkait tiga aspek . ketiga aspek itu menyangkut perizinan dan tata niaga , keuangan negara , dan penegakan hukum serta reformasi birokrasi .",1,keberadaan aturan presiden nomor 54 tahun 2018 tentang strategi nasional pencegahan korupsi yang telah diteken oleh presiden joko widodo pada 20 juli 2018 silam diharapkan mampu menghasilkan perubahan mendasar khusus nya terkait tiga aspek ketiga aspek itu menyangkut perizinan dan sistem niaga keuangan nagara dan penegakan hukum serta reformasi birokrasi,0.9783769845962524,1,[0.0196 0.9754 0.0051],1,[0.0136 0.9817 0.0047],"{'diharapkan': 'diharapkan', 'joko': 'joko', 'peraturan': 'aturan', 'perizinan': 'perizinan', 'negara': 'nagara', 'presiden': 'presiden', 'pencegahan': 'pencegahan', 'strategi': 'strategi', 'tata': 'sistem', 'nomor': 'nomor', 'hukum': 'hukum', 'diteken': 'diteken', 'aspek': 'aspek'}",1,1,0.1428,,,,,,,,,
"beberapa fungsi layanan kami membutuhkan pendaftaran akun dengan memilih identifikasi pengguna id pengguna dan kata sandi unik , serta memberikan informasi pribadi tertentu . apabila anda memilih id pengguna yang dianggap tidak sopan atau tidak pantas oleh shopee atas kebijakan nya sendiri , shopee berhak untuk menangguhkan atau mengakhiri akun anda .",1,beberapa fungsi layanan kami peryogi pendaftaran akun dengan memilih identifikasi pengguna id pengguna dan kata sandi unik serta memberikan informasi pribadi tertentu apabila anda memilih id pengguna yang dianggap tidak sopan atau tidak pantas oleh shopee atas kebijakan nya sendiri shopee berhak untuk menangguhkan atau mengakhiri akun anda,0.996315896511078,1,[0.0081 0.9027 0.0893],1,[0.0115 0.8514 0.1371],"{'identifikasi': 'identifikasi', 'menangguhkan': 'menangguhkan', 'dianggap': 'dianggap', 'membutuhkan': 'peryogi', 'sandi': 'sandi', 'id': 'id', 'unik': 'unik', 'fungsi': 'fungsi', 'pribadi': 'pribadi', 'pengguna': 'pengguna'}",1,1,0.1345,,,,,,,,,
"sebuah musibah baru saja menimpa kampung adat megalitikum gurusina di bajawa , flores . kebakaran hebat yang terjadi pada senin 13 / 8 sore hampir menghanguskan seluruh kampung . total 27 dari 33 rumah adat yang ada habis dilalap api bersama semua cerita dan sejarah nya .",1,"sebuah musibah baru saja menimpa kampung adat megalitikum gurusina di bajawa , flores . kebakaran hebat yang terjadi pada senin 13 / 8 sore hampir menghanguskan seluruh kampung . total 27 dari 33 rumah adat yang ada habis dilalap api bersama semua cerita dan sejarah nya .",1.0,2,[0.0985 0.0637 0.8378],2,[0.0985 0.0637 0.8378],,2,2,0.02,,,,,,,,,
"di usia 57 tahun , saat nya gerakan pramuka di tanah air menjawab tantangan zaman baru . anggota pramuka harus dididik bukan hanya bahasa morse , tetapi juga pengetahuan digital seperti coding , artificial intelligence , advance robotic , dan internet of things .",1,di usia 57 tahun saat nya gerakan pramuka di tanah air menjawab tantangan zaman baru anggota pramuka harus dididik bukan hanya bahasa morse tetapi juga pengetahuan digital seperti coding artificial intelligence sateuacanna robotic dan internet of Hal,0.9639980792999268,1,[0.1593 0.7973 0.0434],1,[0.0446 0.9443 0.0111],"{'robotic': 'robotic', 'coding': 'coding', 'intelligence': 'intelligence', 'pramuka': 'pramuka', 'of': 'of', 'anggota': 'anggota', 'things': 'Hal', 'morse': 'morse', 'advance': 'sateuacanna'}",1,1,0.1075,,,,,,,,,
"dalam paparan nya , menkeu smi menekankan penting nya menjaga integritas taxmin sebagai penyalur utama informasi perpajakan agar menyampaikan informasi yang baik dan benar kepada masyarakat melalui media sosial yang dimiliki nya .",1,dalam paparan nya menkeu smi menekankan penting nya menjaga integritas taxmin sebagai penyalur utama informasi perpajakan agar menyampaikan informasi yang baik dan benar kepada masyarakat melalui media sosial yang dimiliki nya,1.0,1,[0.0264 0.9692 0.0044],1,[0.0271 0.9687 0.0042],"{'masyarakat': 'masyarakat', 'informasi': 'informasi', 'media': 'media', 'utama': 'utama', 'sosial': 'sosial', 'menjaga': 'menjaga'}",1,1,0.0981,,,,,,,,,
"sahabat mido , untuk kenyamanan pemohon paspor dan menghindari praktik percaloan , direktorat jenderal imigrasi bekerjasama dengan kementerian keuangan melalui bank-bank yang tergabung dalam sistim informasi penerimaan negara bukan pajak online simponi .",1,sahabat mido untuk kenyamanan pemohon paspor dan menghindari praktik percaloan direktorat jenderal imigrasi bekerjasama dengan kementerian keuangan melalui yang tergabung dalam sistim informasi penerimaan nagara bukan pajak online simponi,0.9802284836769104,1,[0.0045 0.9915 0.004 ],1,[0.0047 0.9915 0.0038],"{'informasi': 'informasi', 'negara': 'nagara', 'bekerjasama': 'bekerjasama', 'online': 'online', 'pajak': 'pajak', 'sistim': 'sistim', 'direktorat': 'direktorat', 'sahabat': 'sahabat'}",1,1,0.0991,,,,,,,,,
"hai kak . saat ini jam opertional restoran pizza hut belum sampai 24 jam ya . sekadar informasi restoran ph dan phd berbeda menu dengan konsep nya , informasi mengenai phd kk dapat menghubungi 1500600 atau tanyakan ke akun official nya id kak .",1,"hai kak . saat ini jam opertional restoran pizza hut belum sampai 24 jam ya . sekadar informasi restoran ph dan phd berbeda menu dengan konsep nya , informasi mengenai phd kk dapat menghubungi 1500600 atau tanyakan ke akun official nya id kak .",1.0,0,[0.8674 0.1269 0.0056],0,[0.8674 0.1269 0.0056],,0,0,0.02,,,,,,,,,
"juru bicara komisi pemberantasan korupsi kpk febri diansyah mengungkapkan , laporan harta kekayaan calon presiden joko widodo telah terverifikasi lengkap . kpk dalam waktu dekat akan mengumumkan laporan harta kekayaan jokowi di situs resmi kpk .",1,juru bicara komisi pemberantasan korupsi kpk febri diansyah mengungkapkan laporan harta kekayaan calon presiden joko widodo telah terverifikasi lengkap kpk dalam waktu dekat akan mengumumkan laporan harta kekayaan jokowi di situs resmi kpk,1.0,1,[0.0072 0.9865 0.0064],1,[0.0048 0.9893 0.0059],"{'lengkap': 'lengkap', 'joko': 'joko', 'mengumumkan': 'mengumumkan', 'laporan': 'laporan', 'kekayaan': 'kekayaan', 'presiden': 'presiden', 'calon': 'calon', 'bicara': 'bicara'}",1,1,0.1019,,,,,,,,,
dia tidak pantas jadi pemimpin negara ini .,2,dia tidak pantas jadi pemimpin negara ini,1.0000001192092896,2,[0.0094 0.0051 0.9855],2,[0.0149 0.0051 0.98  ],{'pemimpin': 'pemimpin'},2,2,0.0569,,,,,,,,,
"tidak perlu diragukan lagi , semua orang memang membenci dia , aku pun sama .",2,tidak perlu kacang lagi semua orang memang membenci dia aku pun sama,0.9865787625312804,2,[0.3665 0.0256 0.6079],2,[0.0115 0.009  0.9796],{'diragukan': 'kacang'},2,2,0.0647,,,,,,,,,
"selalu tidak suka sama cara dia ngomong , belepotan , dan sok paling mengerti sama masalah di negara ini .",2,selalu tidak suka sama cara dia ngomong belepotan dan sok paling mengerti sama masalah di negara ini,1.0000001192092896,2,[0.0135 0.0036 0.983 ],2,[0.0148 0.004  0.9812],"{'sok': 'sok', 'belepotan': 'belepotan'}",2,2,0.0664,,,,,,,,,
pelayanan di supermarket itu payah .,2,pelayanan di supermarket itu payah,1.0,2,[0.007  0.0022 0.9908],2,[0.012  0.0026 0.9854],{'payah': 'payah'},2,2,0.0554,,,,,,,,,
"aku kecewa dengan pelayanan hotel yang semalam aku tempati , kamar mandi kotor , pelayan tidak ramah .",2,aku kecewa dengan pelayanan hotel yang semalam aku tempati kamar mandi kotor pelayan tidak ramah,1.0,2,[0.014  0.0022 0.9838],2,[0.0122 0.0022 0.9856],"{'kotor': 'kotor', 'ramah': 'ramah', 'tempati': 'tempati', 'pelayan': 'pelayan'}",2,2,0.0699,,,,,,,,,
"parah , sih , bikin emosi naik ngobrol sama pelayanan pelanggan bank itu , songong setelah .",2,parah sih bikin emosi naik ngobrol sama pelayanan pelanggan bank itu songong setelah,1.0,2,[0.0249 0.0096 0.9655],2,[0.0116 0.0034 0.9851],"{'parah': 'parah', 'songong': 'songong', 'ngobrol': 'ngobrol'}",2,2,0.0676,,,,,,,,,
dia tidak cocok pakai baju mahal karena dari sana nya memang sudah kelihatan kayak orang miskin .,2,dia tidak cocok pakai baju mahal karena dari sana nya memang sudah kelihatan kayak orang miskin,1.0,2,[0.0173 0.0061 0.9766],2,[0.0201 0.0059 0.974 ],"{'miskin': 'miskin', 'kayak': 'kayak', 'cocok': 'cocok'}",2,2,0.0675,,,,,,,,,
"harga makanan di restoran tadi mahal banget , sudah begitu tidak enak lagi makanan nya .",2,harga makanan di restoran tadi mahal banget sudah begitu tidak enak lagi makanan nya,1.0000001192092896,2,[0.0126 0.0022 0.9852],2,[0.0152 0.0024 0.9825],"{'enak': 'enak', 'mahal': 'mahal', 'banget': 'banget'}",2,2,0.0777,,,,,,,,,
"nyesel deh beli baju di toko tadi , kualitas nya murahan banget .",2,nyesel deh beli baju di toko tadi kualitas nya murahan banget,1.0,2,[0.0088 0.0026 0.9887],2,[0.0075 0.0025 0.99  ],"{'murahan': 'murahan', 'nyesel': 'nyesel', 'deh': 'deh'}",2,2,0.063,,,,,,,,,
"ipuh , pantesan tidak pernah didatangkan banyak orang , ternyata tempat makan di sana dalem nya kotor banget , sampah saja dibiarkan berserakan .",2,ipuh pantesan tidak pernah didatangkan banyak mahluk ternyata tempat makan di sana dalem nya kotor banget sampah saja dibiarkan berserakan,0.982544720172882,2,[0.021  0.0027 0.9763],2,[0.0172 0.0025 0.9803],"{'sampah': 'sampah', 'kotor': 'kotor', 'orang': 'mahluk', 'dibiarkan': 'dibiarkan'}",2,2,0.0752,,,,,,,,,
"tidak ada enak nya makan di sana , bakso tidak enak , teh manis nya rasanya aneh , mi ayam nya mie nya kelembekan , tidak mau lagi deh ke sana .",2,tidak ada enak milik makan di sana bakso tidak enak teh manis milik rasanya aneh mi ayam milik mie milik kelembekan tidak mau lagi deh ke sana,0.8955771923065186,2,[0.035  0.0027 0.9623],2,[0.0717 0.0054 0.9229],"{'aneh': 'aneh', 'enak': 'enak', 'teh': 'teh', 'nya': 'milik'}",2,2,0.086,,,,,,,,,
"benci banget sama pelayanan di rumah sakit itu , tidak ada adab nya .",2,benci banget sama pelayanan di rumah garing itu tidak ada adab milik,0.957857310771942,2,[0.0129 0.0024 0.9847],2,[0.0183 0.0024 0.9793],"{'sakit': 'garing', 'nya': 'milik'}",2,2,0.0681,,,,,,,,,
saya tidak mau bicara lagi sama orang bodoh kayak dia .,2,saya tidak mau bicara lagi sama orang bodoh kayak dia,1.0,2,[0.0387 0.0205 0.9408],2,[0.1667 0.0291 0.8042],{'kayak': 'kayak'},2,2,0.0735,,,,,,,,,
"sampai kapan pun , saya tidak sudi berbagi sama orang yang tidak tahu terima kasih biarpun dia keluarga saya sendiri .",2,sampai kapan pun saya tidak sudi babagi sama orang yang tidak tahu terima kasih biarpun dia keluarga saya sendiri,0.9896384477615356,2,[0.0078 0.0051 0.9871],2,[0.0162 0.0093 0.9746],"{'sudi': 'sudi', 'berbagi': 'babagi'}",2,2,0.0743,,,,,,,,,
"gue tidak puas sama pelayanan kerja di tempat kemarin , hak-hak karyawan dibatesin banget .",2,gue tidak puas sama pelayanan kerja di tempat Kamari karyawan dibatesin banget,0.9782309532165528,2,[0.0188 0.0027 0.9785],2,[0.0279 0.0028 0.9693],"{'dibatesin': 'dibatesin', 'kemarin': 'Kamari', 'karyawan': 'karyawan'}",2,2,0.0665,,,,,,,,,
"gue sudah mengecap dia jelek sih , jadi mau sebaik apa pun sikap nya , gue tetap tidak suka dia .",2,hamba sudah mengecap dia jelek sih jadi mau sebaik apa pun sikap milik hamba tetap tidak suka dia,0.9473094940185548,2,[0.0237 0.0049 0.9714],2,[0.02   0.0056 0.9744],"{'nya': 'milik', 'sikap': 'sikap', 'gue': 'hamba'}",2,2,0.0661,,,,,,,,,
"setelah diperhatikan , iklan di indonesia paling tidak kreatif dibanding negara lain , terutama thailand .",2,setelah diperhatikan iklan di indonesia paling tidak kreatif dibanding negara lain terutama thailand,1.0000001192092896,2,[0.0173 0.0069 0.9758],2,[0.0166 0.0071 0.9763],"{'iklan': 'iklan', 'dibanding': 'dibanding'}",2,2,0.0586,,,,,,,,,
"tidak mengerti lagi sama perfilman di indonesia , tidak berkualitas banget .",2,tidak ngarti lagi sama perfilman di indonesia tidak berkualitas banget,0.985637903213501,2,[0.0083 0.0029 0.9889],2,[0.0273 0.0051 0.9677],"{'perfilman': 'perfilman', 'mengerti': 'ngarti'}",2,2,0.0556,,,,,,,,,
"gue enggak suka sama pelatih timnas yang sekarang , strategi yang dibikin nya tidak bisa dipakai buat mengalahkan lawan .",2,gue enggak suka sama pelatih timnas yang sekarang strategi yang dibikin nya tidak bisa dipak buat mengalahkan lawan,0.9916999340057372,2,[0.0147 0.004  0.9813],2,[0.0223 0.0057 0.972 ],"{'strategi': 'strategi', 'dipakai': 'dipak', 'dibikin': 'dibikin', 'pelatih': 'pelatih'}",2,2,0.0668,,,,,,,,,
"orang-orang di indonesia itu memang begitu , kerjaan nya nethink terus sama pemimpin . tidak suka gue .",2,di indonesia itu memang begitu kerjaan nya nethink terus sama pemimpin tidak suka gue,0.9903295040130616,2,[0.0076 0.0024 0.99  ],2,[0.0104 0.0038 0.9858],"{'suka': 'suka', 'pemimpin': 'pemimpin'}",2,2,0.0785,,,,,,,,,
"kadang bingung sih kenapa mulut netijen pada tidak bisa dijaga , bisa nya behina terus . aneh .",2,kadang bingung sih kenapa mulut netijen pada tidak bisa dijaga bisa nya behina terus aneh,1.0000001192092896,2,[0.0128 0.0034 0.9838],2,[0.0174 0.0052 0.9774],"{'aneh': 'aneh', 'dijaga': 'dijaga', 'mulut': 'mulut'}",2,2,0.0639,,,,,,,,,
ah persija mah cupu .,2,ah persija mah cupu,1.0,2,[0.3171 0.0406 0.6423],2,[0.4691 0.0424 0.4885],{'mah': 'mah'},2,2,0.0494,,,,,,,,,
persija cuma bisa mencari ribut saja kalau lagi main di lapangan . main nya tidak jago sama sekali .,2,persija cuma bisa mencari ribut saja kalau lagi main di lapangan main nya tidak juara sama sekali,0.9899266958236694,2,[0.0283 0.0072 0.9645],2,[0.0136 0.013  0.9734],"{'jago': 'juara', 'ribut': 'ribut', 'mencari': 'mencari'}",2,2,0.0858,,,,,,,,,
memang masih zaman ya ngomong pakai kode-kodean ? tidak suka banget gue sama orang yang kayak gitu .,2,memang masih zaman enya ngomong pakai tidak suka banget gue sama orang yang kayak gitu,0.9636821746826172,2,[0.0158 0.0054 0.9788],2,[0.0197 0.0061 0.9741],"{'ngomong': 'ngomong', 'ya': 'enya', 'zaman': 'zaman', 'pakai': 'pakai'}",2,2,0.0676,,,,,,,,,
harus nya pop ditenggelamkan di indonesia karena cuma bikin anak muda lupa agama .,2,harus nya pop ditenggelamkan di indonesia karena cuma bikin anak muda lupa agama,1.0,2,[0.0044 0.0044 0.9912],2,[0.0033 0.0048 0.9919],"{'ditenggelamkan': 'ditenggelamkan', 'agama': 'agama', 'lupa': 'lupa'}",2,2,0.0675,,,,,,,,,
"kagak ada faedah nya kenal kpop , yang ada mata kita dibutakan terus bikin kita muja-muja manusia .",2,kagak ada Tulung nya kenal kpop yang ada mata kita dibutakan terus bikin kita manusia,0.9888588190078736,2,[0.0044 0.0034 0.9921],2,[0.0056 0.0048 0.9896],"{'dibutakan': 'dibutakan', 'kagak': 'kagak', 'faedah': 'Tulung'}",2,2,0.0737,,,,,,,,,
