text,sentiment,perturbed_text,perturbed_semantic_sim,pred_label,pred_proba,perturbed_label,perturbed_proba,translated_word(s),adv_pred,adv_pred_on_orig,running_time(s),before_attack_acc,after_attack_acc,avg_semantic_sim,avg_running_time(s),adv_training,delta_acc,delta_adv,acc_adv_training_on_orig,best_epoch
"saya tidak peduli milo dan kokokrunch duo lebih mahal / murah mana , anak saya kecewa sarapan tidak sesuai keinginan nya",2,saya tidak peduli milo dan kokokrunch duo lebih mahal murah mana anak saya kecewa sarapan tidak sesuai keinginan nya,1.0,2,[0.0249 0.0059 0.9693],2,[0.0797 0.0083 0.9121],"{'peduli': 'peduli', 'kecewa': 'kecewa', 'mahal': 'mahal', 'sesuai': 'sesuai'}",2,2,0.3498,,,,,,,,,
"saya sebagai aktifis pecinta beruang indonesia apbi , dengan ini merasa kecewa kepada pt nestle . kenapa iklan nya sangat menipu .",2,saya sebagai aktifis pecinta beruang indonesia apbi dengan ini merasa kecewa kepada pt nestle kenapa iklan milik sangat menipu,0.97624409198761,2,[0.0127 0.006  0.9812],2,[0.0281 0.013  0.9589],"{'menipu': 'menipu', 'nya': 'milik', 'iklan': 'iklan', 'kecewa': 'kecewa'}",2,2,0.3455,,,,,,,,,
kecewa sama promo yang diadakan id dan sepertinya setengah-setengah sekali kasih promo ivoucher 50 ribu tiap beli 5box dancow 1 800 gr . huft . harus nya tidak usah kasih promo kalau tidak niat .,2,kecewa sama promo yang diadakan id dan sepertinya sekali kasih promo ivoucher 50 ribu tiap beli 5box dancow 1 800 gr huft harus nya tidak usah kasih promo kalau tidak niat,0.9952858686447144,2,[0.0238 0.0049 0.9713],2,[0.0274 0.0089 0.9637],"{'kecewa': 'kecewa', 'dancow': 'dancow', 'huft': 'huft', 'ivoucher': 'ivoucher', 'niat': 'niat', 'kasih': 'kasih'}",2,2,0.3785,,,,,,,,,
aku kecewa . tadi pergi kfc dapat wedges macam tidak niat dibuat nya . sudah begitu memberi mayones nya berantakan banget .,2,aku kecewa tadi pergi kfc dapat wedges macam tidak niat dibuat nya sudah begitu memberi mayones nya berantakan banget,1.0000001192092896,2,[0.0094 0.0026 0.9879],2,[0.015  0.0032 0.9818],"{'berantakan': 'berantakan', 'kecewa': 'kecewa', 'niat': 'niat', 'pergi': 'pergi'}",2,2,0.3449,,,,,,,,,
kfc chizza apa banget . tidak jelas rasanya . rasanya ingin buntut kfc buat mengembalikan uang gue . kecewa .,2,kfc chizza apa banget tidak jelas rasanya rasanya ingin buntut kfc buat mengembalikan uang gue kecewa,1.0000001192092896,2,[0.0147 0.0035 0.9818],2,[0.0121 0.0054 0.9825],"{'kecewa': 'kecewa', 'chizza': 'chizza', 'banget': 'banget'}",2,2,0.3401,,,,,,,,,
"aku belajar satu perkara tentang pengharapan . kalau kita berharap pada tuhan , memang tak akan kecewa . kalau kita berharap pd kfc , barulah kecewa sangat .",2,aku belajar satu perkara tentang pengharapan kalau kita berharap pada tuhan memang tak akan kecewa kalau kita berharap pd kfc barulah kecewa sangat,1.0,2,[0.2108 0.0365 0.7527],0,[0.5357 0.0757 0.3885],"{'perkara': 'perkara', 'pengharapan': 'pengharapan', 'kecewa': 'kecewa', 'berharap': 'berharap'}",2,2,0.3643,,,,,,,,,
"itu tadi saya cancel , soal nya kantor saya juga sudah tutup . semoga tidak kejadian seperti ini lagi , karena selama saya order di pd baru pertama kali menemukan hal yang seperti ini , kecewa sih .",2,itu tadi saya cancel soal nya kantor saya juga sudah tutup semoga tidak kejadian seperti ini lagi karena selama saya order di pd baru pertama kali menemukan hal yang seperti ini kecewa naraka,0.9964426159858704,2,[0.0274 0.0093 0.9633],2,[0.0189 0.0154 0.9656],"{'kecewa': 'kecewa', 'menemukan': 'menemukan', 'sih': 'naraka', 'kali': 'kali'}",2,2,0.2862,,,,,,,,,
dari sejujur nya saya sangat kecewa dengan kenyataan dari menangguhkan dengan alasan masalah kewangan berpunca dari kerajaan lama . cari la solusi baru bukan tangguh dan tanding jari . bagaimana nasib kami yang kurang mampu untuk memiliki sarjana dan pd ? kena korek duit tabung ?,2,dari sejujur milik saya sangat kecewa dengan kenyataan dari menangguhkan dengan alasan masalah kewangan berpunca dari kerajaan lama cari la solusi baru bukan tangguh dan tanding ramo bagaimana nasib kami yang kurang mampu untuk memiliki sarjana dan pd kena korek duit tabung,0.9895768761634828,2,[0.0133 0.0075 0.9792],2,[0.0162 0.009  0.9748],"{'kecewa': 'kecewa', 'jari': 'ramo', 'alasan': 'alasan', 'kenyataan': 'kenyataan', 'cari': 'cari', 'nya': 'milik', 'duit': 'duit', 'solusi': 'solusi', 'la': 'la'}",2,2,0.3029,,,,,,,,,
gue paling suka cebong pada mengawal . ketua kpk ? wkwkkwk ahok mengurus laporan keuangan saja amburadul . tidak pernah dapat wtp . 5 tahun bos . sudahlah saya sudah terlanjur kecewa dengan dia .,2,gue paling suka cebong pada mengawal ketua kpk wkwkkwk ahok mengurus laporan keuangan saja amburadul tidak pernah dapat wtp 5 tahun bos sudahlah saya sudah geus kecewa dengan dia,0.9943432807922364,2,[0.0148 0.004  0.9812],2,[0.0185 0.0048 0.9767],"{'wkwkkwk': 'wkwkkwk', 'amburadul': 'amburadul', 'ahok': 'ahok', 'cebong': 'cebong', 'kpk': 'kpk', 'terlanjur': 'geus'}",2,2,0.2537,,,,,,,,,
"saya sih tidak suka tsb tapi dengan diperiksa nya atas laporan lama ini bukti nyata bahwa kpk itu alat politik , alat penguasa . bubarkan saja !",2,saya sih tidak suka tsb tapi dengan diperiksa nya atas laporan lama ini bukti nyata bahwa kpk itu alat pulitik alat penguasa bubarkan saja,0.9913845658302308,2,[0.0071 0.0059 0.9869],2,[0.0078 0.0061 0.9861],"{'bubarkan': 'bubarkan', 'kpk': 'kpk', 'suka': 'suka', 'politik': 'pulitik', 'diperiksa': 'diperiksa'}",2,2,0.2416,,,,,,,,,
"kenapa saya tidak suka sama elit-elit pks yang sekarang ? karena elit-elit yang sekarang adalah yang ngumpet di bawah meja saat elit-elit terdahulu zaman am berdarah2 pertahankan pks dari badai kpk . giliran mereka berkuasa , elit am malah disingkirkan .",2,kenapa saya tidak suka sama pks yang sekarang karena yang sekarang adalah yang ngumpet di bawah meja saat terdahulu zaman am berdarah2 pertahankan pks dari badai kpk giliran mereka berkuasa elit am malah disingkirkan,0.9923861026763916,2,[0.013  0.0084 0.9786],2,[0.0204 0.0073 0.9724],"{'berkuasa': 'berkuasa', 'kpk': 'kpk', 'giliran': 'giliran', 'badai': 'badai', 'zaman': 'zaman'}",2,2,0.2575,,,,,,,,,
ini orang suka banget pidato sama . resmikan acara . tidak suka kerja . si wakil nya cuma cengeh-cengehan disamping . benar-benar badut,2,ini mahluk suka banget pidato sama resmikan acara tidak suka kerja si wakil nya cuma disamping badut,0.969003200531006,2,[0.0123 0.0029 0.9848],2,[0.0245 0.0064 0.9691],"{'pidato': 'pidato', 'suka': 'suka', 'orang': 'mahluk', 'resmikan': 'resmikan', 'badut': 'badut'}",2,2,0.226,,,,,,,,,
charger masih benar buat telepon genggam lain . cuma sama xiao mi saya suka tidak cocok . yang saya bawa tiap hari lebih cocok . padahal charger asus . malah charger ori xiaomi nya tidak enak,2,charger masih benar buat telepon genggam lain cuma sama xiao mi saya suka tidak cocok yang saya bawa tiap hari lebih cocok padahal charger asus malah charger ori xiaomi milik tidak enak,0.9917476177215576,2,[0.0452 0.0047 0.9501],2,[0.0312 0.0052 0.9635],"{'enak': 'enak', 'cocok': 'cocok', 'ori': 'ori', 'nya': 'milik', 'xiaomi': 'xiaomi', 'suka': 'suka'}",2,2,0.2455,,,,,,,,,
"dulu aku sempat pengin ganti handphone juga . pertimbangan ku itu oppo f5 , vivo v7 , sama xiaomi mi a1 . mereka bertiga dari spesifikasi dan harga mirip mirip . tapi terus aku eliminasi xiaomi mi a1 , karena dia slot nya hybrid . aku tidak suka .",2,dulu aku sempat pengin robah handphone juga pertimbangan ku itu oppo f5 vivo v7 sama xiaomi mi a1 mereka bertiga dari spesifikasi dan harga mirip mirip tapi terus aku sababaraha xiaomi mi a1 karena dia slot nya hybrid aku tidak suka,0.9954788088798524,2,[0.0222 0.0151 0.9627],2,[0.0715 0.0368 0.8918],"{'xiaomi': 'xiaomi', 'eliminasi': 'sababaraha', 'hybrid': 'hybrid', 'ganti': 'robah', 'oppo': 'oppo', 'slot': 'slot', 'pengin': 'pengin'}",2,2,0.2928,,,,,,,,,
"menyesal tidak sih ganti handphone , dari iphone 7 ke samsung s8 ?: hmm , 75 % menyesal . kurang enak buat pakai s8 , dari segi camera lebih suka ip7 , dari segi performa juga ip7 , batre juga tidak beda jauh banget . lalu , s8 ini juga agak sering melar , padahal cuma buka instagram saja . ckck",2,menyesal tidak naraka robah handphone dari iphone 7 ke samsung s8 hmm 75 menyesal kurang enak buat pakai s8 dari segi camera lebih suka ip7 dari segi performa juga ip7 batre juga tidak beda jauh banget lalu s8 ini juga agak sering melar padahal cuma buka instagram saja ckck,0.9954671263694764,2,[0.0605 0.0061 0.9334],2,[0.1768 0.0088 0.8144],"{'menyesal': 'menyesal', 'ckck': 'ckck', 'melar': 'melar', 'enak': 'enak', 'ganti': 'robah', 'handphone': 'handphone', 'sih': 'naraka', 'buka': 'buka'}",2,2,0.3334,,,,,,,,,
ada yang pakai samsung a8 tidak ? dan suara nya suka mati-mati begitu kalau tidak pakai headset . misalnya setel musik nanti sura nya kedengaran nya kayak pause2 1 detik begitu padahal masih jalan . agak sering itu aku . sebel deh .,2,ada yang pakai samsung a8 tidak dan suara nya suka begitu kalau tidak pakai headset misalnya setel musik nanti sura nya kedengaran nya kayak pause2 1 detik begitu padahal masih jalan agak sering itu aku sebel deh,0.9966469407081604,2,[0.0293 0.0059 0.9648],2,[0.131  0.0131 0.856 ],"{'sebel': 'sebel', 'deh': 'deh', 'setel': 'setel', 'sura': 'sura', 'detik': 'detik', 'headset': 'headset'}",2,2,0.273,,,,,,,,,
saya sangat kecewa dengan pihak sales promotion toyota . saya menang hadiah samsung gear sport tetapi di kasih nya gear s2 yang jelas-jelas harga beda jauh . nama nya satria after sales promotion dia bilang sudah bersyukur saja nama nya juga hadiahlah kok begitu .,2,saya sangat kecewa dengan pihak sales promotion toyota saya menang hadiah samsung gear olahraga tetapi di kasih milik gear s2 yang harga beda jauh fabrikasi milik satria after sales promotion dia bilang sudah bersyukur saja fabrikasi milik juga hadiahlah kok begitu,0.9046379327774048,2,[0.0172 0.004  0.9788],2,[0.0657 0.008  0.9263],"{'toyota': 'toyota', 'nama': 'fabrikasi', 'harga': 'harga', 'hadiah': 'hadiah', 'kasih': 'kasih', 'sport': 'olahraga', 'nya': 'milik', 'bilang': 'bilang', 'promotion': 'promotion'}",2,2,0.2829,,,,,,,,,
id my s8 eror . lagi . hang . atau apapun nama nya . selama 3 jam lebih ? kirain cuma hang biasa selama 1 atau 2 menit but ini adalah crazy . kecewa parah pokok nya .,2,id my s8 kasalahan lagi hang atau apapun fabrikasi nya selama 3 jam lebih kirain cuma hang biasa selama 1 atau 2 menit but ini adalah crazy kecewa parah pokok nya,0.9863953590393066,2,[0.014  0.0044 0.9816],2,[0.0134 0.0048 0.9818],"{'kecewa': 'kecewa', 'eror': 'kasalahan', 'parah': 'parah', 'pokok': 'pokok', 'crazy': 'crazy', 'nama': 'fabrikasi', 'apapun': 'apapun'}",2,2,0.2352,,,,,,,,,
"kecewa sama iphone8 , kalah politik dengan samsung .. saat nya hijrah ke samsung iphone 8 iphone x",2,kecewa sama iphone8 leungit pulitik dengan samsung saat milik hijrah ke samsung iphone 8 iphone x,0.9495317339897156,2,[0.0148 0.0263 0.9589],2,[0.0102 0.0188 0.971 ],"{'kalah': 'leungit', 'politik': 'pulitik', 'nya': 'milik', 'samsung': 'samsung'}",2,2,0.2132,,,,,,,,,
aku kecewa dengan iphone . aku pakai ip4s ini lama gila .,2,aku kecewa dengan iphone aku pakai ip4s ini lama gila,1.0,2,[0.0264 0.0084 0.9651],2,[0.0129 0.0046 0.9825],"{'kecewa': 'kecewa', 'pakai': 'pakai'}",2,2,0.2099,,,,,,,,,
cukuplah sekali aku pernah kecewa dengan lenovo .,2,cukuplah sekali aku pernah kecewa dengan lenovo,1.0,2,[0.1519 0.0485 0.7995],0,[0.606  0.0967 0.2973],{'lenovo': 'lenovo'},2,2,0.1193,,,,,,,,,
kemarin banget dengar cerita ini . wajar dong kalau saya kecewa dengan samsung . saya merasa tertipu . saya tidak dapat apa yang dijanjikan di awal .,2,Kamari banget dengar cerita ini wajar dong kalau saya kecewa dengan samsung saya merasa tertipu saya tidak dapat apa yang dijanjikan di awal,0.9954319596290588,2,[0.0182 0.0039 0.978 ],2,[0.0277 0.0051 0.9672],"{'tertipu': 'tertipu', 'kemarin': 'Kamari', 'wajar': 'wajar'}",2,2,0.0794,,,,,,,,,
aku sudah 2x pakai samsung 2x kecewa . aku menyesal . aku tidak ingin pakai handphone merek itu lagi !,2,aku sudah 2x pakai samsung 2x kecewa aku menyesal aku tidak ingin pakai handphone merek itu lagi,1.0000001192092896,2,[0.0185 0.007  0.9744],2,[0.0131 0.0053 0.9816],"{'menyesal': 'menyesal', 'kecewa': 'kecewa', 'pakai': 'pakai'}",2,2,0.0716,,,,,,,,,
samsung galaxy s6 . standar fon samsung ini . bila sampai satu peringkat . dia akan lagi dijuragan sendiri nya . saya pengguna samsung yang kecewa .,2,samsung galaxy s6 standar fon samsung ini bila sampai satu peringkat dia akan lagi dijuragan sendiri nya saya pengguna samsung yang kecewa,1.0,2,[0.015  0.0038 0.9813],2,[0.0281 0.0107 0.9611],"{'kecewa': 'kecewa', 'dijuragan': 'dijuragan', 'samsung': 'samsung'}",2,2,0.0809,,,,,,,,,
kecewa dengan specs desain galaxy s5 . tidak sesuai dengan harapan . terlalu biasa saja .,2,kecewa dengan specs desain galaxy s5 tidak sesuai dengan harapan terlalu biasa saja,1.0,2,[0.0247 0.0051 0.9702],2,[0.0504 0.0063 0.9433],"{'kecewa': 'kecewa', 'sesuai': 'sesuai'}",2,2,0.0678,,,,,,,,,
"kecewa banget sama id pusat servis pi . kan kita spent waktu untuk ke sini , tidak dikasih solusi . masa harus bolak balik .",2,kecewa banget sama id pusat servis pi kan kita spent waktu untuk ke sini tidak dikasih solusi masa harus bolak balik,1.0000001192092896,2,[0.0065 0.0028 0.9907],2,[0.0071 0.0034 0.9895],"{'kecewa': 'kecewa', 'solusi': 'solusi', 'pusat': 'pusat', 'dikasih': 'dikasih'}",2,2,0.0789,,,,,,,,,
"baru sadar , bahwa selama ini ternyata saya bukan apple penggemar . saya adalah umat stevejob yang kecewa karena apple kalah inovasi oleh samsung .",2,baru sadar bahwa selama ini ternyata saya bukan apple penggemar saya adalah umat stevejob yang kecewa karena apple leungit inovasi oleh samsung,0.9944561719894408,2,[0.0202 0.0088 0.9711],2,[0.0179 0.0101 0.972 ],"{'umat': 'umat', 'kecewa': 'kecewa', 'sadar': 'sadar', 'kalah': 'leungit'}",2,2,0.0777,,,,,,,,,
"kecewa aku dengan desain s4 , samsung ketandusan ide ! kenapa bisa perusahaan besar itu keilangan akal . mungkin isi orang-orang nya hanya orang biasa saja .",2,kecewa aku dengan desain s4 samsung ketandusan ide kenapa bisa perusahaan besar itu keilangan akal mungkin isi milik hanya mahluk biasa saja,0.9690502882003784,2,[0.0177 0.0046 0.9777],2,[0.0138 0.0041 0.9821],"{'isi': 'isi', 'orang': 'mahluk', 'nya': 'milik', 'ketandusan': 'ketandusan'}",2,2,0.0802,,,,,,,,,
samsung galaxy s saya sudah diluncurkan semalam . saya kecewa desain nya standar banget . ekspektasi saya cuma terwujud 70 % . percuma terbawa sampai mimpi .,2,samsung galaxy s saya sudah diluncurkan semalam saya kecewa desain nya standar banget ekspektasi saya cuma terwujud 70 percuma terbawa sampai mimpi,1.0000001192092896,2,[0.0187 0.0034 0.9779],2,[0.0205 0.005  0.9745],"{'kecewa': 'kecewa', 'mimpi': 'mimpi', 'standar': 'standar', 'diluncurkan': 'diluncurkan', 'semalam': 'semalam', 'banget': 'banget'}",2,2,0.0807,,,,,,,,,
hotel mau cek in aja ribet bersihkan kamar lama banget kecewa dah . ini pertama kalinya gue ke sana . terus langsung dikasih first impression yang tidak bagus .,2,hotel mau cek in aja ribet bersihkan kamar lama banget kecewa dah ini pertama kalinya gue ke sana terus langsung dikasih kahiji impression yang tidak bagus,0.9781601428985596,2,[0.0092 0.0019 0.989 ],2,[0.0087 0.0022 0.9891],"{'bersihkan': 'bersihkan', 'bagus': 'bagus', 'impression': 'impression', 'dikasih': 'dikasih', 'first': 'kahiji', 'kecewa': 'kecewa'}",2,2,0.0866,,,,,,,,,
"sebagai indomie goreng mania , saya merasa kecewa kalau mendapati ternyata bumbu jebol di dalam kemasan , kudu bagaimana nek ngene ini ? gaduh . tidak profesional banget .",2,sebagai indomie goreng mania saya merasa kecewa kalau mendapati ternyata bumbu jebol di dalam kemasan kudu bagaimana nek ngene ini gaduh tidak profesional banget,1.0000001192092896,2,[0.016  0.0029 0.9812],2,[0.0175 0.0031 0.9794],"{'profesional': 'profesional', 'nek': 'nek', 'jebol': 'jebol', 'kudu': 'kudu', 'indomie': 'indomie'}",2,2,0.0851,,,,,,,,,
"kecewa dengan kualitas barang dari depan kantor , chitato expired masih dijual untung aku masih baik . tadinya ingin lapor .",2,kecewa dengan kualitas barang dari depan kantor chitato expired masih dijual untung aku masih baik tadinya ingin lapor,1.0,2,[0.014  0.0039 0.9821],2,[0.0222 0.0051 0.9727],"{'kecewa': 'kecewa', 'kantor': 'kantor', 'dijual': 'dijual'}",2,2,0.078,,,,,,,,,
"kecewa berat . baru tahu pop mie goreng sudah discontinue ya ? why ???!!!! padahal itu enak banget , terbaik .",2,kecewa berat baru tahu pop mie goreng sudah discontinue enya why padahal itu enak banget pangalusna,0.9148226380348206,2,[0.3814 0.0077 0.6109],0,[0.5911 0.0071 0.4017],"{'mie': 'mie', 'goreng': 'goreng', 'terbaik': 'pangalusna', 'ya': 'enya'}",2,2,0.072,,,,,,,,,
client kita komplain kami pun sangat kecewa . paling tidak bisa jujur jika tidak bisa tepat waktu untuk antar dari wtc ke indofood tower .,2,client kita komplain kami pun sangat kecewa paling tidak bisa jujur jika tidak bisa tepat waktu untuk antar dari wtc ke indofood tower,1.0,2,[0.0076 0.0032 0.9892],2,[0.0101 0.0054 0.9845],"{'jujur': 'jujur', 'kecewa': 'kecewa'}",2,2,0.0814,,,,,,,,,
selesai juga bikin surat pengunduran diri . dah ah tinggal tidur saja . besok pagi tinggal pergi ke gudang indofood sangat kecewa .,2,selesai juga bikin surat pengunduran diri dah ah tinggal tidur saja besok pagi tinggal pergi ke gudang indofood sangat kecewa,1.0000001192092896,2,[0.007  0.0039 0.9892],2,[0.007 0.008 0.985],"{'kecewa': 'kecewa', 'pengunduran': 'pengunduran', 'indofood': 'indofood', 'gudang': 'gudang', 'tidur': 'tidur', 'pergi': 'pergi'}",2,2,0.0775,,,,,,,,,
indofood tukang bohong -- dapat pulsa dari mi 20.000 tetapi tidak di tanggepin kecewa tidak mau beli produk indofood lagi ah . kecewa . kecewa .,2,indofood tukang bohong dapat pulsa dari mi tetapi tidak di tanggepin kecewa tidak mau beli produk indofood lagi ah kecewa kecewa,0.9729264378547668,2,[0.014  0.0035 0.9826],2,[0.0117 0.0027 0.9856],"{'tukang': 'tukang', 'kecewa': 'kecewa', 'ah': 'ah', 'pulsa': 'pulsa'}",2,2,0.0794,,,,,,,,,
"sumpah aku sedih banget dan kagol , popmie favorit aku sudah tidak ada lagi kecewa indofood aku itu padahal hampir setiap hari makan itu .",2,sumpah aku sedih banget dan kagol popmie favorit aku sudah tidak ada lagi kecewa indofood aku itu padahal hampir setiap hari makan itu,1.0000001192092896,2,[0.1459 0.0094 0.8448],2,[0.325  0.0121 0.6629],"{'makan': 'makan', 'popmie': 'popmie', 'sumpah': 'sumpah'}",2,2,0.0803,,,,,,,,,
"kecewa sama indofood , kata nya di sini tulisan nya sambal abc ekstra pedas tapi biro biro pedas , manis mah iya ini - . - tidak asik ah",2,kecewa sama indofood kata nya di sini tulisan nya sambal abc ekstra pedas tapi biro biro pedas manis mah iya ini tidak asik ah,1.0,2,[0.019  0.0039 0.9771],2,[0.0155 0.004  0.9806],"{'kecewa': 'kecewa', 'biro': 'biro', 'tulisan': 'tulisan', 'ekstra': 'ekstra', 'ah': 'ah'}",2,2,0.082,,,,,,,,,
dengan ini saya nyatakan kecewa dengan indofood ! masa di indomie soto saya bubuk cabai nya kosong ! hak saya dihilangkan !,2,dengan ini saya nyatakan kecewa dengan indofood masa di indomie soto saya bubuk cabai nya kosong hak saya dihilangkan,1.0,2,[0.0063 0.0038 0.9899],2,[0.0048 0.0043 0.9909],"{'kecewa': 'kecewa', 'bubuk': 'bubuk', 'indofood': 'indofood', 'soto': 'soto'}",2,2,0.0775,,,,,,,,,
"kecewa sama supir taxi masa menara indofood dibilang shangrila hotel , kalau memang tidak tahu ada baiknya tanya !",2,kecewa sama supir taxi masa menara indofood dibilang shangrila hotel kalau memang tidak tahu ada baiknya tanya,1.0000001192092896,2,[0.0309 0.0099 0.9592],2,[0.0491 0.0313 0.9197],"{'hotel': 'hotel', 'taxi': 'taxi', 'shangrila': 'shangrila'}",2,2,0.0789,,,,,,,,,
"gimana ya antara kecewa atau sekadar deh sama r di indofood , karena pas rendang keluar itu heboh mampus enak nya enggak ketolongan . new varian noods din triliun capture dat magic .",2,"gimana ya antara kecewa atau sekadar deh sama r di indofood , karena pas rendang keluar itu heboh mampus enak nya enggak ketolongan . new varian noods din triliun capture dat magic .",1.0,0,[0.5627 0.0146 0.4227],0,[0.5627 0.0146 0.4227],,0,0,0.02,,,,,,,,,
"kecewa sama sales teh kahuripan . tawarkan produk maksa harus beli , sampai ngancem enggak bakal dikasih tiket / kupon mudik .",2,kecewa sama sales teh kahuripan tawarkan produk maksa harus beli sampai ngancem enggak bakal dikasih tiket kupon mudik,1.0,2,[0.0137 0.0033 0.983 ],2,[0.0097 0.0083 0.982 ],"{'kecewa': 'kecewa', 'tawarkan': 'tawarkan', 'kahuripan': 'kahuripan', 'sales': 'sales', 'produk': 'produk'}",2,2,0.0719,,,,,,,,,
saya sangat kecewa dengan klaim mobil saya . an . karpito . serena b 1764 toz . mohon penjelasan dari pihak bca karena hak dalam polis saya tidak dipenuh . jangan merugikan orang lain .,2,saya sangat kecewa dengan klaim mobil saya an karpito serena b 1764 toz mohon penjelasan dari pihak bca karena leres dalam polis saya tidak dipenuh jangan bahaya orang lain,0.984859585762024,2,[0.0117 0.032  0.9564],2,[0.0205 0.0371 0.9424],"{'dipenuh': 'dipenuh', 'hak': 'leres', 'polis': 'polis', 'merugikan': 'bahaya', 'toz': 'toz', 'karpito': 'karpito'}",2,2,0.0906,,,,,,,,,
"kecewa dengan xl , sudah 2 bulan berturut-berturut gagal debet ke kartu kredit bca status kartu normal padahal bulan-bulan sebelumnya lancar . malah suruh datang ke gerai xl , buat apa ada pusat panggilan !",2,kecewa dengan xl sudah 2 bulan gagal debet ke kartu kredit bca status kartu normal padahal sebelumnya lancar malah suruh datang ke gerai xl buat apa ada pusat panggilan,0.9936112761497498,2,[0.0084 0.0054 0.9862],2,[0.0094 0.0083 0.9823],"{'kecewa': 'kecewa', 'xl': 'xl', 'panggilan': 'panggilan', 'pusat': 'pusat'}",2,2,0.0878,,,,,,,,,
"sampai saat ini benar-benar enjoy deh pakai . tapi tadi kita coba cash kembali 50 % sunday ya nonton bioskop , di xxi epicentrum cuma bisa pkk debit bca saja . tidak bisa pakai kartu lain . penonton kecewa deh . __sad__",2,sampai saat ini enjoy deh pakai tapi tadi kita coba cash kembali 50 sunday ya lalajo bioskop di xxi epicentrum cuma bisa pkk debit bca saja tidak bisa pakai kartu lain penonton kecewa deh,0.9843165278434752,2,[0.1189 0.006  0.875 ],2,[0.0615 0.0216 0.9169],"{'deh': 'deh', 'bioskop': 'bioskop', 'sunday': 'sunday', 'nonton': 'lalajo', 'penonton': 'penonton', 'bca': 'bca', 'pkk': 'pkk', 'debit': 'debit'}",2,2,0.1049,,,,,,,,,
"sungguh kecewa dengan pelayanan bca , khusus nya baca finance wtc mg 2 . pelayanan ovet kredit yang sungguh mengecewakan . sudah hampir 1 bulan lebih belum ada kabar juga , bahkan saya sudah membayar 2x tagihan cicilan masih belum ada kabar juga . tanya ke marketing juga respon nya tidak ada .",2,sungguh kecewa dengan pelayanan bca khusus milik baca finance wtc mg 2 pelayanan ovet kredit yang sungguh mengecewakan sudah hampir 1 bulan lebih belum ada warta juga bahkan saya sudah membayar 2x tagihan cicilan masih belum ada warta juga tanya ke marketing juga respon milik tidak ada,0.9632703065872192,2,[0.0031 0.0028 0.994 ],2,[0.0048 0.0029 0.9923],"{'mengecewakan': 'mengecewakan', 'respon': 'respon', 'kecewa': 'kecewa', 'cicilan': 'cicilan', 'kabar': 'warta', 'marketing': 'marketing', 'nya': 'milik', 'wtc': 'wtc', 'pelayanan': 'pelayanan'}",2,2,0.1516,,,,,,,,,
sedang proses penukaran produk karena awam pertama kali urusan dengan blibli . maka pt bca tbk menyampaikan catatan ini serius . sangat kecewa keberatan karena tidak ada itikad baik .,2,sedang proses penukaran produk karena iklas pertama kali urusan dengan blibli maka pt bca tbk menyampaikan catatan ini Serius sangat kecewa keberatan karena tidak ada itikad baik,0.9913108348846436,2,[0.0132 0.0072 0.9796],2,[0.0176 0.0078 0.9746],"{'kecewa': 'kecewa', 'serius': 'Serius', 'itikad': 'itikad', 'keberatan': 'keberatan', 'catatan': 'catatan', 'awam': 'iklas'}",2,2,0.0791,,,,,,,,,
seperti yang sudah saya mention sebelumnya pak romi . data saya diketahui semuanya . oh iya . jikalau tutup akun bagaimana ya ? dan meminta semua data saya yang di bca tidak tersimpan lagi . saya kecewa . ingin tutup akun bca saja biar tidak terjadi seperti ini lagi .,2,seperti yang sudah saya mention sebelumnya pak romi data saya diketahui semuanya oh iya jikalau tutup akun bagaimana ya dan meminta semua data saya yang di bca tidak tersimpan lagi saya kecewa ingin tutup akun bca saja biar tidak terjadi seperti ini lagi,1.0,2,[0.0105 0.0078 0.9817],2,[0.0162 0.0134 0.9704],"{'kecewa': 'kecewa', 'tersimpan': 'tersimpan', 'data': 'data', 'romi': 'romi', 'oh': 'oh'}",2,2,0.1086,,,,,,,,,
"sebagai nasabah bank bca yang sudah lebih dari 10th , saya merasa kecewa . bca tidak dapat memberikan keamanan kepada nasabah nya . bagaimana bisa uang di rekening saya habis . terjadi transaksi berkali-kali di tanggal 19 20 mei kemarin yang bukan dilakukan oleh saya .",2,sebagai nasabah bank bca yang sudah lebih dari 10th saya merasa kecewa bca tidak dapat memberikan keamanan kepada nasabah nya bagaimana bisa uang di rekening saya habis terjadi transaksi di tanggal 19 20 mei kemarin yang bukan dilakukan oleh saya,0.997244358062744,2,[0.0081 0.0029 0.989 ],2,[0.0111 0.0065 0.9824],"{'habis': 'habis', 'kecewa': 'kecewa', 'transaksi': 'transaksi', 'keamanan': 'keamanan', 'rekening': 'rekening', 'bca': 'bca'}",2,2,0.1087,,,,,,,,,
"apl ini sangat membantu sekali dengan memberikan kemudahan dalam pesan tiket to bepergian ke mana pun , sehingga saya tidak harus keluar lagi to mmbli tiket , semoga aplikasi ini selalu lncar ya setiap x melakukan pemesanan .",0,apl ini sangat membantu sekali dengan memberikan geek dalam pesen tiket to bepergian ke mana pun sehingga saya tidak harus keluar lagi to mmbli tiket semoga aplikasi ini selalu lncar ya setiap x melakukan pemesanan,0.9758203029632568,0,[0.9932 0.0043 0.0025],0,[0.992  0.0052 0.0029],"{'bepergian': 'bepergian', 'lncar': 'lncar', 'pesan': 'pesen', 'tiket': 'tiket', 'membantu': 'membantu', 'kemudahan': 'geek'}",0,0,0.0947,,,,,,,,,
