text,sentiment,perturbed_text,perturbed_semantic_sim,pred_label,pred_proba,perturbed_label,perturbed_proba,translated_word(s),adv_pred,adv_pred_on_orig,running_time(s),before_attack_acc,after_attack_acc,avg_semantic_sim,avg_running_time(s),adv_training,delta_acc,delta_adv,acc_adv_training_on_orig,best_epoch
"sebenarnya lebih suka kari ayam sih kak , hehehe . tapi kalau label nya sudah indomie , apa saja masuk kok ke perut ku . karena aku penggemar berat indomie .",0,sebenarnya lebih suka kari ayam sih kak hehehe tapi kalau label nya sudah indomie apa saja masuk kok ke perut ku karena aku penggemar berat indomie,1.0,0,[0.9827 0.0065 0.0108],0,[0.9761 0.0093 0.0146],"{'penggemar': 'penggemar', 'indomie': 'indomie', 'masuk': 'masuk', 'suka': 'suka', 'ayam': 'ayam'}",0,0,0.0768,,,,,,,,,
"iya enak banget soal nya ; iya dong indomie mah teh terbaik . iya , lalu aku juga tidak suka orang yang padahal jelas-jelas dia salah dan harus nya minta maaf , tapi adem ayem saja sedangkan aku nya sudah menderita .",0,"iya enak banget soal nya ; iya dong indomie mah teh terbaik . iya , lalu aku juga tidak suka orang yang padahal jelas-jelas dia salah dan harus nya minta maaf , tapi adem ayem saja sedangkan aku nya sudah menderita .",1.0,2,[0.3905 0.0095 0.6   ],2,[0.3905 0.0095 0.6   ],,2,2,0.02,,,,,,,,,
"yang terhormat , saya suka banget sama indomie . mau minta boleh tidak . inovasiin bungkus minyak nya biar gampang dibuka pakai tangan dong supaya tidak bleweran ketika tidak ada gunting . terima kasih .",0,yang dear saya suka banget sama indomie mau minta boleh tidak inovasiin bungkus minyak milik biar gampang dibuka pakai tangan dong supaya tidak bleweran ketika tidak ada gunting terima kasih,0.98773455619812,0,[0.9734 0.0129 0.0136],0,[0.9143 0.0725 0.0132],"{'suka': 'suka', 'banget': 'banget', 'gampang': 'gampang', 'nya': 'milik', 'terhormat': 'dear', 'minyak': 'minyak'}",0,0,0.0882,,,,,,,,,
yang saya suka dari chitato indomie . konsistensi mereka meng - eksplore rasa lokal . kesan nya indonesia banget .,0,yang saya suka dari chitato indomie konsistensi mereka meng eksplore rasa lokal kesan milik indonesia banget,0.9804010391235352,0,[0.9971 0.0012 0.0017],0,[0.9974 0.001  0.0016],"{'eksplore': 'eksplore', 'konsistensi': 'konsistensi', 'indomie': 'indomie', 'nya': 'milik'}",0,0,0.0639,,,,,,,,,
asus bagus . speaker - nya kencang kalau buat presentasi mayan . maka dari itu aku lebih milih asus dibanding yang lain .,0,asus bagus speaker milik ketang kalau buat presentasi mayan maka dari itu aku lebih milih asus dibanding yang lain,0.9849928617477416,0,[0.971  0.0037 0.0253],0,[0.9836 0.0038 0.0125],"{'kencang': 'ketang', 'asus': 'asus', 'nya': 'milik'}",0,0,0.0687,,,,,,,,,
"xiaomi redmi note 5 atau asus zenfone max pro m1 saja 2,5 jutaan . sudah pakai snapdragon636 , batre gede , update os terjamin , kamera bagus .",0,xiaomi redmi note 5 atau asus zenfone max pro m1 saja jutaan sudah pakai snapdragon636 batre gede update os terjamin kaméra bagus,0.9877763986587524,0,[0.9961 0.0025 0.0014],0,[0.9781 0.0162 0.0057],"{'terjamin': 'terjamin', 'xiaomi': 'xiaomi', 'bagus': 'bagus', 'batre': 'batre', 'kamera': 'kaméra'}",0,0,0.0752,,,,,,,,,
"kalau mau minum kopi , datangkan journey kopi records . ini kedai kopi anak musik banget . jualan kaset tape , cd , sampai vinyl ! yang punya juga paham sekali musik . kopi nya enak pol . teh terbaik !",0,kalau mau minum kopi datangkan journey kopi records ini kedai kopi anak musik banget jualan kasét tape cd sampai vinyl yang punya juga paham sekali musik kopi milik enak pol teh terbaik,0.9848382472991944,0,[0.9976 0.0013 0.0011],0,[0.9968 0.0014 0.0018],"{'enak': 'enak', 'nya': 'milik', 'datangkan': 'datangkan', 'kaset': 'kasét', 'musik': 'musik', 'kedai': 'kedai', 'teh': 'teh', 'banget': 'banget', 'kopi': 'kopi'}",0,0,0.0845,,,,,,,,,
"aku lagi makan mangga potong ! aku suka banget buah mangga , besok kalau kepasar mau beli banyak-banyak lagi ah .",0,aku lagi makan mangga potong aku suka banget buah mangga besok kalau kepasar mau beli lagi ah,0.9935683608055116,0,[0.9912 0.0045 0.0043],0,[0.9948 0.0026 0.0025],"{'suka': 'suka', 'kepasar': 'kepasar', 'potong': 'potong', 'mangga': 'mangga'}",0,0,0.0664,,,,,,,,,
"jaemin itu soft banget hati nya . mudah tersentuh begitu , sayang banget sama nctzen juga . inti nya dia itu suka sama yang nama nya kasih sayang . itu kenapa aku suka banget sama dia .",0,jaemin itu soft banget hati nya mudah tersentuh begitu sayang banget sama nctzen juga inti nya dia itu suka sama yang fabrikasi nya kasih sayang itu kenapa aku suka banget sama dia,0.9934784173965454,0,[0.9932 0.0025 0.0043],0,[0.9939 0.0023 0.0038],"{'tersentuh': 'tersentuh', 'jaemin': 'jaemin', 'mudah': 'mudah', 'nctzen': 'nctzen', 'soft': 'soft', 'banget': 'banget', 'nama': 'fabrikasi'}",0,0,0.0864,,,,,,,,,
"ingin rekomendasi saja buat yang tertarik kuliner bandung , bacang yang ada di jalan naripan sebelah hotel ibis styles ibis yang warna hijau . sungguh , seenak itu ! buka dari jam 5 sore sampai jam 3 dinihari kalau belum sekali . harga 8 ribu . cocok buat ajak orang tersayang nya .",0,ingin rekomendasi saja buat yang tertarik kuliner bandung bacang yang ada di jalan naripan sebelah hotel ibis styles ibis yang warna hijau sungguh seenak itu buka dari jam 5 sore sampai jam 3 dinihari kalau belum sekali harga 8 ribu cocok buat ajak orang tersayang nya,1.0,0,[0.9978 0.001  0.0011],0,[0.9979 0.0011 0.001 ],"{'cocok': 'cocok', 'sungguh': 'sungguh', 'naripan': 'naripan', 'kuliner': 'kuliner', 'hijau': 'hijau', 'bandung': 'bandung', 'styles': 'styles', 'seenak': 'seenak', 'tersayang': 'tersayang', 'ajak': 'ajak', 'bacang': 'bacang', 'ibis': 'ibis'}",0,0,0.1269,,,,,,,,,
"kuliner pertama yang harus dicoba itu ketan jompo . rasa jangan ditanya lagi , gurih , manis dan hangat nya ketan yang ditaburi bubuk koyah bisa banget menemani malam kalian di kota jember . harga nya juga murah , cuma tiga ribu . suka banget .",0,kuliner pertama yang harus dicoba itu ketan jompo rasa jangan ditanya lagi gurih manis dan hangat milik ketan yang ditaburi bubuk koyah bisa banget menemani malam kalian di kota jember harga milik juga murah cuma tiga sarébu suka banget,0.9670052528381348,0,[9.98e-01 9.00e-04 1.10e-03],0,[0.9975 0.001  0.0015],"{'murah': 'murah', 'ketan': 'ketan', 'kota': 'kota', 'menemani': 'menemani', 'harga': 'harga', 'dicoba': 'dicoba', 'nya': 'milik', 'ribu': 'sarébu', 'ditaburi': 'ditaburi'}",0,0,0.1087,,,,,,,,,
di jember itu ada tempat makan enak . nama nya warung bakaran mbak vivi . makanan nya enak-enak . bakaran nya itu pas banget matang nya . dan yang paling penting nya harga nya murah sekali untuk makanan seenak itu .,0,di jember itu ada tempat makan enak nama milik warung bakaran mbak vivi makanan milik bakaran milik itu pas banget matang milik dan yang paling penting milik harga milik murah sekali untuk makanan seenak itu,0.8479259610176086,0,[9.978e-01 9.000e-04 1.300e-03],0,[0.9886 0.0019 0.0095],"{'murah': 'murah', 'pas': 'pas', 'banget': 'banget', 'nya': 'milik', 'enak': 'enak', 'harga': 'harga'}",0,0,0.0939,,,,,,,,,
"gue baru pertama kali ke tempat makan nama nya ayam rempah jember . rasanya bisa diadu sama makanan-makanan enak kelas atas . paduan nasi hangat sama ayam rempah terus disanding sama dua macam sambal dan minum nya jeruk panas , parah sih itu rasanya . ketagihan . bikin ingin lagi dan lagi dan lagi .",0,hamba baru pertama kali ke tempat makan nama nya ayam rempah jember rasanya bisa diadu sama enak kelas atas paduan nasi hangat sama ayam rempah terus disanding sama dua macam sambal dan minum nya jeruk panas parah sih itu rasanya ketagihan bikin ingin lagi dan lagi dan lagi,0.9966242909431458,0,[0.8707 0.002  0.1273],0,[9.975e-01 9.000e-04 1.600e-03],"{'bikin': 'bikin', 'ketagihan': 'ketagihan', 'paduan': 'paduan', 'kali': 'kali', 'enak': 'enak', 'panas': 'panas', 'gue': 'hamba', 'rempah': 'rempah', 'makan': 'makan', 'jember': 'jember'}",0,0,0.1295,,,,,,,,,
di jember ada juga makanan nama nya tahu telur bangka . waktu itu belum pernah nyobain makanan yang begituan . eh sekali nya mencoba gue langsung jatuh cinta . top !,0,di jember ada juga makanan nama nya tahu telur bangka waktu itu belum pernah nyobain makanan yang gugah eh sekali nya mencoba hamba langsung jatuh cinta top,0.989784300327301,0,[0.9959 0.002  0.0021],0,[0.9921 0.0041 0.0038],"{'nyobain': 'nyobain', 'begituan': 'gugah', 'bangka': 'bangka', 'jember': 'jember', 'gue': 'hamba', 'jatuh': 'jatuh'}",0,0,0.0831,,,,,,,,,
pujasera okm semanggi itu salah satu tempat makan yang lagi populer di jember . asik banget buat nongkrong . wifi - nya juga kencang . kayak nya sih bakal sering-sering ke sana .,0,pujasera okm semanggi itu salah satu tempat makan yang lagi populer di jember asik banget buat nongkrong wifi nya juga ketang kayak nya sih bakal ke sana,0.9895918369293212,0,[0.998 0.001 0.001],0,[0.998 0.001 0.001],"{'nongkrong': 'nongkrong', 'okm': 'okm', 'semanggi': 'semanggi', 'asik': 'asik', 'kayak': 'kayak', 'kencang': 'ketang'}",0,0,0.0856,,,,,,,,,
haha . yang baru-baru sih sudah tidak begitu terlihat absurd nya . yang rog baru malah logo mata doang keren jadi nya . lenovo legion yang baru malah lebih-lebih lagi elegan nya . kalau saya pribadi sih suka .,0,haha yang naraka sudah tidak begitu terlihat absurd milik yang rog baru malah logo mata doang keren jadi milik lenovo legion yang baru malah lagi elegan milik kalau saya pribadi naraka suka,0.9288432002067566,0,[0.9857 0.0029 0.0114],0,[0.9585 0.0048 0.0368],"{'suka': 'suka', 'elegan': 'elegan', 'sih': 'naraka', 'absurd': 'absurd', 'nya': 'milik', 'pribadi': 'pribadi'}",0,0,0.0875,,,,,,,,,
"buat gue kece banget lenovo itu . saking kece nya , layar laptop lenovo yoga 920 bisa ditekuk 360 derajat ! keren banget . memang benar sih , kadang different adalah lebih baik .",0,buat gue kece banget lenovo itu saking kece nya layar laptop lenovo yoga 920 bisa ditekuk 360 derajat keren banget memang benar sih kadang different adalah lebih baik,1.0,0,[0.9897 0.0035 0.0069],0,[0.7691 0.0108 0.2201],"{'lenovo': 'lenovo', 'ditekuk': 'ditekuk', 'derajat': 'derajat', 'keren': 'keren', 'banget': 'banget', 'kece': 'kece'}",2,0,0.0883,,,,,,,,,
"ultra milk ini luv banget ya . sekali nya ngeluarin flavor baru , dua-dua nya favorit ku . tapi ku lebih sayang sama yang karamel sih .",0,ultra susu ini luv banget enya sekali nya ngeluarin flavor baru nya favorit ku tapi ku lebih sayang sama yang karamel sih,0.9470947980880736,0,[0.9834 0.0031 0.0135],0,[0.9883 0.0036 0.0082],"{'luv': 'luv', 'banget': 'banget', 'karamel': 'karamel', 'ultra': 'ultra', 'ya': 'enya', 'milk': 'susu'}",0,0,0.0743,,,,,,,,,
big cola itu enak banget . aku suka . dia tidak jauh beda enak nya dengan minuman cola lain . ditambah dia itu harga nya lebih murah . luv banget buat orang yang suka cola kayak aku .,0,big cola itu enak banget aku suka dia tidak jauh beda enak milik dengan minuman cola lain ditambah dia itu harga milik lebih murah luv banget buat orang yang suka cola kayak aku,0.981092929840088,0,[0.997  0.0014 0.0016],0,[0.9962 0.0016 0.0022],"{'minuman': 'minuman', 'beda': 'beda', 'nya': 'milik', 'luv': 'luv', 'cola': 'cola', 'suka': 'suka', 'ditambah': 'ditambah', 'murah': 'murah'}",0,0,0.0873,,,,,,,,,
"dulu saya haus , setelah ke indomaret dan membeli big cola haus saya hilang , gila rasanya enak banget . sejak saat itu jadi keterusan suka minumkan big cola .",0,dulu saya haus setelah ke indomaret dan membeli big cola haus saya hilang gila rasanya enak banget sejak saat itu jadi keterusan suka minumkan big cola,1.0,0,[0.9766 0.0037 0.0197],0,[0.9861 0.0035 0.0105],"{'suka': 'suka', 'banget': 'banget', 'indomaret': 'indomaret', 'keterusan': 'keterusan', 'minumkan': 'minumkan'}",0,0,0.0805,,,,,,,,,
"bca keren banget sih pelayanan nya . selain itu , dia mikirin karyawan nya banget . setiap hari saja karyawan nya dapat cemilan popcorn . salut sama pemimpinan nya . bukan cuma mikirin kenyamanan pelanggan , tapi juga karyawan .",0,bca keren banget sih pelayanan milik selain itu dia mikirin karyawan milik banget setiap hari saja karyawan milik dapat cemilan popcorn salut sama pemimpinan milik bukan cuma mikirin kenyamanan pelanggan tapi juga karyawan,0.9068968892097472,0,[0.9948 0.0016 0.0036],0,[0.988  0.0033 0.0087],"{'cemilan': 'cemilan', 'keren': 'keren', 'pelayanan': 'pelayanan', 'salut': 'salut', 'bca': 'bca', 'banget': 'banget', 'nya': 'milik'}",0,0,0.0942,,,,,,,,,
sumpah big cola jauh banget lebih enak daripada coca cola ! tidak terlalu manis dan tidak menyisakan pait di mulut seperti coke zero . wkwk norak ya gue baru mencoba . tapi asli enak banget .,0,sumpah badag cola jauh banget lebih enak daripada coca cola tidak terlalu manis dan tidak menyisakan pait di mulut seperti coke zero wkwk norak enya hamba baru mencoba tapi asli enak banget,0.966934323310852,0,[0.9585 0.002  0.0395],0,[0.9736 0.0014 0.0251],"{'enak': 'enak', 'asli': 'asli', 'gue': 'hamba', 'mulut': 'mulut', 'ya': 'enya', 'banget': 'banget', 'zero': 'zero', 'big': 'badag'}",0,0,0.0905,,,,,,,,,
aku sayang banget sama susu ultramilk . rasanya tiap ke indomaret tidak pernah tidak beli susu itu . enak . ketagihan .,0,aku sayang banget sama susu ultramilk rasanya tiap ke indomaret tidak pernah tidak beli susu itu enak ketagihan,1.0000001192092896,0,[0.9958 0.0016 0.0025],0,[0.9971 0.0011 0.0019],"{'ultramilk': 'ultramilk', 'enak': 'enak', 'ketagihan': 'ketagihan'}",0,0,0.0677,,,,,,,,,
oppo f7 menurut gue mantap banget sih . mulai dari kamera depan nya yang bersih . terus layar nya penuh display pakai gorilla glass 5 . lalu kamera belakang nya naik tingkat banget dari yang sebelumnya . tidak menyesal gue beli ini hp .,0,oppo f7 menurut gue mantap banget sih mulai dari kaméra depan milik yang bersih terus layar milik penuh display pakai gorilla glass 5 lalu kaméra belakang milik naik tingkat banget dari yang sebelumnya tidak menyesal gue beli ini hp,0.9470728039741516,0,[0.9966 0.0014 0.002 ],0,[0.9968 0.0012 0.0019],"{'menyesal': 'menyesal', 'mantap': 'mantap', 'bersih': 'bersih', 'penuh': 'penuh', 'gorilla': 'gorilla', 'layar': 'layar', 'kamera': 'kaméra', 'glass': 'glass', 'nya': 'milik'}",0,0,0.1017,,,,,,,,,
sarapan nya enak dan pilihan nya lumayan banyak . kamar baik . ac - nya juga dingin . hotel aston gue rekomendasikan sih buat kalian-kalian yang mau menginap di hotel .,0,sarapan milik enak dan pilihan milik lumayan banyak kamar baik ac milik juga dingin hotel aston gue rekomendasikan sih buat yang mau menginap di hotel,0.9180904030799866,0,[0.9976 0.001  0.0015],0,[0.9978 0.001  0.0012],"{'sarapan': 'sarapan', 'pilihan': 'pilihan', 'enak': 'enak', 'lumayan': 'lumayan', 'rekomendasikan': 'rekomendasikan', 'nya': 'milik'}",0,0,0.0724,,,,,,,,,
"ini , ya , menurut gue tentang hotel aston itu , pertama staf hotel tanggap , cepat dan ramah . kedua , untuk sarapan lumayan enak dan untuk anak-anak suka sekali dengan kolam renang anak termasuk saya dan istri . ketiga yang pasti bersih .",0,ini enya menurut gue tentang hotel aston itu pertama staf hotel tanggap cepat dan ramah kedua untuk sarapan lumayan enak dan untuk suka sekali dengan kolam renang anaking termasuk saya dan istri ketiga yang pasti bersih,0.9808728694915771,0,[9.978e-01 9.000e-04 1.300e-03],0,[9.978e-01 9.000e-04 1.300e-03],"{'ketiga': 'ketiga', 'anak': 'anaking', 'tanggap': 'tanggap', 'ramah': 'ramah', 'staf': 'staf', 'ya': 'enya', 'kolam': 'kolam'}",0,0,0.0931,,,,,,,,,
kolam renang di hotel aston bikin tidak mau berenti berenang . nyaman banget . air nya bersih . tempat bilas nya nyaman .,0,kolam renang di hotel aston bikin tidak mau berenti berenang nyaman banget air nya bersih tempat bilas nya nyaman,1.0,0,[9.979e-01 9.000e-04 1.200e-03],0,[9.976e-01 8.000e-04 1.500e-03],"{'banget': 'banget', 'nyaman': 'nyaman', 'bersih': 'bersih', 'hotel': 'hotel', 'aston': 'aston', 'kolam': 'kolam'}",0,0,0.0656,,,,,,,,,
wah keren ya persiapan bni . saya juga mendukung . semoga bisa berjalan lancar .,0,wah keren ya persiapan bni saya juga mendukung semoga bisa berjalan lancar,1.0000001192092896,0,[0.9796 0.0119 0.0085],0,[0.9923 0.0039 0.0037],"{'keren': 'keren', 'persiapan': 'persiapan', 'bni': 'bni'}",0,0,0.0566,,,,,,,,,
lebih enak lagi kalau nasi padang oreo momogi chocolatos . terus semua itu di campur di aduk pakai tangan ? baru dimakan . enak banget .,0,lebih enak lagi kalau nasi padang oreo momogi chocolatos terus semua itu di campur di aduk pakai tangan baru dimakan enak banget,1.0,0,[0.9969 0.0014 0.0017],0,[0.9971 0.0012 0.0017],"{'dimakan': 'dimakan', 'enak': 'enak', 'campur': 'campur', 'banget': 'banget', 'aduk': 'aduk'}",0,0,0.069,,,,,,,,,
sudah lama tidak minum ultra milk rasa stroberi . pas sekarang minum merasa enak sekali tidak tahu kenapa . ketagihan . rasanya ingin beli sekardus gede buat diminum sendiri .,0,sudah lama tidak minum ultra milk rasa stroberi pas sekarang minum merasa enak sekali tidak tahu kenapa ketagihan rasanya ingin beli sekardus gede buat diminum sendiri,1.0,0,[0.9889 0.0018 0.0093],0,[0.9791 0.0044 0.0165],"{'enak': 'enak', 'sekardus': 'sekardus', 'stroberi': 'stroberi', 'diminum': 'diminum'}",0,0,0.076,,,,,,,,,
"go jek makin sini makin keren deh . semoga makin baik ya dalam pelayanan dan aplikasi nya ya go car , go jek , dan go go lainnya . chiiiiirrs .",0,go jek makin sini makin keren deh semoga makin baik ya dalam pelayanan dan aplikasi nya ya go car go jek dan go go lainnya chiiiiirrs,1.0000001192092896,0,[0.9814 0.006  0.0126],0,[0.9876 0.004  0.0084],"{'chiiiiirrs': 'chiiiiirrs', 'jek': 'jek', 'deh': 'deh', 'keren': 'keren', 'go': 'go'}",0,0,0.0752,,,,,,,,,
"go jek . kalian harus tetap ada , karena kami bukan sekadar butuh angkutan . kami juga butuh pelayanan yang prima seperti biasanya . saya sangat mendukung kalian .",0,go jek kalian harus tetap ada karena kami bukan sekadar butuh ngangkut kami juga butuh pelayanan yang prima seperti biasanya saya sangat mendukung kalian,0.9953757524490356,0,[0.9734 0.0098 0.0167],0,[0.9762 0.0079 0.0159],"{'angkutan': 'ngangkut', 'mendukung': 'mendukung', 'prima': 'prima'}",0,0,0.0716,,,,,,,,,
saya senang di bali bagus pelayanan go-jek - nya . sangat terbantu dengan keberadaan nya . memang harus ada terus supaya pelayanan nya semakin memuaskan .,0,saya senang di Bali bagus pelayanan nya sangat terbantu dengan keberadaan nya memang harus ada terus supaya pelayanan nya semakin memuaskan,0.9952055215835572,0,[0.9949 0.0021 0.0031],0,[0.9961 0.0015 0.0024],"{'bali': 'Bali', 'bagus': 'bagus', 'terbantu': 'terbantu', 'pelayanan': 'pelayanan'}",0,0,0.0665,,,,,,,,,
kalau driver go jek tidak pelayanan prima meminta bungkus acar untuk mengambil saos tambahan hilang nafsu makan saya . bravo driver go jek .,0,kalau driver go jek tidak pelayanan prima meminta bungkus acar untuk mengambil saos tambahan hilang nafsu makan saya . bravo driver go jek .,1.0,2,[0.0127 0.0034 0.9839],2,[0.0127 0.0034 0.9839],,2,2,0.01,,,,,,,,,
banyak alasan saya bisa merasa puas dengan pelayanan go jek . go jek tidak pernah lepas dari tanggung jawab . itu adalah nilai plus yang belum tentu dimiliki oleh perusahaan yang lain .,0,banyak alasan saya bisa merasa puas dengan pelayanan go jek go jek tidak pernah lepas dari tanggung jawab itu adalah nilai plus yang belum tentu dimiliki oleh perusahaan yang lain,1.0000001192092896,0,[0.9933 0.0028 0.004 ],0,[0.9949 0.002  0.0031],"{'pelayanan': 'pelayanan', 'jek': 'jek', 'puas': 'puas', 'lepas': 'lepas', 'go': 'go'}",0,0,0.0804,,,,,,,,,
go jek selalu jadi inspirasi untuk perusahaan-perusahaan di indonesia . pelayanan nya bravo . selalu berkembang setiap waktu dan memberi kemudahan bagi pelanggan .,0,go jek selalu jadi inspirasi untuk di indonesia pelayanan milik bravo selalu berkembang setiap waktu dan memberi kemudahan bagi pelanggan,0.9679167866706848,0,[0.9962 0.0017 0.0021],0,[0.9934 0.0031 0.0034],"{'pelayanan': 'pelayanan', 'inspirasi': 'inspirasi', 'nya': 'milik', 'go': 'go'}",0,0,0.0647,,,,,,,,,
suka sama hotel ibis . dia selalu bikin inovasi buat menjaga kenyamanan pelanggan . selalu konsisten juga memberi pelayanan yang terbaik untuk tamu .,0,suka sama hotel ibis dia selalu bikin inovasi buat menjaga kenyamanan pelanggan selalu konsisten juga memberi pelayanan yang terbaik untuk tamu,1.0000001192092896,0,[0.9959 0.0018 0.0023],0,[0.9966 0.0015 0.0019],"{'suka': 'suka', 'ibis': 'ibis', 'inovasi': 'inovasi', 'kenyamanan': 'kenyamanan'}",0,0,0.0661,,,,,,,,,
"kepada yang terhormat ibu dari ayi djembarsari . selamat menunaikan tugas , bu , sebagai dirut rshs . semoga pelayanan rshs semakin baik . saya bangga kepada ibu .",0,kepada yang dear ibu dari ayi djembarsari selamat menunaikan tugas bu sebagai dirut rshs semoga pelayanan rshs semakin baik saya reueus kepada ibu,0.9802651405334472,0,[0.9689 0.02   0.0111],0,[0.9331 0.0449 0.022 ],"{'bangga': 'reueus', 'djembarsari': 'djembarsari', 'pelayanan': 'pelayanan', 'terhormat': 'dear', 'rshs': 'rshs'}",0,0,0.0742,,,,,,,,,
terima kasih atas saran yang kamu berikan kak . kami akan selalu berusaha untuk meningkatkan pelayanan kami untuk pengalaman belanja yang lebih menyenangkan ya .,0,terima kasih atas saran yang kamu berikan kak kami akan selalu usaha untuk meningkatkan pelayanan kami untuk pengalaman belanja yang lebih pikaresepeun ya,0.9867740273475648,0,[0.9772 0.0172 0.0056],0,[0.975  0.0179 0.0071],"{'belanja': 'belanja', 'pengalaman': 'pengalaman', 'menyenangkan': 'pikaresepeun', 'berusaha': 'usaha'}",0,0,0.0738,,,,,,,,,
"hai kak , terima kasih atas masukan kamu ya . saran kamu sangat berharga bagi kami . kami akan berupaya meningkatkan performa aplikasi dan pelayanan kami untuk pengalaman jual - beli yang selalu menyenangkan untuk kamu dan semua sobat shopee ya kak :",0,hai kak terima kasih atas masukan kamu ya saran kamu sangat berharga bagi kami kami akan berupaya meningkatkan performa aplikasi dan pelayanan kami untuk pengalaman jual beli yang selalu pikaresepeun untuk kamu dan semua sobat shopee ya kak,0.9974663257598876,0,[0.9704 0.0227 0.0069],0,[0.976  0.0166 0.0074],"{'pengalaman': 'pengalaman', 'menyenangkan': 'pikaresepeun', 'jual': 'jual', 'kak': 'kak', 'pelayanan': 'pelayanan', 'beli': 'beli', 'berharga': 'berharga', 'performa': 'performa'}",0,0,0.0955,,,,,,,,,
"keleveru terbaik memang , dari kualitas , kuantitas , pelayanan pun terbaik . tidak salah pilih aku .",0,keleveru terbaik memang dari kualitas kuantitas pelayanan pun terbaik tidak salah pilih aku,1.0,0,[0.9913 0.0031 0.0057],0,[0.9946 0.0017 0.0038],"{'salah': 'salah', 'keleveru': 'keleveru', 'kuantitas': 'kuantitas'}",0,0,0.0585,,,,,,,,,
cocok banget gue pakai shope . sudah mana ongkos kirim gratis . pengiriman juga aman dan lancar .,0,cocok banget gue pakai shope sudah mana ongkos kirim gratis pengiriman juga aman dan lancar,1.0,0,[0.9978 0.0011 0.0011],0,[0.9977 0.0011 0.0013],"{'banget': 'banget', 'ongkos': 'ongkos', 'cocok': 'cocok', 'gratis': 'gratis'}",0,0,0.0617,,,,,,,,,
"alhamdulillah selama beli di lazada tidak pernah bermasalah . barang-barang nya lebih lucu-lucu . pelayanan juga lebih baik dari yang lain . sudah deh kalau beli apa-apa , aku mau beli di lazada saja .",0,Alhamdulillah selama beli di lazada tidak pernah bermasalah milik lebih pelayanan juga lebih baik dari yang lain sudah deh kalau beli aku mau beli di lazada saja,0.985832154750824,0,[0.9947 0.0022 0.0032],0,[0.9873 0.006  0.0066],"{'bermasalah': 'bermasalah', 'pelayanan': 'pelayanan', 'nya': 'milik', 'alhamdulillah': 'Alhamdulillah'}",0,0,0.0766,,,,,,,,,
"karena shopee bukan barang shope , dia itu tempat belanjaan aku yang paling luar biasa ! pelayanan nya oke punya , disko nya banjir !",0,karena shopee bukan barang shope dia itu tempat belanjaan aku yang paling luar biasa pelayanan milik Oké punya disko milik banjir,0.9334962964057922,0,[0.9017 0.0046 0.0937],0,[0.7748 0.0347 0.1905],"{'pelayanan': 'pelayanan', 'oke': 'Oké', 'nya': 'milik'}",0,0,0.068,,,,,,,,,
"harus belanja di shopee karena shopee itu memberikan bukti pelayanan yang baik , bukan sekadar janji doang , seperti mantan itu",0,harus belanja di shopee karena shopee itu memberikan bukti pelayanan yang baik bukan sekadar janji doang seperti mantan itu,1.0000001192092896,0,[0.5225 0.0121 0.4654],0,[0.9341 0.0118 0.0542],"{'shopee': 'shopee', 'pelayanan': 'pelayanan'}",0,0,0.0648,,,,,,,,,
harus belanja di shopee karena pelayanan dari shope itu benar benar memuaskan pelanggan dan takkan mengecewakan .,0,harus belanja di shopee karena pelayanan dari shope itu benar benar memuaskan pelanggan dan moal mengecewakan,0.990635871887207,0,[0.9929 0.0028 0.0043],0,[0.9877 0.0031 0.0091],"{'takkan': 'moal', 'memuaskan': 'memuaskan', 'pelayanan': 'pelayanan'}",0,0,0.059,,,,,,,,,
karena hanya shope yang pelayanan nya memuaskan . diskon besar-besaran . barang nya juga pasti nya bermerek . mantap .,0,karena hanya shope yang pelayanan nya memuaskan diskon barang nya juga pasti nya bermerek mantap,0.9920081496238708,0,[0.9974 0.0011 0.0015],0,[0.9974 0.0011 0.0015],"{'mantap': 'mantap', 'bermerek': 'bermerek', 'memuaskan': 'memuaskan', 'shope': 'shope'}",0,0,0.0672,,,,,,,,,
shopee tidak pernah mengecewakan pelanggan selalu memberikan yang terbaik dalam pelayanan . pokok nya shopee selalu memberikan pelayanan dengan baik .,0,shopee tidak pernah mengecewakan pelanggan selalu memberikan yang terbaik dalam pelayanan pokok nya shopee selalu memberikan pelayanan dengan baik,1.0000001192092896,0,[0.9967 0.0013 0.0021],0,[0.9968 0.0011 0.002 ],"{'mengecewakan': 'mengecewakan', 'shopee': 'shopee'}",0,0,0.0682,,,,,,,,,
"shopee itu pusat pembelanjaan online terpercaya dengan pelayanan yang memuaskan . yang paling menarik adalah pemberian diskon yang besar-besaran . aku suka , aku suka .",0,shopee itu pusat pembelanjaan online terpercaya dengan pelayanan yang memuaskan yang paling menarik adalah pemberian diskon yang aku suka aku suka,0.996188223361969,0,[0.9963 0.0016 0.0021],0,[0.9953 0.0024 0.0022],"{'memuaskan': 'memuaskan', 'pembelanjaan': 'pembelanjaan', 'menarik': 'menarik', 'shopee': 'shopee'}",0,0,0.0687,,,,,,,,,
