label,tweet,perturbed_text,perturbed_semantic_sim,pred_label,pred_proba,perturbed_label,perturbed_proba,translated_word(s),running_time(s),before_attack_acc,after_attack_acc,avg_semantic_sim,avg_running_time(s)
4,"sangat bersyukur bisa mendoakan kakeknya, Bung Karno, bersama anak-anak yatim piatu. #BulanBungKarno #JuniBulanBungKarno #PenyambungLidahRakyatIndonesia #nomor2untukjatim #jatimpilihgusipulputi #KabehSedulurKabehMakmur [USERNAME] h",sangat give thanks bisa mendoakan kakeknya Bung Karno bersama yatim piatu BulanBungKarno JuniBulanBungKarno Indonesian People's Tongue Connector nomor2untukjatim Jatimselectgusipulputi KabehSedulurKabehMakmur USERNAME h,0.7756588459014893,4,[0.0179 0.004  0.0182 0.0047 0.9552],4,[0.0165 0.0055 0.0135 0.0046 0.9599],"{'bersyukur': 'give thanks', 'jatimpilihgusipulputi': 'Jatimselectgusipulputi', 'PenyambungLidahRakyatIndonesia': ""Indonesian People's Tongue Connector""}",8.14,,,,
2,"UWWHHH HAPPY ONE MONTH WITH UNNIEEE! SEMOGA BISA KETEMU DI BULAN BULAN BERIKUTNYA NDE! MAKIN SAYANG SAMA AQ, DAN SEMOGA KITA MENJADI KELUWARGA YG SAMAWAAA WKWKWKWK SARANG APA? SARANGEYOOO",UWWHHH HAPPY ONE MONTH WITH UNNIEEEE HOPEFULLY BISA KETEMU DI BULAN BULAN BERIKUTNYA NDE MAKIN SAYANG SAMA AQ DAN HOPEFULLY KITA MENJADI KELUWARGA YG SAMAWAAA WKWKWKWK SARANG WHAT SARANGEYOOO,0.9044068455696106,2,[0.0146 0.0053 0.4947 0.0061 0.4793],4,[0.018  0.0061 0.4508 0.0076 0.5175],"{'SEMOGA': 'HOPEFULLY', 'UNNIEEE': 'UNNIEEEE', 'WKWKWKWK': 'WKWKWKWK', 'ONE': 'ONE', 'APA': 'WHAT'}",7.8,,,,
4,Bekerja dg hati dan selalu mengandalkan dari Allah sendiri itu hasilnya beda dan awet. Selamat bertransformasi menjadi comdev yg sesungguhnya. Sbg teman saya selalu berikan support Dena \,Bekerja dg hati dan selalu mengandalkan dari Allah sendiri itu hasilnya beda dan durable Selamat bertransformasi menjadi comdev which sesungguhnya Sbg teman saya selalu berikan support Dena,0.9641985297203064,4,[0.0139 0.0034 0.0357 0.006  0.9411],4,[0.0162 0.0031 0.0818 0.0048 0.894 ],"{'comdev': 'comdev', 'awet': 'durable', 'yg': 'which'}",5.8,,,,
2,MANIS BANGET SIH TAMBAH SAYANG KAN YA AMPUN JIMIN ADABYU BUING BUING,SWEET VERY SIH TAMBAH SAYANG KAN YA AMPUN JIMIN ADABYU BUING BUING,0.8755465745925903,2,[0.0158 0.0035 0.9672 0.0031 0.0105],2,[0.0156 0.0032 0.9707 0.0035 0.0071],"{'MANIS': 'SWEET', 'BANGET': 'VERY'}",5.07,,,,
1,"Ini akan baik, jika kita saling bertukar posisi. Awalnya istri yg atur, kemudian ada tudingan krg mengenakan. Biarkan suami yg mengatur.. dan lihat apa msh bs ada kalimat2 pembuat murka yg dilontarkan ulang ? :"")",Ini akan baik jika kita saling bertukar posisi Awalnya istri yg atur kemudian ada accusations krg mengenakan Let suami yg mengatur dan lihat apa msh bs ada kalimat2 pembuat wrath yg dilontarkan ulang,0.968860924243927,1,[0.099  0.8605 0.0019 0.0345 0.0041],1,[0.2202 0.6728 0.0028 0.099  0.0053],"{'tudingan': 'accusations', 'murka': 'wrath', 'Biarkan': 'Let', 'kalimat2': 'kalimat2'}",6.51,,,,
0,"Tak perlu iri,kita punya sepi sendiri-sendiri. Jika hidup orang tampak meriah,itu karena sepi dirayakan dengan mewah. - Adimas Imanuel [URL]","Tak perlu iri,kita punya sepi sendiri-sendiri. Jika hidup orang tampak meriah,itu karena sepi dirayakan dengan mewah. - Adimas Imanuel [URL]",1.0,4,[0.1329 0.0107 0.0143 0.0097 0.8324],4,[0.1329 0.0107 0.0143 0.0097 0.8324],,0.02,,,,
1,"jangan sok akrab ye mention mention gue , maling dulu aje yg bener nanti kalo udah sukses jadi malingnye baru gue bales mentionan lu lu pada .. #SalamSatuNyaliLari #BonekJancuk [URL]",jangan pretentious akrab ye mention mention gue thief dulu aje yg bener nanti kalo udah sukses jadi thief baru gue bales mentionan lu lu pada SalamSatuNyaliLari BonekJancuk URL,0.8918529152870178,1,[0.021  0.9648 0.0017 0.0082 0.0044],1,[0.1376 0.6388 0.0227 0.0321 0.1688],"{'maling': 'thief', 'malingnye': 'thief', 'sok': 'pretentious', 'mention': 'mention'}",6.09,,,,
3,"Eh nganu, kalau kita ditelpon orang yg mau nipu, bisa gak sih kita laporin polisi berdasarkan nomor telpon dia? Kan tiap nomor sekarang udah teregisterasi ya? Terus bakal ditindaklanjuti gak ya? Maksudnya tuh biar orgnya ditangkap dan gak makan korban.","Eh nganu, kalau kita ditelpon orang yg mau nipu, bisa gak sih kita laporin polisi berdasarkan nomor telpon dia? Kan tiap nomor sekarang udah teregisterasi ya? Terus bakal ditindaklanjuti gak ya? Maksudnya tuh biar orgnya ditangkap dan gak makan korban.",1.0,1,[0.0246 0.8458 0.0021 0.1215 0.006 ],1,[0.0246 0.8458 0.0021 0.1215 0.006 ],,0.02,,,,
4,"Jadi yes, mengatur kesiapan yu yu buat punya anak bukan cuma dari mental, tapi juga kesiapan finansial. Harus imbang men. Aing sih percaya, tanaman yang dari awal dirawat dengan baik beda kualitas sama yang dibiarin idup gitu aja.","Jadi yes, mengatur kesiapan yu yu buat punya anak bukan cuma dari mental, tapi juga kesiapan finansial. Harus imbang men. Aing sih percaya, tanaman yang dari awal dirawat dengan baik beda kualitas sama yang dibiarin idup gitu aja.",1.0,0,[0.6773 0.076  0.0046 0.2326 0.0095],0,[0.6773 0.076  0.0046 0.2326 0.0095],,0.02,,,,
0,Protes warga yg tak terima anaknya diterima masuk ke SMA negeri bukan karena kualitas sekolah negeri lebih baik atau bisa membuat anak2nya sukses. Tapi karena biayanya yg lebih murah. Ini benar2 zaman sulit.,Protes inhabitant yg tak terima anaknya diterima masuk ke SMA negeri bukan karena kualitas sekolah negeri lebih baik atau bisa membuat anak2nya sukses Tapi karena biayanya yg lebih murah This benar2 era sulit,0.9739824533462524,0,[0.5569 0.3722 0.005  0.0582 0.0078],0,[0.7952 0.1544 0.0056 0.0279 0.0168],"{'benar2': 'benar2', 'zaman': 'era', 'Ini': 'This', 'warga': 'inhabitant'}",6.58,,,,
1,pancasila diuangin THR dipaksain pendidikan dijualin otak dikandangin kampus disatronin 2 periode dibatalin. #batalin2periode [URL],Pancasila diuangin THR forced pendidikan dijualin otak housed kampus disatronin 2 periode dibatalin batalin2periode URL,0.8086024522781372,1,[0.0389 0.9468 0.0013 0.007  0.006 ],1,[0.0386 0.9446 0.0017 0.0088 0.0063],"{'pancasila': 'Pancasila', 'dikandangin': 'housed', 'dipaksain': 'forced'}",6.65,,,,
4,Hamdulilah si FIFA ternyata adil wkwkwkwk~ So happy finally [USERNAME] song will be played at the stadium too yipiiee,Hamdulilah si FIFA ternyata adil So happy finally USERNAME song will be played at the stadium too yipiiee,0.9873586893081665,4,[0.0109 0.0043 0.0079 0.004  0.9729],4,[0.0116 0.006  0.0063 0.0038 0.9722],"{'happy': 'happy', 'finally': 'finally', 'song': 'song'}",5.5,,,,
3,"Aq lebih takut ama manusia daripada ama setan. Gk pernah ada setan kemanusiaan, tapi kalo manusia kesetanan banyak bahkan seram abis",Aq lebih takut ama manusia daripada ama setan Gk pernah ada setan kemanusiaan tapi kalo manusia fiend banyak bahkan spooky abis,0.955527663230896,3,[0.0255 0.0284 0.0283 0.9022 0.0155],3,[0.0296 0.0296 0.0312 0.8937 0.016 ],"{'kesetanan': 'fiend', 'seram': 'spooky'}",5.88,,,,
1,Anis bilang Prabowo didukung mafia asal mangap apa fakta?? sok nyolot kunyuk [USERNAME] satu ini nggak ada sopan santunnya sama pemimpin,Anis bilang Prabowo didukung mafia asal mangap apa fakta sok nyolot kunyuk USERNAME satu ini no ada polite santunnya sama pemimpin,0.9551855325698853,1,[0.0201 0.9618 0.0029 0.0082 0.007 ],1,[0.0292 0.9371 0.0058 0.0144 0.0135],"{'sopan': 'polite', 'nggak': 'no', 'USERNAME': 'USERNAME'}",5.98,,,,
3,"[USERNAME] kalo gue blm punya apa2 padahal gue pengen bawa cewek gue ke jenjang yg lebih lanjut, lebih serius, jelas gue minder. takut gabisa memenuhi kebutuhan dia secara materi. inilah yg bikin gue takut buat menikah, endingnya.",USERNAME kalo I blm punya apa2 padahal I pengen bring cewek I ke jenjang yg lebih lanjut lebih serius jelas I minder takut gabisa memenuhi need dia secara materi inilah yg bikin I takut buat menikah endingnya,0.9366453886032104,3,[0.0098 0.004  0.0047 0.9792 0.0023],3,[0.0066 0.0045 0.0042 0.9823 0.0024],"{'bawa': 'bring', 'kebutuhan': 'need', 'apa2': 'apa2', 'gue': 'I'}",8.86,,,,
3,"TAPI ITU TAKUT WOY sumpah beneran sampe paralyzed. Gemeteran. Gabisa ngapa ngapain dan gabisa mikir. Temen temen gua pada bilang ""kenapa lu galari?"" ""Lari anjir malah diem disitu"" ""gua kl jadi lu udh lari dah"" well, i would said the same thing if i were you. Tp lu gatau rasanya",BUT THAT TAKUT WOY sumpah beneran sampe paralyzed Gemeteran Gabisa ngapa ngapain dan gabisa thinking Temen friend gua pada bilang kenapa lu galari Lari anjir malah diem disitu gua kl jadi lu udh lari dah well i would said the same thing if i were you Tp lu gatau rasanya,0.9303449392318726,3,[0.0076 0.0068 0.0039 0.9792 0.0025],3,[0.0084 0.0089 0.0042 0.9762 0.0023],"{'ITU': 'THAT', 'TAPI': 'BUT', 'mikir': 'thinking', 'paralyzed': 'paralyzed', 'would': 'would', 'temen': 'friend', 'i': 'i', 'well': 'well'}",7.58,,,,
2,Dr dulu suka gemes sndr tiap abang maen game maapin ya klo maminya sering ikutan nimbeung ya bang #cinta #kiddos #play #games,Dr dulu suka gemes sndr tiap abang maen game maapin yes klo maminya sering ikutan nimbeung yes bang love kiddos play games,0.9032787680625916,2,[0.008  0.0016 0.9677 0.0032 0.0194],2,[0.0314 0.0045 0.7213 0.0061 0.2367],"{'cinta': 'love', 'play': 'play', 'ya': 'yes'}",5.98,,,,
0,"Bapak Kos liat sinetron di ruang tengah. Bule dateng terus bilang ""Nangis-nangis terus, kenapa Indonesia bikin film nangis-nangis terus"" emmm kenapa kira2?","Bapak Kos liat sinetron di ruang tengah. Bule dateng terus bilang ""Nangis-nangis terus, kenapa Indonesia bikin film nangis-nangis terus"" emmm kenapa kira2?",1.0,1,[0.3367 0.5776 0.0028 0.0609 0.0221],1,[0.3367 0.5776 0.0028 0.0609 0.0221],,0.07,,,,
0,"Tersenyum saja walau terpaksa saat kau di khianati sahabat atas janji dan sumpah setianya, karena kau sdg di perlihatkan betapa bangsatnya dia dan dijauhkannya hatimu dari memberi rasa sayang padanya",Smile saja walau terpaksa saat you di khianati sahabat atas janji dan sumpah setianya karena you sdg di perlihatkan betapa bangsatnya dia dan keep it away hatimu dari memberi rasa sayang padanya,0.9239152073860168,0,[0.5655 0.0087 0.4074 0.0104 0.008 ],2,[0.0278 0.0024 0.9417 0.003  0.0251],"{'dijauhkannya': 'keep it away', 'kau': 'you', 'Tersenyum': 'Smile'}",8.15,,,,
0,"[USERNAME] [USERNAME] Menanti balasan dari tuhan gitu yha?, yha sih, doa orang yg tersakiti itu mujarab asli!. Intinya terlalu cinta Disakitin apapun itu ia tetep cinta. Kasian gw jadinya :('",USERNAME USERNAME Menanti balasan dari tuhan gitu yha yha sih doa orang yg tersakiti itu mujarab asli The main thing is terlalu cinta Disakitin apapun itu ia tetep cinta Kasian gw jadinya,0.9816806316375732,0,[0.7151 0.007  0.2491 0.0203 0.0085],2,[0.1361 0.0042 0.845  0.0078 0.0069],{'Intinya': 'The main thing is'},5.58,,,,
3,"[USERNAME] [USERNAME] [USERNAME] Anda benar. Tidak disemua tempat kita boleh melaksanakan sholat, salah satunya di bangunan yang didirikan untuk kekafiran (salah satunya gereja). Aku berlindung kepada ALLAAH SWT. dari godaan setan yang terku",USERNAME USERNAME USERNAME Anda benar Tidak disemua tempat kita boleh melaksanakan sholat salah satunya di bangunan yang didirikan untuk kekafiran salah satunya gereja I berlindung kepada ALLAAH SWT dari temptation Devil yang terku,0.9585949182510376,3,[0.0195 0.0321 0.0035 0.9414 0.0036],3,[0.3311 0.1137 0.0052 0.5441 0.006 ],"{'setan': 'Devil', 'Aku': 'I', 'godaan': 'temptation', 'terku': 'terku'}",6.46,,,,
4,"Awalnya di bio ig dituliskan every picture has a story dan aku mulai merenungkan kayaknya engga deh, emang di balik foto selfie ada cerita apaan. Oke berarti harus di ubah berarti menjadi berisi cekrekan teman dan cekrekan sendiri. Sip","Awalnya di bio ig dituliskan every picture has a story dan aku mulai merenungkan kayaknya engga deh, emang di balik foto selfie ada cerita apaan. Oke berarti harus di ubah berarti menjadi berisi cekrekan teman dan cekrekan sendiri. Sip",1.0,0,[0.8924 0.012  0.004  0.0791 0.0125],0,[0.8924 0.012  0.004  0.0791 0.0125],,0.02,,,,
4,Ya Allah mhn berikanlh kekuatan dan kesehatn buat yg menjalankan tugas #JelajahDesa2018 Wakil Ketua MPR [USERNAME] dan Mendes [USERNAME] dan rombongn serta masyrakt untk menuju ridhoMU. Aamiin3 [USERNAME] [USERNAME] [USERNAME] [USERNAME] [USERNAME] [USERNAME] [URL],Ya Allah mhn berikanlh kekuatan dan health buat yg menjalankan tugas JelajahDesa2018 representative Ketua MPR USERNAME dan Mendes USERNAME dan rombongn serta masyrakt untk menuju bless you Aamiin3 USERNAME USERNAME USERNAME USERNAME USERNAME USERNAME URL,0.9677215814590454,4,[0.0239 0.0086 0.02   0.0092 0.9383],4,[0.04   0.0116 0.0265 0.0115 0.9104],"{'Aamiin3': 'Aamiin3', 'JelajahDesa2018': 'JelajahDesa2018', 'kesehatn': 'health', 'ridhoMU': 'bless you', 'Wakil': 'representative'}",6.81,,,,
4,"#PacaranJamanDulu baru jadian langsung ganti status di Facebook ""berpacaran dengan..."", kalo putus langsung saat itu juga ganti status di Facebook ""Lajang"" ","#PacaranJamanDulu baru jadian langsung ganti status di Facebook ""berpacaran dengan..."", kalo putus langsung saat itu juga ganti status di Facebook ""Lajang"" ",1.0,0,[0.8919 0.0059 0.045  0.0087 0.0485],0,[0.8919 0.0059 0.045  0.0087 0.0485],,0.02,,,,
1,[USERNAME] [USERNAME] [USERNAME] Apakah bisa di anggap saudara jika mreka akan membubarkan acara ustadz yg akan memberikan tausiah ilmu kpd kami???mikir dikit napa??,USERNAME USERNAME USERNAME Apakah bisa di anggap saudara jika mreka akan membubarkan acara ustadz yg akan memberikan tausiah ilmu to kami mikir dikit napa,0.9778398871421814,1,[0.0234 0.8269 0.002  0.1432 0.0045],1,[0.0552 0.6679 0.0024 0.2694 0.0052],"{'USERNAME': 'USERNAME', 'kpd': 'to'}",6.94,,,,
2,"Kalo aku bilang sayang sama kamu, tandanya aku bohong sama kamu.. Kalo aku bener sayang, aku pasti nikahin kamu.. Makanya aku mau nikahin kamu..",Kalo aku bilang Dear sama kamu tandanya aku bohong sama kamu Kalo aku bener Dear aku pasti nikahin kamu So aku mau nikahin kamu,0.9706308841705322,2,[0.0079 0.0019 0.9793 0.0043 0.0065],2,[0.0101 0.0024 0.9756 0.0054 0.0065],"{'Makanya': 'So', 'sayang': 'Dear'}",6.07,,,,
2,"Nona tidak perlu takut, toh ini hanya gerimis kan? Sudah ku siapkan rumah untuk berteduh barangkali nanti berubah menjadi hujan angin. #ceritakemarinsore #spoiler","Nona tidak perlu takut, toh ini hanya gerimis kan? Sudah ku siapkan rumah untuk berteduh barangkali nanti berubah menjadi hujan angin. #ceritakemarinsore #spoiler",1.0,3,[0.0197 0.0039 0.0116 0.9534 0.0113],3,[0.0197 0.0039 0.0116 0.9534 0.0113],,0.02,,,,
1,[USERNAME] Mas Adie biasanya para pecundang memang kaya gitu...selalu berharap hal terburuk menimpa negri ini sambil meperkeruh suasana .... dengan harapan ada kesempatan untuk mencuri kekuasaan...#2019IstiqomahJokowi,USERNAME Mas Adie biasanya para loser memang kaya gitu selalu berharap hal terburuk menimpa negri ini sambil meperkeruh suasana dengan harapan ada kesempatan untuk steal power 2019IstiqomahJokowi,0.9181908965110779,1,[0.1017 0.865  0.0018 0.0261 0.0053],0,[0.6461 0.1807 0.0041 0.1506 0.0186],"{'kekuasaan': 'power', 'mencuri': 'steal', 'pecundang': 'loser'}",6.53,,,,
2,"Cinta mengerti apa yang tak diungkapkan, merasakan tanpa dijelaskan, karna cinta bukan tentang wajah nan rupawan tapi cinta itu tentang sebuah pengertian",Cinta mengerti apa yang tak diungkapkan merasakan tanpa dijelaskan karna love bukan tentang wajah nan rupawan tapi love itu tentang sebuah definition,0.9264001250267029,2,[0.012  0.0018 0.9777 0.0038 0.0048],2,[0.0127 0.0019 0.9768 0.0038 0.0047],"{'pengertian': 'definition', 'cinta': 'love'}",5.42,,,,
2,"Permulaan cinta adalah membiarkan orang yang kamu cintai menjadi dirinya sendiri, dan tidak merubahnya menjadi gambaran yang kamu inginkan. Jika tidak, kamu hanya mencintai pantulan diri sendiri yang kamu temukan di dalam dirinya.",Permulaan cinta adalah let orang yang kamu cintai menjadi dirinya sendiri dan tidak merubahnya menjadi gambaran yang kamu inginkan Jika tidak kamu hanya love pantulan diri sendiri yang kamu temukan di dalam dirinya,0.9853733777999878,2,[0.0211 0.002  0.9674 0.0056 0.0039],2,[0.0245 0.0027 0.9621 0.0064 0.0043],"{'membiarkan': 'let', 'mencintai': 'love'}",6.31,,,,
1,"Hah? Yg kemarin dipermasalahkan di kasus Gitasav kan bukan bagian sexual harrasment Gitasav ke Tristan, itu sih udah bener. Yg dipermasalahkan kan cara dia merespon Helmi. Those are two different cases. Kayaknya banyak ya yg salah paham kmrn yg kontra sm Gitasav di case mana.",Hah Yg yesterday dipermasalahkan di kasus Gitasav kan bukan bagian sexual harrasment Gitasav ke Tristan itu sih udah right Yg dipermasalahkan kan cara dia merespon Helmi Those are two different cases Kayaknya banyak ya yg salah paham kmrn yg kontra sm Gitasav di case mana,0.9928396940231323,1,[0.0461 0.9355 0.0014 0.0131 0.0038],1,[0.0289 0.9553 0.0012 0.0105 0.0041],"{'bener': 'right', 'Hah': 'Hah', 'kemarin': 'yesterday', 'case': 'case', 'Gitasav': 'Gitasav'}",7.9,,,,
0,Kamu.... Ah aku benci semuanya! :'(,Kamu Ah aku benci semuanya,0.9999998807907104,0,[0.5569 0.3371 0.0757 0.0208 0.0096],2,[0.403  0.0613 0.4979 0.0308 0.0071],{'Ah': 'Ah'},4.89,,,,
1,"[USERNAME] [USERNAME] Coba selama masa jabatan anda pak [USERNAME] , apa saja yg sudah anda lakukan untuk Indonesia agar disegani bangsa2? Bangsa mana saja yg sudah menyegani Indonesia?",USERNAME USERNAME Coba selama masa jabatan anda pak USERNAME apa saja which sudah anda do untuk Indonesia agar disegani bangsa2 Bangsa mana saja which sudah menyegani Indonesia,0.9513819813728333,1,[0.0257 0.9591 0.0015 0.0077 0.0059],1,[0.0203 0.9634 0.0025 0.0071 0.0067],"{'lakukan': 'do', 'yg': 'which'}",5.59,,,,
3,[askmf] tadi jam 10 gue beraniin buat line dia duluan. Tp sampe skrng masi takut buka line(aplkasinya gue stop jd gada notif) gue takut gadibaless:(,askmf tadi jam 10 I beraniin buat line dia duluan Tp sampe skrng masi afraid buka line the app I stop jd gada notif I afraid gadibaless,0.710748553276062,3,[0.0069 0.0044 0.0048 0.9812 0.0027],3,[0.0139 0.0072 0.0034 0.9729 0.0026],"{'gue': 'I', 'takut': 'afraid', 'jd': 'jd', 'aplkasinya': 'the app'}",6.56,,,,
4,"Persahabatan itu tidak perlu filosopi, tidak memiliki nilai dalam hidup. akan tetapi, itulah yang memberikan nilai untuk kelangsungan hidup happy friendship day","Persahabatan itu tidak perlu filosopi, tidak memiliki nilai dalam hidup. akan tetapi, itulah yang memberikan nilai untuk kelangsungan hidup happy friendship day",1.0,2,[0.0139 0.0027 0.881  0.0037 0.0987],2,[0.0139 0.0027 0.881  0.0037 0.0987],,0.02,,,,
1,[USERNAME] [USERNAME] Keledai itu dibilang bodoh karena bisa jato ke lobang yg sama.. ternyata ada juga yang lebih parah dari keledai. Bikin emosi aja ngebayangin besok,[USERNAME] [USERNAME] Keledai itu dibilang bodoh karena bisa jato ke lobang yg sama.. ternyata ada juga yang lebih parah dari keledai. Bikin emosi aja ngebayangin besok,1.0,3,[0.0595 0.1112 0.0037 0.8207 0.005 ],3,[0.0595 0.1112 0.0037 0.8207 0.005 ],,0.02,,,,
4,"gw suka, gw mau ktmu, gw ntn konser sndrian no prob yg penting di dalem gw have fun.",gw suka gw mau ktmu gw ntn concert sndrian no prob yg penting di dalem gw have fun,0.9755520820617676,4,[0.0109 0.0051 0.0819 0.0029 0.8992],4,[0.01   0.0052 0.0411 0.0027 0.9411],"{'konser': 'concert', 'no': 'no', 'sndrian': 'sndrian'}",7.22,,,,
2,"yang, aku aja inget :"") malah kemaren siapa yang ngajarin aku rap lagu ini? gatausih(?) gapapa aku tetep sayang kok bri hehe",yang aku aja inget malah kemaren siapa yang ngajarin aku rap lagu ini I don't know gapapa aku stay sayang kok bri hehe,0.9762837886810303,2,[0.01   0.0016 0.9722 0.0044 0.0118],2,[0.0255 0.0021 0.9606 0.0055 0.0064],"{'tetep': 'stay', 'gatausih': ""I don't know""}",6.01,,,,
4,[USERNAME] sebagai jiwa berwirausaha atau pengusaha harus berani mengambil resiko apapun itu demi usaha nya kegagalan awal dari kesuksesan,[USERNAME] sebagai jiwa berwirausaha atau pengusaha harus berani mengambil resiko apapun itu demi usaha nya kegagalan awal dari kesuksesan,1.0,0,[0.4111 0.0315 0.0096 0.4055 0.1423],0,[0.4111 0.0315 0.0096 0.4055 0.1423],,0.02,,,,
3,"Di logika aja gini, sblm2nya gua dan temen2 gua ga pernah deket2 kamar itu ga sampe ini setan nongol anjir. Gara2 si abang jadi nongol itu setan, gua takut.",Di logic aja like this sblm2nya gua dan temen2 gua ga pernah deket2 kamar itu ga sampe ini setan nongol anjir Gara2 si abang jadi nongol itu setan gua takut,0.9544776678085327,3,[0.0111 0.0126 0.0134 0.955  0.0079],3,[0.0114 0.0131 0.0134 0.9541 0.008 ],"{'Gara2': 'Gara2', 'temen2': 'temen2', 'gini': 'like this', 'logika': 'logic'}",5.54,,,,
0,"[USERNAME] Akhirnya kutemui kembali, lelaki yg sekian tahun lalu gagal aku dekati, Ketika tahun ini ingin memperjuangkan cinta kembali ternyata kau sudah ada calon untuk kau nikahi",USERNAME Akhirnya meet kembali lelaki yg so much tahun lalu gagal aku dekati Ketika tahun ini ingin memperjuangkan cinta kembali ternyata kau sudah ada calon untuk kau marry,0.9501783847808838,0,[0.6587 0.0081 0.3138 0.0138 0.0057],2,[0.3514 0.0065 0.6227 0.0084 0.0109],"{'kutemui': 'meet', 'sekian': 'so much', 'nikahi': 'marry'}",6.02,,,,
1,JILBABER BAJU NATAL NORAK & ANJING2 KALIAN SDH MNYAMBUT DI HOTEL WAHAI INTEL SETAN [USERNAME] [USERNAME] APEP AHMAD TARDIYANA URBANE ANJING !! INI AJA POLA ULAH INTEL BUSUK LO NGIKUTIN ORG KEMNPUN TAEKKKK !! ALAT TEROR BNGSAT LAGI2 KALIAN PASANG DI KAMAR KERJASAMA DGN HOTEL TAEK!,JILBABER BAJU NATAL UNCOUTH ANJING2 WE ALREADY MNYAMBUT DI HOTEL WAHAI INTEL SETAN USERNAME USERNAME APEP AHMAD TARDIYANA URBANE ANJING INI AJA PATTERN ULAH INTEL BUSUK LO NGIKUTIN ORG KEMNPUN TAEKKKK TOOL TEROR BGSAT LAGI2 WE PASANG DI KAMAR KERJASAMA DGN HOTEL TAEK,0.9052572250366211,1,[0.0101 0.9761 0.0017 0.0076 0.0044],1,[0.0222 0.9074 0.0031 0.0589 0.0084],"{'ALAT': 'TOOL', 'KALIAN': 'WE', 'TAEKKKK': 'TAEKKKK', 'POLA': 'PATTERN', 'URBANE': 'URBANE', 'SDH': 'ALREADY', 'BNGSAT': 'BGSAT', 'NORAK': 'UNCOUTH'}",12.67,,,,
1,"Kadang gak setuju sih kalo mau bikin impression bahwa lu itu arsitek dengan cara isi feed ig dengan hal berbau arsitektur. Yah padahal bagi aing sih ig ya buat interest aja, ga melulu hal arsitektur. Dan banyak media lain selain ig semacam behance, issuu dll buat memamerkan karya",Kadang no setuju sih kalo mau make impression bahwa lu itu arsitek dengan cara isi feed ig dengan hal berbau arsitektur Yes padahal bagi aing sih ig ya buat interest aja ga melulu hal arsitektur Dan banyak media lain selain ig semacam behance issuu dll buat memamerkan karya,0.9831805229187012,1,[0.1352 0.839  0.0028 0.0122 0.0108],1,[0.143  0.8152 0.0029 0.0126 0.0263],"{'gak': 'no', 'lu': 'lu', 'feed': 'feed', 'ig': 'ig', 'bikin': 'make', 'Yah': 'Yes'}",8.99,,,,
0,iya ya kok saya bodoh si dana jatuh dilubang yang sama wkwk tidak-kuat nih saya begini mulu! capai,iya ya kok saya bodoh si dana jatuh dilubang yang sama wkwk tidak-kuat nih saya begini mulu! capai,1.0,1,[0.1919 0.7829 0.0025 0.0132 0.0095],1,[0.1919 0.7829 0.0025 0.0132 0.0095],,0.02,,,,
0,Sedih lihat kondisi rahtawu sekarang kyk gini.... lebih suka kondisi rahtawu yang dulu sepi dan alami... . . #sekitarkudus #infosekitarkudus #kudus #riprahtawu [USERNAME] [URL],Sedih lihat kondisi rahtawu sekarang kyk gini lebih like kondisi rahtawu yang dulu sepi dan experience sekitarkudus infosekitarkudus holy riprahtawu USERNAME URL,0.9182372093200684,0,[0.9063 0.0206 0.0129 0.0502 0.01  ],0,[0.663  0.0365 0.0107 0.2805 0.0094],"{'suka': 'like', 'kudus': 'holy', 'alami': 'experience'}",6.04,,,,
0,"separah inilah aku yang tak mengerti bahwa ada fitur sms banking dan i-banking. okay i'm done~ btw terimakasih sudah menjadi yg tersabar menghadapi diriku yg gapteknya gak ketulungan, semoga alam semesta mengamini chatmu ya!","separah inilah aku yang tak mengerti bahwa ada fitur sms banking dan i-banking. okay i'm done~ btw terimakasih sudah menjadi yg tersabar menghadapi diriku yg gapteknya gak ketulungan, semoga alam semesta mengamini chatmu ya!",1.0,4,[0.0556 0.0049 0.0271 0.0066 0.9057],4,[0.0556 0.0049 0.0271 0.0066 0.9057],,0.02,,,,
0,"Kalo emg td hari terakhir bsa bercanda2 sama lu inshaallah gue udh siap buat pisah... Biar berat jga gaboleh egois, moga sukses ya lo ke depan","Kalo emg td hari terakhir bsa bercanda2 sama lu inshaallah gue udh siap buat pisah... Biar berat jga gaboleh egois, moga sukses ya lo ke depan",1.0,4,[0.2464 0.0074 0.2222 0.0554 0.4686],4,[0.2464 0.0074 0.2222 0.0554 0.4686],,0.07,,,,
1,beberapa hari yang lalu foto aku di posting salah satu akun Instagram milik bisnis transportasi kapal laut tanpa izin dan tidak mencantumkan si pemilik karya,beberapa hari yang lalu foto aku di posting salah satu akun Instagram milik bisnis transportasi kapal laut tanpa permission dan tidak include si pemilik creation,0.929810106754303,1,[0.2668 0.6138 0.0036 0.1045 0.0113],1,[0.3546 0.4336 0.0045 0.194  0.0133],"{'mencantumkan': 'include', 'izin': 'permission', 'karya': 'creation'}",6.17,,,,
4,"Gue sama kakak gue adalah orang yang jago makan pedes. Lagi musim ayam geprek atau gepuk pastimintanya yang paling pedes. Jadi kemarin siang gofood OK Cis (Ayam Geprek Ria Ricis), ternyata enak. Malamnya beli lagi dan makan di tempat.",I sama kakak gue adalah orang yang jago makan pedes Lagi musim chicken geprek atau gepuk pastimintanya yang paling pedes Jadi kemarin siang gofood OK Cis Chicken geprek Ria Ricis ternyata enak Malamnya beli lagi dan makan di tempat,0.9652597904205322,4,[0.0404 0.0118 0.024  0.016  0.9077],4,[0.0307 0.008  0.0137 0.0095 0.9381],"{'Gue': 'I', 'OK': 'OK', 'Ayam': 'Chicken', 'Geprek': 'geprek', 'ayam': 'chicken'}",6.57,,,,
4,"Akhirnya ku putari itu thamrin sampe pening kq ini, w melihat-lihat. Dan yu kno wat? Banyak bgt dong baju kemeja koko bomber jacket kaos cakep2 bgt bwt brondong dan mantan w.","Akhirnya ku putari itu thamrin sampe pening kq ini, w melihat-lihat. Dan yu kno wat? Banyak bgt dong baju kemeja koko bomber jacket kaos cakep2 bgt bwt brondong dan mantan w.",1.0,0,[0.8729 0.0115 0.0068 0.0266 0.0822],0,[0.8729 0.0115 0.0068 0.0266 0.0822],,0.06,,,,
