text,sentiment,perturbed_text,perturbed_semantic_sim,pred_label,pred_proba,perturbed_label,perturbed_proba,translated_word(s),running_time(s),before_attack_acc,after_attack_acc,avg_semantic_sim,avg_running_time(s)
menyesal,2,menyesal,1.0,2,[0.1676 0.0158 0.8167],2,[0.1676 0.0158 0.8167],{'menyesal': 'regret'},11.86,,,,
aku sih beli di groupon kupon diskon . jadi bisa diskon lumayan . rasa enak kok . aku makan sop buntut dan lumpia .,0,aku sih beli di groupon kupon diskon jadi bisa diskon reasonable rasa nice kok aku makan sop tail dan spring rolls,0.8997205495834351,0,[0.9958 0.0016 0.0026],0,[0.9934 0.0023 0.0043],"{'enak': 'nice', 'lumayan': 'reasonable', 'buntut': 'tail', 'lumpia': 'spring rolls'}",9.0,,,,
"salah satu bubur ayam yang enak di bandung adalah bubur ayam hamid . yang saya suka adalah bubur ayam yang pakai ati ampela , sedangkan kalau istri lebih suka yang pakai telur mentah . bubur nya kental , bumbu nya terasa , dan porsi nya juga cukup banyak . selain di kafetaria merdeka , juga ada di jalan pajajaran , dekat travel andi s .",0,salah satu porridge chicken yang nice di bandung adalah porridge chicken hamid yang saya like adalah porridge chicken yang pakai ati ampela sedangkan kalau istri lebih like yang pakai telur mentah porridge his thick Spice his terasa dan portion his juga cukup banyak selain di kafetaria merdeka juga ada di road pajajaran dekat travel andi s,0.7477622032165527,0,[9.98e-01 9.00e-04 1.00e-03],0,[0.9971 0.0015 0.0014],"{'kental': 'thick', 'nya': 'his', 'bumbu': 'Spice', 'porsi': 'portion', 'bubur': 'porridge', 'ayam': 'chicken', 'travel': 'travel', 'enak': 'nice', 'suka': 'like', 'jalan': 'road'}",13.69,,,,
jumlah pemilih dalam negeri sebanyak 185.379.878 dan pemilih luar negeri sebanyak 1.281.597 .,1,jumlah picker dalam negeri sebanyak dan picker luar negeri sebanyak,0.5529681444168091,1,[0.0022 0.9833 0.0144],1,[0.0053 0.9891 0.0057],{'pemilih': 'picker'},8.21,,,,
"penolong saat lapar di waktu malam , tempat nongkrong yang asyik menikmati udara dingin kota bandung bersama teman dan keluarga",0,penolong saat lapar di waktu malam tempat nongkrong yang fun menikmati air cold kota Bandung bersama teman dan keluarga,0.9155303239822388,0,[0.9938 0.0043 0.002 ],0,[0.9945 0.0035 0.0019],"{'asyik': 'fun', 'dingin': 'cold', 'udara': 'air', 'bandung': 'Bandung'}",8.82,,,,
bu risma jauh lebih smart daripada anis . anis gubernur ter goblok sepanjang sejarah . pantas jadi menteri dipecat . memalukan,2,bu risma jauh lebih smart daripada anis anis gubernur ter stupid sepanjang sejarah pantas jadi minister dipecat embarrassing,0.8415508270263672,2,[0.0056 0.003  0.9913],2,[0.0122 0.0055 0.9824],"{'goblok': 'stupid', 'memalukan': 'embarrassing', 'menteri': 'minister', 'anis': 'anis'}",8.97,,,,
"lokasi nya dekat sekali dari pusat kota bandung , disekitaran dago , jembatan pasopati . ada beberapa kampus juga yang sangat dekat dengan lokasi abuba yang ada di jalan prabu dimuntur . untuk rasa sebenarnya biasa saja , tidak terlalu istimewa . harga nya juga terbilang mahal dibandingkan dengan steak sekelas di kota bandung lainnya . namun , kalau sedang promo , bisa murah banget . untuk 200 gr new zealand rib eye",0,location his dekat sekali dari pusat city Bandung around dago jembatan pasopati ada beberapa kampus juga yang sangat dekat dengan location abuba yang ada di jalan prabu dimuntur untuk rasa sebenarnya biasa saja tidak terlalu istimewa harga his juga terbilang mahal compared to dengan steak classmate di city Bandung lainnya namun kalau sedang promo bisa inexpensive very untuk 200 gr new zealand rib eye,0.8961312770843506,0,[0.9392 0.0096 0.0512],0,[0.9669 0.0095 0.0235],"{'promo': 'promo', 'steak': 'steak', 'murah': 'inexpensive', 'banget': 'very', 'nya': 'his', 'kota': 'city', 'dibandingkan': 'compared to', 'lokasi': 'location', 'bandung': 'Bandung', 'sekelas': 'classmate', 'disekitaran': 'around', 'abuba': 'abuba'}",16.42,,,,
"ikhlas menerima kesalahan , dan belajar dari setiap kesalahan , karena itu yang akan menjadikan mu kuat dalam menjalani kehidupan .",0,sincere accept error dan study dari setiap error karena itu yang akan menjadikan mu kuat dalam menjalani kehidupan,0.8375954627990723,0,[0.8613 0.0891 0.0496],0,[0.7505 0.1821 0.0674],"{'ikhlas': 'sincere', 'menerima': 'accept', 'kesalahan': 'error', 'belajar': 'study'}",8.99,,,,
makan malam di sini membuat saya ketagihan dan ingin kembali ke sini . pelayanan yang ramah dan setara dengan apa yang kita keluarkan . menu makanan variatif . tidak terlalu lama untuk menunggu sampai makanan dihidangkan . pemandangan yang indah di tengah kota bandung,0,makan malam di sini membuat saya ketagihan dan ingin kembali ke sini pelayanan yang ramah dan setara dengan apa yang kita keluarkan menu food variative tidak terlalu lama untuk menunggu sampai food served view yang beautiful di tengah city bandung,0.9470852613449097,0,[9.979e-01 8.000e-04 1.300e-03],0,[9.976e-01 9.000e-04 1.500e-03],"{'indah': 'beautiful', 'pemandangan': 'view', 'dihidangkan': 'served', 'variatif': 'variative', 'kota': 'city', 'makanan': 'food'}",10.98,,,,
ikutan bpjs tidak untung bagi saya karena tidak bisa dipakai di banyak rumah sakit,2,follow bpjs tidak untung bagi saya karena tidak bisa worn di banyak rumah sakit,0.9278534650802612,2,[0.0047 0.0149 0.9804],2,[0.0076 0.0255 0.9668],"{'ikutan': 'follow', 'dipakai': 'worn'}",8.66,,,,
"ke sini selalu dengan pesanan yang sama , jus stroberi susu , minuman signature dari sams dan mi yamin manis dengan ayam yang lembut . it lever fails .",0,ke sini selalu dengan pesanan yang sama juice stroberi susu minuman signature dari sams dan noodles sure sweet dengan ayam yang gentle it lever fails,0.9128865003585815,0,[0.7968 0.0064 0.1968],0,[0.9733 0.0042 0.0226],"{'manis': 'sweet', 'signature': 'signature', 'lembut': 'gentle', 'mi': 'noodles', 'yamin': 'sure', 'jus': 'juice'}",9.64,,,,
"pelayanan dan makan nya rekomendasi sekali , buat makan malam tempat nya romantis , karena di pribadi meja jadi makan nya lebih leluasa . pokokk nya buat pasangan yang mau merayakan anniv atau birthday cocok banget",0,service dan eat his recommendation sekali buat eat night tempat his romantis karena di pribadi meja jadi eat his lebih free pokokk his buat pasangan yang mau celebrate anniv atau birthday cocok banget,0.7947661280632019,0,[0.9976 0.001  0.0014],0,[0.9946 0.0021 0.0033],"{'nya': 'his', 'rekomendasi': 'recommendation', 'leluasa': 'free', 'makan': 'eat', 'malam': 'night', 'pelayanan': 'service', 'merayakan': 'celebrate'}",10.82,,,,
kok bisa kasih nomer kode seperti 885 4 28,1,kok bisa kasih nomer code seperti 885 4 28,0.9151341915130615,1,[0.0099 0.8651 0.125 ],1,[0.0132 0.8303 0.1565],"{'kode': 'code', '885': '885'}",8.22,,,,
"sesuai dengan nama nya , di rumah nenek ini kita bisa menikmati makanan dengan suasana rumahan yang sangat nyaman . saat itu saya bersama keluarga besar memilih duduk di meja panjang besar yang berada di ruang tengah dan sebagian duduk di sofa panjang yang ada di belakang nya . di sekeliling ruangan terdapat berbagai dekorasi , pajangan , dan perabotan antik .",0,sesuai dengan nama nya di rumah nenek ini kita bisa enjoy food dengan atmosphere home yang sangat comfortable saat itu saya bersama family besar choose sit di meja panjang besar yang berada di ruang tengah dan sebagian sit di sofa panjang yang ada di belakang nya di around ruangan terdapat berbagai dekorasi pajangan dan perabotan antik,0.9317917823791504,0,[0.995  0.0033 0.0017],0,[0.995  0.0032 0.0018],"{'nyaman': 'comfortable', 'rumahan': 'home', 'suasana': 'atmosphere', 'menikmati': 'enjoy', 'makanan': 'food', 'keluarga': 'family', 'memilih': 'choose', 'duduk': 'sit', 'sekeliling': 'around'}",11.32,,,,
"sesuai nama nya , zenbu house of mozaru menyajikan mozaru yang lezat . dengan pilihan berbagai macam daging , mulai dari ayam , sapi , jamur , hingga seafood . pilihan nasi nya pun ada 3 , favorit saya adalah butter rice . plus sauce dynamite sauce nya pun tersedia dalam 3 pilihan . keju nya mantap banget , yummy , dan mengenyangkan .",0,sesuai nama his zenbu house of mozaru menyajikan mozaru yang delicious dengan choice berbagai macam daging mulai dari chicken cow mold hingga seafood choice nasi his pun ada 3 favorite saya adalah butter rice plus sauce dynamite sauce his pun available dalam 3 choice cheese his steady very yummy dan filling,0.7313481569290161,0,[0.9975 0.001  0.0015],0,[0.997  0.0012 0.0018],"{'mantap': 'steady', 'nya': 'his', 'keju': 'cheese', 'yummy': 'yummy', 'mengenyangkan': 'filling', 'banget': 'very', 'ayam': 'chicken', 'lezat': 'delicious', 'pilihan': 'choice', 'favorit': 'favorite', 'jamur': 'mold', '3': '3', 'tersedia': 'available', 'sapi': 'cow'}",14.32,,,,
keren banget lo bisa punya otak secerdas itu,0,keren very lo bisa punya otak secerdas itu,0.9680982828140259,0,[0.9197 0.0284 0.0519],0,[0.7446 0.1077 0.1477],"{'banget': 'very', 'lo': 'lo'}",8.33,,,,
"ini bagus getaway dari kesibukan sehari hari . udara nya sejuk , ada taman bunga , air terjun , sungai kecil , danau buatan . kalau lapar , ada pilihan restoran fine dining , saung tepi danau atau foodcourt . tempat nya kece dah untuk foto-foto .",0,ini good getaway dari kesibukan sehari hari air his cool ada Park bunga air terjun sungai kecil Lake buatan kalau lapar ada choice restaurant fine dining saung tepi Lake atau foodcourt tempat his kece dah untuk,0.7943894863128662,0,[0.9979 0.001  0.0011],0,[0.9964 0.0019 0.0017],"{'danau': 'Lake', 'pilihan': 'choice', 'udara': 'air', 'taman': 'Park', 'nya': 'his', 'sejuk': 'cool', 'bagus': 'good', 'restoran': 'restaurant'}",11.19,,,,
"solaria di mana standarlah tetapi baru kali ini saya mengalami kejadian aneh , ketika memesan gordon bleu ayam nya gosong ketika dikomplain gosong kata pelayan nya di luar nya saja yang begitu pak di dalam nya enggak karena kesal saya bilang ini makanan kamu harus ganti dan saya tidak mau yang gosong begini saya disini bayar bukan gratisan akhirnya baru diganti . sudah seharusnya pelanggan dilayani dengan . lanjutan",2,solaria di mana standarlah tetapi baru kali ini saya mengalami kejadian aneh ketika memesan gordon bleu chicken his burnt ketika complained burnt kata waiter his di luar his saja yang begitu pak di dalam his enggak karena kesal saya say ini makanan kamu harus change dan saya tidak mau yang burnt begini saya disini pay bukan gratisan akhirnya baru diganti sudah seharusnya pelanggan dilayani dengan advanced,0.8144022226333618,2,[0.0093 0.0018 0.989 ],2,[0.0082 0.0023 0.9895],"{'ayam': 'chicken', 'dikomplain': 'complained', 'bilang': 'say', 'nya': 'his', 'pelayan': 'waiter', 'bayar': 'pay', 'ganti': 'change', 'lanjutan': 'advanced', 'gosong': 'burnt'}",12.28,,,,
soun claypot nya enak . udang nya besar-besar . salad ubar-ubar nya juga enak . suki nya banyak macam nya . saus nya enak . sayang harga nya mahal sekali . makan per-8 habis kurang lebih 2 juta rupiah . jadi berpikir dua kali kalau mau ke sini lagi .,2,soun claypot nya enak . udang nya besar-besar . salad ubar-ubar nya juga enak . suki nya banyak macam nya . saus nya enak . sayang harga nya mahal sekali . makan per-8 habis kurang lebih 2 juta rupiah . jadi berpikir dua kali kalau mau ke sini lagi .,1.0,0,[0.9512 0.0048 0.044 ],0,[0.9512 0.0048 0.044 ],,0.03,,,,
asik,0,asik,1.0,2,[0.0747 0.0162 0.9091],2,[0.0747 0.0162 0.9091],,0.02,,,,
"teknik-teknik pencitraan ini , kalau memang bermanfaat untuk rakyat kenapa masih diimpor , kalau hanya ingin meraih simpatisan menjual nama rakyat , sebaiknya tobat dulu pak , jangan asal bunyi .",2,imaging ini kalau memang beneficial untuk rakyat kenapa masih diimpor kalau hanya ingin meraih simpatisan sell nama rakyat sebaiknya repent dulu pak jangan asal bunyi,0.905750036239624,2,[0.0036 0.0029 0.9935],2,[0.0624 0.0234 0.9142],"{'tobat': 'repent', 'menjual': 'sell', 'bermanfaat': 'beneficial', 'pencitraan': 'imaging'}",9.18,,,,
"ini adalah restoran yang sangat saya sarankan apabila anda sempat berwisata ke kota bandung . karena selain kualitas rasa dan pelayanan yang excellent , anda juga akan disuguhi pemandangan yang luar biasa cantik dari dua lembah hijau yang mengapit restoran ini . cobalah ke sana kapan-kapan . what a sangat bagus escape !",0,ini adalah restoran yang sangat saya recommend apabila anda sempat travel ke kota Bandung karena selain kualitas rasa dan pelayanan yang excellent anda juga akan treated view yang luar biasa cantik dari dua lembah hijau yang mengapit restoran ini cobalah ke sana what a sangat good escape,0.9650181531906128,0,[0.9972 0.0011 0.0017],0,[0.9975 0.001  0.0015],"{'disuguhi': 'treated', 'bagus': 'good', 'escape': 'escape', 'pemandangan': 'view', 'bandung': 'Bandung', 'sarankan': 'recommend', 'excellent': 'excellent', 'berwisata': 'travel'}",11.01,,,,
nanti turun di sini transit naik ini . ini mah bapak nya ngedumel sendiri kayak benar saja . kecewa banget saya . maaf kalau salah lapak . karena media sosial transjogja tidak ada,2,nanti turun di sini transit naik ini ini mah bapak his ngedumel sendiri kayak benar saja disappointed banget saya maaf kalau wrong lapak karena media sosial transjogja tidak ada,0.9444751143455505,2,[0.0032 0.0021 0.9948],2,[0.0045 0.0023 0.9932],"{'kecewa': 'disappointed', 'salah': 'wrong', 'nya': 'his', 'transit': 'transit', 'mah': 'mah'}",9.71,,,,
untuk apa pemerintah mengurus orang papua lagi . orang-orang nya saja sudah ketinggalan zaman begitu .,2,untuk apa government mengurus orang papua lagi nya saja sudah left behind zaman begitu,0.8982776403427124,2,[0.0023 0.0024 0.9953],2,[0.0026 0.0038 0.9935],"{'ketinggalan': 'left behind', 'pemerintah': 'government'}",8.53,,,,
"sangat berterima kasih kepada hospitality semua teman di 18th restaurant trans luxury hotel . momen wedding anniversay saya bersama istri jadi benar-benar sempurna . makanan enak , harga sangat terjangkau untuk kelas restoran seperti ini , pelayanan yang sangat baik . sekali lagi terima kasih .",0,sangat berterima kasih kepada hospitality semua teman di 18th restaurant trans luxury hotel momen wedding anniversay saya bersama wife jadi sempurna food nice price sangat affordable untuk class restoran seperti ini service yang sangat baik sekali lagi accept kasih,0.9080530405044556,0,[0.994  0.0025 0.0035],0,[0.9939 0.0021 0.004 ],"{'pelayanan': 'service', 'terjangkau': 'affordable', 'luxury': 'luxury', 'makanan': 'food', 'harga': 'price', 'enak': 'nice', 'terima': 'accept', 'istri': 'wife', 'kelas': 'class'}",10.97,,,,
ini adalah video yang dibuat oleh ahokers . sengaja dibuat untuk memecahkan nkri .,2,ini adalah video yang dibuat oleh ahokers . sengaja dibuat untuk memecahkan nkri .,1.0,1,[0.0107 0.9174 0.0719],1,[0.0107 0.9174 0.0719],,0.07,,,,
dari kemarin seperti begitu marah sama indosat,2,dari kemarin seperti begitu angry sama indosat,0.8654708862304688,2,[0.0025 0.0027 0.9948],2,[0.0047 0.0034 0.9918],{'marah': 'angry'},8.38,,,,
"kurang klik bateray nya juragan , saya minta ganti",2,"kurang klik bateray nya juragan , saya minta ganti",1.0,1,[0.0097 0.6553 0.335 ],1,[0.0097 0.6553 0.335 ],,0.02,,,,
"steak di sini enak dan harga pun tidak terlalu mahal . tempat yang baru di jalan cimanuk cukup besar . walau ramai pengunjung , pelayanan nya cukup cepat . memanggil pelayanan nya juga mudah .",0,steak di sini enak dan harga pun tidak terlalu expensive tempat yang baru di jalan cimanuk cukup besar walau ramai visitors service nya cukup fast call service nya juga easy,0.9024803042411804,0,[9.979e-01 8.000e-04 1.400e-03],0,[0.9975 0.001  0.0016],"{'mahal': 'expensive', 'mudah': 'easy', 'pengunjung': 'visitors', 'cepat': 'fast', 'memanggil': 'call', 'pelayanan': 'service'}",10.17,,,,
"kalau fpi boikot semua medsos maka dunia medsos akan menemukan kedamaian nya kembali , jadi mari kita dukung mereka .",0,"kalau fpi boikot semua medsos maka dunia medsos akan menemukan kedamaian nya kembali , jadi mari kita dukung mereka .",1.0,1,[0.3687 0.3762 0.2551],1,[0.3687 0.3762 0.2551],,0.02,,,,
iya pak untuj transfer data ke komputer,1,iya pak for transfer data ke computer,0.8452437520027161,1,[0.0048 0.9846 0.0106],1,[0.0036 0.99   0.0064],"{'untuj': 'for', 'komputer': 'computer'}",8.54,,,,
sudah 4 kali saya rental .,1,sudah 4 time saya rental,0.7354570627212524,1,[0.008 0.972 0.02 ],1,[0.0155 0.9407 0.0438],{'kali': 'time'},8.94,,,,
nyaman sekali tempat nya . romantis hahah . enjoy banget . makanan nya enak-enak . apalagi mbak nya baik banget . terima kasih ya mbak della .,0,nyaman sekali tempat his romantis hahaha enjoy banget food his apalagi miss his baik banget terima kasih ya miss della,0.6882631182670593,0,[0.997 0.001 0.002],0,[0.9933 0.0019 0.0048],"{'makanan': 'food', 'mbak': 'miss', 'nya': 'his', 'hahah': 'hahaha', 'enjoy': 'enjoy'}",10.17,,,,
"restoran sunda tradisional yang menyediakan beberapa variasi nasi dan lauk menu yang saya pilih adalah nasi liwet , yang dimasak di atas tungku bara api . mereka juga menyediakan nasi putih biasa dan nasi merah . lauk yang saya coba : cumi hitam , dan cumi asin . favorit saya cumi hitam nya . tidak ketinggalan paru goreng , usus goreng , dan babat goreng nya . paru nya tebal dan enak !",0,restoran sunda tradisional yang menyediakan beberapa variasi rice dan side dish menu yang saya pilih adalah rice liwet yang dimasak di atas tungku bara api mereka juga menyediakan rice putih biasa dan rice merah side dish yang saya coba squid black dan squid salty favorite saya squid black his tidak left behind lungs fry usus fry dan tripe fry his lungs his thick dan nice,0.6755731701850891,0,[9.979e-01 9.000e-04 1.200e-03],0,[0.9957 0.0022 0.0022],"{'enak': 'nice', 'ketinggalan': 'left behind', 'tebal': 'thick', 'nya': 'his', 'favorit': 'favorite', 'paru': 'lungs', 'goreng': 'fry', 'lauk': 'side dish', 'babat': 'tripe', 'cumi': 'squid', 'asin': 'salty', 'hitam': 'black', 'nasi': 'rice'}",14.63,,,,
makan malam di sini akan disuguhi suasana malam pedesaan dengan saung-saung dan cahaya obor diiringi suara gemericik air sungai dan air terjun . cukup menentramkan hati dan terbayar sudah perjalanan yang cukup panjang dari pusat kota bandung . menu makanan dan minuman cukup bervariasi dengan waktu tunggu yang lumayan lama .,0,makan night di sini akan disuguhi atmosphere night pedesaan dengan dan cahaya obor diiringi suara gemericik water sungai dan water terjun cukup menentramkan hati dan paid off sudah journey yang cukup panjang dari center city bandung menu food dan drink cukup varied dengan waktu tunggu yang lumayan lama,0.8820518255233765,0,[0.9976 0.001  0.0014],0,[0.9961 0.0018 0.0021],"{'makanan': 'food', 'minuman': 'drink', 'pusat': 'center', 'kota': 'city', 'menu': 'menu', 'air': 'water', 'bervariasi': 'varied', 'suasana': 'atmosphere', 'malam': 'night', 'terbayar': 'paid off', 'perjalanan': 'journey'}",13.86,,,,
"tempat nya agak tersembunyi dari jalan besar tapi begitu masuk ke resto ini suasana sangat nyaman . konsep nya garmen resto karena ditengah-ditengah nya terhampar lapangan rumput dengan pohon beringin besar yang membuat betah bersama-bersama di sana . makanan nya kebanyakan makanan barat dan indonesian food , tapi rasanya enak banget deh . harga nya juga tidak mahal . tempat oke , suasana oke , rasa makanan oke , semuanya oke . top deh .",0,tempat his agak hidden dari road besar tapi begitu enter ke resto ini atmosphere sangat comfortable konsep his garmen resto karena his terhampar field rumput dengan pohon beringin besar yang membuat feel at home di sana food his most food barat dan indonesian food tapi rasanya enak very deh harga his juga tidak expensive tempat okay atmosphere okay rasa food okay semuanya okay top deh,0.8165112137794495,0,[9.978e-01 8.000e-04 1.400e-03],0,[0.9964 0.0011 0.0025],"{'mahal': 'expensive', 'makanan': 'food', 'nyaman': 'comfortable', 'masuk': 'enter', 'suasana': 'atmosphere', 'tersembunyi': 'hidden', 'banget': 'very', 'jalan': 'road', 'kebanyakan': 'most', 'betah': 'feel at home', 'nya': 'his', 'oke': 'okay', 'lapangan': 'field'}",14.08,,,,
tempat yang nyaman untuk nongkrong bersama teman atau keluarga . tidak ada tempat untuk nge - cas telepon genggam atau laptop . jadi kafe ini khusus buat ngobrol bukan kerja .,0,tempat yang comfortable untuk hang out bersama friend atau family tidak ada tempat untuk nge case telepon genggam atau laptop jadi kafe ini khusus buat ngobrol bukan kerja,0.9508770704269409,0,[0.8643 0.0124 0.1233],0,[0.9042 0.0196 0.0762],"{'nyaman': 'comfortable', 'teman': 'friend', 'keluarga': 'family', 'nongkrong': 'hang out', 'cas': 'case'}",9.81,,,,
"penerbangan saya dipindahkan oleh pihak garuda tanpa pemberitahuan , sangat mengecewakan",2,penerbangan saya dipindahkan oleh pihak garuda tanpa announcement sangat disappointing,0.7619367837905884,2,[0.0025 0.0017 0.9957],2,[0.0039 0.0019 0.9942],"{'mengecewakan': 'disappointing', 'pemberitahuan': 'announcement'}",8.86,,,,
ingin marah marah ketika ditanya soal film ini h jelek sekali,2,ingin marah marah ketika ditanya soal film ini h bad sekali,0.9446033239364624,2,[0.0047 0.0022 0.9931],2,[0.0049 0.003  0.9921],"{'jelek': 'bad', 'h': 'h'}",8.73,,,,
dosen ini yakin profesor ? profesional pesong kali . mengajar nya tidak benar,2,dosen ini yakin profesor profesional sling kali mengajar his tidak benar,0.7734848856925964,2,[0.0024 0.0021 0.9955],2,[0.0015 0.0069 0.9916],"{'nya': 'his', 'pesong': 'sling'}",8.57,,,,
awal nya sih saya merasa aneh . enak gitu puyuh ? secara kan masih jarang juga resro yang sediakan makanan dengan daging puyuh jadi masih awam . setelah saya memberanikan makan karena bingung mau makan apa lagi setelah cape jalan-jalan di fo yang terdekat ya resto ini karena bersebelahan dengan fo herritage . lumayan cukup lama anggu buat datang makanan nya dan ternyata tidak enak pula . menyesal .,2,awal his the hell saya merasa strange enak like that puyuh secara kan masih jarang juga resro yang provide food dengan meat puyuh jadi masih awam setelah saya dare eat karena bingung mau eat apa lagi setelah cape di fo yang terdekat ya resto ini karena bersebelahan dengan fo herritage lumayan cukup lama anggu buat datang food his dan ternyata tidak enak pula regret,0.9064640998840332,2,[0.0089 0.0014 0.9897],2,[0.1257 0.0038 0.8705],"{'aneh': 'strange', 'menyesal': 'regret', 'gitu': 'like that', 'makanan': 'food', 'sediakan': 'provide', 'makan': 'eat', 'nya': 'his', 'daging': 'meat', 'sih': 'the hell', 'memberanikan': 'dare'}",12.54,,,,
"pelayan nya perlu di training lagi , dalam greeting melihat tamu membawa kendaraan apa ? makanan enak , harga cocok , toilet bersih",0,pelayan nya perlu di training lagi dalam greeting melihat tamu membawa kendaraan apa makanan nice price suitable toilet clean,0.8270449638366699,0,[0.983  0.0065 0.0105],0,[0.9215 0.0157 0.0628],"{'cocok': 'suitable', 'bersih': 'clean', 'harga': 'price', 'enak': 'nice', 'toilet': 'toilet'}",9.32,,,,
"resto sunda yang selalu ramai , baik pada hari kerja apalagi akhir pekan . tempat nya nyaman , apalagi kalau bawa anak-anak . mereka pasti suka banget makan sambil melihat ikan koi seliweran . makanan nya pas banget di lidah . favorit saya terong krispi . garing dan renyah .",0,resto sunda yang selalu crowded baik pada hari kerja apalagi akhir week tempat his nyaman apalagi kalau bring mereka pasti like very eat sambil melihat fish koi millipede makanan his pas very di lidah favorit saya terong krispi garing dan renyah,0.8297853469848633,0,[9.98e-01 8.00e-04 1.30e-03],0,[9.974e-01 9.000e-04 1.800e-03],"{'pekan': 'week', 'suka': 'like', 'ramai': 'crowded', 'ikan': 'fish', 'banget': 'very', 'bawa': 'bring', 'makan': 'eat', 'nya': 'his', 'seliweran': 'millipede'}",10.73,,,,
"iya aku juga heran sekali kok ada yang tugas di sana , apa enak nya sih . makanan nya saja mahal tapi dikit dan pedas mampus :",2,iya aku juga amazed sekali kok ada yang Duty di sana apa enak his sih makanan his saja mahal tapi dikit dan pedas mampus,0.9087049961090088,2,[0.0114 0.0013 0.9873],2,[0.0178 0.0015 0.9806],"{'tugas': 'Duty', 'heran': 'amazed', 'nya': 'his'}",9.25,,,,
pemandangan serta spot buat foto-foto sih bagus tapi makan nya tidak banget . mau makan ala untuk bisa makan harus bayar 120 ribu per orang minimal 4 orang . buat yang tidak berempat dilarang makan di situ . makan di foodcourt harga nya sekitar 20 ribu tapi rasanya tawar banget . tiket masuk dusun bambu 20 ribu per orang belum bayar parkir kendaraan . mahal . tidak asik .,2,pemandangan serta spot buat sih good tapi eat nya tidak very mau eat ala untuk bisa eat harus pay 120 ribu per person minimal 4 person buat yang tidak berempat dilarang eat di there eat di food court harga nya sekitar 20 ribu tapi rasanya tawar very ticket masuk village bamboo 20 ribu per person belum pay parking vehicle expensive tidak asik,0.7604844570159912,2,[0.0461 0.002  0.9519],2,[0.0757 0.0029 0.9214],"{'mahal': 'expensive', 'banget': 'very', 'bayar': 'pay', 'parkir': 'parking', 'kendaraan': 'vehicle', 'situ': 'there', 'foodcourt': 'food court', 'bagus': 'good', 'makan': 'eat', 'spot': 'spot', 'tiket': 'ticket', 'orang': 'person', 'dusun': 'village', 'ala': 'ala', 'bambu': 'bamboo'}",14.24,,,,
"ini jadi salah satu tempat favorit buat nongkrong karena murah , masa spaghetti saja ada yang 9 ribu haha dan tempat nya nyaman lagi",0,ini jadi salah satu tempat favorite buat nongkrong karena inexpensive masa spaghetti saja ada yang 9 ribu haha dan tempat his comfortable lagi,0.9430934190750122,0,[0.9972 0.0011 0.0018],0,[0.9961 0.0014 0.0024],"{'nyaman': 'comfortable', 'nya': 'his', 'favorit': 'favorite', 'murah': 'inexpensive'}",9.03,,,,
foto lawas gus dur kepergok megawati usai salam tempel viral di media sosial,1,foto lawas gus dur kepergok megawati usai regards tempel viral di media social,0.8118710517883301,1,[0.0026 0.9939 0.0035],1,[0.0023 0.994  0.0037],"{'sosial': 'social', 'megawati': 'megawati', 'salam': 'regards', 'dur': 'dur'}",9.48,,,,
