text,sentiment,perturbed_text,perturbed_semantic_sim,pred_label,pred_proba,perturbed_label,perturbed_proba,translated_word(s),running_time(s),before_attack_acc,after_attack_acc,avg_semantic_sim,avg_running_time(s)
"meski masa kampanye sudah selesai , bukan berati habis pula upaya mengerek tingkat kedipilihan elektabilitas .",1,"meski masa kampanye sudah selesai , bukan berati habis pula upaya mengerek tingkat kedipilihan elektabilitas .",1.0,2,[0.0343 0.3033 0.6625],2,[0.0343 0.3033 0.6625],,0.02,0.9301587301587302,0.8968253968253969,0.8619530075126224,10.234992063492065
tidak enak,2,tidak nice,0.5409587621688843,2,[0.0071 0.0017 0.9912],2,[0.0157 0.0026 0.9818],{'enak': 'nice'},3.82,,,,
"restoran ini menawarkan makanan sunda . kami memesan ayam goreng , kangkung , sayur asam , ikan gurame goreng , ikan bakar , nasi goreng , karedok , tahu tempe , nasi putih , nasi merah etc minuman yang mereka tawarkan juga cukup variatif . rasa makanan enak dan harga murah . kami 9 dewasa dan 5 anak kecil , hanya menghabiskan 800,000",0,restaurant ini menawarkan food sunda kami order ayam fry kangkung sayur asam fish gurame fry fish bakar rice fry karedok tahu tempeh rice putih rice Red etc drink yang mereka tawarkan juga cukup variative rasa food nice dan price inexpensive kami 9 dewasa dan 5 anak kecil hanya menghabiskan,0.6539433002471924,0,[0.982  0.0041 0.0138],0,[0.9909 0.004  0.0051],"{'variatif': 'variative', 'harga': 'price', 'enak': 'nice', 'makanan': 'food', 'merah': 'Red', 'murah': 'inexpensive', 'etc': 'etc', 'minuman': 'drink', 'goreng': 'fry', 'tempe': 'tempeh', 'nasi': 'rice', 'restoran': 'restaurant', 'ikan': 'fish', 'memesan': 'order'}",8.74,,,,
"lokasi di alun alun masakan padang ini cukup terkenal dengan kepala ikan kakap gule , biasa saya pesan nasi bungkus padang berisikan rendang , ayam pop dan perkedel . porsi banyak dan mengenyangkan",0,lokasi di alun alun masakan padang ini cukup terkenal dengan kepala ikan kakap gule biasa saya message rice wrap padang berisikan rendang chicken pop dan cakes portion banyak dan filling,0.8617212772369385,0,[0.9979 0.001  0.0011],0,[0.9972 0.0014 0.0014],"{'mengenyangkan': 'filling', 'perkedel': 'cakes', 'porsi': 'portion', 'pesan': 'message', 'rendang': 'rendang', 'ayam': 'chicken', 'bungkus': 'wrap', 'nasi': 'rice'}",7.32,,,,
"betapa bejad kader gerindra yang anggota dprd mencabuli anak smp , rakyat harus cerdas partai mana yang harus di tengelamkan di 2019",2,how bejad kader gerindra yang anggota dprd molested child smp rakyat harus intelligent partai mana yang harus di drown di 2019,0.8252458572387695,2,[0.0044 0.0131 0.9825],1,[0.0063 0.6165 0.3772],"{'tengelamkan': 'drown', 'mencabuli': 'molested', 'cerdas': 'intelligent', 'betapa': 'how', 'anak': 'child'}",5.96,,,,
"kampiun bistro berada di jalan . kebon kawung , sebelah kanan seberang stasiun kota bandung . harga makanan dan minuman nya sangat terjangkau . ada live musik juga . dan kalau beruntung , anda akan bertemu dengan yuke dewa19 di tempat ini .",0,kampiun bistro berada di jalan kebon kawung sebelah kanan seberang stasiun kota Bandung price food dan drink his sangat affordable ada live musik juga dan kalau lucky anda akan bertemu dengan yuke dewa19 di tempat ini,0.904231071472168,0,[0.9958 0.0024 0.0018],0,[0.9948 0.0033 0.0019],"{'minuman': 'drink', 'nya': 'his', 'makanan': 'food', 'harga': 'price', 'terjangkau': 'affordable', 'beruntung': 'lucky', 'bandung': 'Bandung', 'live': 'live'}",8.41,,,,
kamar nya sempit tidak ada tempat menyimpan barang malah menambah barang . by the way ini kipas2 mau diletakkan mana . mana uchiwa segede ini pula .,2,kamar nya sempit tidak ada tempat menyimpan goods malah menambah goods by the way ini kipas2 mau diletakkan mana mana uchiwa as big as ini pula,0.9247398376464844,2,[0.0076 0.0022 0.9902],2,[0.3405 0.0125 0.647 ],"{'barang': 'goods', 'segede': 'as big as', 'uchiwa': 'uchiwa', 'way': 'way', 'kipas2': 'kipas2'}",6.51,,,,
"saya tadi mampir ke restauran ini , mungkin letak nya strategis , pertama masuk dikasih senyuman manis sama mbak yang ramah , di situ pun saya memesan chiken grill , es thai tea dan super duper ice cream . enak . saya suka .",0,saya tadi mampir ke restauran ini mungkin letak nya strategis pertama masuk dikasih senyuman manis sama miss yang ramah di situ pun saya memesan chicken grill ice Thai tea dan super duper ice cream nice saya suka,0.9585530161857605,0,[0.9969 0.0011 0.0019],0,[9.977e-01 8.000e-04 1.500e-03],"{'super': 'super', 'enak': 'nice', 'ice': 'ice', 'es': 'ice', 'cream': 'cream', 'chiken': 'chicken', 'duper': 'duper', 'thai': 'Thai', 'mbak': 'miss'}",6.94,,,,
jangan percaya dengan agama buddha . agama itu saja tidak punya tuhan . agama sesat itu .,2,jangan percaya dengan religion buddha religion itu saja tidak punya tuhan religion sesat itu,0.8343959450721741,2,[0.0019 0.0021 0.996 ],2,[0.0027 0.002  0.9953],{'agama': 'religion'},4.67,,,,
kafe ini menawarkan sesuatu hal yang sebelumnya saya tak suka tapi akhirnya saya bisa rekomendasi karena enak rasanya yaitu terong goreng ! di sini saya baru bisa menikmati terong yang diolah sehingga terasa lezat :,0,kafe ini menawarkan sesuatu hal yang sebelumnya saya tak suka tapi akhirnya saya bisa rekomendasi karena enak rasanya yaitu eggplant goreng di sini saya baru bisa enjoy eggplant yang processed sehingga terasa delicious,0.8658557534217834,0,[0.9931 0.0023 0.0045],0,[0.9939 0.0022 0.0039],"{'lezat': 'delicious', 'diolah': 'processed', 'terong': 'eggplant', 'menikmati': 'enjoy'}",6.02,,,,
yusri seorang ibu yang tidak tahu diri . sudah tidak punya uang mebel lagi . melihat muka ibu dikaca . sudah dibantu tidak terima kasih . dasar maling .,2,yusri seorang ibu yang tidak tahu diri sudah tidak punya money furniture lagi melihat muka ibu mirrored sudah dibantu tidak terima kasih dasar thief,0.8988136053085327,2,[0.003  0.0016 0.9955],2,[0.0042 0.0021 0.9937],"{'maling': 'thief', 'uang': 'money', 'mebel': 'furniture', 'dikaca': 'mirrored'}",6.02,,,,
menemukan bocah-bocah sampai yang komentar di yutub pakai kata-kata kotor begitu . yang mengajarkan siapa dah ? sedih :,2,menemukan sampai yang komentar di yutub pakai dirty begitu yang teach siapa dah sad,0.7520307898521423,2,[0.0022 0.0026 0.9952],2,[0.0021 0.0033 0.9946],"{'kotor': 'dirty', 'sedih': 'sad', 'mengajarkan': 'teach'}",4.67,,,,
indomaret adalah penjahat anyar dalam dunia perdagangan,2,indomaret adalah penjahat anyar dalam world perdagangan,0.8735125064849854,2,[0.0028 0.1029 0.8943],2,[0.0027 0.0955 0.9018],{'dunia': 'world'},3.88,,,,
"malah .. !!! tren si tukang fitnah bicara iman , dasar akun sapi yang takut kehilangan kursi cawapres prabowo makanya busukkan nama ahy dan say",2,malah tren si Craftsman slander bicara faith base akun sapi yang takut lost chair cawapres prabowo makanya rot nama ahy dan say,0.6755895018577576,2,[0.0072 0.0105 0.9823],2,[0.004  0.1076 0.8883],"{'dasar': 'base', 'busukkan': 'rot', 'fitnah': 'slander', 'kursi': 'chair', 'kehilangan': 'lost', 'tukang': 'Craftsman', 'iman': 'faith'}",7.2,,,,
"tahun 2018 , bri ingin akuisisi 2 bank cilik",1,tahun 2018 bri ingin acquisition 2 bank little,0.8065964579582214,1,[0.0022 0.994  0.0039],1,[0.0026 0.9933 0.0041],"{'cilik': 'little', 'akuisisi': 'acquisition'}",4.62,,,,
pilihan bakso nya sangat beragam dan kelebihan nya adalah kita bebas memilih jenis dan jumlah bakso yang kita inginkan,0,pilihan meatball nya sangat beragam dan kelebihan nya adalah kita free choose type dan jumlah meatball yang kita inginkan,0.7347103953361511,0,[0.9911 0.0061 0.0028],0,[0.9878 0.01   0.0022],"{'bakso': 'meatball', 'bebas': 'free', 'memilih': 'choose', 'jenis': 'type'}",5.48,,,,
"dulu mau modalin , sediakan tempat , dan carikan pembeli . kok sekarang sindir warga zaman now bergantung pada pemerintah . tidak jelas banget .",2,dulu mau modalin sediakan tempat dan carikan pembeli kok sekarang quip warga zaman now depend pada pemerintah tidak jelas very,0.918543815612793,2,[0.004  0.004  0.9919],2,[0.0061 0.0347 0.9592],"{'sindir': 'quip', 'bergantung': 'depend', 'banget': 'very', 'now': 'now'}",5.17,,,,
"tempa nya sangat memanjakan pengunjung . dengan suasana pedesaan , banyak nya pohon-pohon menambang kesejukan di tempat ini . tapi , pengunjung memang harus siap dengan harga makanan dan minuman yang diperjualbelikan di sini",0,tempa his sangat pamper visitors dengan atmosphere rural banyak his menambang kesejukan di tempat ini tapi visitors memang harus siap dengan harga makanan dan minuman yang diperjualbelikan di sini,0.809990644454956,0,[0.9854 0.0034 0.0111],0,[0.9894 0.0031 0.0075],"{'memanjakan': 'pamper', 'pedesaan': 'rural', 'nya': 'his', 'suasana': 'atmosphere', 'pengunjung': 'visitors'}",5.73,,,,
"musnahkan lgbt , gay , homo , dan lesbian dari muka bumi ini . ancaman terbesar untuk umat manusia dibumi . jika dibiarkan manusia akan punah .",2,destroy lgbt gay homo dan lesbian dari muka bumi ini ancaman terbesar untuk people manusia dibumi jika left manusia akan punah,0.9390363693237305,2,[0.0024 0.0031 0.9945],2,[0.0022 0.0058 0.9919],"{'lgbt': 'lgbt', 'musnahkan': 'destroy', 'gay': 'gay', 'lesbian': 'lesbian', 'dibiarkan': 'left', 'umat': 'people'}",5.48,,,,
"banyak pilihan menu khas bakso , bakso rawit dan bakso granat yang pedas , dan sop iga nya mantap , dengan banyak pilihan minuman , yang saya suka adalah rainbow jely",0,banyak pilihan menu khas meatball meatball rawit dan meatball granat yang pedas dan sop ribs his steady dengan banyak pilihan drink yang saya like adalah rainbow jely,0.6991105675697327,0,[9.978e-01 9.000e-04 1.300e-03],0,[0.9964 0.002  0.0015],"{'nya': 'his', 'mantap': 'steady', 'minuman': 'drink', 'suka': 'like', 'bakso': 'meatball', 'iga': 'ribs', 'menu': 'menu'}",6.6,,,,
"piring kaleng , gelas kaleng , makanan rumahan , es cincau , dan yang terpenting , cumi masak hitam yang tak terkalahkan oleh rumah makan di mana pun . makan ala prasmanan dengan pilihan nasi merah yang cocok bagi pelaku diet , barisan lauk pauk yang bisa kita pilih semau nya , pilihan sambal dan lalapan yang bisa diambil sebanyak kita mau , dan harga yang sangat ramah kantong .",0,piring kaleng gelas kaleng makanan rumahan es cincau dan yang terpenting cumi masak black yang tak defeated oleh rumah eat di mana pun eat ala buffet dengan choice rice merah yang suitable bagi pelaku diet barisan side dish pauk yang bisa kita pilih semau nya choice sambal dan fresh vegetables yang bisa diambil sebanyak kita mau dan price yang sangat friendly pocket,0.8963086605072021,0,[9.976e-01 9.000e-04 1.400e-03],0,[0.9959 0.0021 0.0019],"{'ramah': 'friendly', 'terkalahkan': 'defeated', 'harga': 'price', 'makan': 'eat', 'prasmanan': 'buffet', 'ala': 'ala', 'lalapan': 'fresh vegetables', 'nasi': 'rice', 'kantong': 'pocket', 'pauk': 'pauk', 'lauk': 'side dish', 'pilihan': 'choice', 'cocok': 'suitable', 'hitam': 'black'}",12.17,,,,
"pertama datang ke sini karena rekomendasi dari medsos . tertarik melihat minuman dengan aromanis diatas nya dan kue cantik lainnya . tempat nya di lantai 3 mayfair building . jangan sampai kelewat ya , karena pertama ke sana cukup kesulitan . begitu masuk ke tempat nya kata yang terlintas adalah manis . mulai dari dekorasi dan konsep yang diterapkan sampai menu makanan nya .",0,pertama datang ke sini karena rekomendasi dari medsos tertarik melihat minuman dengan aromanis diatas his dan cake beautiful lainnya tempat his di lantai 3 mayfair building jangan sampai too ya karena pertama ke sana cukup kesulitan begitu enter ke tempat his kata yang crossed adalah sweet mulai dari decor dan draft yang applied sampai menu makanan his,0.847794771194458,0,[0.9972 0.0011 0.0017],0,[0.9901 0.0033 0.0065],"{'manis': 'sweet', 'kelewat': 'too', 'terlintas': 'crossed', 'nya': 'his', 'kue': 'cake', 'cantik': 'beautiful', 'diterapkan': 'applied', 'dekorasi': 'decor', 'konsep': 'draft', 'masuk': 'enter'}",7.63,,,,
senang nya pakai kartu,0,senang his pakai kartu,0.5770789384841919,0,[0.9631 0.0163 0.0206],0,[0.8435 0.0921 0.0645],{'nya': 'his'},4.3,,,,
trans corp kembali berniat membuka transmart,1,trans corp kembali berniat membuka transmart,1.0,1,[0.0036 0.9932 0.0032],1,[0.0036 0.9932 0.0032],"{'transmart': 'transmart', 'trans': 'trans'}",4.7,,,,
: kalau subscriber youtube netmediatama mencapai 1 juta .,1,kalau subscriber youtube netmediatama mencapai 1 million,0.819383978843689,1,[0.0088 0.9738 0.0174],1,[0.014  0.9638 0.0221],"{'netmediatama': 'netmediatama', 'juta': 'million'}",4.73,,,,
gue bingung sama pemerintahan jokowi . banyak orang yang muji dia padahal dia cuma bisa merusak negara kita saja . aneh,2,gue confused sama government jokowi banyak person yang muji dia padahal dia cuma bisa merusak negara kita saja aneh,0.899621844291687,2,[0.0026 0.0019 0.9956],2,[0.0035 0.0022 0.9942],"{'pemerintahan': 'government', 'bingung': 'confused', 'orang': 'person'}",5.1,,,,
"kalau melihat desain nya pixel 3 sih biasa saja , tapi iklan nya ini bagus banget sampai bikin barang nya jadi terlihat wah banget",0,kalau melihat desain his pixel 3 sih biasa saja tapi iklan his ini good very sampai bikin barang his jadi terlihat wah very,0.7834460735321045,0,[0.9824 0.0051 0.0124],0,[0.9608 0.0117 0.0276],"{'bagus': 'good', 'banget': 'very', 'nya': 'his'}",5.71,,,,
"menu-menu tradisional sunda dengan tempat dan wadah yang unik makanan nya banyak ragam minuman dan makanan khas sunda yang jarang dijumpai di luar , ternyata ada di sini .",0,tradisional Sunda dengan tempat dan receptacle yang unique makanan his banyak ragam minuman dan makanan khas Sunda yang seldom dijumpai di luar ternyata ada di sini,0.9132267832756042,0,[0.9961 0.0021 0.0018],0,[0.9894 0.0057 0.0049],"{'unik': 'unique', 'nya': 'his', 'jarang': 'seldom', 'wadah': 'receptacle', 'sunda': 'Sunda'}",6.61,,,,
"ampera benhil . pegawai judes , banyak asap rokok , kotor . ini cabang ampera yang paling mengecewakan .",2,ampere benhil pegawai judes banyak asap rokok dirty ini cabang ampere yang paling disappointing,0.6498512029647827,2,[0.0028 0.0015 0.9957],2,[0.0024 0.0049 0.9927],"{'ampera': 'ampere', 'mengecewakan': 'disappointing', 'kotor': 'dirty'}",5.23,,,,
salut,0,salute,0.5821758508682251,0,[0.9452 0.0102 0.0446],0,[0.8753 0.0256 0.099 ],{'salut': 'salute'},4.23,,,,
"makanan nya enak , porsi nya lumayan banyak , suasana nya juga enak , di tengah nya ada taman dan bergaya zaman dulu , pada waktu datang dikasih roti untuk makanan pembuka",0,food his nice portion his reasonable banyak suasana his juga nice di tengah his ada taman dan bergaya era dulu pada waktu datang dikasih roti untuk food pembuka,0.708575963973999,0,[0.9972 0.0011 0.0017],0,[0.9934 0.0025 0.0042],"{'enak': 'nice', 'porsi': 'portion', 'nya': 'his', 'makanan': 'food', 'zaman': 'era', 'lumayan': 'reasonable'}",6.76,,,,
sangat tidak profesional institusi . hanya membuat kecewa dan sangat tidak rapi anda bermain . kalau mau main rapi jangan ada kotor sedikit pun,2,sangat tidak professional institution hanya membuat kecewa dan sangat tidak neat anda bermain kalau mau main neat jangan ada kotor sedikit pun,0.9231122732162476,2,[0.0061 0.0015 0.9925],2,[0.0095 0.0016 0.9889],"{'profesional': 'professional', 'rapi': 'neat', 'institusi': 'institution'}",5.56,,,,
"sejak jokwi naik jadi presiden , simbol-simbol pki tumbuh subur tanpa henti seolah tak ada pihak yang berdaya memberangus hal tersebut . selaku presiden , omongan gebuk pki tak lebih hanya pembohongan publik",2,sejak jokwi naik jadi presiden pki tumbuh subur tanpa henti seolah tak ada pihak yang Empower memberangus hal tersebut selaku presiden talk thump pki tak lebih hanya lying public,0.922444224357605,2,[0.0189 0.0078 0.9733],2,[0.0461 0.0285 0.9255],"{'berdaya': 'Empower', 'gebuk': 'thump', 'publik': 'public', 'omongan': 'talk', 'pembohongan': 'lying'}",6.76,,,,
"demo , inilah permintaan nelayan pamekasan kepada menteri susi",1,demo inilah request fisherman pamekasan kepada menteri susi,0.703168511390686,1,[0.0021 0.9897 0.0082],1,[0.0019 0.9922 0.0058],"{'permintaan': 'request', 'nelayan': 'fisherman'}",4.64,,,,
"swiss hormone mengembalikan bentuk brast plus boolat , merapatkan misi v plus wangi sekali smilingfacewithheart - eyes smilingfacewithheart - eyes smilingfacewithheart - eyes .",0,"swiss hormone mengembalikan bentuk brast plus boolat , merapatkan misi v plus wangi sekali smilingfacewithheart - eyes smilingfacewithheart - eyes smilingfacewithheart - eyes .",1.0,1,[0.389  0.5637 0.0472],1,[0.389  0.5637 0.0472],,0.02,,,,
"resto nya bikin kangen . suasana nya enak terutama live music nya suka ramai begitu atau lagu oma oppa tempo dulu , enak banget , makanan nya juga enak-enak , harga tidak mahal , puas dan sudah ketiga kalinya ke sini",0,resto nya make miss suasana nya nice terutama live music nya like ramai begitu atau lagu grandma WL tempo dulu nice very makanan nya juga harga tidak expensive puas dan sudah ketiga kalinya ke sini,0.8427951335906982,0,[9.975e-01 8.000e-04 1.700e-03],0,[0.8545 0.0074 0.1381],"{'mahal': 'expensive', 'banget': 'very', 'enak': 'nice', 'suka': 'like', 'oppa': 'WL', 'kangen': 'miss', 'live': 'live', 'oma': 'grandma', 'bikin': 'make'}",6.89,,,,
sudah satu bulan ini dia magang di google indonesia .,1,sudah satu bulan ini dia apprenticeship di google indonesia,0.9002244472503662,1,[0.0036 0.9797 0.0167],1,[0.0078 0.9859 0.0064],{'magang': 'apprenticeship'},4.24,,,,
"makan mi di sini bikin ketagihan , mienyabeda dengan tempat makan mi yang lain . yang paling gila pedes nya , tidak berani pakai sambal lagi tidak kuat pedas .",0,"makan mi di sini bikin ketagihan , mienyabeda dengan tempat makan mi yang lain . yang paling gila pedes nya , tidak berani pakai sambal lagi tidak kuat pedas .",1.0,2,[0.3095 0.0047 0.6857],2,[0.3095 0.0047 0.6857],,0.02,,,,
"kemarin saya ke gym yang di daerah kalibata . awal nya mau work out biar bisa membakar lemak . eh di luar ekspektasi , tempat nya ternyata tidak nyaman .",2,kemarin saya ke gym yang di daerah kalibata awal his mau work out biar bisa burn fat uh di luar expectation tempat his ternyata tidak nyaman,0.8689179420471191,2,[0.0074 0.0045 0.9881],2,[0.0059 0.0098 0.9843],"{'ekspektasi': 'expectation', 'nya': 'his', 'eh': 'uh', 'lemak': 'fat', 'membakar': 'burn'}",5.96,,,,
"menu warkop , tempat gaul . paling enak ke sini pagi hari masih sepi . kalau siang - malam ramai bingitzzxz . cocok untuk anak baru besar atau remaja . buat bincang bisnis tidak cocok tetlalu ramai . kopi nya gayo arabica mantap , sayang tidak ada manual brew . semuanya pakai expresso mesin . buat kawula muda cocoklah",0,menu warkop tempat gaul paling enak ke sini pagi hari masih sepi kalau siang malam ramai bingitzzxz suitable untuk anak baru besar atau remaja buat bincang bisnis tidak suitable too long ramai coffee his gayo arabica steady sayang tidak ada manual brew semuanya use expresso machine buat me young match,0.8971467614173889,0,[0.9835 0.0032 0.0133],0,[0.8426 0.0099 0.1475],"{'cocoklah': 'match', 'cocok': 'suitable', 'mantap': 'steady', 'kopi': 'coffee', 'muda': 'young', 'manual': 'manual', 'nya': 'his', 'pakai': 'use', 'mesin': 'machine', 'kawula': 'me', 'tetlalu': 'too long', 'expresso': 'expresso'}",12.6,,,,
"resto ini desain interior nya cukup menawan . penataan nya cukup serasi . layanan nya cukup baik dan cepat saji . tersedia berbagai menu seperti ayam goreng , bubur ayam , cheeseburger , egg burger , fish fillet burger dan sebagai nya . ayam goreng rasanya gurih , renyah dan nikmat . bubur ayam nya terasa sangat nikmat . cheeseburger sangat terasa rasa keju nya . rata-rata masakan nya nikmat .",0,restaurant ini desain interior his cukup menawan penataan his cukup serasi layanan his cukup baik dan cepat saji tersedia berbagai menu seperti chicken fry porridge chicken cheeseburger egg burger fish fillet burger dan sebagai his chicken fry rasanya tasty renyah dan enjoyment porridge chicken his terasa sangat enjoyment cheeseburger sangat terasa rasa cheese his Cook his enjoyment,0.6117437481880188,0,[9.979e-01 8.000e-04 1.400e-03],0,[0.9934 0.0023 0.0044],"{'bubur': 'porridge', 'gurih': 'tasty', 'fillet': 'fillet', 'nikmat': 'enjoyment', 'egg': 'egg', 'fish': 'fish', 'goreng': 'fry', 'nya': 'his', 'ayam': 'chicken', 'masakan': 'Cook', 'resto': 'restaurant', 'keju': 'cheese'}",10.39,,,,
"menu bubur untuk sarapan pagi favorit semua orang . porsi cukup , tidak terlalu besar , tidak terlalu sedikit . bubur ayam lokal yang cukup untuk mengganjal perut di pagi hari .",0,menu bubur untuk sarapan morning favorite semua person porsi cukup tidak terlalu besar tidak terlalu sedikit bubur ayam lokal yang cukup untuk mengganjal perut di morning hari,0.9250669479370117,0,[0.9969 0.001  0.0021],0,[0.9806 0.0064 0.013 ],"{'favorit': 'favorite', 'orang': 'person', 'menu': 'menu', 'pagi': 'morning'}",5.75,,,,
"makanan nya semuanya enak banget , favorit nya nachos dan salad 90 gourmet , sushi nya juga enak , suasana nya nyaman untuk berdua atau kumpul keluarga , selalu jadi pilihan kalau lagi ingin makanan jepang atau korea .",0,makanan his semuanya enak banget favorite his nachos dan salad 90 gourmet sushi his juga enak atmosphere his nyaman untuk berdua atau kumpul family selalu jadi pilihan kalau lagi ingin makanan Japan atau Korea,0.8565701842308044,0,[9.977e-01 8.000e-04 1.500e-03],0,[0.997  0.0011 0.002 ],"{'korea': 'Korea', 'jepang': 'Japan', 'gourmet': 'gourmet', '90': '90', 'keluarga': 'family', 'salad': 'salad', 'nya': 'his', 'suasana': 'atmosphere', 'favorit': 'favorite'}",7.41,,,,
betul . cebong-cebong pada bodoh semua maka dari itu bisa kalahkan prabowo dan bisa usir itu si anjing rizieq shihab,2,betul pada stupid semua maka dari itu bisa beat prabowo dan bisa usir itu si dog rizieq shihab,0.9373760223388672,2,[0.0028 0.003  0.9943],2,[0.0037 0.0056 0.9907],"{'bodoh': 'stupid', 'anjing': 'dog', 'kalahkan': 'beat'}",4.96,,,,
mulai bosan nih sama pekerjaan yang sekarang,2,mulai bosan here sama pekerjaan yang sekarang,0.8628235459327698,2,[0.0031 0.0041 0.9928],2,[0.0025 0.0036 0.9939],{'nih': 'here'},4.34,,,,
tidak pernah kapok dan terus berlangganan sama pengiriman jne soal nya cepat sampai nya,0,tidak pernah kapok dan terus berlangganan sama pengiriman jne soal his fast sampai his,0.8729662299156189,0,[0.9951 0.0025 0.0024],0,[0.9882 0.0068 0.0051],"{'cepat': 'fast', 'nya': 'his'}",5.02,,,,
"bagus tempat , bagus harga , bagus rasa . ditambah live musik jadi ingin bawa doi ke sini , sayang waktu itu ngumpul nya sama teman-teman kantor , semoga lain waktu bisa datang lagi ke tjendana bistro .",0,good tempat good price good rasa added live music jadi ingin bawa doi ke sini sayang waktu itu ngumpul nya sama kantor hopefully lain waktu bisa datang lagi ke tjendana bistro,0.8752140998840332,0,[0.9952 0.0018 0.003 ],0,[0.9941 0.0026 0.0034],"{'harga': 'price', 'bagus': 'good', 'ditambah': 'added', 'musik': 'music', 'semoga': 'hopefully'}",7.0,,,,
makanan yang terkenal di sini adalah kepiting . kami jarang makan di tempat karena terkendala parkir . kita harus parkir di seberang jalan dan jalan nya adalah jalan besar dengan kendaraan yang terus berlalu lalang . karena itu biasanya saya dan keluarga lebih senang untuk pengiriman .,0,food yang famous di sini adalah kepiting kami jarang makan di tempat karena terkendala parkir kita harus parkir di across road dan road his adalah road besar dengan kendaraan yang terus berlalu lalang karena itu biasanya saya dan family lebih like untuk pengiriman,0.913177490234375,0,[0.9132 0.0098 0.077 ],0,[0.9673 0.0108 0.0219],"{'keluarga': 'family', 'terkenal': 'famous', 'makanan': 'food', 'nya': 'his', 'seberang': 'across', 'senang': 'like', 'jalan': 'road'}",6.85,,,,
saya tidak suka ayam . saya lindas ayam itu,2,saya tidak like ayam saya lindas ayam itu,0.9466515183448792,2,[0.0031 0.0019 0.995 ],2,[0.0055 0.0023 0.9922],{'suka': 'like'},4.21,,,,
sepertinya ingin sekali marah sama indosat ini .,2,sepertinya ingin sekali angry sama indosat ini,0.8623509407043457,2,[0.0025 0.003  0.9944],2,[0.1437 0.0382 0.8181],{'marah': 'angry'},4.15,,,,
"nama nya yang membuat saya tergelitik untuk mampir dan makan , kemudian menanyakan kepada staf mereka , kenapa nama nya sapu lidi ? tidak ada yang bisa menjawab dan baru terjawab ketika pemilik nya diwawancara disebuah stasiun televisi . sapu lidi idebtik dengan rakkyat , dengan desa / kampung . tempat ini di desain cukup unik menurut saya seunik pemilik nya juga",0,nama his yang membuat saya tergelitik untuk stop by dan makan kemudian menanyakan kepada staf mereka kenapa nama his broom stick tidak ada yang bisa menjawab dan baru terjawab ketika owner his diwawancara disebuah stasiun televisi broom stick idebtik dengan rakkyat dengan village village tempat ini di design cukup unique menurut saya as unique owner his juga,0.7744951248168945,0,[0.9576 0.006  0.0364],0,[0.9722 0.0083 0.0195],"{'unik': 'unique', 'seunik': 'as unique', 'desain': 'design', 'kampung': 'village', 'pemilik': 'owner', 'nya': 'his', 'mampir': 'stop by', 'sapu': 'broom', 'desa': 'village', 'lidi': 'stick'}",8.36,,,,
"kecewa sama barista yang literally menambahkan additional tanpa bilang ada biaya nya . maksud gue , kalau harga akhir produk akan berubah wajar nya dikasih tahu sebelum dia input tidak sih ? apalagi sama new pelanggan",2,disappointed sama barista yang literally menambahkan additional tanpa bilang ada biaya his maksud gue kalau price akhir produk akan changed reasonable his given tahu sebelum dia input tidak sih apalagi sama new pelanggan,0.8696354627609253,2,[0.0067 0.0053 0.988 ],2,[0.009  0.0059 0.9851],"{'kecewa': 'disappointed', 'harga': 'price', 'input': 'input', 'nya': 'his', 'dikasih': 'given', 'berubah': 'changed', 'wajar': 'reasonable'}",7.71,,,,
