text,sentiment,perturbed_text,perturbed_semantic_sim,pred_label,pred_proba,perturbed_label,perturbed_proba,translated_word(s),running_time(s),before_attack_acc,after_attack_acc,avg_semantic_sim,avg_running_time(s)
nabi muhammad pendekar buta huruf pembohong besar maka dari itu umat nya kalau naik haji diwajibkan mencium batu yang berbentuk seperti vagina wanita,2,nabi muhammad Warrior blind huruf liar besar maka dari itu people nya kalau naik haji diwajibkan kiss batu yang berbentuk seperti vagina wanita,0.9129675030708313,2,[0.003  0.004  0.9931],2,[0.0047 0.0113 0.984 ],"{'pembohong': 'liar', 'buta': 'blind', 'umat': 'people', 'muhammad': 'muhammad', 'mencium': 'kiss', 'pendekar': 'Warrior'}",11.07,,,,
kalau hujan-hujan begini yang dikangenin ya cuma indomie bukan pacar : v,0,kalau hujan-hujan begini yang dikangenin ya cuma indomie bukan pacar : v,1.0,2,[0.0139 0.0558 0.9303],2,[0.0139 0.0558 0.9303],,0.02,,,,
"jika akhir pekan resto ini dipenuhi pengunjung yang makan di sini atau sekadar bungkus buat oleh-oleh , jadi harus sabar antre .",0,jika akhir pekan restaurant ini fulfilled pengunjung yang makan di sini atau sekadar bungkus buat jadi harus sabar in line,0.9473965167999268,0,[0.7733 0.0271 0.1997],0,[0.5787 0.0528 0.3685],"{'dipenuhi': 'fulfilled', 'antre': 'in line', 'resto': 'restaurant'}",10.21,,,,
tidak ada faedah nya jokowi jadi presiden,2,tidak ada avail nya jokowi jadi presiden,0.9681621789932251,2,[0.0061 0.0127 0.9812],2,[0.0111 0.1635 0.8254],{'faedah': 'avail'},10.15,,,,
"kafe ini daerah dago , bangunan dengan mayoritas kayu , cukup cantik apabila makan malam sambil menikmati pemandangan lampu lampu kota . pilih lantai 2 saja ya , lebih terlihat pemandangan nya . banyak variasi menu makanan dan minuman dan harga kelas menengah sekitar 25 ribu - 120 ribu .",0,kafe ini area dago bangunan dengan mayoritas wood cukup beautiful apabila eat night sambil enjoy pemandangan lampu lampu kota pilih lantai 2 saja ya lebih terlihat pemandangan nya banyak variation menu makanan dan drink dan price kelas menengah sekitar 25 thousand 120 thousand,0.8574984073638916,0,[0.9976 0.0011 0.0013],0,[0.9971 0.0015 0.0014],"{'cantik': 'beautiful', 'harga': 'price', 'makan': 'eat', '120': '120', 'menikmati': 'enjoy', 'minuman': 'drink', 'malam': 'night', '25': '25', 'variasi': 'variation', 'kayu': 'wood', 'daerah': 'area', 'ribu': 'thousand'}",14.67,,,,
"tempat makan modern dengan sentuhan tempo doloe . saya mencoba mi petruk isi aci yang rasanya lumayan juga es kacang singapore yang isi nya jelly keras . harga makanan di sini lumayan terjangkau , pelayanan cepat dan lokasi nya di dalam pvj mal yang nyaman dan bersih .",0,tempat makan modern dengan sentuhan tempo doloe saya mencoba mi petruk isi ok yang rasanya reasonable juga es peanut singapore yang isi his jelly keras price food di sini reasonable terjangkau pelayanan cepat dan lokasi his di dalam pvj mal yang nyaman dan bersih,0.8920932412147522,0,[9.979e-01 8.000e-04 1.300e-03],0,[0.9963 0.0012 0.0025],"{'lumayan': 'reasonable', 'jelly': 'jelly', 'doloe': 'doloe', 'harga': 'price', 'singapore': 'singapore', 'nya': 'his', 'kacang': 'peanut', 'makanan': 'food', 'tempo': 'tempo', 'aci': 'ok'}",12.64,,,,
"kami mengunjungi rumah makan ini pada pertengahan januari 2015 , yang enak dari tempat ini menurut saya adalah ayam goreng nya dan juga lalapan yang masih segar .",0,kami mengunjungi rumah makan ini pada pertengahan januari 2015 yang nice dari tempat ini menurut saya adalah ayam fry nya dan juga fresh vegetables yang masih fresh,0.9239954948425293,0,[0.9964 0.0015 0.0021],0,[0.9953 0.002  0.0026],"{'segar': 'fresh', 'enak': 'nice', 'lalapan': 'fresh vegetables', 'goreng': 'fry'}",10.14,,,,
"bancakan adalah restoran dengan konsep prasmanan . terletak di jalan trunojoyo , bandung . lokasi restoran dapat dicirikan dengan banyak nya kendaraan yang parkir di depan restoran , bahkan hingga jauh . makanan dan minuman di sini semua khas sunda , mulai dari gepuk , sambel goreng kentang , sambal oncom , aneka pepes , dan karedok . bikin bingung dan mau karena makanan yang beragam dan menggugah selera .",0,bancakan adalah restoran dengan konsep prasmanan terletak di road trunojoyo bandung lokasi restoran dapat dicirikan dengan banyak nya kendaraan yang parkir di depan restoran bahkan hingga jauh food dan drink di sini semua typical sunda mulai dari gepuk sambal goreng kentang sambal oncom miscellaneous pepes dan karedok make confused dan mau karena food yang variety dan evoke appetite,0.900511622428894,0,[0.9958 0.0018 0.0024],0,[0.994  0.0027 0.0033],"{'menggugah': 'evoke', 'beragam': 'variety', 'makanan': 'food', 'selera': 'appetite', 'bikin': 'make', 'karedok': 'karedok', 'minuman': 'drink', 'bingung': 'confused', 'khas': 'typical', 'aneka': 'miscellaneous', 'jalan': 'road', 'sambel': 'sambal'}",13.69,,,,
datang dengan rekan malam menjelang . pilihan duduk di luar dengan pemandangan lampu kota bandung yang ciamik . ditemani steak dan wine,0,datang dengan rekan malam menjelang pilihan duduk di luar dengan pemandangan light city bandung yang cute ditemani steak dan wine,0.9383377432823181,0,[0.9976 0.0013 0.001 ],0,[0.9965 0.0023 0.0012],"{'ciamik': 'cute', 'steak': 'steak', 'lampu': 'light', 'wine': 'wine', 'kota': 'city'}",11.99,,,,
tumbangkan calon-calon pdip . partai-partai pendukung penista agama tenggelamkan .,2,tumbangkan pdip pendukung blasphemer agama tenggelamkan,0.748014509677887,2,[0.0033 0.175  0.8217],1,[0.0047 0.7558 0.2395],"{'penista': 'blasphemer', 'pdip': 'pdip'}",10.7,,,,
pernyataan politik demokrat berkaitan agenda nasional 2018 yang didisampaikan oleh ketum bapak . menyangkut 5 poin,1,statement political democrat berkaitan agenda nasional 2018 yang didisampaikan oleh ketum bapak menyangkut 5 poin,0.7026329040527344,1,[0.0032 0.9907 0.0061],1,[0.0056 0.9865 0.0079],"{'demokrat': 'democrat', '2018': '2018', 'politik': 'political', 'pernyataan': 'statement'}",10.25,,,,
"kafe ini berlokasi cukup jauh , di dago atas yang naik nya benar-benar ke atas . tapi ketika sampai di sana , lokasi nya luas , karena saya ke sana malam hari , maka suasana romantis sangat terlihat dengan cuaca bandung yang dingin , lampu lampu kafe temaram , menyenangkan bila ke sana dengan pasangan . saya ke sana dengan teman-teman kerja saya dan bercanda tawa senda gurau , hingga ada teman saya yang memesan .",0,kafe ini berlokasi cukup jauh di dago atas yang naik his ke atas tapi ketika sampai di sana lokasi his wide karena saya ke sana night hari maka atmosphere romantic sangat terlihat dengan cuaca bandung yang dingin lampu lampu kafe Twilight pleasant bila ke sana dengan couple saya ke sana dengan work saya dan bercanda tawa send gurau hingga ada teman saya yang memesan,0.9121719598770142,0,[0.9971 0.0012 0.0017],0,[0.9958 0.0018 0.0024],"{'suasana': 'atmosphere', 'pasangan': 'couple', 'menyenangkan': 'pleasant', 'romantis': 'romantic', 'malam': 'night', 'temaram': 'Twilight', 'nya': 'his', 'luas': 'wide', 'senda': 'send', 'kerja': 'work'}",15.8,,,,
"bbq malam di padma hotel itu keren dan enak banget ! steak nya enak banget , sushi nya mantap , dan semuanya enak deh . yang paling penting suasana nyaman dan romantis .",0,bbq malam di padma hotel itu keren dan enak very steak his enak very sushi his steady dan semuanya enak deh yang paling penting atmosphere nyaman dan romantis,0.8825563192367554,0,[0.9975 0.001  0.0015],0,[9.974e-01 9.000e-04 1.700e-03],"{'nya': 'his', 'hotel': 'hotel', 'mantap': 'steady', 'banget': 'very', 'padma': 'padma', 'suasana': 'atmosphere'}",12.83,,,,
"baru kali ini kecewa dengan belanja online , karena produk yang diterima tidak sesuai dengan gambar yang di tampilkan .",2,baru kali ini disappointed dengan belanja online karena product yang diterima tidak in accordance dengan gambar yang di tampilkan,0.9184643626213074,2,[0.0047 0.002  0.9934],2,[0.0089 0.0029 0.9882],"{'kecewa': 'disappointed', 'sesuai': 'in accordance', 'produk': 'product'}",10.29,,,,
tokopedia benar-benar terpercaya,0,Tokopedia terpercaya,0.7837895154953003,0,[0.9878 0.0052 0.0069],0,[0.981  0.0071 0.0119],{'tokopedia': 'Tokopedia'},9.22,,,,
"hai angga , untuk penerbitan tiket reschedule diharuskan melakukan pembayaran dulu ya .",1,hai angga untuk penerbitan ticket reschedule diharuskan melakukan payment dulu ya,0.8468210101127625,1,[0.0068 0.9709 0.0223],1,[0.0055 0.9828 0.0116],"{'pembayaran': 'payment', 'reschedule': 'reschedule', 'tiket': 'ticket'}",10.92,,,,
"kesal karena samalam membeli seafood pinggir jalan dengan harga mahal dan rasahya tidak enak , akhirnya saya dan teman hati saya ingin balas dendam mencari seafood murah dan enak mumpung sedang berada di bandung , browsing dan dapatlah di cost ini , sebenarnya di cost ini banyak cabang nya hanya saja kebetulan kami terdekat yaitu ke d cost seafood sukajadi , akhirnya kami ke sana dan memesan makanan . lanjutan",0,"kesal karena samalam membeli seafood pinggir jalan dengan harga mahal dan rasahya tidak enak , akhirnya saya dan teman hati saya ingin balas dendam mencari seafood murah dan enak mumpung sedang berada di bandung , browsing dan dapatlah di cost ini , sebenarnya di cost ini banyak cabang nya hanya saja kebetulan kami terdekat yaitu ke d cost seafood sukajadi , akhirnya kami ke sana dan memesan makanan . lanjutan",1.0,2,[0.0439 0.0056 0.9504],2,[0.0439 0.0056 0.9504],,0.08,,,,
anjing-anjing fpi memang harus di musnahkan . fpi itu mental pengemis tidak mau kerja . bawa kotak amal keliling kampung,2,fpi memang harus di destroy fpi itu mental pengemis tidak mau kerja bawa kotak charity around kampung,0.9011825323104858,2,[0.0023 0.003  0.9947],2,[0.0023 0.0041 0.9936],"{'mental': 'mental', 'keliling': 'around', 'amal': 'charity', 'musnahkan': 'destroy'}",11.61,,,,
"pada saat kami sangat lelah , pilihan makan di hotel merupakan opsi yang tepat . kebetulan ada restoran yang cukup terkenal di jakarta . rasa yang cukup terjaga dengan yang di jakarta . tidak mengecewakan dan memuaskan .",0,pada saat kami sangat lelah pilihan makan di hotel merupakan option yang tepat kebetulan ada restaurant yang cukup famous di jakarta rasa yang cukup terjaga dengan yang di jakarta tidak disappointing dan memuaskan,0.942855954170227,0,[0.9963 0.0013 0.0024],0,[0.9698 0.0048 0.0254],"{'mengecewakan': 'disappointing', 'opsi': 'option', 'restoran': 'restaurant', 'terkenal': 'famous'}",11.39,,,,
kfc di dago ini tempat nya strategis sehingga sangat cocok untuk kumpul-kumpul dengan teman sambil menikmati french fries dan minuman yang dijual di sini .,0,kfc di dago ini tempat nya strategis sehingga sangat cocok untuk dengan friend sambil enjoy french fries dan drink yang dijual di sini,0.9302266836166382,0,[0.9968 0.0018 0.0015],0,[0.9971 0.0015 0.0014],"{'teman': 'friend', 'minuman': 'drink', 'menikmati': 'enjoy', 'fries': 'fries'}",10.74,,,,
dasar miskin ilmu bahasa sunda,2,base miskin knowledge bahasa sunda,0.6054192781448364,2,[0.0024 0.0099 0.9877],2,[0.1092 0.2963 0.5946],"{'ilmu': 'knowledge', 'dasar': 'base'}",9.52,,,,
"restoran ini sangat sesuai dengan nama nya , berkarakter rock dengan suguhan musik yang apik , sangat cocok hanya untuk sekedar melepas malam diiringi musik rock dan segelas minuman .",0,restoran ini sangat sesuai dengan nama nya berkarakter rock dengan suguhan music yang nice sangat suitable hanya untuk just let go malam accompanied by music rock dan segelas drink,0.8524026870727539,0,[0.9975 0.001  0.0014],0,[0.9977 0.001  0.0014],"{'apik': 'nice', 'diiringi': 'accompanied by', 'minuman': 'drink', 'melepas': 'let go', 'cocok': 'suitable', 'musik': 'music', 'sekedar': 'just'}",12.58,,,,
"enak ya panjat sosial bawa-bawa korea ? langsung banyak yang komentar begini . biasanya tidak ada yang komenin , eh sekali nya bawa artis korea langsung ramai . sedih kenapa harus pakai cara kotor kayak begini buat pansos . tidak ada konten lain yang lebih bermutu kah daripada menyebar kebencian begini ?",2,enak ya panjat sosial korea langsung banyak yang comment begini biasanya tidak ada yang komenin uh sekali his bring artis korea langsung ramai sad kenapa harus use cara dirty kayak begini buat social assistance tidak ada konten lain yang lebih bermutu kah daripada menyebar hatred begini,0.9167863726615906,2,[0.0058 0.0017 0.9925],2,[0.0515 0.0037 0.9447],"{'sedih': 'sad', 'kotor': 'dirty', 'kebencian': 'hatred', 'pakai': 'use', 'kah': 'kah', 'pansos': 'social assistance', 'komentar': 'comment', 'eh': 'uh', 'bawa': 'bring', 'nya': 'his'}",13.21,,,,
"makanan nya enak , menu nya unik . pelayanan nya bagus dan unik juga . lucu , kreatif , lokasi nya strategis , di tengah keramaian sekali .",0,food nya enak menu nya unique pelayanan nya bagus dan unique juga funny kreatif location nya strategic di tengah keramaian sekali,0.8011896014213562,0,[9.977e-01 8.000e-04 1.500e-03],0,[0.9973 0.001  0.0017],"{'strategis': 'strategic', 'lokasi': 'location', 'lucu': 'funny', 'makanan': 'food', 'menu': 'menu', 'unik': 'unique'}",11.19,,,,
sang rajawali kepret temui menteri susi bahas nasib nelayan,1,sang rajawali kepret meet menteri Susie discuss nasib nelayan,0.6133098602294922,1,[0.0022 0.9927 0.0051],1,[0.0039 0.9905 0.0055],"{'temui': 'meet', 'bahas': 'discuss', 'susi': 'Susie'}",10.32,,,,
"lembaga pusat isu bohong nasional , paslon yang sudah diplot , di kemas dengan media mainstream hasil nya tidak sesuai , untuk menyembunyikan kebohongan dengan cara framing dengan istilah bus lonjakan suara . dan lain-lain sebagai justifikasi lembaga survei dan menyembunyikan sponsor",2,institution pusat isu lie nasional candidate pair yang sudah diplot di pack up dengan media mainstream results nya tidak in accordance untuk hide kebohongan dengan cara framing dengan term bus lonjakan suara dan sebagai justifikasi institution survei dan hide sponsor,0.8265385627746582,2,[0.0026 0.0027 0.9947],2,[0.0039 0.0148 0.9813],"{'bohong': 'lie', 'sesuai': 'in accordance', 'menyembunyikan': 'hide', 'lembaga': 'institution', 'hasil': 'results', 'istilah': 'term', 'paslon': 'candidate pair', 'media': 'media', 'kemas': 'pack up'}",13.28,,,,
"kami mampir ke sini di bulan april 2016 roemah nenek menyajikan menu-menu rumahan jaman belanda yang enak-enak . terutama zuppa sup nya lokasi nya sangat strategis , di tengah kota . suasana nya vintage , karena menggunakan rumah besar model jaman belanda thanx",0,kami stop by ke sini di bulan april 2016 roemah nenek menyajikan rumahan jaman belanda yang terutama zuppa sup his location his sangat strategic di tengah city atmosphere his vintage karena menggunakan rumah besar model jaman belanda thanx,0.7168927192687988,0,[0.9977 0.001  0.0014],0,[0.9959 0.0019 0.0022],"{'strategis': 'strategic', 'nya': 'his', 'lokasi': 'location', 'suasana': 'atmosphere', 'mampir': 'stop by', 'thanx': 'thanx', 'kota': 'city', 'zuppa': 'zuppa'}",12.84,,,,
"bu risma oh bu risma , saya rindu dengan ibu",0,ma'am risma oh ma'am risma saya rindu dengan ibu,0.5366414785385132,0,[0.9384 0.0268 0.0348],0,[0.9655 0.0133 0.0211],"{'bu': ""ma'am"", 'risma': 'risma'}",10.95,,,,
"mcd dago selalu menjadi tempat favorit dari zaman kuliah . selain tempat nya yang sangat strategis dekat dengan kampus dan kos di sini juga menyediakan wifi gratis bisa dimanfaatkan buat mengerjakan tugas kuliah , hehehe dan yang paling penting buka 24 jam !",0,mcd dago selalu menjadi tempat favorit dari zaman studying selain tempat nya yang sangat strategic dekat dengan campus dan cost di sini juga menyediakan wifi free bisa dimanfaatkan buat mengerjakan Duty studying hehehe dan yang paling penting buka 24 jam,0.9197011590003967,0,[0.997  0.0015 0.0015],0,[0.994  0.0039 0.0021],"{'tugas': 'Duty', 'strategis': 'strategic', 'kampus': 'campus', 'kuliah': 'studying', 'kos': 'cost', 'gratis': 'free'}",11.88,,,,
para penakut lari dari masalah dan merugi,2,para penakut run dari masalah dan merugi,0.9281585216522217,2,[0.003  0.0032 0.9939],2,[0.0031 0.0029 0.994 ],{'lari': 'run'},10.06,,,,
ini politisi tong kosong berbunyi nyaring : setya novanto ditambah dia itu maling,2,ini politisi tong blank berbunyi loud setya novanto ditambah dia itu thief,0.7582182288169861,2,[0.0017 0.0131 0.9852],2,[0.0023 0.0124 0.9852],"{'kosong': 'blank', 'nyaring': 'loud', 'maling': 'thief'}",10.86,,,,
tidak cinta,2,tidak love,0.7767360210418701,2,[0.0173 0.0044 0.9784],2,[0.0368 0.0038 0.9595],{'cinta': 'love'},9.7,,,,
"kfc dago merupakan alternatif tempat makan 24 jam yang ada di sekitar dago . lokasi sangat strategis satu bangunan dengan superindo dago , dan bersebrangan dengan plaza dago . selain kfc , terdapat kfc coffee untuk yang berniat bersantai sambil minum kopi . menu yang ditawarkan standar ala kfc . tersedia wifi , hanya sayang colokan listrik kurang banyak , jadi susah untuk mencharge laptop .",0,kfc dago merupakan alternative tempat makan 24 o'clock yang ada di sekitar dago lokasi sangat strategic satu building dengan superindo dago dan bersebrangan dengan plaza dago selain kfc terdapat kfc coffee untuk yang intend relax sambil drink coffee menu yang offered standard ala kfc tersedia wifi hanya sayang colokan listrik kurang banyak jadi susah untuk mencharge laptop,0.9459155201911926,0,[0.9715 0.0047 0.0239],0,[0.9776 0.0106 0.0118],"{'minum': 'drink', 'kopi': 'coffee', 'menu': 'menu', 'ditawarkan': 'offered', 'berniat': 'intend', 'bersantai': 'relax', 'alternatif': 'alternative', 'strategis': 'strategic', 'standar': 'standard', 'jam': ""o'clock"", 'coffee': 'coffee', 'bangunan': 'building', '24': '24', 'plaza': 'plaza'}",14.25,,,,
pelayanan di hotel crown sangat mengecewakan ya . lama dan kurang pelayan nya .,2,pelayanan di hotel crown sangat disappointing yes lama dan kurang pelayan nya,0.9092384576797485,2,[0.0038 0.0013 0.9949],2,[0.0047 0.0014 0.9938],"{'mengecewakan': 'disappointing', 'ya': 'yes'}",10.19,,,,
karena pendidikan di indonesia guru nya malas hanya ingin digaji tapi tidak sesuai dengan hasil kerja,2,karena education di indonesia guru nya lazy hanya ingin digaji tapi tidak in accordance dengan hasil kerja,0.9063442945480347,2,[0.0026 0.0029 0.9945],2,[0.0023 0.0026 0.9951],"{'sesuai': 'in accordance', 'malas': 'lazy', 'pendidikan': 'education'}",10.46,,,,
"makan malam di kafe asix sangat nyaman , suasana kental dengan suasana sunda menu bermacam pilihan . jarak dari hote malaka hanya 10 menit dengan berjalan kaki",0,eat night di kafe asix sangat nyaman suasana thick dengan suasana sunda menu bermacam pilihan distance dari hote malaka hanya 10 minute dengan berjalan kaki,0.8372437953948975,0,[9.981e-01 9.000e-04 1.000e-03],0,[0.998 0.001 0.001],"{'menu': 'menu', 'asix': 'asix', 'malam': 'night', 'menit': 'minute', 'kental': 'thick', 'makan': 'eat', 'jarak': 'distance'}",13.03,,,,
"kunjungan : jumat 30 ags 2014 , sore hari . tempat terdiri dari dua lantai , kami naik ke lantai atas karena di bawah penuh . ada penjual kue rangi , jus di bawah . batagor dijual per porsi 30.000 . terdiri dari tiga potong . rada mengherankan siomay tidak dijual di hari itu , bahkan di daftar menu pun tidak ada . berhubung saya lebih menyukai siomay maka saya sudah kurang sreg .",2,kunjungan jumat 30 ags 2014 sore hari tempat terdiri dari dua lantai kami naik ke lantai atas karena di bawah penuh ada penjual kue rangi jus di bawah batagor for sale per porsi terdiri dari tiga cut slightly surprising dumplings tidak for sale di hari itu bahkan di list menu pun tidak ada berhubung saya lebih like dumplings maka saya sudah kurang comfortable,0.9251043200492859,2,[0.0294 0.0034 0.9672],2,[0.154  0.0244 0.8216],"{'mengherankan': 'surprising', 'sreg': 'comfortable', 'dijual': 'for sale', 'rada': 'slightly', 'siomay': 'dumplings', 'daftar': 'list', 'potong': 'cut', 'menyukai': 'like', 'menu': 'menu'}",14.7,,,,
"saya dan adik saya ke sini untuk sarapan dan merasakan bahwa tempat nya sangat nyaman apalagi untuk yang bawa keluarga . ada taman bermain anak yang bikin makin betah untuk berlama-lama di sini . suasana restoran juga cukup rindang banyak pepohonan . kalau makanan biasa saja menurut saya , yang cukup spesial adalah pancake durian nya .",0,saya dan younger brother saya ke sini untuk sarapan dan feel bahwa tempat his sangat nyaman apalagi untuk yang bawa keluarga ada Park bermain anak yang make makin feel at home untuk di sini suasana restoran juga cukup rindang banyak pepohonan kalau makanan biasa saja menurut saya yang cukup spesial adalah pancake durian his,0.9393143653869629,0,[0.9975 0.001  0.0015],0,[0.9969 0.0013 0.0018],"{'bikin': 'make', 'betah': 'feel at home', 'durian': 'durian', 'taman': 'Park', 'merasakan': 'feel', 'adik': 'younger brother', 'nya': 'his'}",13.98,,,,
"nasi marah sumatera plus telor 1 / 2 mateng plus kerupuk nya benar benar bikin ketagihan . dengan 5 level tingkat kepedesan yang bisa dipilih sesuai dengan selera . potato chips nya juga salah satu menu favourite . rekomendasi tempat buat yang santai , makan siang , makan malam dengan big layar 100",0,nasi angry sumatera plus telor 1 2 die plus kerupuk his benar benar make addicted dengan 5 level tingkat kepedesan yang bisa dipilih sesuai dengan appetite potato chips his juga salah satu menu favourite rekomendasi tempat buat yang santai makan afternoon makan night dengan big layar 100,0.8601244688034058,0,[9.978e-01 9.000e-04 1.400e-03],0,[0.9962 0.0018 0.002 ],"{'ketagihan': 'addicted', 'bikin': 'make', 'nya': 'his', 'siang': 'afternoon', 'plus': 'plus', '1': '1', 'malam': 'night', 'selera': 'appetite', 'mateng': 'die', '2': '2', 'big': 'big', 'marah': 'angry', 'level': 'level'}",14.72,,,,
"rumah stoberi adalah sebuah caf dan penginapan yang dilengkapi dengan perkebunan strawberry , playground , outbound . tempat ini sangat enak untuk bersantai terlebih jika cuaca tidak panas . udara sejuk , pemandangan bagus , tempat bermain anak yang sangat disukai anak-anak , makanan enak dengan harga terjangkau serta tersedia musala yang layak",0,rumah stoberi adalah sebuah caf dan penginapan yang dilengkapi dengan perkebunan strawberry playground outbound tempat ini sangat nice untuk bersantai terlebih jika weather tidak hot udara cool view good tempat bermain anak yang sangat liked food nice dengan price terjangkau serta tersedia musala yang layak,0.8849107027053833,0,[0.9973 0.0012 0.0015],0,[0.9974 0.0012 0.0014],"{'makanan': 'food', 'disukai': 'liked', 'enak': 'nice', 'sejuk': 'cool', 'pemandangan': 'view', 'panas': 'hot', 'bagus': 'good', 'harga': 'price', 'outbound': 'outbound', 'cuaca': 'weather'}",13.29,,,,
otak kita itu canggih banget lo,0,otak kita itu canggih banget lo,1.0,2,[0.1141 0.0147 0.8713],2,[0.1141 0.0147 0.8713],,0.02,,,,
"ya maka dari itu , yang dibilang dari tadi juga apa . jual ayat , jual mayat , ganti atribut agama lain oleh fpi biadab , apa menurut lo itu benar ? bukan nya itu meresahkan rakyat dan bangsa ? kalau waras coba di pikir lebih dalam . dasar ulah orang-orang sok suci sampai merusak kerukunan bangsa .",2,ya maka dari itu yang say dari tadi juga apa sell ayat sell mayat change attribute agama lain oleh fpi savage apa menurut lo itu benar bukan his itu meresahkan rakyat dan nation kalau waras coba di pikir lebih dalam dasar ulah sok suci sampai damage kerukunan nation,0.8567043542861938,2,[0.0029 0.002  0.9952],2,[0.0031 0.0021 0.9948],"{'jual': 'sell', 'biadab': 'savage', 'bangsa': 'nation', 'dibilang': 'say', 'ganti': 'change', 'lo': 'lo', 'nya': 'his', 'merusak': 'damage', 'atribut': 'attribute'}",13.23,,,,
"walaupun sejujur nya saya sering melewat tempat ini , tapi memang jarang mempunyai niat untuk mencoba nya . lalu saat ada kesempatan untuk mencoba , ternyata tidak buruk juga . rasa kuah nya enak , dan bisa diri nya sehingga bisa berganti-ganti . menu suki nya pun cukup variatif , hanya saja mungkin akan lebih menarik jika pilihan suki nya dipajang sehingga kita bisa mengambil sendiri . lalu ada pilihan dim sum nya juga .",0,walaupun sejujur his saya sering melewat tempat ini tapi memang jarang mempunyai niat untuk mencoba his lalu saat ada chance untuk mencoba ternyata tidak bad juga rasa broth his nice dan bisa diri his sehingga bisa menu suki his pun cukup variatif hanya saja mungkin akan lebih menarik jika pilihan suki his dipajang sehingga kita bisa mengambil sendiri lalu ada pilihan dim sum his juga,0.8323602676391602,0,[0.9972 0.001  0.0018],0,[0.9919 0.0028 0.0053],"{'buruk': 'bad', 'nya': 'his', 'kuah': 'broth', 'sum': 'sum', 'enak': 'nice', 'suki': 'suki', 'kesempatan': 'chance', 'menu': 'menu'}",14.2,,,,
"siapa yang menyangka , konsep restoran satu ini hanya ada satu di indonesia . konsep menyantap sajian makanan dan minuman dari one eighty coffe music , tidak hanya dilakukan di atas lantai seperti restoran pada umum nya . namun anda bisa menyantap hidangan di atas kolam renang yang berukuran sekitar 6x8 meter . posisi yang disediakan adalah duduk seperti pada umum nya . unik dan sangat menarik .",0,siapa yang menyangka konsep restaurant satu ini hanya ada satu di indonesia konsep menyantap sajian food dan drink dari one eighty coffee music tidak hanya dilakukan di atas lantai seperti restaurant pada umum his namun anda bisa menyantap hidangan di atas pool renang yang berukuran sekitar 6x8 meter posisi yang provided adalah sit seperti pada umum his unique dan sangat interesting,0.9038684368133545,0,[0.9968 0.0013 0.0019],0,[0.9948 0.0025 0.0027],"{'nya': 'his', 'disediakan': 'provided', 'duduk': 'sit', 'menarik': 'interesting', 'coffe': 'coffee', 'makanan': 'food', 'minuman': 'drink', 'restoran': 'restaurant', 'unik': 'unique', 'kolam': 'pool', 'eighty': 'eighty'}",14.14,,,,
