label,tweet,perturbed_text,perturbed_semantic_sim,pred_label,pred_proba,perturbed_label,perturbed_proba,translated_word(s),running_time(s),before_attack_acc,after_attack_acc,avg_semantic_sim,avg_running_time(s)
3,"[USERNAME] [USERNAME] hahahahah anjir sama, gue waktu itu sempet takut muka gue penuh dengan rambut rambut halus yg numbuh gara gara aloevera:(",USERNAME USERNAME hahahahah anchor sama gue waktu itu sempet takut muka gue penuh dengan hair hair fine yg numbuh gara gara aloevera,0.8934067487716675,3,[0.0096 0.0048 0.0067 0.9756 0.0034],3,[0.0095 0.0066 0.0081 0.9713 0.0046],"{'halus': 'fine', 'anjir': 'anchor', 'rambut': 'hair'}",6.6,,,,
1,Kalau berita ini benar.. Sungguh menggelikan sekaligus menjijikkan... Lebih parah merendahkan martabat diri bangsa dan masyarakat Indonesia... Semoga itu Hoax... [USERNAME] [USERNAME] [USERNAME] [USERNAME] [URL] [URL],Kalau berita ini benar.. Sungguh menggelikan sekaligus menjijikkan... Lebih parah merendahkan martabat diri bangsa dan masyarakat Indonesia... Semoga itu Hoax... [USERNAME] [USERNAME] [USERNAME] [USERNAME] [URL] [URL],1.0,3,[0.0456 0.2097 0.0035 0.7343 0.0069],3,[0.0456 0.2097 0.0035 0.7343 0.0069],,0.02,,,,
1,[USERNAME] no telepon 02122302243 Sudah dr kemaren useetv sy layar blank.. Tolong segera dieprbaiki. Dan tolong segera kirim teknisi ke lapangan.. Sy menunggu 1 jam lagi.. Tolonf konfirmasinya Sy hrs pergi kerja Jangan pelanggan hanya disuruh menunggu I,USERNAME no telepon 02122302243 Sudah dr kemaren useetv sy layar blank Tolong segera dieprbaiki And tolong segera kirim teknisi ke lapangan Sy waiting 1 jam lagi Please help konfirmasinya Sy hrs pergi kerja Jangan customer hanya ordered waiting I,0.8593151569366455,1,[0.0714 0.8848 0.0012 0.0384 0.0043],1,[0.2028 0.7092 0.0036 0.073  0.0114],"{'pelanggan': 'customer', 'USERNAME': 'USERNAME', 'menunggu': 'waiting', 'disuruh': 'ordered', 'Dan': 'And', 'Tolonf': 'Please help'}",8.71,,,,
2,Romantis buat aing itu ketika melakukan apa yang harus dilakukan untuk sebuah hubungan dan ada saat pasangan bener-bener membutuhkan.,Romantic buat aing itu ketika melakukan apa yang harus dilakukan untuk sebuah hubungan dan ada saat pasangan membutuhkan,0.9586455821990967,2,[0.0113 0.0016 0.9609 0.0039 0.0223],2,[0.0219 0.0032 0.8551 0.0049 0.1148],{'Romantis': 'Romantic'},5.13,,,,
3,"Fans mana pun yang benci sama 'Curry' bakalan ttp ngakuin 3 points nya bahaya bgt Mau ngelempar dr mana pun kemungkinan bola masuknya itu 99,99%",Fans mana pun yang benci sama bakalan ttp ngakuin 3 points his bahaya bgt Want to ngelempar dr mana pun kemungkinan bola masuknya itu,0.8958390355110168,3,[0.0213 0.0567 0.004  0.9139 0.0042],3,[0.0837 0.4379 0.0044 0.4673 0.0068],"{'nya': 'his', 'Mau': 'Want to'}",5.82,,,,
1,Ahoker PDIP ini kenapa ya gak pernah obyektif menilai prestasi? Kenapa Ahok selalu diklaim paling berprestasi? Penyesatan opini publik adalah jahat menurut saya sih [URL],Ahoker PDIP ini kenapa ya gak pernah obyektif menilai prestasi Kenapa Ahok selalu diklaim paling berprestasi Penyesatan opini publik adalah wicked menurut saya sih URL,0.9785881638526917,1,[0.0305 0.9501 0.0029 0.0097 0.0069],1,[0.0408 0.9398 0.0029 0.0091 0.0074],"{'Ahoker': 'Ahoker', 'jahat': 'wicked', 'Ahok': 'Ahok'}",6.99,,,,
4,"Yg pernah atau sedang ngejalanin usaha pasti tau lika liku keunikan konsumen. Prinsip gue, selama bisa gue penuhin permintaannya, I will do it. Walaupun bagi gua aneh.",Yg pernah atau sedang ngejalanin usaha pasti tau like liku keunikan konsumen Principle gue selama bisa gue penuhin permintaannya I will do it Although bagi cave aneh,0.9247213006019592,4,[0.0481 0.0164 0.1958 0.0172 0.7225],4,[0.0528 0.0164 0.0959 0.0116 0.8233],"{'Walaupun': 'Although', 'Prinsip': 'Principle', 'lika': 'like', 'gua': 'cave'}",6.8,,,,
2,"Selamat Ulang Tahun Yaa Istriku Semoga Sehat Dan Panjang Umur Selalu ,, Semakin Di Beri Kesabaran Dan Selalu Tulus Merawat Kedua Anak Kita ... Love u",Selamat Ulang Tahun Yaa My wife Semoga Sehat Dan Panjang Umur Selalu Semakin Di Beri Kesabaran Dan Selalu Tulus Nurse Kedua Anak Kita love u,0.9427759647369385,2,[0.0127 0.0023 0.8729 0.0055 0.1067],2,[0.0144 0.003  0.7432 0.0062 0.2331],"{'Love': 'love', 'Istriku': 'My wife', 'u': 'u', 'Merawat': 'Nurse'}",6.59,,,,
4,"Ini yang kami sebut KEBAHAGIAAN Member SJ mungkin sering berubah karna tugas mereka untuk negara, tetapi aku tidak bisa menyembunyikan kegembiraanku. Tahun depan kami menyelesaikan perjalanan panjang kami mengirim oppa kami utk mendaftar wajib militer #ReturnOfTheLittlePrince [URL]",Ini yang kami sebut KEBAHAGIAAN Member SJ mungkin sering berubah karna tugas mereka untuk country tetapi aku tidak bisa hide kegembiraanku Tahun depan kami menyelesaikan journey panjang kami mengirim oppa kami utk mendaftar wajib militer ReturnOfTheLittlePrince URL,0.966558575630188,4,[0.0174 0.0031 0.0158 0.0057 0.958 ],4,[0.0197 0.0036 0.0222 0.0059 0.9486],"{'SJ': 'SJ', 'menyembunyikan': 'hide', 'negara': 'country', 'perjalanan': 'journey'}",7.13,,,,
1,"[USERNAME] Betul betul mbah sya juga heran kok masih ada prof,kyai,dan buya yang mau dibawah rok siembok yang setahu saya selama sekolah tidak terdapat satupun tulisan ataupun artikel yang memuat jasa siembok terhadap negara",USERNAME Betul betul mbah sya juga heran kok masih ada prof kyai dan buya yang mau dibawah rok siembok yang setahu saya selama sekolah tidak terdapat satupun tulisan ataupun article yang memuat jasa siembok terhadap country,0.9580273628234863,1,[0.4002 0.5495 0.0034 0.0391 0.0079],1,[0.4179 0.5231 0.0031 0.0479 0.008 ],"{'buya': 'buya', 'artikel': 'article', 'negara': 'country', 'kyai': 'kyai'}",6.79,,,,
1,"[USERNAME] Namanya juga kerja a -_- harus profesional, kalo gak profesional mau makan apa neng? Cinta? Gak kenyang neng lebih suka makan daging apalagi yg bakarnya aa!","[USERNAME] Namanya juga kerja a -_- harus profesional, kalo gak profesional mau makan apa neng? Cinta? Gak kenyang neng lebih suka makan daging apalagi yg bakarnya aa!",1.0,0,[0.8441 0.109  0.0042 0.0328 0.0098],0,[0.8441 0.109  0.0042 0.0328 0.0098],,0.02,,,,
0,"Berkumpul dengan temen-temen SMP, yes SMP. Yg pernah berjuang bersama 14 taun yg lalu. Udah jadi bapak dan calon bapak. Saya sih harusnya udah jadi calon bapak juga, kalau saja taun lalu, iya taun lalu, ah sudahlah haha.","Berkumpul dengan temen-temen SMP, yes SMP. Yg pernah berjuang bersama 14 taun yg lalu. Udah jadi bapak dan calon bapak. Saya sih harusnya udah jadi calon bapak juga, kalau saja taun lalu, iya taun lalu, ah sudahlah haha.",1.0,4,[0.096  0.0031 0.0204 0.0059 0.8746],4,[0.096  0.0031 0.0204 0.0059 0.8746],,0.02,,,,
2,"[USERNAME] tidak terasa, sudah seminggu yang lalu berjumpa. sejak pertemuan pertama kita, aku semakin cinta terhadap masing-masing member. kini aku selalu terbayang-bayang dengan kehadiran sosok kalian setiap mendengar lagu kalian.",USERNAME tidak terasa sudah seminggu yang lalu berjumpa sejak pertemuan pertama kita aku semakin love terhadap member kini aku selalu dengan kehadiran sosok kalian setiap mendengar lagu kalian,0.9854195713996887,2,[0.0094 0.0015 0.9777 0.0028 0.0085],2,[0.0137 0.0015 0.968  0.0025 0.0144],"{'cinta': 'love', 'member': 'member'}",6.12,,,,
1,"[USERNAME] [USERNAME] Maunya hadiahnya aja (khayru ummah), perintahnya (menyuruh kepada yg ma'ruf dan mencegah yg Munkar) ogah. Ibarat pengen kenyang tapi ogah makan.",USERNAME USERNAME Wants hadiahnya aja khayru ummah the order menyuruh kepada yg dan mencegah yg Munkar ogah Ibarat pengen kenyang tapi ogah makan,0.9548064470291138,1,[0.1909 0.7834 0.0017 0.0132 0.0109],0,[0.6061 0.3374 0.0024 0.0193 0.0348],"{'perintahnya': 'the order', 'Maunya': 'Wants', 'khayru': 'khayru'}",7.46,,,,
1,"[USERNAME] Selamat malam, seyogyanya jalur sepeda hanya utk sepeda, dan trotoar utk pejalan kaki, sesuai dg UU No.22/2009. Parkir sembarangan adlah tindakan ""pura2 tidak tahu"". Saya yakin, manajemen [USERNAME] tahu UU tsb. #MariTertibLantas [USERNAME]",USERNAME Selamat malam should be jalur sepeda hanya utk sepeda dan trotoar utk pejalan kaki sesuai dg UU Parkir sembarangan adlah tindakan pura2 tidak tahu Saya yakin manajemen USERNAME tahu UU tb Let's Order then USERNAME,0.933912456035614,1,[3.280e-02 9.372e-01 9.000e-04 2.440e-02 4.700e-03],1,[0.0392 0.9313 0.0015 0.0215 0.0065],"{'MariTertibLantas': ""Let's Order then"", 'USERNAME': 'USERNAME', 'tsb': 'tb', 'seyogyanya': 'should be'}",9.8,,,,
0,"w suka heran ya sama bapak bapak, abang abang, yg makan siang dirumah makan dikerumunan orang banyak saat bulan puasa. rasa malu nya dimana itu lho","w suka heran ya sama bapak bapak, abang abang, yg makan siang dirumah makan dikerumunan orang banyak saat bulan puasa. rasa malu nya dimana itu lho",1.0,3,[0.0575 0.0137 0.0051 0.9195 0.0042],3,[0.0575 0.0137 0.0051 0.9195 0.0042],,0.02,,,,
0, Turut berduka cita buat kawan a cak. Semoga. Keluarga yg di tinggalkan a. Bisa di beri kesabaran &amp meridoi kepergian alm.. #sajete #wani,Turut mourn dream buat kawan a cak Semoga Keluarga yg di tinggalkan Bisa di beri kesabaran amp meridoi kepergian alm sajete wani,0.9104881286621094,0,[0.9461 0.0059 0.0119 0.0267 0.0094],3,[0.4582 0.0122 0.0136 0.5049 0.0112],"{'cita': 'dream', 'berduka': 'mourn', 'cak': 'cak'}",6.42,,,,
1,Situ mo ngelacur di mana n dibayar berapa bukan urusan sini ... sini cuman gasukak kalo situ salah gamo minta maap .. etapi bukan urusan situ jugak si sini mo sukak or enggak ma situ ...,Situ mo ngelacur di mana n paid berapa bukan urusan sini sini cuman happy kalo situ salah gamo minta maap etapi bukan urusan situ jugak si sini mo sukak or enggak ma situ,0.9693304300308228,1,[0.0133 0.9745 0.0015 0.0068 0.0039],1,[0.0235 0.964  0.0014 0.0065 0.0047],"{'dibayar': 'paid', 'gasukak': 'happy', 'mo': 'mo', 'n': 'n'}",7.89,,,,
3,"Kemaren di belakang kampus juga, ada anak kambing asal nyebrang. Eh kambing nya b ajha yang nyebrang w yang histeris takut mereka ketabrak :((",Kemaren di belakang kampus juga ada anak kambing asal nyebrang Uh kambing nya b ajha yang nyebrang w yang histeris afraid mereka ketabrak,0.9775655269622803,3,[0.0137 0.0041 0.0039 0.9757 0.0026],3,[0.0154 0.0093 0.0028 0.9693 0.0032],"{'takut': 'afraid', 'w': 'w', 'Eh': 'Uh'}",6.54,,,,
4,makasih mba novitasarilaras sudah service macbook di [USERNAME] @ Auditorium Nurcholish Madjid - Universitas Paramadina,thanks mba novitasarilaras sudah service macbook di USERNAME Auditorium Nurcholish Madjid Universitas Paramadina,0.918415904045105,4,[0.0215 0.0132 0.0127 0.0105 0.942 ],4,[0.0317 0.0198 0.014  0.015  0.9195],"{'makasih': 'thanks', 'novitasarilaras': 'novitasarilaras'}",6.38,,,,
3,"sangat tidak mudah mjd keluarga korban pencabulan, beberapa keluarga yg memilih menutup buku kasus, karena takut aib akan tersebar. lebih milih kyk gitu, trauma anak jd nomor 2",sangat tidak mudah mjd keluarga korban molestation beberapa keluarga which memilih close buku kasus karena takut aib akan tersebar lebih milih kyk gitu trauma anak jd nomor 2,0.8971625566482544,3,[0.0136 0.0047 0.004  0.9754 0.0024],3,[0.0116 0.0081 0.0066 0.9693 0.0043],"{'pencabulan': 'molestation', 'trauma': 'trauma', 'menutup': 'close', 'yg': 'which'}",6.84,,,,
0,"Walopun lebaran msh lama nuansa maaf memaafkan sdh menyebar kemana2 .Td ke ATM,Katanya Maaf saldo anda tdk mencukupi. Gw coba telfon tmn ,eh operator jg minta maaf. Katanya Maaf pulsa anda tdk cukup utk melakukan panggilan ini #recehkantwitter","Walopun lebaran msh lama nuansa maaf memaafkan sdh menyebar kemana2 .Td ke ATM,Katanya Maaf saldo anda tdk mencukupi. Gw coba telfon tmn ,eh operator jg minta maaf. Katanya Maaf pulsa anda tdk cukup utk melakukan panggilan ini #recehkantwitter",1.0,1,[0.0906 0.8864 0.0022 0.0159 0.0049],1,[0.0906 0.8864 0.0022 0.0159 0.0049],,0.02,,,,
1,"Malah Lu harusnya tanya ke IG nya langsung, yang menghapus yg punya akun atau dari kebijakan IGnya? Pastikan... jangan melulu salahkan rezim.... kalau ternyata bukan akibat rezim itu ntar masuknya fitnah.... n",Malah Lu harusnya tanya ke IG nya langsung yang delete yg punya akun atau dari policy IGnya Pastikan jangan melulu blame rezim kalau ternyata bukan akibat rezim itu later masuknya fitnah n,0.9091871380805969,1,[0.0157 0.9668 0.0012 0.0126 0.0037],1,[0.0238 0.9463 0.0013 0.0241 0.0045],"{'menghapus': 'delete', 'kebijakan': 'policy', 'ntar': 'later', 'salahkan': 'blame'}",7.31,,,,
1,"kalian para wanita dgn mudah berkata: ""kami tdk butuh ketampanan, kami hanya butuh kenyamanan.."" kami para pria berpikir keras setengah hidup: ""yakin cuk? apa kalau kami gak tampan kalian bisa nyaman? hah? hah? hah? wtf! bullshit!"" hee ~ #relationshit",kalian para wanita dgn mudah berkata kami tdk butuh ketampanan kami hanya butuh kenyamanan kami para pria berpikir keras setengah life yakin cuk apa kalau kami gak handsome kalian bisa nyaman hah hah hah wtf bullshit hee relationshit,0.9725897908210754,1,[0.0508 0.9353 0.0021 0.007  0.0047],1,[0.0247 0.9648 0.0018 0.0053 0.0035],"{'bullshit': 'bullshit', 'tampan': 'handsome', 'hidup': 'life', 'hah': 'hah'}",7.22,,,,
0,"Apabila kamu sudah tidak dianggap ada, jangan merasa bahwa kamu itu invisible, tapi merasalah intangible. Seenggaknya kamu tetap berharga meskipun tidak berwujud. #skripsibaper #kapanmarineeeeeeeeyaAllah","Apabila kamu sudah tidak dianggap ada, jangan merasa bahwa kamu itu invisible, tapi merasalah intangible. Seenggaknya kamu tetap berharga meskipun tidak berwujud. #skripsibaper #kapanmarineeeeeeeeyaAllah",1.0,4,[0.0662 0.0034 0.0889 0.0068 0.8346],4,[0.0662 0.0034 0.0889 0.0068 0.8346],,0.08,,,,
0,"Tahun ini juga mau maksain. Kemaren mau mati gara2 cicilan harian 150rb/hari (cicilan lebaran 10rb/hr, dapetnya 3jt, gw ikut 15biji). Beratnya krn gw dan istri usaha bareng, namanya usaha, ada pasang surut, jadi blm mapan. Megap-megap dah",Year ini juga mau maksain Kemaren mau mati gara2 cicilan harian cicilan lebaran dapetnya 3jt gw ikut 15biji weight krn gw dan istri business bareng his name business ada pasang surut jadi blm established dah,0.8950430154800415,0,[0.6451 0.0241 0.005  0.3167 0.009 ],0,[0.6568 0.0991 0.0037 0.23   0.0104],"{'Tahun': 'Year', 'Beratnya': 'weight', 'usaha': 'business', 'mapan': 'established', 'namanya': 'his name'}",8.29,,,,
0,"#SaveViaVallen lagi marak. Hanya opini saja, saya malah support mbavia. Yang menyedihkan banyak yang anggap itu lelucon, makin aneh lagi banyak perempuan yang memojokkan mbavia, fanatisme yang tinggi membuat empati kehilangan tempat.",SaveViaVallen lagi marak Hanya opinion saja saya malah support mbavia Yang menyedihkan banyak yang anggap itu lelucon makin aneh lagi banyak perempuan yang memojokkan mbavia fanatisme yang tinggi membuat empati kehilangan tempat,0.9885931015014648,0,[0.5295 0.4355 0.0041 0.0242 0.0067],1,[0.0407 0.9468 0.0017 0.0067 0.004 ],"{'support': 'support', 'opini': 'opinion', 'mbavia': 'mbavia'}",7.4,,,,
1,sudah ngaku saja ci haha enga lah enak saja kamu -_-,sudah ngaku saja ci haha enga lah enak saja kamu -_-,1.0,0,[0.9078 0.0525 0.0039 0.0285 0.0072],0,[0.9078 0.0525 0.0039 0.0285 0.0072],,0.02,,,,
2,"Cinta itu sederhana. Aku dan kamu, dan tidak ada yang lain. Aku untukmu, dan kamu untukku. Yang lain cuma nonton.",Cinta itu sederhana I dan kamu dan tidak ada yang lain I untukmu dan kamu untukku Yang lain cuma nonton,0.9581097364425659,2,[0.0147 0.002  0.9737 0.0041 0.0055],2,[0.02   0.0021 0.9687 0.0039 0.0053],{'Aku': 'I'},6.23,,,,
3,Hanya mampu retweet bagi peminat cerita seram tengok je lah. Saya penakut. Kalau tengok kat wayang ni dengar suara aku sorang je menjerit walaupun tutup mata,Hanya mampu retweet bagi peminat cerita spooky tengok je lah I Coward If tengok kat wayang ni dengar suara aku sorang je menjerit walaupun tutup mata,0.9012605547904968,3,[0.0344 0.0061 0.0052 0.9501 0.0043],0,[0.8043 0.0191 0.0098 0.149  0.0177],"{'penakut': 'Coward', 'seram': 'spooky', 'Saya': 'I', 'Kalau': 'If'}",6.52,,,,
1,[USERNAME] [USERNAME] Inilah Contoh Manusia Yg Buta Matanya.Udh Tau Ok Oce Dn Dp 0% Hanya tipu Muslihat.Mau Di Bilang Ada Paktanya.Udh Ga Waras Ya Loe.,USERNAME USERNAME here Contoh Manusia Yg Buta Tau Ok Oce Dn Dp 0 Hanya tipu Di say Exist Ga Waras Yes Loe,0.9145233631134033,1,[0.0126 0.9756 0.002  0.0053 0.0046],1,[0.0123 0.9774 0.0012 0.006  0.0031],"{'Inilah': 'here', 'Bilang': 'say', 'Ya': 'Yes', 'Ada': 'Exist'}",6.96,,,,
1,Astaghfirullah baru jam 10 gw udah istighfar aja mo marah-marahin orang 'please refer to my last e-mail' alias BITCH I JUST SAID SO WHY ARE YOU ASKING AGAIN,Astaghfirullah baru jam 10 gw udah istighfar aja mo orang refer to my last alias BITCH I JUST SAID SO WHY ARE YOU ASKING AGAIN,0.9439493417739868,1,[0.0129 0.9755 0.0013 0.0071 0.0033],1,[0.0616 0.9204 0.0015 0.0116 0.0049],"{'ASKING': 'ASKING', 'YOU': 'YOU', 'ARE': 'ARE', 'AGAIN': 'AGAIN'}",8.04,,,,
1,"[USERNAME] Sudah, jawabannya sama, no HP/billing/NPWP dll tidak terdaftar. Bagaimana mungkin belum terdaftar wong saya mendaftar di kantor BPJSTK di Menara Jamsostek kok. Dan mengapa pakai tokopedia bisa? (Pakai tokopedia kena biaya admin).",USERNAME Sudah the answer sama no dll tidak terdaftar Bagaimana mungkin belum terdaftar wong saya mendaftar di office BPJSTK di Menara Jamsostek kok Dan mengapa pakai tokopedia bisa Use tokopedia kena biaya admin,0.9634624719619751,1,[0.0668 0.8821 0.0029 0.0401 0.0081],1,[0.0708 0.8824 0.0042 0.0317 0.011 ],"{'kantor': 'office', 'USERNAME': 'USERNAME', 'jawabannya': 'the answer', 'Pakai': 'Use'}",6.91,,,,
0,Kalo inget hari itu worst bgt sih. Kebetulan emang lg berusaha buka hati buat orang lain krn yaduuu capek bgt nungguin orang 3tahun ga dapet2. Eh sekalinya dapet apes. (Part 2) [URL],Kalo inget hari itu worst bgt sih Accidental emang lg berusaha buka heart buat orang lain krn yaduuu tired bgt wait orang 3tahun ga dapet2 Eh sekalinya got apes Part 2 URL,0.9503573775291443,0,[0.6944 0.0136 0.0056 0.2738 0.0126],0,[0.483  0.021  0.0045 0.4826 0.0089],"{'capek': 'tired', 'hati': 'heart', 'dapet': 'got', 'nungguin': 'wait', 'Kebetulan': 'Accidental'}",7.92,,,,
0,"lg di dlm kereta, lihat keluar jendela kaca cuma kelihatan lihat lampu2 kota,lgunya [USERNAME] the truth untold ini bikin baper maximal","lg di dlm kereta, lihat keluar jendela kaca cuma kelihatan lihat lampu2 kota,lgunya [USERNAME] the truth untold ini bikin baper maximal",1.0,3,[0.4422 0.019  0.0079 0.5218 0.0092],3,[0.4422 0.019  0.0079 0.5218 0.0092],,0.02,,,,
3,"Siapapun besok tolong ingetin AA tommy yah Selasa 5 Juni 2018 Jam 15.00 Tolong Sms/telp/wa Takut AA nya ketinggalan info dari travelo*a Deg deg an nihh semoga dapet nonton piala dunia langsung *gak bakal bisa tidur nyenyak malam ini , nunggu pengumuman besok*",Siapapun besok help remember A A tommy yah Selasa 5 Juni 2018 Jam Tolong Afraid A A nya ketinggalan info dari travelo a deg deg an here semoga dapet nonton piala dunia langsung gak bakal bisa tidur nyenyak malam ini nunggu pengumuman besok,0.9189491868019104,3,[0.0135 0.006  0.0033 0.9739 0.0033],3,[0.1164 0.0254 0.005  0.8428 0.0104],"{'nihh': 'here', 'ingetin': 'remember', 'Deg': 'deg', 'deg': 'deg', 'Takut': 'Afraid', 'tolong': 'help', 'AA': 'A A'}",8.84,,,,
1,"[USERNAME] Barang kiriman saya no resi 013150189591518 kok belum diantar ya? Padahal tgl 5/6 jam 09.24 wib sdh di Angke, masih pagi tapi kok gak diteruskan ke alamat tujuan? [URL]",USERNAME Barang kiriman saya no resi 013150189591518 kok belum diantar ya Padahal tgl jam wib sdh di Angke masih pagi tapi kok gak continue ke address tujuan URL,0.9593865871429443,1,[0.0597 0.8716 0.0018 0.0611 0.0058],1,[0.0503 0.9124 0.0014 0.0304 0.0055],"{'diteruskan': 'continue', '013150189591518': '013150189591518', 'URL': 'URL', 'alamat': 'address'}",6.33,,,,
2,"ENGGAAAAAAA. KARNA SAYANG ITU TIDA MEMANDANG UMUR. KARNA AKU BAKALAN BUCININ PASANGAN AKU, JADI MAU TUA ATAU MUDA NYA DIA BAKALAN AKU IKUTIN TERUSSD",ENGGAAAAAAA KARNA DEAR THAT TIDA MEMANDANG UMUR KARNA AKU BAKALAN BUCININ PASANGAN AKU JADI MAU TUA ATAU MUDA HIS DIA BAKALAN AKU FOLLOW TERUSSD,0.9162561893463135,2,[0.0098 0.0024 0.9783 0.0035 0.0059],2,[0.0279 0.0228 0.9292 0.0061 0.0141],"{'SAYANG': 'DEAR', 'NYA': 'HIS', 'ITU': 'THAT', 'IKUTIN': 'FOLLOW'}",6.79,,,,
1,"Sedang terjadi: seorang teman yg pas kuliah dulu sering bgt ngatain Jokowi, pemerintah ini itu lah, Jokowi ini itulah, ngechat gue dan nanya Gimana sih tipsnya biar lolos tes CPNS?",Sedang terjadi seorang teman yg pas kuliah dulu sering bgt ngatain Jokowi government ini itu lah Jokowi ini itulah chat gue dan nanya Gimana sih tipsnya biar lolos tes CPNS,0.9706833362579346,1,[0.2368 0.5439 0.0031 0.2062 0.0099],1,[0.3577 0.4382 0.0024 0.1891 0.0126],"{'Jokowi': 'Jokowi', 'pemerintah': 'government', 'ngechat': 'chat'}",7.82,,,,
3,"Lindungilah rakyat Ind dari penguasa yg dzalim ya Alloh penguasa semesta,,,kami yakin Engkau pasti akan menghancurkan org2 yg dzalim [URL]","Lindungilah rakyat Ind dari penguasa yg dzalim ya Alloh penguasa semesta,,,kami yakin Engkau pasti akan menghancurkan org2 yg dzalim [URL]",1.0,1,[0.0545 0.765  0.004  0.1666 0.0098],1,[0.0545 0.765  0.004  0.1666 0.0098],,0.02,,,,
1,Jika orang tuamu tau kamu diperlakukan seperti itu oleh pacarmu mungkin mereka tidak akan membiarkan kamu dengan lelaki itu.. di caci maki di pukul di tendang di tempat umum ... Mending tinggalin aja cowok gt mah,Jika orang tuamu tau kamu diperlakukan seperti itu oleh pacarmu mungkin mereka tidak akan membiarkan kamu dengan lelaki itu di badger maki di pukul di tendang di tempat umum Mending tinggalin just cowok gt mah,0.9741235971450806,1,[0.223  0.7425 0.0089 0.0194 0.0062],1,[0.4201 0.5295 0.013  0.0296 0.0078],"{'caci': 'badger', 'aja': 'just', 'gt': 'gt'}",7.78,,,,
4,[USERNAME] Kok banyak yg protes ye..ini pemain bagus buat sundulan..bayangin kalo oezil sama.xhaka kasih umpan lambung terus yang nyamber ini bocah..mayan kaga,[USERNAME] Kok banyak yg protes ye..ini pemain bagus buat sundulan..bayangin kalo oezil sama.xhaka kasih umpan lambung terus yang nyamber ini bocah..mayan kaga,1.0,1,[0.0204 0.9654 0.0014 0.0089 0.0039],1,[0.0204 0.9654 0.0014 0.0089 0.0039],,0.02,,,,
0,"Terimakasih saudara/iku... Kalian telah menyadarkan kami bahwa kepulangan dari persinggahan ini tidaklah memilih di mana tempat dan kapan waktunya, sebagaimana air mata tak pernah memilih tempat jatuhnya. . . . [URL]","Terimakasih saudara/iku... Kalian telah menyadarkan kami bahwa kepulangan dari persinggahan ini tidaklah memilih di mana tempat dan kapan waktunya, sebagaimana air mata tak pernah memilih tempat jatuhnya. . . . [URL]",1.0,4,[0.1444 0.0042 0.1407 0.0064 0.7043],4,[0.1444 0.0042 0.1407 0.0064 0.7043],,0.02,,,,
0,Aku menyadari bahwa kadang kita sulit ikhlas ketika kita benar-benar yakin kita seharusnya yg mendapatkannya. Kita benar-benar sudah berusaha maksimal dan merasa lebih baik dari orang lain yang berhasil mendapatkannya.,I realize bahwa kadang kita sulit ikhlas ketika kita yakin kita seharusnya yg mendapatkannya Kita sudah berusaha maksimal dan merasa lebih baik dari orang lain yang berhasil mendapatkannya,0.9729644060134888,0,[0.8862 0.0039 0.0615 0.0171 0.0314],0,[0.9476 0.0043 0.0179 0.012  0.0181],"{'menyadari': 'realize', 'Aku': 'I'}",6.18,,,,
0,"Bersamamu, aku ingin lupa pada sebuah kata pergi yg meninggalkan luka. Karna aku pernah kehilangan banyak hal yg aku miliki. Namun untukmu, aku siap kehilangan kembali banyak hal.",Bersamamu aku ingin lupa pada sebuah kata pergi which meninggalkan wound Karna aku pernah kehilangan banyak hal which aku miliki Namun untukmu aku siap kehilangan kembali banyak hal,0.9251422882080078,0,[0.8525 0.0037 0.1211 0.0135 0.0091],0,[0.8999 0.005  0.077  0.0118 0.0063],"{'luka': 'wound', 'yg': 'which'}",6.84,,,,
0,"Kini, kemarau berkepanjangan, setelah berbaris-baris doa kau kutuk hujan. Barusan, ku dengar dalam tekukan lutut mu sungguh gersang hidup ini.",Kini kemarau berkepanjangan setelah doa kau kutuk hujan Just now my dengar dalam tekukan lutut mu serious gersang hidup ini,0.8804489374160767,0,[0.8364 0.0201 0.0321 0.1056 0.0057],0,[0.8047 0.0427 0.0354 0.1043 0.0129],"{'Barusan': 'Just now', 'sungguh': 'serious', 'ku': 'my'}",6.49,,,,
4,"Masa keemasan bermain Badminton, ketika saya dan rekan saya Dwi Sulistyono menyabet Juara di kelas double junior piala bupati 2008 dan 2010. Trus semi final single junior 2007, sampe sekarang masing terngiang.",Masa keemasan bermain Badminton ketika saya dan rekan saya Dwi Sulistyono menyabet Juara di class double junior Trophy bupati 2008 dan 2010 then semi final single junior 2007 sampe sekarang masing terngiang,0.9236792325973511,4,[0.0358 0.0031 0.0209 0.0048 0.9353],0,[0.6818 0.0081 0.0182 0.0188 0.2731],"{'piala': 'Trophy', 'kelas': 'class', 'Trus': 'then', '2008': '2008'}",6.78,,,,
1,"Sebel banget deh kalo ada senior kerja yang kek gini Teh, tauuuuuuuu.... Teiung. Belom selesai nanya loh,udah di jawab, untung lagi ga pegang pisau.",Sebel banget deh kalo ada senior kerja yang cake gini Teh tauuuuuuuu Teiung Belom selesai nanya loh udah di jawab profit lagi ga pegang knife,0.909339189529419,1,[0.0399 0.8387 0.0028 0.1126 0.0059],1,[0.0159 0.9437 0.0014 0.0348 0.0042],"{'untung': 'profit', 'kek': 'cake', 'Teiung': 'Teiung', 'pisau': 'knife'}",7.66,,,,
0,"mon maap, bukan mau jadi party pooper, cuman itu fakultas disebrang jalan rektorat masi banyak yg nafas HTI. tulung diciduk dulu bu. tengs. [URL]","mon maap, bukan mau jadi party pooper, cuman itu fakultas disebrang jalan rektorat masi banyak yg nafas HTI. tulung diciduk dulu bu. tengs. [URL]",1.0,1,[0.028  0.9572 0.001  0.0098 0.0039],1,[0.028  0.9572 0.001  0.0098 0.0039],,0.02,,,,
