text,sentiment,perturbed_text,perturbed_semantic_sim,pred_label,pred_proba,perturbed_label,perturbed_proba,translated_word(s),adv_pred,adv_pred_on_orig,running_time(s),before_attack_acc,after_attack_acc,avg_semantic_sim,avg_running_time(s),adv_training,delta_acc,delta_adv,acc_adv_training_on_orig,best_epoch
"aku lagi makan mangga potong ! aku suka banget buah mangga , besok kalau kepasar mau beli banyak-banyak lagi ah .",0,aku lagi makan mangga potong aku suka banget buah mangga esok kalau kepasar mau beli lagi ah,0.98688805103302,0,[9.974e-01 1.800e-03 8.000e-04],0,[0.9977 0.0013 0.001 ],"{'suka': 'suka', 'potong': 'potong', 'buah': 'buah', 'banget': 'banget', 'beli': 'beli', 'makan': 'makan', 'besok': 'esok', 'kepasar': 'kepasar'}",0,0,0.6893,,,,,,,,,
"jaemin itu soft banget hati nya . mudah tersentuh begitu , sayang banget sama nctzen juga . inti nya dia itu suka sama yang nama nya kasih sayang . itu kenapa aku suka banget sama dia .",0,jaemin itu soft banget hati miliknya mudah tersentuh begitu sayang banget sama nctzen juga inti miliknya dia itu suka sama yang nama miliknya cinta sayang itu kenapa aku suka banget sama dia,0.9726455211639404,0,[9.984e-01 4.000e-04 1.200e-03],0,[9.979e-01 6.000e-04 1.600e-03],"{'banget': 'banget', 'kasih': 'cinta', 'suka': 'suka', 'nctzen': 'nctzen', 'hati': 'hati', 'sayang': 'sayang', 'soft': 'soft', 'inti': 'inti', 'nya': 'miliknya', 'mudah': 'mudah', 'tersentuh': 'tersentuh'}",0,0,0.8007,,,,,,,,,
"ingin rekomendasi saja buat yang tertarik kuliner bandung , bacang yang ada di jalan naripan sebelah hotel ibis styles ibis yang warna hijau . sungguh , seenak itu ! buka dari jam 5 sore sampai jam 3 dinihari kalau belum sekali . harga 8 ribu . cocok buat ajak orang tersayang nya .",0,ingin rekomendasi saja buat yang tertarik Masak bandung bacang yang ada di jalan naripan sebelah hotel ibis styles ibis yang warna hijau sungguh seenak itu buka dari jam 5 sore sampai jam 3 dinihari kalau belum sekali harga 8 ribu mengikut buat ajak orang tersayang miliknya,0.9911381006240844,0,[9.99e-01 5.00e-04 5.00e-04],0,[9.982e-01 1.000e-03 8.000e-04],"{'sebelah': 'sebelah', 'orang': 'orang', 'tersayang': 'tersayang', 'sungguh': 'sungguh', 'rekomendasi': 'rekomendasi', 'bacang': 'bacang', 'jalan': 'jalan', 'kuliner': 'Masak', 'jam': 'jam', 'warna': 'warna', 'ajak': 'ajak', 'cocok': 'mengikut', 'hijau': 'hijau', 'hotel': 'hotel', 'sore': 'sore', 'buka': 'buka', 'ibis': 'ibis', 'naripan': 'naripan', 'nya': 'miliknya', 'tertarik': 'tertarik', 'styles': 'styles'}",0,0,0.9834,,,,,,,,,
"kuliner pertama yang harus dicoba itu ketan jompo . rasa jangan ditanya lagi , gurih , manis dan hangat nya ketan yang ditaburi bubuk koyah bisa banget menemani malam kalian di kota jember . harga nya juga murah , cuma tiga ribu . suka banget .",0,Masak pertama yang harus dicoba itu ketan jompo rasa jangan ditanya lagi gurih manis dan hangat miliknya ketan yang ditaburi bubuk koyah bisa banget menemani malam kalian di kota jember harga miliknya juga murah cuma tiga ribu suka banget,0.9853963851928712,0,[9.993e-01 3.000e-04 4.000e-04],0,[9.988e-01 5.000e-04 7.000e-04],"{'hangat': 'hangat', 'manis': 'manis', 'nya': 'miliknya', 'murah': 'murah', 'bubuk': 'bubuk', 'harga': 'harga', 'banget': 'banget', 'koyah': 'koyah', 'ketan': 'ketan', 'ditaburi': 'ditaburi', 'kota': 'kota', 'jompo': 'jompo', 'kuliner': 'Masak', 'malam': 'malam', 'gurih': 'gurih', 'ribu': 'ribu'}",0,0,0.8762,,,,,,,,,
di jember itu ada tempat makan enak . nama nya warung bakaran mbak vivi . makanan nya enak-enak . bakaran nya itu pas banget matang nya . dan yang paling penting nya harga nya murah sekali untuk makanan seenak itu .,0,di jember itu ada tempat makan baik nama miliknya warung terbakar rindu vivi makanan miliknya terbakar miliknya itu pas banget matang miliknya dan yang paling penting miliknya harga miliknya murah sekali untuk makanan seenak itu,0.91567063331604,0,[9.992e-01 3.000e-04 5.000e-04],0,[9.982e-01 5.000e-04 1.300e-03],"{'mbak': 'rindu', 'nya': 'miliknya', 'pas': 'pas', 'harga': 'harga', 'matang': 'matang', 'banget': 'banget', 'makanan': 'makanan', 'nama': 'nama', 'enak': 'baik', 'makan': 'makan', 'bakaran': 'terbakar', 'warung': 'warung', 'murah': 'murah'}",0,0,0.8063,,,,,,,,,
"gue baru pertama kali ke tempat makan nama nya ayam rempah jember . rasanya bisa diadu sama makanan-makanan enak kelas atas . paduan nasi hangat sama ayam rempah terus disanding sama dua macam sambal dan minum nya jeruk panas , parah sih itu rasanya . ketagihan . bikin ingin lagi dan lagi dan lagi .",0,saya baru pertama kali ke tempat makan nama miliknya ayam rempah jember rasanya bisa diadu sama baik kelas atas paduan nasi hangat sama ayam rempah terus disanding sama dua macam sambal dan minum miliknya jeruk panas parah neraka itu rasanya ketagihan bikin ingin lagi dan lagi dan lagi,0.9834859371185304,0,[9.99e-01 3.00e-04 6.00e-04],0,[9.982e-01 4.000e-04 1.400e-03],"{'sih': 'neraka', 'ketagihan': 'ketagihan', 'panas': 'panas', 'gue': 'saya', 'bikin': 'bikin', 'ayam': 'ayam', 'enak': 'baik', 'jember': 'jember', 'minum': 'minum', 'nama': 'nama', 'nya': 'miliknya', 'jeruk': 'jeruk', 'kelas': 'kelas', 'sambal': 'sambal', 'parah': 'parah', 'makan': 'makan', 'hangat': 'hangat', 'nasi': 'nasi'}",0,0,0.9953,,,,,,,,,
di jember ada juga makanan nama nya tahu telur bangka . waktu itu belum pernah nyobain makanan yang begituan . eh sekali nya mencoba gue langsung jatuh cinta . top !,0,di jember ada juga makanan nama miliknya tahu telur bangka waktu itu belum pernah nyobain makanan yang begituan eh sekali miliknya mencoba saya langsung jatuh cinta pada,0.9674230813980104,0,[9.987e-01 5.000e-04 8.000e-04],0,[0.9927 0.0036 0.0036],"{'makanan': 'makanan', 'mencoba': 'mencoba', 'nama': 'nama', 'nya': 'miliknya', 'telur': 'telur', 'langsung': 'langsung', 'eh': 'eh', 'top': 'pada', 'bangka': 'bangka', 'gue': 'saya', 'cinta': 'cinta'}",0,0,0.7305,,,,,,,,,
pujasera okm semanggi itu salah satu tempat makan yang lagi populer di jember . asik banget buat nongkrong . wifi - nya juga kencang . kayak nya sih bakal sering-sering ke sana .,0,pujasera okm semanggi itu salah satu tempat makan yang lagi populer di jember asik banget buat nongkrong wifi nya juga kencang kayak nya neraka bakal ke sana,0.993494153022766,0,[9.99e-01 4.00e-04 6.00e-04],0,[9.965e-01 8.000e-04 2.600e-03],"{'makan': 'makan', 'populer': 'populer', 'semanggi': 'semanggi', 'salah': 'salah', 'nongkrong': 'nongkrong', 'wifi': 'wifi', 'asik': 'asik', 'okm': 'okm', 'jember': 'jember', 'kencang': 'kencang', 'banget': 'banget', 'sih': 'neraka'}",0,0,0.7669,,,,,,,,,
haha . yang baru-baru sih sudah tidak begitu terlihat absurd nya . yang rog baru malah logo mata doang keren jadi nya . lenovo legion yang baru malah lebih-lebih lagi elegan nya . kalau saya pribadi sih suka .,0,haha yang neraka sudah tidak begitu terlihat absurd miliknya yang rog baru malah logo mata doang keren jadi miliknya lenovo legion yang baru malah lagi elegan miliknya kalau saya pribadi neraka suka,0.9615334272384644,0,[9.969e-01 7.000e-04 2.500e-03],0,[0.9631 0.0019 0.035 ],"{'absurd': 'absurd', 'suka': 'suka', 'nya': 'miliknya', 'legion': 'legion', 'sih': 'neraka', 'keren': 'keren', 'pribadi': 'pribadi', 'haha': 'haha', 'mata': 'mata', 'rog': 'rog', 'logo': 'logo'}",0,0,0.7931,,,,,,,,,
"buat gue kece banget lenovo itu . saking kece nya , layar laptop lenovo yoga 920 bisa ditekuk 360 derajat ! keren banget . memang benar sih , kadang different adalah lebih baik .",0,buat saya kece banget lenovo itu saking kece miliknya layar laptop lenovo yoga 920 bisa ditekuk 360 derajat keren banget memang benar sih kadang different adalah lebih baik,0.9903691411018372,0,[0.9969 0.0013 0.0018],0,[9.978e-01 7.000e-04 1.500e-03],"{'keren': 'keren', 'lenovo': 'lenovo', 'banget': 'banget', 'nya': 'miliknya', 'layar': 'layar', 'yoga': 'yoga', 'saking': 'saking', 'laptop': 'laptop', 'different': 'different', 'kece': 'kece', 'ditekuk': 'ditekuk', 'derajat': 'derajat', 'gue': 'saya'}",0,0,0.7784,,,,,,,,,
"ultra milk ini luv banget ya . sekali nya ngeluarin flavor baru , dua-dua nya favorit ku . tapi ku lebih sayang sama yang karamel sih .",0,ultra milk ini luv banget ya sekali miliknya keluarkan flavor baru miliknya favorit ku tapi ku lebih sayang sama yang karamel sih,0.9750360250473022,0,[9.986e-01 8.000e-04 6.000e-04],0,[9.983e-01 8.000e-04 9.000e-04],"{'banget': 'banget', 'favorit': 'favorit', 'ya': 'ya', 'luv': 'luv', 'nya': 'miliknya', 'flavor': 'flavor', 'milk': 'milk', 'ku': 'ku', 'ngeluarin': 'keluarkan', 'karamel': 'karamel', 'ultra': 'ultra'}",0,0,0.7035,,,,,,,,,
big cola itu enak banget . aku suka . dia tidak jauh beda enak nya dengan minuman cola lain . ditambah dia itu harga nya lebih murah . luv banget buat orang yang suka cola kayak aku .,0,big cola itu baik banget aku suka dia tidak jauh beda baik miliknya dengan minuman cola lain ditambah dia itu harga miliknya lebih murah luv banget buat orang yang suka cola kayak aku,0.983228087425232,0,[9.992e-01 3.000e-04 5.000e-04],0,[9.99e-01 4.00e-04 6.00e-04],"{'luv': 'luv', 'banget': 'banget', 'harga': 'harga', 'ditambah': 'ditambah', 'suka': 'suka', 'minuman': 'minuman', 'enak': 'baik', 'beda': 'beda', 'nya': 'miliknya', 'kayak': 'kayak', 'cola': 'cola', 'orang': 'orang'}",0,0,0.7939,,,,,,,,,
"dulu saya haus , setelah ke indomaret dan membeli big cola haus saya hilang , gila rasanya enak banget . sejak saat itu jadi keterusan suka minumkan big cola .",0,dulu saya dahaga setelah ke indomaret dan membeli big cola dahaga saya hilang gila rasanya baik banget sejak saat itu jadi keterusan suka minumkan big cola,0.930703103542328,0,[9.983e-01 6.000e-04 1.100e-03],0,[9.977e-01 8.000e-04 1.500e-03],"{'haus': 'dahaga', 'banget': 'banget', 'enak': 'baik', 'gila': 'gila', 'cola': 'cola', 'big': 'big', 'suka': 'suka', 'indomaret': 'indomaret', 'membeli': 'membeli'}",0,0,0.776,,,,,,,,,
"bca keren banget sih pelayanan nya . selain itu , dia mikirin karyawan nya banget . setiap hari saja karyawan nya dapat cemilan popcorn . salut sama pemimpinan nya . bukan cuma mikirin kenyamanan pelanggan , tapi juga karyawan .",0,bca keren banget neraka pelayanan miliknya selain itu dia mikirin pekerja miliknya banget setiap hari saja pekerja miliknya dapat cemilan popcorn salut sama pemimpinan miliknya bukan cuma mikirin kenyamanan pelanggan tapi juga pekerja,0.9216919541358948,0,[9.986e-01 4.000e-04 1.000e-03],0,[9.946e-01 9.000e-04 4.400e-03],"{'pelayanan': 'pelayanan', 'karyawan': 'pekerja', 'banget': 'banget', 'nya': 'miliknya', 'sih': 'neraka', 'popcorn': 'popcorn', 'cemilan': 'cemilan', 'kenyamanan': 'kenyamanan', 'pelanggan': 'pelanggan', 'keren': 'keren'}",0,0,0.7688,,,,,,,,,
sumpah big cola jauh banget lebih enak daripada coca cola ! tidak terlalu manis dan tidak menyisakan pait di mulut seperti coke zero . wkwk norak ya gue baru mencoba . tapi asli enak banget .,0,sumpah big cola jauh banget lebih baik daripada koka cola tidak terlalu manis dan tidak menyisakan pait di mulut seperti coke zero wkwk norak ya saya baru mencoba tapi asli baik banget,0.9685725569725036,0,[9.979e-01 3.000e-04 1.800e-03],0,[9.854e-01 8.000e-04 1.380e-02],"{'enak': 'baik', 'mencoba': 'mencoba', 'asli': 'asli', 'manis': 'manis', 'ya': 'ya', 'gue': 'saya', 'zero': 'zero', 'cola': 'cola', 'mulut': 'mulut', 'big': 'big', 'coca': 'koka', 'coke': 'coke', 'banget': 'banget'}",0,0,0.781,,,,,,,,,
aku sayang banget sama susu ultramilk . rasanya tiap ke indomaret tidak pernah tidak beli susu itu . enak . ketagihan .,0,aku sayang banget sama susu ultramilk rasanya tiap ke indomaret tidak pernah tidak beli susu itu baik ketagihan,0.9914491772651672,0,[9.988e-01 5.000e-04 7.000e-04],0,[9.987e-01 5.000e-04 8.000e-04],"{'ultramilk': 'ultramilk', 'enak': 'baik', 'susu': 'susu', 'indomaret': 'indomaret', 'beli': 'beli', 'ketagihan': 'ketagihan', 'banget': 'banget'}",0,0,0.6869,,,,,,,,,
oppo f7 menurut gue mantap banget sih . mulai dari kamera depan nya yang bersih . terus layar nya penuh display pakai gorilla glass 5 . lalu kamera belakang nya naik tingkat banget dari yang sebelumnya . tidak menyesal gue beli ini hp .,0,oppo f7 menurut gue mantap banget neraka mulai dari kamera depan miliknya yang bersih terus layar miliknya penuh display pakai gorilla glass 5 lalu kamera belakang miliknya naik tingkat banget dari yang sebelumnya tidak menyesal gue beli ini hp,0.9725400805473328,0,[9.988e-01 4.000e-04 9.000e-04],0,[9.979e-01 5.000e-04 1.600e-03],"{'menyesal': 'menyesal', 'tingkat': 'tingkat', 'bersih': 'bersih', 'kamera': 'kamera', 'banget': 'banget', 'nya': 'miliknya', 'beli': 'beli', 'oppo': 'oppo', 'mantap': 'mantap', 'layar': 'layar', 'gorilla': 'gorilla', 'display': 'display', 'sih': 'neraka', 'penuh': 'penuh', 'pakai': 'pakai'}",0,0,0.8391,,,,,,,,,
sarapan nya enak dan pilihan nya lumayan banyak . kamar baik . ac - nya juga dingin . hotel aston gue rekomendasikan sih buat kalian-kalian yang mau menginap di hotel .,0,sarapan miliknya baik dan pilihan miliknya lumayan banyak kamar baik ac miliknya juga dingin hotel aston gue rekomendasikan neraka buat yang mau menginap di hotel,0.9423543214797974,0,[9.991e-01 4.000e-04 5.000e-04],0,[9.982e-01 7.000e-04 1.000e-03],"{'menginap': 'menginap', 'kamar': 'kamar', 'nya': 'miliknya', 'hotel': 'hotel', 'lumayan': 'lumayan', 'pilihan': 'pilihan', 'ac': 'ac', 'dingin': 'dingin', 'sih': 'neraka', 'enak': 'baik'}",0,0,0.7242,,,,,,,,,
"ini , ya , menurut gue tentang hotel aston itu , pertama staf hotel tanggap , cepat dan ramah . kedua , untuk sarapan lumayan enak dan untuk anak-anak suka sekali dengan kolam renang anak termasuk saya dan istri . ketiga yang pasti bersih .",0,ini ya menurut saya tentang hotel aston itu pertama staf hotel tanggap cepat dan ramah kedua untuk sarapan lumayan baik dan untuk suka sekali dengan kolam berenang anak termasuk saya dan istri ketiga yang pasti bersih,0.9894739985466005,0,[9.982e-01 8.000e-04 1.000e-03],0,[9.982e-01 8.000e-04 9.000e-04],"{'suka': 'suka', 'staf': 'staf', 'anak': 'anak', 'istri': 'istri', 'lumayan': 'lumayan', 'aston': 'aston', 'ramah': 'ramah', 'tanggap': 'tanggap', 'hotel': 'hotel', 'renang': 'berenang', 'cepat': 'cepat', 'enak': 'baik', 'gue': 'saya', 'ya': 'ya'}",0,0,0.8174,,,,,,,,,
kolam renang di hotel aston bikin tidak mau berenti berenang . nyaman banget . air nya bersih . tempat bilas nya nyaman .,0,kolam berenang di hotel aston bikin tidak mau berenti berenang selesa banget air miliknya bersih tempat bilas miliknya selesa,0.8897753357887268,0,[9.987e-01 5.000e-04 8.000e-04],0,[9.984e-01 6.000e-04 1.000e-03],"{'berenti': 'berenti', 'banget': 'banget', 'nyaman': 'selesa', 'bikin': 'bikin', 'bilas': 'bilas', 'berenang': 'berenang', 'renang': 'berenang', 'nya': 'miliknya', 'hotel': 'hotel', 'aston': 'aston', 'air': 'air'}",0,0,0.672,,,,,,,,,
wah keren ya persiapan bni . saya juga mendukung . semoga bisa berjalan lancar .,0,wah keren ya persiapan bni saya juga sokongan Semoga bisa berjalan lancar,0.9803842306137084,0,[0.9902 0.0078 0.0019],0,[0.9721 0.0179 0.0099],"{'mendukung': 'sokongan', 'bni': 'bni', 'keren': 'keren', 'berjalan': 'berjalan', 'ya': 'ya', 'semoga': 'Semoga'}",0,0,0.6676,,,,,,,,,
lebih enak lagi kalau nasi padang oreo momogi chocolatos . terus semua itu di campur di aduk pakai tangan ? baru dimakan . enak banget .,0,lebih baik lagi kalau nasi padang oreo momogi chocolatos terus semua itu di campurkan di aduk pakai tangan baru dimakan baik banget,0.9790036678314208,0,[9.992e-01 4.000e-04 5.000e-04],0,[0.9976 0.0012 0.0012],"{'padang': 'padang', 'campur': 'campurkan', 'banget': 'banget', 'enak': 'baik', 'chocolatos': 'chocolatos', 'nasi': 'nasi', 'pakai': 'pakai', 'tangan': 'tangan', 'aduk': 'aduk'}",0,0,0.6994,,,,,,,,,
sudah lama tidak minum ultra milk rasa stroberi . pas sekarang minum merasa enak sekali tidak tahu kenapa . ketagihan . rasanya ingin beli sekardus gede buat diminum sendiri .,0,sudah lama tidak minum ultra milk rasa stroberi pas sekarang minum merasa baik sekali tidak tahu kenapa ketagihan rasanya ingin beli sekardus gede buat diminum sendiri,0.9953169822692872,0,[0.9972 0.001  0.0019],0,[0.9943 0.0017 0.0041],"{'ketagihan': 'ketagihan', 'enak': 'baik', 'minum': 'minum', 'milk': 'milk', 'pas': 'pas', 'stroberi': 'stroberi', 'ultra': 'ultra', 'gede': 'gede'}",0,0,0.7377,,,,,,,,,
"go jek makin sini makin keren deh . semoga makin baik ya dalam pelayanan dan aplikasi nya ya go car , go jek , dan go go lainnya . chiiiiirrs .",0,go jek makin sini makin keren deh Semoga makin baik ya dalam pelayanan dan aplikasi miliknya ya go car go jek dan go go lainnya chiiiiirrs,0.9869290590286256,0,[9.98e-01 6.00e-04 1.40e-03],0,[9.966e-01 8.000e-04 2.700e-03],"{'car': 'car', 'nya': 'miliknya', 'pelayanan': 'pelayanan', 'jek': 'jek', 'go': 'go', 'aplikasi': 'aplikasi', 'deh': 'deh', 'chiiiiirrs': 'chiiiiirrs', 'semoga': 'Semoga'}",0,0,0.7308,,,,,,,,,
"go jek . kalian harus tetap ada , karena kami bukan sekadar butuh angkutan . kami juga butuh pelayanan yang prima seperti biasanya . saya sangat mendukung kalian .",0,go jek kalian harus tetap ada karena kami bukan sekadar perlukan angkutan kami juga perlukan pelayanan yang perdana seperti biasanya saya sangat sokongan kalian,0.9571347832679749,0,[0.9944 0.0021 0.0035],0,[9.932e-01 9.000e-04 5.800e-03],"{'mendukung': 'sokongan', 'pelayanan': 'pelayanan', 'prima': 'perdana', 'angkutan': 'angkutan', 'butuh': 'perlukan'}",0,0,0.702,,,,,,,,,
saya senang di bali bagus pelayanan go-jek - nya . sangat terbantu dengan keberadaan nya . memang harus ada terus supaya pelayanan nya semakin memuaskan .,0,saya senang di bali baik pelayanan miliknya sangat terbantu dengan kewujudan miliknya memang harus ada terus supaya pelayanan miliknya semakin memuaskan,0.902046799659729,0,[9.989e-01 4.000e-04 6.000e-04],0,[9.978e-01 6.000e-04 1.600e-03],"{'bagus': 'baik', 'nya': 'miliknya', 'senang': 'senang', 'pelayanan': 'pelayanan', 'keberadaan': 'kewujudan', 'terbantu': 'terbantu'}",0,0,0.6864,,,,,,,,,
kalau driver go jek tidak pelayanan prima meminta bungkus acar untuk mengambil saos tambahan hilang nafsu makan saya . bravo driver go jek .,0,kalau driver go jek tidak pelayanan prima meminta bungkus acar untuk mengambil saos tambahan hilang nafsu makan saya . bravo driver go jek .,1.0,2,[0.4934 0.004  0.5026],2,[0.4934 0.004  0.5026],,0,0,0.21,,,,,,,,,
banyak alasan saya bisa merasa puas dengan pelayanan go jek . go jek tidak pernah lepas dari tanggung jawab . itu adalah nilai plus yang belum tentu dimiliki oleh perusahaan yang lain .,0,banyak alasan saya bisa merasa puas dengan pelayanan go jek go jek tidak pernah lepas dari tanggung jawab itu adalah nilai plus yang belum tentu dimiliki oleh perusahaan yang lain,1.0000001192092896,0,[0.9972 0.0012 0.0015],0,[9.98e-01 7.00e-04 1.30e-03],"{'dimiliki': 'dimiliki', 'pelayanan': 'pelayanan', 'plus': 'plus', 'jek': 'jek', 'perusahaan': 'perusahaan', 'lepas': 'lepas', 'alasan': 'alasan', 'nilai': 'nilai', 'tanggung': 'tanggung'}",0,0,0.7487,,,,,,,,,
go jek selalu jadi inspirasi untuk perusahaan-perusahaan di indonesia . pelayanan nya bravo . selalu berkembang setiap waktu dan memberi kemudahan bagi pelanggan .,0,go jek selalu jadi inspirasi untuk di Indonesia pelayanan miliknya bravo selalu berkembang setiap waktu dan memberi kemudahan bagi pelanggan,0.980847954750061,0,[9.989e-01 4.000e-04 6.000e-04],0,[9.981e-01 8.000e-04 1.100e-03],"{'inspirasi': 'inspirasi', 'bravo': 'bravo', 'indonesia': 'Indonesia', 'go': 'go', 'nya': 'miliknya', 'pelayanan': 'pelayanan', 'jek': 'jek', 'pelanggan': 'pelanggan'}",0,0,0.6815,,,,,,,,,
suka sama hotel ibis . dia selalu bikin inovasi buat menjaga kenyamanan pelanggan . selalu konsisten juga memberi pelayanan yang terbaik untuk tamu .,0,suka sama hotel ibis dia selalu bikin inovasi buat menjaga kenyamanan pelanggan selalu konsisten juga memberi pelayanan yang terbaik untuk tamu,1.0000001192092896,0,[9.989e-01 4.000e-04 7.000e-04],0,[9.985e-01 5.000e-04 1.000e-03],"{'suka': 'suka', 'menjaga': 'menjaga', 'konsisten': 'konsisten', 'kenyamanan': 'kenyamanan', 'inovasi': 'inovasi', 'terbaik': 'terbaik', 'pelanggan': 'pelanggan', 'hotel': 'hotel', 'bikin': 'bikin'}",0,0,0.713,,,,,,,,,
"kepada yang terhormat ibu dari ayi djembarsari . selamat menunaikan tugas , bu , sebagai dirut rshs . semoga pelayanan rshs semakin baik . saya bangga kepada ibu .",0,kepada yang sayang ibu dari ayi djembarsari selamat menunaikan Kewajipan bu sebagai CEO rshs semoga pelayanan rshs semakin baik saya bangga kepada ibu,0.928093671798706,0,[0.9755 0.0193 0.0052],0,[0.9873 0.0094 0.0033],"{'bangga': 'bangga', 'djembarsari': 'djembarsari', 'rshs': 'rshs', 'ayi': 'ayi', 'pelayanan': 'pelayanan', 'terhormat': 'sayang', 'dirut': 'CEO', 'tugas': 'Kewajipan', 'bu': 'bu'}",0,0,0.7216,,,,,,,,,
terima kasih atas saran yang kamu berikan kak . kami akan selalu berusaha untuk meningkatkan pelayanan kami untuk pengalaman belanja yang lebih menyenangkan ya .,0,terima cinta atas saran yang kamu berikan kakak kami akan selalu berusaha untuk meningkatkan pelayanan kami untuk pengalaman belanja yang lebih menyenangkan ya,0.976932406425476,0,[0.7586 0.2307 0.0108],0,[0.8951 0.0894 0.0155],"{'pengalaman': 'pengalaman', 'berusaha': 'berusaha', 'kak': 'kakak', 'terima': 'terima', 'kasih': 'cinta', 'ya': 'ya', 'belanja': 'belanja', 'saran': 'saran'}",0,0,0.696,,,,,,,,,
"hai kak , terima kasih atas masukan kamu ya . saran kamu sangat berharga bagi kami . kami akan berupaya meningkatkan performa aplikasi dan pelayanan kami untuk pengalaman jual - beli yang selalu menyenangkan untuk kamu dan semua sobat shopee ya kak :",0,hai kakak terima kasih atas masukan kamu ya saran kamu sangat berharga bagi kami kami akan berupaya meningkatkan performa aplikasi dan pelayanan kami untuk pengalaman jual beli yang selalu menyenangkan untuk kamu dan semua sobat shopee ya kakak,0.9779292941093444,0,[0.9095 0.0834 0.0071],0,[0.9517 0.0405 0.0079],"{'menyenangkan': 'menyenangkan', 'shopee': 'shopee', 'sobat': 'sobat', 'jual': 'jual', 'meningkatkan': 'meningkatkan', 'masukan': 'masukan', 'berupaya': 'berupaya', 'performa': 'performa', 'aplikasi': 'aplikasi', 'pelayanan': 'pelayanan', 'pengalaman': 'pengalaman', 'kak': 'kakak', 'ya': 'ya', 'hai': 'hai', 'beli': 'beli', 'terima': 'terima'}",0,0,0.8305,,,,,,,,,
"keleveru terbaik memang , dari kualitas , kuantitas , pelayanan pun terbaik . tidak salah pilih aku .",0,keleveru terbaik memang dari kualitas kuantitas pelayanan pun terbaik tidak salah pilih aku,1.0,0,[9.983e-01 5.000e-04 1.200e-03],0,[0.9929 0.0016 0.0055],"{'pilih': 'pilih', 'pelayanan': 'pelayanan', 'terbaik': 'terbaik', 'salah': 'salah', 'kualitas': 'kualitas'}",0,0,0.6358,,,,,,,,,
cocok banget gue pakai shope . sudah mana ongkos kirim gratis . pengiriman juga aman dan lancar .,0,mengikut banget saya pakai shope sudah mana ongkos hantar gratis pengiriman juga selamat dan lancar,0.932758092880249,0,[9.98e-01 8.00e-04 1.20e-03],0,[9.977e-01 6.000e-04 1.600e-03],"{'banget': 'banget', 'gue': 'saya', 'cocok': 'mengikut', 'pengiriman': 'pengiriman', 'kirim': 'hantar', 'shope': 'shope', 'gratis': 'gratis', 'aman': 'selamat'}",0,0,0.6526,,,,,,,,,
"alhamdulillah selama beli di lazada tidak pernah bermasalah . barang-barang nya lebih lucu-lucu . pelayanan juga lebih baik dari yang lain . sudah deh kalau beli apa-apa , aku mau beli di lazada saja .",0,Alhamdulillah selama beli di lazada tidak pernah bermasalah miliknya lebih pelayanan juga lebih baik dari yang lain sudah deh kalau beli aku mau beli di lazada saja,0.9884299635887146,0,[0.9959 0.001  0.0031],0,[0.9941 0.001  0.0049],"{'beli': 'beli', 'lazada': 'lazada', 'pelayanan': 'pelayanan', 'nya': 'miliknya', 'alhamdulillah': 'Alhamdulillah'}",0,0,0.7333,,,,,,,,,
"karena shopee bukan barang shope , dia itu tempat belanjaan aku yang paling luar biasa ! pelayanan nya oke punya , disko nya banjir !",0,karena shopee bukan barang shope dia itu tempat belanjaan aku yang paling luar biasa pelayanan miliknya baik punya disko miliknya banjir,0.969091296195984,0,[9.987e-01 4.000e-04 9.000e-04],0,[0.9946 0.0013 0.0041],"{'pelayanan': 'pelayanan', 'belanjaan': 'belanjaan', 'barang': 'barang', 'oke': 'baik', 'nya': 'miliknya', 'disko': 'disko', 'shope': 'shope'}",0,0,0.6803,,,,,,,,,
"harus belanja di shopee karena shopee itu memberikan bukti pelayanan yang baik , bukan sekadar janji doang , seperti mantan itu",0,"harus belanja di shopee karena shopee itu memberikan bukti pelayanan yang baik , bukan sekadar janji doang , seperti mantan itu",1.0,2,[0.2341 0.0133 0.7525],2,[0.2341 0.0133 0.7525],,2,2,0.22,,,,,,,,,
harus belanja di shopee karena pelayanan dari shope itu benar benar memuaskan pelanggan dan takkan mengecewakan .,0,harus belanja di shopee karena pelayanan dari shope itu benar benar memuaskan pelanggan dan takkan mengecewakan,1.0000001192092896,0,[9.986e-01 5.000e-04 8.000e-04],0,[9.982e-01 5.000e-04 1.300e-03],"{'mengecewakan': 'mengecewakan', 'takkan': 'takkan', 'pelayanan': 'pelayanan', 'memuaskan': 'memuaskan', 'pelanggan': 'pelanggan', 'shope': 'shope'}",0,0,0.662,,,,,,,,,
karena hanya shope yang pelayanan nya memuaskan . diskon besar-besaran . barang nya juga pasti nya bermerek . mantap .,0,karena hanya shope yang pelayanan miliknya memuaskan diskon barang miliknya juga pasti miliknya bermerek mantap,0.8762192726135254,0,[9.987e-01 5.000e-04 8.000e-04],0,[9.977e-01 7.000e-04 1.600e-03],"{'bermerek': 'bermerek', 'mantap': 'mantap', 'nya': 'miliknya', 'pelayanan': 'pelayanan', 'diskon': 'diskon', 'shope': 'shope'}",0,0,0.6512,,,,,,,,,
shopee tidak pernah mengecewakan pelanggan selalu memberikan yang terbaik dalam pelayanan . pokok nya shopee selalu memberikan pelayanan dengan baik .,0,shopee tidak pernah mengecewakan pelanggan selalu memberikan yang terbaik dalam pelayanan pokok miliknya shopee selalu memberikan pelayanan dengan baik,0.9867826104164124,0,[9.988e-01 5.000e-04 7.000e-04],0,[9.981e-01 6.000e-04 1.300e-03],"{'mengecewakan': 'mengecewakan', 'shopee': 'shopee', 'pelayanan': 'pelayanan', 'pokok': 'pokok', 'nya': 'miliknya'}",0,0,0.67,,,,,,,,,
