text,sentiment,perturbed_text,perturbed_semantic_sim,pred_label,pred_proba,perturbed_label,perturbed_proba,translated_word(s),adv_pred,adv_pred_on_orig,running_time(s),before_attack_acc,after_attack_acc,avg_semantic_sim,avg_running_time(s),adv_training,delta_acc,delta_adv,acc_adv_training_on_orig,best_epoch
"kemarin gue datang ke tempat makan baru yang ada di dago atas . gue kira makanan nya enak karena harga nya mahal . ternyata , boro-boro . tidak mau lagi deh ke tempat itu . sudah mana tempat nya juga tidak nyaman banget , terlalu sempit .",2,kemarin saya datang ke tempat makan baru yang ada di dago atas saya kira makanan miliknya enak karena harga miliknya mahal ternyata tidak mau lagi deh ke tempat itu sudah mana tempat miliknya juga tidak selesa banget terlalu sempit,0.968470335006714,2,[9.400e-03 4.000e-04 9.903e-01],2,[1.050e-02 3.000e-04 9.891e-01],"{'nyaman': 'selesa', 'banget': 'banget', 'gue': 'saya', 'mahal': 'mahal', 'makan': 'makan', 'dago': 'dago', 'nya': 'miliknya', 'sempit': 'sempit', 'makanan': 'makanan'}",2,2,1.515,0.948,0.918,0.9771166347265244,0.695448,0.948,0.029999999999999916,-0.029999999999999916,0.962,0.0
"kayak nya sih gue tidak akan mau balik lagi ke tempat itu . gila , ya , gue enggak ngerti kenapa tempat nya dibiarkan panas . sudah begitu kotor pula . kalau panas kepanasan , kalau hujan kehujanan . harus nya sih tidak ada restoran yang kayak gitu . tidak tahu deh apa yang mereka jual .",2,kayak miliknya neraka saya tidak akan mau balik lagi ke tempat itu gila ya saya enggak faham kenapa tempat miliknya ditinggalkan panas sudah begitu kotor pula kalau panas panas kalau hujan kehujanan harus miliknya neraka tidak ada restoran yang kayak gitu tidak tahu deh apa yang mereka jual,0.9718883633613586,2,[1.100e-03 3.000e-04 9.986e-01],2,[1.100e-03 3.000e-04 9.986e-01],"{'panas': 'panas', 'kehujanan': 'kehujanan', 'kepanasan': 'panas', 'kotor': 'kotor', 'ngerti': 'faham', 'ya': 'ya', 'gila': 'gila', 'nya': 'miliknya', 'gue': 'saya', 'deh': 'deh', 'dibiarkan': 'ditinggalkan', 'kayak': 'kayak', 'sih': 'neraka', 'gitu': 'gitu', 'hujan': 'hujan'}",2,2,0.9885,,,,,,,,,
"kalau dipikir-pikir , sebenarnya tidak ada yang bisa dibanggakan dari jokowi . pertama , dia tidak bisa nepatin janji . kedua , kerjaan nya selalu pencitraan . ketiga , dia tidak pro rakyat . sudahlah . ku sudah terlanjur kecewa .",2,kalau sebenarnya tidak ada yang bisa dibanggakan dari jokowi pertama dia tidak bisa nepatin janji kedua kerjaan miliknya selalu pencitraan ketiga dia tidak pro rakyat sudahlah ku sudah terlanjur kecewa,0.9863624572753906,2,[1.100e-03 3.000e-04 9.986e-01],2,[1.000e-03 3.000e-04 9.987e-01],"{'rakyat': 'rakyat', 'terlanjur': 'terlanjur', 'pencitraan': 'pencitraan', 'dibanggakan': 'dibanggakan', 'kerjaan': 'kerjaan', 'jokowi': 'jokowi', 'nya': 'miliknya', 'nepatin': 'nepatin', 'kecewa': 'kecewa', 'ketiga': 'ketiga'}",2,2,0.8255,,,,,,,,,
"ini pertama kalinya gua ke bank buat ngurusin pembuatan rekening baru . nama nya juga orang pertama kali ya baru ke bank , gua kena semprot . kelihatan banget pelayanan pelanggan - nya tidak suka gua banyak bertanya . amit-amit . padahal itu kan tugas mereka buat melayangkan gua !",2,ini pertama kalinya saya ke bank buat ngurusin pembuatan rekening baru nama miliknya juga orang pertama masa ya baru ke bank saya kena semprot kelihatan banget pelayanan pelanggan miliknya tidak suka saya banyak bertanya padahal itu kan Kewajipan mereka buat melayangkan saya,0.9496727585792542,2,[9.000e-04 6.000e-04 9.986e-01],2,[9.000e-04 7.000e-04 9.983e-01],"{'suka': 'suka', 'melayangkan': 'melayangkan', 'pelayanan': 'pelayanan', 'semprot': 'semprot', 'banget': 'banget', 'ngurusin': 'ngurusin', 'kali': 'masa', 'gua': 'saya', 'nya': 'miliknya', 'kalinya': 'kalinya', 'pelanggan': 'pelanggan', 'ya': 'ya', 'bank': 'bank', 'tugas': 'Kewajipan', 'kena': 'kena'}",2,2,0.9103,,,,,,,,,
"waktu sampai dengan gue pernah disuruh ibu latihan karate . kata nya biar gue bisa melawan penjahat kalau ada laki-laki iseng , tapi di hari pertama latihan , kaki gue langsung cedera . jadilah sekarang trauma dan tidak mau sekali-sekali buat latihan karate lagi .",2,waktu sampai dengan saya pernah disuruh ibu latihan karate kata miliknya biar saya bisa melawan penjahat kalau ada iseng tapi di hari pertama latihan kaki saya langsung cedera jadilah sekarang trauma dan tidak mau buat latihan karate lagi,0.9729993343353271,2,[8.000e-04 7.000e-04 9.985e-01],2,[6.000e-04 6.000e-04 9.987e-01],"{'disuruh': 'disuruh', 'karate': 'karate', 'penjahat': 'penjahat', 'iseng': 'iseng', 'trauma': 'trauma', 'kaki': 'kaki', 'biar': 'biar', 'latihan': 'latihan', 'cedera': 'cedera', 'gue': 'saya', 'nya': 'miliknya'}",2,2,0.9224,,,,,,,,,
pelayanan di hotel salak bogor tidak sebagus yang gue membayangkan . fasilitas nya juga biasa banget padahal kata nya hotel bintang lima . hm . kecewa . kayak nya sih nanti-nanti tidak mau ke sana lagi .,2,pelayanan di hotel salak bogor tidak sebagus yang gue membayangkan fasilitas miliknya juga biasa banget padahal kata miliknya hotel bintang lima hm kecewa kayak miliknya neraka tidak mau ke sana lagi,0.960978627204895,2,[2.500e-03 3.000e-04 9.972e-01],2,[1.300e-03 3.000e-04 9.985e-01],"{'kayak': 'kayak', 'fasilitas': 'fasilitas', 'bogor': 'bogor', 'banget': 'banget', 'pelayanan': 'pelayanan', 'kecewa': 'kecewa', 'hm': 'hm', 'hotel': 'hotel', 'sih': 'neraka', 'nya': 'miliknya', 'membayangkan': 'membayangkan', 'salak': 'salak'}",2,2,0.7881,,,,,,,,,
ada apa dengan young lex ? kenapa dia harus mengirim hal-hal tidak berfaedah kayak gitu . merusak moral banget sumpah !,2,ada apa dengan young lex kenapa dia harus mengirim tidak berfaedah kayak gitu merusak moral banget sumpah,0.9961702227592468,2,[7.000e-04 5.000e-04 9.988e-01],2,[6.000e-04 3.000e-04 9.991e-01],"{'berfaedah': 'berfaedah', 'sumpah': 'sumpah', 'merusak': 'merusak', 'banget': 'banget', 'moral': 'moral', 'young': 'young', 'lex': 'lex', 'gitu': 'gitu'}",2,2,0.7435,,,,,,,,,
"gue pesimis sama manusia , terutama dalam ngurusin sampah . sudah berapa banyak hewan-hewan laut jadi korban gara-gara kita buang sampah ke laut . tidak tega gue liat nya . kadang tidak mengerti juga sebenarnya pemimpin-pemimpin yang ada itu pada mikirin enggak sih urusan penting kayak gini . he .",2,saya pesimis sama manusia terutama dalam ngurusin sampah sudah berapa banyak laut jadi korban kita buang sampah ke laut tidak tega saya liat miliknya kadang tidak mengerti juga sebenarnya yang ada itu pada mikirin enggak sih benda penting kayak gini dia,0.9779934883117676,2,[1.300e-03 4.000e-04 9.983e-01],2,[8.000e-04 4.000e-04 9.988e-01],"{'laut': 'laut', 'urusan': 'benda', 'kayak': 'kayak', 'mengerti': 'mengerti', 'kadang': 'kadang', 'gue': 'saya', 'nya': 'miliknya', 'sampah': 'sampah', 'gini': 'gini', 'he': 'dia', 'ngurusin': 'ngurusin', 'pesimis': 'pesimis', 'buang': 'buang', 'tega': 'tega'}",2,2,0.9427,,,,,,,,,
saya kecewa karena pengeditan biodata penumpang dilakukan by sistem tanpa konfirmasi dan solusi permasalahan nya pun dianggap sepele karena dibiarkan begitu saja sedang pelayanan pelanggan yang sudah berkali-berkali dihubungi pun hanya seperti mengulur waktu . sampai detik ini belum ada solusi untuk masalah saya yang kesalahan nya sendiri bukan dari pihak saya .,2,saya kecewa karena pengeditan biodata penumpang dilakukan by sistem tanpa konfirmasi dan solusi permasalahan miliknya pun dipertimbangkan remeh karena ditinggalkan begitu saja sedang pelayanan pelanggan yang sudah dihubungi pun hanya seperti mengulur waktu sampai detik ini belum ada solusi untuk masalah saya yang kesalahan miliknya sendiri bukan dari pihak saya,0.9840960502624512,2,[1.400e-03 7.000e-04 9.979e-01],2,[1.300e-03 4.000e-04 9.983e-01],"{'kecewa': 'kecewa', 'penumpang': 'penumpang', 'nya': 'miliknya', 'konfirmasi': 'konfirmasi', 'pengeditan': 'pengeditan', 'permasalahan': 'permasalahan', 'solusi': 'solusi', 'sistem': 'sistem', 'dianggap': 'dipertimbangkan', 'biodata': 'biodata', 'by': 'by', 'sepele': 'remeh', 'dibiarkan': 'ditinggalkan', 'kesalahan': 'kesalahan'}",2,2,1.117,,,,,,,,,
"saya hari ini melakukan pemesanan dan tiket saya tidak kunjung saya terima . padahal saya sudah menelpon pelayanan pelanggan , sudah mengirimkan email dengan bukti transfer tapi respon nya sangat lambat dan tidak jelas .",2,saya hari ini melakukan pemesanan dan tiket saya tidak kunjung saya terima padahal saya sudah menelpon pelayanan pelanggan sudah mengirimkan email dengan bukti transfer tapi respon miliknya sangat lambat dan tidak jelas,0.9918009042739868,2,[0.0015 0.002  0.9965],2,[7.000e-04 9.000e-04 9.984e-01],"{'menelpon': 'menelpon', 'lambat': 'lambat', 'pemesanan': 'pemesanan', 'terima': 'terima', 'nya': 'miliknya', 'transfer': 'transfer', 'bukti': 'bukti', 'pelanggan': 'pelanggan', 'pelayanan': 'pelayanan', 'tiket': 'tiket', 'kunjung': 'kunjung'}",2,2,0.8312,,,,,,,,,
"sangat merugikan , saya sudah memesan dan membayar tetapi e - tiket tidak ada juga , padahal bukti pembayaran sudah jelas , sudah menelepon pelayanan pelanggan berkali kali dan tidak ada solusi nya , pulsa sudah habis ratusan ribu , saya meminta kembalikan uang juga sangat lama proses nya , sangat merugikan pengguna , banyak kerugian uang transport , waktu , penginapan dll.",2,sangat merugikan saya sudah memesan dan membayar tetapi e tiket tidak ada juga padahal bukti pembayaran sudah jelas sudah menelepon pelayanan pelanggan berkali masa dan tidak ada solusi miliknya pulsa sudah habis ratusan ribu saya meminta kembalikan uang juga sangat lama proses miliknya sangat merugikan pengguna banyak kerugian uang pengangkutan waktu penginapan,0.9536991119384766,2,[1.400e-03 6.000e-04 9.981e-01],2,[8.000e-04 4.000e-04 9.988e-01],"{'pulsa': 'pulsa', 'tiket': 'tiket', 'membayar': 'membayar', 'e': 'e', 'nya': 'miliknya', 'pelayanan': 'pelayanan', 'kerugian': 'kerugian', 'memesan': 'memesan', 'bukti': 'bukti', 'pembayaran': 'pembayaran', 'pengguna': 'pengguna', 'kembalikan': 'kembalikan', 'uang': 'uang', 'merugikan': 'merugikan', 'menelepon': 'menelepon', 'penginapan': 'penginapan', 'pelanggan': 'pelanggan', 'transport': 'pengangkutan', 'solusi': 'solusi', 'habis': 'habis', 'kali': 'masa'}",2,2,1.1263,,,,,,,,,
saya itu memesan tiket dot com . sudah dibayar email belum ada balasan . bukti pembayaran sudah saya kirim by email . saya masukkan data balasan nya pemesanan kadaluarsa terus . akhirnya saya beli lagi langsung ke loket . saya minta uang kembali masih menunggu 3 - 14 hari . ambil saja uang tiket nya tidak apa-apa . sedih saya download aplikasi ini .,2,saya itu memesan tiket dot com sudah dibayar email belum ada balasan bukti pembayaran sudah saya kirim by email saya masukkan data balasan miliknya pemesanan kadaluarsa terus akhirnya saya beli lagi langsung ke loket saya minta uang kembali masih menunggu 3 14 hari ambil saja uang tiket miliknya tidak sedih saya download aplikasi ini,0.99066561460495,2,[6.000e-04 5.000e-04 9.989e-01],2,[0.0271 0.0019 0.971 ],"{'menunggu': 'menunggu', 'loket': 'loket', 'beli': 'beli', 'kadaluarsa': 'kadaluarsa', 'download': 'download', 'dot': 'dot', 'pemesanan': 'pemesanan', 'tiket': 'tiket', 'com': 'com', 'dibayar': 'dibayar', 'pembayaran': 'pembayaran', 'uang': 'uang', 'memesan': 'memesan', 'balasan': 'balasan', 'email': 'email', 'bukti': 'bukti', 'data': 'data', 'nya': 'miliknya', 'ambil': 'ambil', 'by': 'by'}",2,2,1.2005,,,,,,,,,
"saya sudah bayar tetapi etiket tidak dikirim malah kadaluwarsa , diminta struk pembayaran saya sudah tidak punya hanya sms banking . tetapi tetap saja tidak digubris dari pelayanan pelanggan - nya . sudah email dan telepon berkali-berkali tetap tidak ada hasil . sangat mengecewakan .",2,saya sudah bayar tetapi etiket tidak dikirim malah kadaluwarsa diminta resit pembayaran saya sudah tidak punya hanya sms banking tetapi tetap saja tidak diabaikan dari pelayanan pelanggan miliknya sudah email dan telepon tetap tidak ada hasil sangat mengecewakan,0.977589786052704,2,[1.400e-03 9.000e-04 9.977e-01],2,[1.500e-03 6.000e-04 9.979e-01],"{'mengecewakan': 'mengecewakan', 'pelayanan': 'pelayanan', 'kadaluwarsa': 'kadaluwarsa', 'bayar': 'bayar', 'nya': 'miliknya', 'pembayaran': 'pembayaran', 'digubris': 'diabaikan', 'sms': 'sms', 'struk': 'resit', 'telepon': 'telepon', 'pelanggan': 'pelanggan', 'email': 'email'}",2,2,0.887,,,,,,,,,
"saya mesan tiket tapi tidak dikonformasi dan proses pengembalian uang yang tidak jelas dan belum ada sampai sekarang , pelayanan nya yang sangat buruk dan saran saya jangan pesan di sini , sangat mengecewakan .",2,saya mesan tiket tapi tidak dikonformasi dan proses pengembalian uang yang tidak jelas dan belum ada sampai sekarang pelayanan nya yang sangat buruk dan saran saya jangan pesan di sini sangat mengecewakan,1.0,2,[1.100e-03 4.000e-04 9.985e-01],2,[9.000e-04 3.000e-04 9.988e-01],"{'mengecewakan': 'mengecewakan', 'dikonformasi': 'dikonformasi', 'pengembalian': 'pengembalian', 'mesan': 'mesan', 'uang': 'uang', 'pelayanan': 'pelayanan', 'proses': 'proses', 'saran': 'saran', 'tiket': 'tiket'}",2,2,0.8519,,,,,,,,,
"sangat kecewa dengan aplikasi ini , sudah ditransfer tetapi etiket tidak dikirim saya coba telepon call centre seharian tetapi sibuk terus call genre nya , mending pakai traveloka adalah untuk pesanan selanjutnya .",2,sangat kecewa dengan aplikasi ini sudah ditransfer tetapi etiket tidak dikirim saya coba telepon call pusat seharian tetapi sibuk terus call genre miliknya mending pakai traveloka adalah untuk pesanan selanjutnya,0.9645706415176392,2,[2.100e-03 8.000e-04 9.971e-01],2,[4.200e-03 7.000e-04 9.951e-01],"{'kecewa': 'kecewa', 'seharian': 'seharian', 'nya': 'miliknya', 'mending': 'mending', 'dikirim': 'dikirim', 'call': 'call', 'telepon': 'telepon', 'centre': 'pusat', 'coba': 'coba', 'ditransfer': 'ditransfer', 'genre': 'genre', 'etiket': 'etiket', 'aplikasi': 'aplikasi'}",2,2,0.829,,,,,,,,,
melihat komen nya 90 % negatif jadi pikir-pikir buat mencari tiket kereta di sini . mending aplikasi yang lain saja yang sudah terbukti bagus bertahun-bertahun .,2,melihat komen miliknya 90 negatif jadi buat mencari tiket kereta di sini mending aplikasi yang lain saja yang sudah terbukti bagus,0.9887595772743224,2,[0.008  0.0012 0.9908],2,[1.01e-02 9.00e-04 9.89e-01],"{'komen': 'komen', 'mending': 'mending', 'nya': 'miliknya', 'kereta': 'kereta', 'negatif': 'negatif', 'tiket': 'tiket', 'mencari': 'mencari'}",2,2,0.8326,,,,,,,,,
aplikasi tukang bohong . promo gratis makan tidak terjadi . komplain ke pelayanan pelanggan dengan email tidak ditanggapi . komplain by phone hanya dicatat saja tidak ada tindak lanjut . sangat tidak direkomendasikan untuk siapa pun .,2,aplikasi tukang bohong promo gratis makan tidak terjadi komplain ke pelayanan pelanggan dengan email tidak ditanggapi komplain by phone hanya dicatat saja tidak ada tindak lanjut sangat tidak disyorkan untuk siapa pun,0.9936104416847228,2,[1.300e-03 5.000e-04 9.982e-01],2,[1.500e-03 4.000e-04 9.981e-01],"{'bohong': 'bohong', 'komplain': 'komplain', 'ditanggapi': 'ditanggapi', 'phone': 'phone', 'dicatat': 'dicatat', 'by': 'by', 'tukang': 'tukang', 'email': 'email', 'direkomendasikan': 'disyorkan', 'aplikasi': 'aplikasi', 'makan': 'makan', 'tindak': 'tindak'}",2,2,0.8857,,,,,,,,,
kata nya dapat promo 100 ribu . tapi setelah di bayar di atm - nya ternyata harga normal . sudah saya kirim email tapi tidak ada balasan . mengecewakan .,2,kata miliknya dapat promo 100 ribu tapi setelah di bayar di atm miliknya ternyata harga normal sudah saya hantar email tapi tidak ada balasan mengecewakan,0.9563860297203064,2,[7.000e-04 1.100e-03 9.982e-01],2,[0.0259 0.0062 0.9679],"{'promo': 'promo', 'mengecewakan': 'mengecewakan', 'bayar': 'bayar', 'email': 'email', 'balasan': 'balasan', 'nya': 'miliknya', 'harga': 'harga', 'ribu': 'ribu', 'kirim': 'hantar'}",2,2,0.8383,,,,,,,,,
"saya sudah bayar untuk hotel tapi etiket tidak terbit , saya sudah kirim email bukti pembayaran nya tapi tetap tidak ada mengikuti naik - nya . sampai hari h mau cek - in ini . sudah menghubungi bolak balik pelayanan pelanggan sama saja ngulang-ngulang informasi dari awal . dijanjikan akan ditelpon tapi tidak dihubungi juga sampai sekarang . saya mau laporkan polisi . menyebalkan .",2,saya sudah bayar untuk hotel tapi etiket tidak terbit saya sudah hantar email bukti pembayaran miliknya tapi tetap tidak ada mengikuti naik miliknya sampai hari h mau cek dalam ini sudah menghubungi bolak balik pelayanan pelanggan sama saja informasi dari awal dijanjikan akan ditelpon tapi tidak dihubungi juga sampai sekarang saya mau laporkan polisi menyebalkan,0.982402205467224,2,[7.000e-04 8.000e-04 9.985e-01],2,[6.000e-04 7.000e-04 9.986e-01],"{'menyebalkan': 'menyebalkan', 'dijanjikan': 'dijanjikan', 'ditelpon': 'ditelpon', 'laporkan': 'laporkan', 'bolak': 'bolak', 'terbit': 'terbit', 'mengikuti': 'mengikuti', 'nya': 'miliknya', 'hotel': 'hotel', 'pelayanan': 'pelayanan', 'email': 'email', 'bukti': 'bukti', 'h': 'h', 'pembayaran': 'pembayaran', 'menghubungi': 'menghubungi', 'polisi': 'polisi', 'bayar': 'bayar', 'kirim': 'hantar', 'in': 'dalam'}",2,2,1.1925,,,,,,,,,
"saya kecewa karena saya sudah transfer dan belum dikonfirmasi saya telepon malah pelanggan sibuk terus , aduh kecewa nih gue .",2,saya kecewa karena saya sudah transfer dan belum dikonfirmasi saya telepon malah pelanggan sibuk terus aduh kecewa nih saya,0.987597107887268,2,[8.000e-04 8.000e-04 9.984e-01],2,[6.000e-04 5.000e-04 9.988e-01],"{'dikonfirmasi': 'dikonfirmasi', 'aduh': 'aduh', 'nih': 'nih', 'kecewa': 'kecewa', 'transfer': 'transfer', 'telepon': 'telepon', 'gue': 'saya'}",2,2,0.6836,,,,,,,,,
saya sudah transfer ratusan ribu dan sesuai nominal transfer . tapi tiket belum muncul juga . harus diwaspadai ini aplikasi ini . bahaya .,2,saya sudah transfer ratusan ribu dan sesuai nominal transfer tapi tiket belum muncul juga harus diwaspadai ini aplikasi ini bahaya,1.0,2,[0.0015 0.0019 0.9966],2,[6.000e-04 1.200e-03 9.983e-01],"{'muncul': 'muncul', 'diwaspadai': 'diwaspadai', 'bahaya': 'bahaya', 'tiket': 'tiket', 'aplikasi': 'aplikasi', 'transfer': 'transfer', 'nominal': 'nominal'}",2,2,0.7168,,,,,,,,,
"pelayanan pelanggan tidak respon , komentar disuruh email , email saya tidak ditanggapi , sudah beberapa hari yang lalu , sampai sekarang tidak ada respon . menyusahkan saja .",2,pelayanan pelanggan tidak respon komentar disuruh email email saya tidak ditanggapi sudah beberapa hari yang lalu sampai sekarang tidak ada respon menyusahkan saja,1.0,2,[1.000e-03 7.000e-04 9.983e-01],2,[6.00e-04 4.00e-04 9.99e-01],"{'menyusahkan': 'menyusahkan', 'ditanggapi': 'ditanggapi', 'disuruh': 'disuruh', 'respon': 'respon', 'pelanggan': 'pelanggan', 'email': 'email', 'pelayanan': 'pelayanan', 'komentar': 'komentar'}",2,2,0.7761,,,,,,,,,
tolong untuk pelayana nya diperjelas ya . sudah pesan tiket sudah dibayar tetapi dengan alasan bank bermasalah dan tidak ada pertanggungjawaban untuk memulangkan uang saja harus sampai ditelpon lagi . dikirim by email untuk komponen tidak direspon . kecewa .,2,tolong untuk pelayana miliknya diperjelas ya sudah pesan tiket sudah dibayar tetapi dengan alasan bank bermasalah dan tidak ada pertanggungjawaban untuk memulangkan uang saja harus sampai ditelpon lagi dikirim by email untuk komponen tidak direspon kecewa,0.994430661201477,2,[1.200e-03 9.000e-04 9.979e-01],2,[8.000e-04 7.000e-04 9.985e-01],"{'pertanggungjawaban': 'pertanggungjawaban', 'memulangkan': 'memulangkan', 'direspon': 'direspon', 'ditelpon': 'ditelpon', 'bermasalah': 'bermasalah', 'kecewa': 'kecewa', 'uang': 'uang', 'diperjelas': 'diperjelas', 'bank': 'bank', 'dibayar': 'dibayar', 'alasan': 'alasan', 'pelayana': 'pelayana', 'ya': 'ya', 'dikirim': 'dikirim', 'nya': 'miliknya', 'by': 'by'}",2,2,0.9109,,,,,,,,,
"luar biasa kecewa sangat dengan aplikasi ini , saya sudah hubungi pusat panggilan untuk cek pemesanan saya karena saya sudah bayar dan tidak muncul e - tiket nya , bahkan saya sudah kirim bukti transaksi nya ke e-mail , hingga saat ini tidak ada pihak pusat panggilan yang menghubungi , kecewa .",2,luar biasa kecewa sangat dengan aplikasi ini saya sudah hubungi pusat panggilan untuk cek pemesanan saya karena saya sudah bayar dan tidak muncul e tiket miliknya bahkan saya sudah kirim bukti transaksi miliknya ke hingga saat ini tidak ada pihak pusat panggilan yang menghubungi kecewa,0.981315553188324,2,[9.000e-04 7.000e-04 9.983e-01],2,[7.000e-04 6.000e-04 9.987e-01],"{'kecewa': 'kecewa', 'panggilan': 'panggilan', 'pusat': 'pusat', 'muncul': 'muncul', 'menghubungi': 'menghubungi', 'aplikasi': 'aplikasi', 'e': 'e', 'bayar': 'bayar', 'bukti': 'bukti', 'transaksi': 'transaksi', 'pemesanan': 'pemesanan', 'hubungi': 'hubungi', 'nya': 'miliknya'}",2,2,0.9418,,,,,,,,,
"sangat mengecewakan , saya pesan tiket dan sudah saya bayar , padahal waktu itu belum kadaluarsa pas saya transfer , tapi sampai sekarang belum dikasih kode bokong nya , malah dikasih notifikasi sudah kadaluarsa , lalu uang nya lari nya ke mana , pas saya hubungi lewat email hanya ditanggapi sekali saja .",2,sangat mengecewakan saya pesan tiket dan sudah saya bayar padahal waktu itu belum kadaluarsa pas saya transfer tapi sampai sekarang belum dikasih kode bokong miliknya malah dikasih notifikasi sudah kadaluarsa lalu uang miliknya lari miliknya ke mana pas saya hubungi lewat email hanya ditanggapi sekali saja,0.9718750715255736,2,[8.000e-04 8.000e-04 9.984e-01],2,[6.000e-04 8.000e-04 9.986e-01],"{'mengecewakan': 'mengecewakan', 'kadaluarsa': 'kadaluarsa', 'bayar': 'bayar', 'pesan': 'pesan', 'transfer': 'transfer', 'uang': 'uang', 'pas': 'pas', 'nya': 'miliknya', 'tiket': 'tiket', 'lari': 'lari', 'ditanggapi': 'ditanggapi', 'hubungi': 'hubungi', 'dikasih': 'dikasih', 'kode': 'kode'}",2,2,1.0105,,,,,,,,,
tolong jangan order tiket pakai aplikasi ini kalau tidak mau kecewa . benci banget . sudah transfer etiket tidak dikirim-kirim malah pesanan dibatalkan . telpon pelayanan pelanggan juga tidak diangkat . di-email tidak dibalas .,2,tolong jangan order tiket pakai aplikasi ini kalau tidak mau kecewa benci banget sudah transfer etiket tidak malah pesanan dibatalkan telpon pelayanan pelanggan juga tidak diangkat tidak dibalas,0.9890929460525512,2,[8.000e-04 5.000e-04 9.987e-01],2,[7.000e-04 4.000e-04 9.989e-01],"{'banget': 'banget', 'dibatalkan': 'dibatalkan', 'dibalas': 'dibalas', 'kecewa': 'kecewa', 'benci': 'benci', 'tiket': 'tiket', 'etiket': 'etiket', 'tolong': 'tolong', 'transfer': 'transfer', 'telpon': 'telpon', 'diangkat': 'diangkat', 'pakai': 'pakai', 'pesanan': 'pesanan'}",2,2,0.7801,,,,,,,,,
saya pesan tiket pesawat dan sudah melakukan pembayaran sesuai instruksi namun sudah lebih dari 4 jam belum ada terbit e - tiket malahan status pesanan saya malah jadi pemesanan kadaluarsa . komplain sudah saya lakukan melalui email dan telpon pelayanan pelanggan sampai sekarang belum ada penyelesaian yang berarti . ini sangat merugikan .,2,saya pesan tiket pesawat dan sudah melakukan pembayaran sesuai instruksi namun sudah lebih dari 4 jam belum ada terbit e tiket malahan status pesanan saya malah jadi pemesanan kadaluarsa komplain sudah saya lakukan melalui email dan telpon pelayanan pelanggan sampai sekarang belum ada penyelesaian yang berarti ini sangat merugikan,1.0,2,[0.0015 0.0016 0.9969],2,[0.0012 0.0013 0.9976],"{'terbit': 'terbit', 'kadaluarsa': 'kadaluarsa', 'pesanan': 'pesanan', 'komplain': 'komplain', 'penyelesaian': 'penyelesaian', 'instruksi': 'instruksi', 'telpon': 'telpon', 'e': 'e', 'sesuai': 'sesuai', 'pembayaran': 'pembayaran', 'pesawat': 'pesawat', 'jam': 'jam', 'pelanggan': 'pelanggan', 'pemesanan': 'pemesanan', 'tiket': 'tiket', 'lakukan': 'lakukan', 'status': 'status'}",2,2,1.0567,,,,,,,,,
"saya pesan ticket sampai sekarang tidak ada konformasi nya . uang sudah ditransfer , kalau seperti itu kembalikan uang nya , tai sekali , telepon pusat panggilan habis pulsa hampir 200 . tidak ada . kembalikan uang saya . jangan pernah kalian pesan tiket di sini . menyesal",2,saya pesan ticket sampai sekarang tidak ada konformasi miliknya uang sudah ditransfer kalau seperti itu kembalikan uang miliknya tai sekali telepon pusat panggilan habis pulsa hampir 200 tidak ada kembalikan uang saya jangan pernah kalian pesan tiket di sini menyesal,0.9860618710517884,2,[9.000e-04 4.000e-04 9.987e-01],2,[6.00e-04 4.00e-04 9.99e-01],"{'ditransfer': 'ditransfer', 'nya': 'miliknya', 'kembalikan': 'kembalikan', 'panggilan': 'panggilan', 'pulsa': 'pulsa', 'habis': 'habis', 'uang': 'uang', 'ticket': 'ticket', 'konformasi': 'konformasi', 'pusat': 'pusat', 'telepon': 'telepon', 'pesan': 'pesan', 'menyesal': 'menyesal'}",2,2,0.8979,,,,,,,,,
pembayaran sudah dilakukan tetapi e - tiket tidak dikirim-dikirim malah dipesan diblang kadaluarsa . titip cs nya berkali-berkali jwaban nya tidak ada yang membantu dan tidak sinkron semua . sampai sekarang belum jelas pengembalian uang ataupun penggantian tiket . disarankan tidak usah memakai aplikasi ini .,2,pembayaran sudah dilakukan tetapi e tiket tidak malah dipesan diblang kadaluarsa titip cs miliknya jwaban miliknya tidak ada yang membantu dan tidak sinkron semua sampai sekarang belum jelas pengembalian uang ataupun penggantian tiket disarankan tidak usah memakai aplikasi ini,0.9778873324394226,2,[1.400e-03 6.000e-04 9.981e-01],2,[9.000e-04 5.000e-04 9.986e-01],"{'kadaluarsa': 'kadaluarsa', 'jwaban': 'jwaban', 'e': 'e', 'membantu': 'membantu', 'pembayaran': 'pembayaran', 'nya': 'miliknya', 'cs': 'cs', 'diblang': 'diblang', 'dipesan': 'dipesan', 'titip': 'titip', 'pengembalian': 'pengembalian', 'tiket': 'tiket', 'uang': 'uang', 'aplikasi': 'aplikasi', 'penggantian': 'penggantian'}",2,2,0.928,,,,,,,,,
