label,tweet,perturbed_text,perturbed_semantic_sim,pred_label,pred_proba,perturbed_label,perturbed_proba,translated_word(s),adv_pred,adv_pred_on_orig,running_time(s),before_attack_acc,after_attack_acc,avg_semantic_sim,avg_running_time(s),adv_training,delta_acc,delta_adv,acc_adv_training_on_orig,best_epoch
2,"Pixy ini kok lama-lama gemesim yaaaa. Setelah jatuh cinta sama lip cream nya, kayak nya bakal jatih cinta sama yang lain. Huft [URL]","Pixy ini kok lama-lama gemesim yaaaa. Setelah jatuh cinta sama lip cream nya, kayak nya bakal jatih cinta sama yang lain. Huft [URL]",1.0,0,[0.9787 0.0033 0.0095 0.0047 0.0038],0,[0.9787 0.0033 0.0095 0.0047 0.0038],,0,0,0.24,0.7886363636363637,0.6454545454545455,0.9219395408237522,0.5613395454545455,0.6931818181818182,0.1431818181818182,-0.04772727272727273,0.7727272727272727,5.0
3,Penyakit hepatitis B 100x lebih infeksius dari HIV/AIDS Duhh serem! Dan belum ada obatnya.,Penyakit epatite B 100x lebih infeksius dari Duhh Dan belum ada,0.8424186110496521,3,[2.000e-03 1.100e-03 1.000e-03 9.952e-01 7.000e-04],1,[0.1308 0.7158 0.0016 0.1179 0.0339],"{'dan': 'e', 'duhh': 'duhh', 'hepatitis': 'epatite'}",3,3,1.077,,,,,,,,,
3,[USERNAME] [USERNAME] [USERNAME] Gw lebih khawatir lg kalo Ahok jd jurkamnya Jokowi bro. Nemo movement malah berbalik jd ikon punya Jokowi. Persis kejadian 212 yg jd panggung Jkw,Gw lebih khawatir lg Se Ahok jd jurkamnya Jokowi Nemo mozione malah berbalik jd icona punya Persis kejadian 212 quale jd panggung Jkw,0.822746753692627,3,[2.600e-03 3.400e-03 4.000e-04 9.924e-01 1.200e-03],3,[2.70e-03 2.30e-03 3.00e-04 9.94e-01 7.00e-04],"{'kejadian': 'kejadian', 'yg': 'quale', 'kalo': 'Se', 'jkw': 'jkw', 'nemo': 'nemo', 'gw': 'gw', 'jurkamnya': 'jurkamnya', 'movement': 'mozione', 'jokowi': 'jokowi', 'ikon': 'icona'}",3,3,1.0174,,,,,,,,,
1,"Kemerdekaan adalah hak segala bangsa ...( Kec Yahudi,Kurdi , Catalonia , Koptik ) sbgmn kita menutup mata terhadap Penjajahan Yaman dan Qatar.Artinya standart ganda ...",Kemerdekaan adalah hak segala nazione Kec Catalonia Koptik sbgmn kita menutup occhio terhadap Penjajahan Yaman dan standart ganda,0.9084892868995668,1,[6.400e-03 9.896e-01 4.000e-04 1.700e-03 1.800e-03],1,[0.1277 0.8636 0.0009 0.0038 0.004 ],"{'mata': 'occhio', 'penjajahan': 'penjajahan', 'catalonia': 'catalonia', 'ganda': 'ganda', 'kec': 'kec', 'bangsa': 'nazione'}",1,1,0.7316,,,,,,,,,
4,"Selamat pak [USERNAME] resmi jadi bapak, sekedar saran sering sering si jagoan dikasih dengar lagu YNWA sama tonton pertandingan Liverpool... Biar ngerti sejarah dan kesetiaan haha",Selamat pak resmi jadi sekedar saran sering sering si jagoan dikasih dengar lagu YNWA sama tonton concorrenza Biar ngerti sejarah dan kesetiaan haha,0.9465392827987672,4,[1.10e-03 4.00e-04 2.59e-02 6.00e-04 9.72e-01],4,[1.700e-03 2.000e-04 1.180e-02 5.000e-04 9.858e-01],"{'selamat': 'selamat', 'sejarah': 'sejarah', 'haha': 'haha', 'pertandingan': 'concorrenza', 'biar': 'biar', 'ngerti': 'ngerti', 'ynwa': 'ynwa', 'lagu': 'lagu', 'dengar': 'dengar', 'resmi': 'resmi'}",4,4,2.6187,,,,,,,,,
0,"Pas aktip di ig merasa twitter ini tempat melarikan diri. Pas lbh sering mencuit, merasa ig itu mall... aku dangkal, butuh hingar, mau di pasar",Pas aktip di ig merasa twitter ini tempat melarikan Pas lbh sering merasa ig itu aku butuh mau di pasar,0.948068618774414,0,[9.925e-01 2.300e-03 9.000e-04 2.100e-03 2.200e-03],0,[0.9118 0.0076 0.005  0.0298 0.0458],"{'twitter': 'twitter', 'butuh': 'butuh', 'melarikan': 'melarikan', 'pas': 'pas', 'ig': 'ig'}",0,0,0.6388,,,,,,,,,
1,Awal nonton cuma 4 orang tenang bgt.. 25 menit film berjalan dan begitu masuk segerombolan alayers lansung bising nya gak ketolong..,Awal nonton cuma 4 orang tenang bgt.. 25 menit film berjalan dan begitu masuk segerombolan alayers lansung bising nya gak ketolong..,1.0,4,[0.0379 0.0013 0.0025 0.0053 0.953 ],4,[0.0379 0.0013 0.0025 0.0053 0.953 ],,4,4,0.21,,,,,,,,,
0,"Bukan gw yang ga mau ikut bukber, tapi dompet yang protes ""bukber mulu lu gw ga di isi isi, dompet gendutin, badan lu kurusin jangan kebalik"" Oke sip besok ku lembur baghai qhuda",Bukan gw yang ga mau ikut tapi dompet yang protes mulu lu gw ga di isi dompet badan lu kurusin jangan Oke sip besok ku lembur baghai qhuda,0.9751265048980712,0,[8.535e-01 1.325e-01 7.000e-04 1.200e-03 1.210e-02],1,[5.200e-03 9.927e-01 2.000e-04 4.000e-04 1.500e-03],{},1,0,0.7639,,,,,,,,,
3,jadi takut buat nikah...buat punya anak...takut kalo saya nikah saya ga bisa bahagiain pasangan...takut kalo punya anak nanti saya banding bandingin...,jadi takut buat punya Se saya nikah saya ga bisa bahagiain Se punya anak nanti saya appello,0.9565058946609496,3,[1.000e-03 1.200e-03 4.000e-04 9.969e-01 5.000e-04],3,[1.900e-03 1.400e-03 4.000e-04 9.959e-01 3.000e-04],"{'kalo': 'Se', 'ga': 'ga', 'nikah': 'nikah', 'banding': 'appello'}",3,3,0.7712,,,,,,,,,
4,"BTW, salut dengan siapapun yang bikin ad Tokopedia yang cerita masa lalu seseorang tentang nabung buat makan udang. Dengan narasi yang cukup simple tapi bisa langsung ngena ke gua emotionally. Well done",salut dengan siapapun yang bikin ad Tokopedia yang cerita masa lalu seseorang tentang nabung buat mangiare Dengan narasi yang cukup simple tapi bisa langsung ngena ke io Well done,0.9621124863624572,4,[0.1366 0.001  0.0376 0.0016 0.8232],4,[6.200e-03 9.000e-04 1.100e-03 6.000e-04 9.912e-01],"{'tokopedia': 'tokopedia', 'well': 'bene', 'ad': 'ad', 'nabung': 'nabung', 'gua': 'io', 'dengan': 'dengan', 'simple': 'simple', 'makan': 'mangiare', 'bikin': 'bikin'}",4,4,0.8021,,,,,,,,,
3,"Pagi ini Surabaya mendungnya rata banget, jangan biarin rasa meger menguasai jiwa &amp","Pagi ini Surabaya mendungnya rata banget, jangan biarin rasa meger menguasai jiwa &amp",1.0,0,[0.9843 0.0014 0.0013 0.0112 0.002 ],0,[0.9843 0.0014 0.0013 0.0112 0.002 ],,0,0,0.21,,,,,,,,,
3,"[USERNAME] [USERNAME] Tidak disemua tempat kita boleh melaksanakan sholat, salah satunya di bangunan yang didirikan untuk kekafiran (salah satunya gereja). Aku berlindung kepada ALLAAH SWT. dari godaan setan yang terkutuk. [URL]",Tidak disemua tempat kita boleh melaksanakan salah satunya di bangunan yang didirikan untuk kekafiran satunya Aku berlindung kepada ALLAAH dari godaan diavolo yang,0.907950222492218,3,[1.080e-02 3.100e-03 6.000e-04 9.848e-01 7.000e-04],3,[0.0167 0.0021 0.0014 0.9789 0.001 ],"{'berlindung': 'berlindung', 'aku': 'io', 'disemua': 'disemua', 'setan': 'diavolo', 'godaan': 'godaan', 'bangunan': 'bangunan', 'allaah': 'Allah', 'tidak': 'tidak'}",3,3,1.1134,,,,,,,,,
1,"Akhirnya jamaahnya tercuci otak, seakan-akan memilih paslon pilkada itu karena kewajiban dari imam besarnya. Bagi mereka program paslon ga penting, yg penting takbir terus milih.","Akhirnya jamaahnya tercuci otak, seakan-akan memilih paslon pilkada itu karena kewajiban dari imam besarnya. Bagi mereka program paslon ga penting, yg penting takbir terus milih.",1.0,0,[0.6987 0.2723 0.0023 0.0074 0.0193],0,[0.6987 0.2723 0.0023 0.0074 0.0193],,0,0,0.23,,,,,,,,,
0,"Sampe rumah masuk2 dijudesin bokap bilang gini kamu lama2 kayak artis ya! Terus gw bingung.. lah ngapa Perasaan tadi brgkt cuman bedakan plus gincu arab an, karna emg ganiat mau kemana2.. (fyi gincu arab itu ga menor samsek kek natural gt) terus gw ngaca ajg kok gw menor bgt",Sampe rumah masuk2 dijudesin bokap bilang gini kamu lama2 kayak artis Terus gw lah ngapa Perasaan tadi brgkt cuman bedakan plus gincu arab perche emg ganiat mau gincu arab itu ga menor samsek kek natural terus gw ngaca ajg kok gw menor grande,0.9672303199768066,0,[0.497  0.01   0.0019 0.4815 0.0096],0,[9.238e-01 4.920e-02 8.000e-04 2.100e-02 5.300e-03],"{'bokap': 'bokap', 'gw': 'gw', 'gini': 'gini', 'artis': 'artis', 'ngaca': 'ngaca', 'dijudesin': 'dijudesin', 'menor': 'menor', 'brgkt': 'brgkt', 'rumah': 'rumah', 'perasaan': 'sensazione', 'bilang': 'bilang', 'karna': 'perche', 'sampe': 'sampe', 'gincu': 'gincu', 'emg': 'emg', 'ganiat': 'ganiat', 'ngapa': 'ngapa', 'bgt': 'grande'}",3,3,1.0147,,,,,,,,,
1,"Hai para penghujat KPOPers. Aku pikir musik itu selera, kaya makan mie instan, kamu suka mie sedap aku suka indomie. Aku suka korean, kalian suka pop, ada yg dandut, and more ~ simpel sekali ~ hanya masalah pilihan yg nyaman di telinga aja kok.",Hai para penghujat Aku pikir musica itu kaya makan mie kamu suka mie sedap aku suka Aku suka kalian suka ada quale e more simpel sekali hanya masalah scelta quale comodo di telinga aja,0.9142307043075562,1,[0.3199 0.636  0.0036 0.0067 0.0338],1,[0.0388 0.8591 0.0028 0.0088 0.0905],"{'sedap': 'sedap', 'simpel': 'simpel', 'suka': 'suka', 'musik': 'musica', 'yg': 'quale', 'telinga': 'telinga', 'aja': 'aja', 'pilihan': 'scelta', 'nyaman': 'comodo', 'and': 'e'}",4,4,0.8964,,,,,,,,,
2,"tiap kali baca kisah2 zaman nabi, rasa jatuh cinta dgn semuaaaaa. mlm ni baca saidina umar dlm hati... ya allah saidina umar ",tiap voltaico baca kisah2 zaman rasa cadere amore dgn Sera ni baca saidina umar dlm ya allah saidina umar,0.847836971282959,2,[1.100e-03 4.000e-04 9.959e-01 1.500e-03 1.100e-03],0,[0.552  0.0016 0.362  0.0083 0.0761],"{'jatuh': 'cadere', 'baca': 'baca', 'allah': 'allah', 'cinta': 'amore', 'umar': 'umar', 'dgn': 'dgn', 'kali': 'voltaico', 'mlm': 'Sera'}",2,2,0.8226,,,,,,,,,
0,"[USERNAME] [USERNAME] Anak sipil kuliah 4tahun buat lulus ada jerih payah tiap detiknya, cuma dinyirnyirin gak jelas gini, ya Allah ya Rabb, mulut netizen Maha Benar memang :""","[USERNAME] [USERNAME] Anak sipil kuliah 4tahun buat lulus ada jerih payah tiap detiknya, cuma dinyirnyirin gak jelas gini, ya Allah ya Rabb, mulut netizen Maha Benar memang :""",1.0,1,[8.400e-03 9.902e-01 2.000e-04 7.000e-04 6.000e-04],1,[8.400e-03 9.902e-01 2.000e-04 7.000e-04 6.000e-04],,1,1,0.26,,,,,,,,,
2,buat aku juga kan eh ada mas adi makasih :3 semangat ya buat kamu :,buat aku juga kan eh ada mas adi makasih :3 semangat ya buat kamu :,1.0,4,[6.00e-04 3.00e-04 3.50e-03 5.00e-04 9.95e-01],4,[6.00e-04 3.00e-04 3.50e-03 5.00e-04 9.95e-01],,4,4,0.21,,,,,,,,,
3,[askmf] kamu kalo pergi ke psikolog pertamanya ngomong apaan? Kan aku mau jelasin terus dia tiba-tiba motong ucapanku. Tapi dia tau masalahku lewat tes gitu. Cuman aku takut nggak diperhatikan bgt gitu.(?),kamu kalo andare ke psicologo pertamanya ngomong Kan aku mau jelasin terus dia motong Tapi dia sapere masalahku lewat test Cuman aku takut nggak diperhatikan grande,0.8999727368354797,3,[6.000e-04 1.000e-03 4.000e-04 9.976e-01 4.000e-04],3,[3.200e-03 5.400e-03 2.000e-04 9.906e-01 5.000e-04],"{'bgt': 'grande', 'cuman': 'cuman', 'kan': 'Giusto', 'pergi': 'andare', 'nggak': 'nggak', 'tes': 'test', 'ngomong': 'ngomong', 'tau': 'sapere', 'psikolog': 'psicologo'}",3,3,0.6736,,,,,,,,,
4,"Self Titled - Bin Idris (2016) Q tau mz haikal cs jago bgt bikin ambience jd nada di Sigmun, di album ini w kaget soalnya lagu2nya sm ambience di MV nya bener2 persis sm apa yg gue bayangin pas denger lagunya. Keren. W suka lagu Dalam Wangi, Calm Water, Rebahan",Self Titled Bin Idris Q tau mz haikal cs jago bgt bikin ambience jd nada di di album ini w kaget soalnya lagu2nya sm ambience di MV nya bener2 persis sm apa quale io bayangin pas denger W suka lagu Dalam Calm Rebahan,0.9583558440208436,4,[1.200e-03 4.000e-04 4.700e-03 9.000e-04 9.928e-01],4,[2.100e-03 3.000e-04 1.400e-02 1.200e-03 9.825e-01],"{'jd': 'jd', 'yg': 'quale', 'ambience': 'ambience', 'gue': 'io', 'nya': 'nya', 'cs': 'cs', 'idris': 'idris', 'w': 'w', 'album': 'album', 'sm': 'sm', 'calm': 'calma', 'kaget': 'kaget', 'mv': 'mv', 'bayangin': 'bayangin', 'rebahan': 'rebahan', 'bin': 'bin', 'self': 'self', 'titled': 'intitolato'}",4,4,2.757,,,,,,,,,
0,"[USERNAME] 1minggu sebelum bapak meninggal agak sedikit membuat bapak marah, dan penyesalanku adalah blm sempat meminta maaf sampai bapak meninggal",1minggu sebelum bapak morire agak sedikit membuat bapak dan penyesalanku adalah blm sempat meminta maaf sampai bapak morire,0.8411069512367249,0,[0.9855 0.0056 0.0039 0.0024 0.0026],0,[0.9906 0.0017 0.0035 0.0018 0.0023],"{'blm': 'blm', 'meninggal': 'morire'}",0,0,0.6998,,,,,,,,,
0,"Throwback video Launching lagu takkan terhenti disini, di tahun 2010, dimana salah satu kaka saya yg ada di video ini sudah meninggal 3 thn lalu. Hoek hiks. [USERNAME] [USERNAME] [URL]",Throwback video Launching lagu takkan terhenti di tahun colomba salah satu kaka saya yg ada di video ini sudah meninggal 3 thn Hoek,0.920796513557434,0,[9.909e-01 6.000e-04 1.900e-03 8.000e-04 5.900e-03],0,[0.9436 0.001  0.0054 0.002  0.048 ],"{'thn': 'thn', 'throwback': 'throwback', 'dimana': 'colomba', 'video': 'video', 'kaka': 'kaka', 'hoek': 'gancio', 'terhenti': 'terhenti'}",0,0,0.9337,,,,,,,,,
0,"[USERNAME] [USERNAME] [USERNAME] [USERNAME] Betul mas. Sayapun kecewa, karena Rahtawu merupakan salah satu objek alam yang menjadi favorit masyarakat Kudus.",Betul Sayapun karena Rahtawu merupakan salah satu objek alam yang menjadi favorit masyarakat,0.5933266878128052,0,[9.836e-01 9.000e-03 6.000e-04 3.300e-03 3.500e-03],4,[2.02e-02 6.00e-04 9.70e-03 3.50e-03 9.66e-01],{},4,0,0.8538,,,,,,,,,
1,"Makanya pernah saya sampaikan kepada anda [USERNAME] jangan kebanyakan baca novel, nonton film dan nonton mak lampir, pahami saja KESELURUHAN isi Kitab Suci Al-Qur'an. Akhirnya anda nyasar kan ? ......... I T U. [URL]",Makanya pernah saya sampaikan kepada anda jangan kebanyakan baca guarda film dan guarda mak pahami saja KESELURUHAN isi Kitab Suci Akhirnya anda nyasar kan I T,0.9116064310073853,1,[0.234  0.7529 0.001  0.0074 0.0048],1,[0.1654 0.55   0.0013 0.2802 0.003 ],"{'kitab': 'kitab', 'suci': 'suci', 'i': 'i', 'nonton': 'guarda', 'baca': 'baca', 't': 't', 'isi': 'isi', 'film': 'film'}",3,1,0.7591,,,,,,,,,
4,"Hepibesdey mbaak canteeeekk [USERNAME] panjang umur, sehat selalu serta mulia dan jadi pribadi yang jauh lebih baik tetep mentel yee tapi jangan jadi simpenan orang",Hepibesdey mbaak canteeeekk panjang sehat selalu serta mulia dan jadi pribadi yang jauh lebih baik ristabilire mentel si tapi jangan jadi simpenan orang,0.9512557983398438,4,[7.000e-04 9.000e-04 1.400e-03 5.000e-04 9.965e-01],4,[8.000e-04 7.000e-04 1.600e-03 5.000e-04 9.965e-01],"{'hepibesdey': 'hepibesdey', 'mentel': 'mentel', 'mbaak': 'mbaak', 'tetep': 'ristabilire', 'sehat': 'sehat', 'yee': 'si'}",4,4,1.1343,,,,,,,,,
1,[USERNAME] [USERNAME] [USERNAME] udah mirip ama sodara anjingnya lu cuuk jancuk hahahaha itu pribadi bukan golongan tagih gih ama orangnya hahahaha #BonekSelamanyaJancok,udah mirip ama sodara anjingnya lu cuuk jancuk hahahaha itu pribadi bukan gruppo tagih gih ama orangnya hahahaha,0.8079447746276855,1,[0.0066 0.8636 0.0009 0.0027 0.1262],1,[2.000e-03 9.873e-01 3.000e-04 7.000e-04 9.600e-03],"{'cuuk': 'cuuk', 'anjingnya': 'anjingnya', 'sodara': 'sodara', 'gih': 'gih', 'golongan': 'gruppo', 'ama': 'ama', 'orangnya': 'orangnya', 'tagih': 'tagih'}",1,4,0.7795,,,,,,,,,
4,Kecerian Bersama Teman-teman BARU itu sangat Mengasikkan. . #KeluargaBaru . Salam Gowes [USERNAME] [URL] republiksepeda mtb_indo bikestable [USERNAME] gowesnusantara gowes_holic,Kecerian Bersama BARU itu sangat Salam Gowes republiksepeda bikestable gowesnusantara,0.696214497089386,4,[6.000e-04 3.000e-04 1.600e-03 4.000e-04 9.971e-01],4,[1.00e-03 9.00e-04 1.20e-03 9.00e-04 9.96e-01],"{'kecerian': 'allegria', 'gowesnusantara': 'gowesnusantara', 'bersama': 'insieme', 'salam': 'salam'}",4,4,0.4439,,,,,,,,,
1,"[USERNAME] [USERNAME] [USERNAME] [USERNAME] [USERNAME] [USERNAME] yg penting janji itu di buktikan dgn kerja nyata, bukan hanya diucapkan saja....jgn pas pilkada dekat dgn rakyat, bila sudah terpilih...lupakan janji itu....kita tunggu saja .....",quale penting promettere itu di buktikan dgn kerja bukan hanya diucapkan pas pilkada dekat dgn bila sudah promettere aspettare saja,0.6081110835075378,1,[9.50e-03 9.78e-01 8.00e-04 4.20e-03 7.40e-03],0,[0.4389 0.3854 0.0036 0.0247 0.1475],"{'kerja': 'kerja', 'janji': 'promettere', 'buktikan': 'buktikan', 'tunggu': 'aspettare', 'pas': 'pas', 'yg': 'quale'}",0,1,0.59,,,,,,,,,
2,"Setelah lulus SMA papa akan sedikit memaksamh untuk menjadi dokter atau insinyur. Ketahuilah, bahwa seluruh paksaan yang dilakukan papa itu semata mata hanya karena memikirkan masa depanmu nanti. Tapi toh papa akan tersenyum dan mendukung saat pilihanmu tdk sesuai dgn papa.",Setelah lulus SMA papà akan sedikit memaksamh untuk menjadi dokter atau bahwa seluruh paksaan yang dilakukan papà itu semata mata hanya karena pensiero masa depanmu Tapi toh papà akan Sorridi dan mendukung saat pilihanmu tdk sesuai dgn,0.8611515760421753,2,[1.80e-03 4.00e-04 9.94e-01 1.50e-03 2.40e-03],0,[0.6587 0.003  0.2762 0.0398 0.0222],"{'depanmu': 'depanmu', 'tersenyum': 'Sorridi', 'memikirkan': 'pensiero', 'papa': 'papà', 'dokter': 'dokter', 'mendukung': 'mendukung', 'dgn': 'dgn', 'tapi': 'tapi', 'sma': 'sma', 'sesuai': 'sesuai'}",2,2,0.7872,,,,,,,,,
4,"Nah hari ini kaka gue memutuskan naikin uang makan gue biar ga makan di kfc mulu, ga bergizi katanya. Dan di hari pertama uang makan gue naik, gue memilih buka puasa pake baso uang makan ada kembalian, hati happy. Makan mah yg penting bismillah",Nah hari ini kaka io memutuskan naikin uang mangiare io biar ga mangiare di kfc ga nutriente Dan di hari pertama uang mangiare io io memilih buka puasa pake baso uang mangiare ada hati Makan mah quale penting bismillah,0.830583930015564,4,[3.000e-03 4.000e-04 8.000e-04 3.000e-04 9.955e-01],4,[0.0642 0.0017 0.0019 0.0025 0.9298],"{'naikin': 'naikin', 'baso': 'baso', 'ga': 'ga', 'gue': 'io', 'bergizi': 'nutriente', 'makan': 'mangiare', 'dan': 'e', 'buka': 'buka', 'uang': 'uang', 'mah': 'mah', 'memutuskan': 'memutuskan', 'yg': 'quale'}",0,4,0.9155,,,,,,,,,
1,"Jangan main2 dengan SARA. Mereka yang bermain dengan SARA apalagi mendekati tahun politik, hampir dapat di pasti ujungnya konflik. [URL]",Jangan main2 dengan Mereka yang bermain dengan SARA apalagi mendekati tahun hampir dapat di pasti ujungnya,0.9178860187530518,1,[0.1442 0.7689 0.0017 0.0808 0.0043],1,[0.0887 0.8724 0.0012 0.0315 0.0062],"{'sara': 'sara', 'mereka': 'essi', 'bermain': 'bermain'}",1,1,0.6941,,,,,,,,,
1,SIAPA YG BILANG PUNYA ANAK MENYENANGKAN TEROS *sodorin anak yg tantrum karna ngantuk tp gak mau bobo* *istigfar kenceng2*,SIAPA YG BILANG PUNYA ANAK MENYENANGKAN TEROS *sodorin anak yg tantrum karna ngantuk tp gak mau bobo* *istigfar kenceng2*,1.0,0,[0.973  0.0034 0.0083 0.0055 0.0098],0,[0.973  0.0034 0.0083 0.0055 0.0098],,0,0,0.2,,,,,,,,,
2,Jadi demen sama oppa ini huhuhuhu,Jadi demen sama oppa ini huhuhuhu,1.0,4,[0.0041 0.0014 0.1088 0.0026 0.8831],4,[0.0041 0.0014 0.1088 0.0026 0.8831],,2,2,0.22,,,,,,,,,
0,"Lebih baik mendengar suara bom, guntur, geledek, petir, atau gunung meletus daripada mendengar suara tangismu yang buat aku tak bisa berbuat apa-apa.",Lebih baik ascoltare suara atau Montagna eruttare daripada ascoltare suara tangismu yang buat aku tak bisa berbuat,0.9116564989089966,0,[9.696e-01 9.000e-04 2.260e-02 5.700e-03 1.200e-03],0,[0.9876 0.0013 0.0073 0.0023 0.0014],"{'tangismu': 'tangismu', 'mendengar': 'ascoltare', 'meletus': 'eruttare', 'gunung': 'Montagna'}",0,0,0.6927,,,,,,,,,
3,"[USERNAME] jujur iya aku takut, soalnya aku takut keciduk pas naik/turun dari mobil di suatu tempat :))) om aku driver ojol takutnya beliau liat :)))",jujur S aku soalnya aku paura keciduk pas dari mobil di suatu tempat om aku driver ojol takutnya beliau liat,0.9462453126907348,3,[9.000e-04 7.000e-04 5.000e-04 9.973e-01 5.000e-04],3,[1.100e-03 6.000e-04 4.000e-04 9.973e-01 6.000e-04],"{'takutnya': 'takutnya', 'keciduk': 'keciduk', 'ojol': 'ojol', 'takut': 'paura', 'liat': 'liat', 'beliau': 'beliau', 'iya': 'S'}",3,3,0.792,,,,,,,,,
1,Pecinta kpop salty? Ya siapa sih yg suka every one insulting things or people whom you passionate about Lo nya aja otaknya pada gaada . EQ nya jongkok Belajar menghargai . Percuma belajar ppkn,Pecinta kpop Ya siapa sih quale suka every one insulting things o people whom you passionate about Lo nya aja otaknya pada gaada EQ nya jongkok Belajar valore Percuma studio ppkn,0.8994405269622803,1,[1.200e-03 9.981e-01 1.000e-04 3.000e-04 3.000e-04],1,[1.700e-03 9.973e-01 2.000e-04 3.000e-04 6.000e-04],"{'insulting': 'insulting', 'kpop': 'kpop', 'lo': 'lo', 'every': 'every', 'yg': 'quale', 'aja': 'aja', 'people': 'people', 'pecinta': 'amante', 'whom': 'whom', 'one': 'one', 'nya': 'nya', 'about': 'about', 'gaada': 'gaada', 'menghargai': 'valore', 'or': 'o', 'belajar': 'studio', 'percuma': 'percuma'}",1,1,0.5312,,,,,,,,,
1,"Lambat laun kok makin ga jelas dan semakin kurang ajar. Gw sabar. Jujur ya, gw ga pernah dan ga mau scr frontal maki org. Gw blg baik2, nasehatin. Scr adek2.",Lambat laun kok makin ga jelas dan semakin kurang Gw Jujur gw ga pernah dan ga mau scr frontal maki Gw blg Scr,0.9672438502311708,1,[1.730e-02 9.807e-01 5.000e-04 7.000e-04 8.000e-04],1,[1.600e-02 9.804e-01 5.000e-04 2.300e-03 7.000e-04],"{'maki': 'maki', 'ga': 'ga', 'blg': 'blg', 'lambat': 'Lento', 'gw': 'gw'}",1,1,0.4703,,,,,,,,,
3,"BESOK UDAH MULAI KERJA YAAMPUN, DAG DIG DUG TAKUT SUSAH BANGUN UDAH MULAI KERJA JAM 6 PAGI, SAMPE BIKIN ALARM KAYA GINI TAKUT GA BISA BANGUN PFFFT. [URL]",BESOK UDAH MULAI KERJA DAG DIG DUG TAKUT SUSAH BANGUN UDAH MULAI KERJA JAM 6 SAMPE BIKIN ALARM KAYA GINI TAKUT GA BISA BANGUN,0.9501848220825196,3,[1.900e-03 3.200e-03 1.000e-03 9.931e-01 8.000e-04],3,[0.0102 0.0071 0.0028 0.9776 0.0022],"{'takut': 'paura', 'ga': 'ga', 'gini': 'gini', 'alarm': 'alarm', 'dig': 'scavare', 'kaya': 'ricco', 'bisa': 'Potere', 'kerja': 'kerja', 'udah': 'già', 'dug': 'scavata', 'bangun': 'alzarsi', 'dag': 'dag'}",3,3,1.4144,,,,,,,,,
4,benar tidak-kangenya nanti bong lagi wakaka,benar nanti bong lagi wakaka,0.9696513414382936,4,[0.3462 0.2025 0.0026 0.0529 0.3959],4,[0.144  0.0515 0.0031 0.0204 0.781 ],{'bong': 'bong'},4,4,0.5348,,,,,,,,,
4,[USERNAME] suka skinship cuma ama pacar. peluk cium nangkring di paha duduk di pangkuan ya gitu deh wkwkw klo ama temen cwek agak canggung nyahah,[USERNAME] suka skinship cuma ama pacar. peluk cium nangkring di paha duduk di pangkuan ya gitu deh wkwkw klo ama temen cwek agak canggung nyahah,1.0,2,[0.0297 0.0009 0.8829 0.0087 0.0779],2,[0.0297 0.0009 0.8829 0.0087 0.0779],,2,2,0.29,,,,,,,,,
4,iya semoga itu karya terbaik mu adalah skripsi mu dan lucua2n mu tapi harapan aku dari kamu adalah kesembuhanmu nold,iya semoga itu karya terbaik mu adalah skripsi mu dan lucua2n mu tapi harapan aku dari kamu adalah kesembuhanmu nold,1.0,0,[9.439e-01 7.000e-04 3.970e-02 2.400e-03 1.330e-02],0,[9.439e-01 7.000e-04 3.970e-02 2.400e-03 1.330e-02],,2,2,0.21,,,,,,,,,
2,"Aku tau berdoa itu bisa kapanpun dimanapun tapi dasarnya aku kangen terus jadi aku mau usahain tiap minggu ketemu papalove you so much daddy sayang papaa... Bersyukur pas papa masi hidup papa sama aku slalu sayang2an, ngomong sayang, cinta ya kita bkn lewat medsos doang [URL]",Aku sapere berdoa itu bisa kapanpun dimanapun tapi dasarnya aku kangen terus jadi aku mau usahain tiap minggu ketemu papalove voi so much daddy Metodo Bersyukur pas papà masi vita papà sama aku spray ngomong amore S kita bkn lewat medsos doang,0.8915475606918335,2,[1.50e-03 4.00e-04 9.96e-01 1.10e-03 9.00e-04],2,[2.360e-02 6.000e-04 9.707e-01 2.400e-03 2.700e-03],"{'papa': 'papà', 'papalove': 'papalove', 'hidup': 'vita', 'cinta': 'amore', 'pas': 'pas', 'bkn': 'bkn', 'daddy': 'daddy', 'slalu': 'spray', 'masi': 'masi', 'ya': 'S', 'bersyukur': 'bersyukur', 'you': 'voi', 'much': 'much', 'tau': 'sapere', 'sayang': 'Metodo'}",2,2,0.9341,,,,,,,,,
0,galau -> bingung mau ngpain tapi malas mau ngapain,galau confuso mau ngpain tapi malas mau ngapain,0.939720869064331,0,[9.935e-01 1.600e-03 8.000e-04 2.600e-03 1.500e-03],0,[0.8668 0.1202 0.0014 0.0053 0.0063],"{'galau': 'galau', 'ngpain': 'ngpain', 'bingung': 'confuso'}",0,0,0.7232,,,,,,,,,
0,Sumpahya ngeliat blekping jd pengen punya rambut panjang lagi hikz :( tapi sampe kapanpun rambut panjang w ga bakalan kayak mereka heeeft [URL],Sumpahya Guarda blekping jd pengen punya rambut panjang lagi hikz tapi sampe kapanpun rambut panjang w ga bakalan kayak mereka heeeft,0.942037045955658,0,[0.9925 0.0012 0.0019 0.0015 0.003 ],0,[0.9448 0.0043 0.0026 0.0041 0.0441],"{'blekping': 'blekping', 'hikz': 'hikz', 'sumpahya': 'imprecare', 'ngeliat': 'Guarda', 'heeeft': 'heeeft', 'rambut': 'rambut', 'sampe': 'sampe'}",0,0,1.1926,,,,,,,,,
4,"Well, ternyata yg punya bali nature lumayan awet baunya. Td sore iseng usap2 di tangan trus ditempelin ke bantal. Ku tinggal pergi sejam 2 jam ehh baunya masih ninggal~ lumayan, alternatif untukku yg sering wahing kena farfumm~  [URL]",ternyata quale punya Bali nature lumayan awet Td pomeriggio iseng usap2 di tangan trus ditempelin ke Ku ristabilire andare sejam 2 minerale ehh baunya masih alternatif untukku quale sering wahing kena,0.815105676651001,4,[3.600e-03 3.000e-04 1.440e-02 2.100e-03 9.796e-01],4,[1.950e-02 4.000e-04 8.700e-03 2.700e-03 9.686e-01],"{'alternatif': 'alternatif', 'yg': 'quale', 'bali': 'Bali', 'tinggal': 'ristabilire', 'lumayan': 'lumayan', 'trus': 'trus', 'ku': 'mio', 'ditempelin': 'ditempelin', 'sejam': 'sejam', 'sore': 'pomeriggio', 'jam': 'minerale', 'pergi': 'andare', 'kena': 'kena'}",4,4,0.7952,,,,,,,,,
0,"Aliran darahku menghantarkan rasa rindu di sela-sela sel otakku yang terus berbisik untuk mengucapkannya, tapi aku tidak mampu, bahkan hanya untuk menyiratkannya. [URL]",Aliran darahku menghantarkan rasa Perdere di sel otakku yang terus berbisik untuk tapi aku tidak bahkan hanya untuk,0.9138959646224976,0,[9.884e-01 1.000e-03 8.400e-03 1.500e-03 8.000e-04],0,[9.922e-01 2.100e-03 1.900e-03 3.000e-03 9.000e-04],"{'berbisik': 'berbisik', 'rindu': 'Perdere', 'aliran': 'aliran', 'menghantarkan': 'menghantarkan'}",0,0,0.7713,,,,,,,,,
