text,sentiment,perturbed_text,perturbed_semantic_sim,pred_label,pred_proba,perturbed_label,perturbed_proba,translated_word(s),adv_pred,adv_pred_on_orig,running_time(s),before_attack_acc,after_attack_acc,avg_semantic_sim,avg_running_time(s),adv_training,delta_acc,delta_adv,acc_adv_training_on_orig,best_epoch
"juru bicara komisi pemberantasan korupsi kpk febri diansyah mengungkapkan , laporan harta kekayaan calon presiden joko widodo telah terverifikasi lengkap . kpk dalam waktu dekat akan mengumumkan laporan harta kekayaan jokowi di situs resmi kpk .",1,juru bicara komisi pemberantasan korupsi kpk febri diansyah mengungkapkan laporan harta kekayaan calon presiden joko widodo telah terverifikasi lengkap kpk dalam waktu dekat akan mengumumkan laporan harta kekayaan jokowi di situs rasmi kpk,0.9911403059959412,1,[9.00e-04 9.98e-01 1.10e-03],1,[0.0012 0.9977 0.0011],"{'korupsi': 'korupsi', 'laporan': 'laporan', 'calon': 'calon', 'harta': 'harta', 'kekayaan': 'kekayaan', 'joko': 'joko', 'situs': 'situs', 'presiden': 'presiden', 'resmi': 'rasmi', 'bicara': 'bicara', 'mengumumkan': 'mengumumkan', 'komisi': 'komisi', 'kpk': 'kpk', 'jokowi': 'jokowi', 'juru': 'juru', 'lengkap': 'lengkap', 'widodo': 'widodo'}",1,1,0.7505,,,,,,,,,
dia tidak pantas jadi pemimpin negara ini .,2,dia tidak pantas jadi pemimpin negara ini,1.0000001192092896,2,[8.000e-04 1.000e-03 9.982e-01],2,[8.000e-04 6.000e-04 9.986e-01],{'pemimpin': 'pemimpin'},2,2,0.6592,,,,,,,,,
"tidak perlu diragukan lagi , semua orang memang membenci dia , aku pun sama .",2,tidak perlu diragukan lagi semua orang memang membenci dia aku pun sama,1.0000001192092896,2,[0.0019 0.0013 0.9969],2,[2.900e-03 6.000e-04 9.965e-01],{'diragukan': 'diragukan'},2,2,0.6703,,,,,,,,,
"selalu tidak suka sama cara dia ngomong , belepotan , dan sok paling mengerti sama masalah di negara ini .",2,selalu tidak suka sama cara dia ngomong belepotan dan sok paling mengerti sama masalah di negara ini,1.0000001192092896,2,[8.000e-04 6.000e-04 9.986e-01],2,[7.000e-04 4.000e-04 9.989e-01],"{'belepotan': 'belepotan', 'sok': 'sok', 'suka': 'suka', 'negara': 'negara'}",2,2,0.6539,,,,,,,,,
pelayanan di supermarket itu payah .,2,pelayanan di supermarket itu payah,1.0,2,[8.000e-04 7.000e-04 9.985e-01],2,[8.000e-04 5.000e-04 9.987e-01],"{'pelayanan': 'pelayanan', 'supermarket': 'supermarket'}",2,2,0.624,,,,,,,,,
"aku kecewa dengan pelayanan hotel yang semalam aku tempati , kamar mandi kotor , pelayan tidak ramah .",2,aku kecewa dengan pelayanan hotel yang semalam aku tempati kamar mandi kotor pelayan tidak ramah,1.0,2,[1.700e-03 5.000e-04 9.978e-01],2,[1.100e-03 4.000e-04 9.985e-01],"{'ramah': 'ramah', 'kecewa': 'kecewa', 'kotor': 'kotor', 'pelayan': 'pelayan', 'tempati': 'tempati', 'hotel': 'hotel', 'pelayanan': 'pelayanan', 'kamar': 'kamar'}",2,2,0.6422,,,,,,,,,
"parah , sih , bikin emosi naik ngobrol sama pelayanan pelanggan bank itu , songong setelah .",2,parah neraka bikin emosi naik ngobrol sama pelayanan pelanggan bank itu songong setelah,0.977336287498474,2,[9.000e-04 5.000e-04 9.986e-01],2,[1.200e-03 5.000e-04 9.983e-01],"{'ngobrol': 'ngobrol', 'parah': 'parah', 'sih': 'neraka', 'emosi': 'emosi', 'songong': 'songong', 'bank': 'bank', 'pelayanan': 'pelayanan'}",2,2,0.6678,,,,,,,,,
dia tidak cocok pakai baju mahal karena dari sana nya memang sudah kelihatan kayak orang miskin .,2,dia tidak mengikut pakai baju mahal karena dari sana miliknya memang sudah kelihatan kayak orang miskin,0.9776818156242372,2,[0.0027 0.0012 0.9961],2,[0.0024 0.0022 0.9954],"{'miskin': 'miskin', 'nya': 'miliknya', 'kayak': 'kayak', 'orang': 'orang', 'cocok': 'mengikut', 'baju': 'baju'}",2,2,0.6481,,,,,,,,,
"harga makanan di restoran tadi mahal banget , sudah begitu tidak enak lagi makanan nya .",2,harga makanan di restoran tadi mahal banget sudah begitu tidak baik lagi makanan nya,0.987892746925354,2,[2.400e-03 4.000e-04 9.972e-01],2,[1.500e-03 2.000e-04 9.983e-01],"{'banget': 'banget', 'enak': 'baik', 'makanan': 'makanan', 'harga': 'harga', 'mahal': 'mahal'}",2,2,0.6584,,,,,,,,,
"nyesel deh beli baju di toko tadi , kualitas nya murahan banget .",2,penyesalan deh beli baju di toko tadi kualitas miliknya murahan banget,0.931321620941162,2,[1.100e-03 4.000e-04 9.984e-01],2,[8.000e-04 3.000e-04 9.989e-01],"{'murahan': 'murahan', 'deh': 'deh', 'nyesel': 'penyesalan', 'banget': 'banget', 'beli': 'beli', 'kualitas': 'kualitas', 'nya': 'miliknya'}",2,2,0.6768,,,,,,,,,
"ipuh , pantesan tidak pernah didatangkan banyak orang , ternyata tempat makan di sana dalem nya kotor banget , sampah saja dibiarkan berserakan .",2,ipuh pantesan tidak pernah didatangkan banyak orang ternyata tempat makan di sana dalem nya kotor banget sampah saja ditinggalkan berserakan,0.9924102425575256,2,[3.200e-03 3.000e-04 9.965e-01],2,[3.400e-03 3.000e-04 9.962e-01],"{'kotor': 'kotor', 'sampah': 'sampah', 'dalem': 'dalem', 'ipuh': 'ipuh', 'dibiarkan': 'ditinggalkan', 'orang': 'orang', 'berserakan': 'berserakan', 'pantesan': 'pantesan'}",2,2,0.694,,,,,,,,,
"tidak ada enak nya makan di sana , bakso tidak enak , teh manis nya rasanya aneh , mi ayam nya mie nya kelembekan , tidak mau lagi deh ke sana .",2,tidak ada baik miliknya makan di sana bakso tidak baik teh manis miliknya rasanya aneh mi ayam miliknya mie miliknya kelembekan tidak mau lagi deh ke sana,0.9356224536895752,2,[4.400e-03 3.000e-04 9.954e-01],2,[1.400e-03 2.000e-04 9.984e-01],"{'makan': 'makan', 'nya': 'miliknya', 'teh': 'teh', 'enak': 'baik', 'manis': 'manis', 'mi': 'mi', 'bakso': 'bakso', 'ayam': 'ayam', 'mie': 'mie'}",2,2,0.7051,,,,,,,,,
"benci banget sama pelayanan di rumah sakit itu , tidak ada adab nya .",2,benci banget sama pelayanan di rumah sakit itu tidak ada adab miliknya,0.9785014986991882,2,[1.100e-03 4.000e-04 9.985e-01],2,[1.000e-03 3.000e-04 9.987e-01],"{'adab': 'adab', 'nya': 'miliknya', 'banget': 'banget', 'rumah': 'rumah', 'benci': 'benci'}",2,2,0.6544,,,,,,,,,
saya tidak mau bicara lagi sama orang bodoh kayak dia .,2,saya tidak mau bicara lagi sama orang bodoh kayak dia,1.0,2,[1.100e-03 9.000e-04 9.981e-01],2,[9.000e-04 4.000e-04 9.986e-01],"{'bodoh': 'bodoh', 'orang': 'orang', 'kayak': 'kayak'}",2,2,0.6745,,,,,,,,,
"sampai kapan pun , saya tidak sudi berbagi sama orang yang tidak tahu terima kasih biarpun dia keluarga saya sendiri .",2,sampai kapan pun saya tidak sudi berbagi sama orang yang tidak tahu terima cinta biarpun dia keluarga saya sendiri,0.9873577952384948,2,[0.0059 0.0021 0.992 ],2,[0.0036 0.0013 0.9951],"{'sudi': 'sudi', 'biarpun': 'biarpun', 'kasih': 'cinta', 'keluarga': 'keluarga', 'terima': 'terima'}",2,2,0.6677,,,,,,,,,
"gue tidak puas sama pelayanan kerja di tempat kemarin , hak-hak karyawan dibatesin banget .",2,saya tidak puas sama pelayanan kerja di tempat semalaman karyawan dibatesin banget,0.9593783617019652,2,[9.000e-04 5.000e-04 9.986e-01],2,[8.000e-04 3.000e-04 9.989e-01],"{'dibatesin': 'dibatesin', 'kemarin': 'semalaman', 'gue': 'saya', 'pelayanan': 'pelayanan', 'kerja': 'kerja', 'puas': 'puas'}",2,2,0.6663,,,,,,,,,
"gue sudah mengecap dia jelek sih , jadi mau sebaik apa pun sikap nya , gue tetap tidak suka dia .",2,saya sudah mengecap dia teruk neraka jadi mau sebaik apa pun sikap miliknya saya tetap tidak suka dia,0.9525469541549684,2,[8.000e-04 4.000e-04 9.988e-01],2,[9.000e-04 3.000e-04 9.988e-01],"{'jelek': 'teruk', 'sih': 'neraka', 'nya': 'miliknya', 'mengecap': 'mengecap', 'gue': 'saya'}",2,2,0.6631,,,,,,,,,
"setelah diperhatikan , iklan di indonesia paling tidak kreatif dibanding negara lain , terutama thailand .",2,setelah diperhatikan iklan di Indonesia paling tidak kreatif dibanding negara lain terutama thailand,1.0000001192092896,2,[1.500e-03 8.000e-04 9.977e-01],2,[1.100e-03 4.000e-04 9.985e-01],"{'iklan': 'iklan', 'indonesia': 'Indonesia', 'kreatif': 'kreatif', 'negara': 'negara', 'dibanding': 'dibanding'}",2,2,0.6597,,,,,,,,,
"tidak mengerti lagi sama perfilman di indonesia , tidak berkualitas banget .",2,tidak mengerti lagi sama pawagam di Indonesia tidak berkualitas banget,0.9841386079788208,2,[8.000e-04 4.000e-04 9.987e-01],2,[8.000e-04 3.000e-04 9.989e-01],"{'mengerti': 'mengerti', 'perfilman': 'pawagam', 'berkualitas': 'berkualitas', 'indonesia': 'Indonesia'}",2,2,0.6675,,,,,,,,,
"gue enggak suka sama pelatih timnas yang sekarang , strategi yang dibikin nya tidak bisa dipakai buat mengalahkan lawan .",2,saya enggak suka sama jurulatih timnas yang sekarang strategi yang dibikin miliknya tidak bisa dipakai buat mengalahkan lawan,0.9698765277862548,2,[9.000e-04 5.000e-04 9.987e-01],2,[7.00e-04 3.00e-04 9.99e-01],"{'dibikin': 'dibikin', 'timnas': 'timnas', 'strategi': 'strategi', 'nya': 'miliknya', 'pelatih': 'jurulatih', 'dipakai': 'dipakai', 'gue': 'saya', 'suka': 'suka'}",2,2,0.6769,,,,,,,,,
"orang-orang di indonesia itu memang begitu , kerjaan nya nethink terus sama pemimpin . tidak suka gue .",2,di Indonesia itu memang begitu kerjaan miliknya nethink terus sama pemimpin tidak suka saya,0.973996639251709,2,[6.00e-04 4.00e-04 9.99e-01],2,[8.000e-04 3.000e-04 9.989e-01],"{'suka': 'suka', 'kerjaan': 'kerjaan', 'nya': 'miliknya', 'gue': 'saya', 'indonesia': 'Indonesia'}",2,2,0.6357,,,,,,,,,
"kadang bingung sih kenapa mulut netijen pada tidak bisa dijaga , bisa nya behina terus . aneh .",2,kadang salah neraka kenapa mulut netijen pada tidak bisa dijaga bisa nya behina terus aneh,0.939768135547638,2,[6.000e-04 6.000e-04 9.989e-01],2,[4.000e-04 5.000e-04 9.991e-01],"{'netijen': 'netijen', 'dijaga': 'dijaga', 'behina': 'behina', 'mulut': 'mulut', 'sih': 'neraka', 'bingung': 'salah', 'aneh': 'aneh'}",2,2,0.6289,,,,,,,,,
ah persija mah cupu .,2,ah persija mah cupu,1.0,2,[7.000e-04 8.000e-04 9.986e-01],2,[9.000e-04 6.000e-04 9.985e-01],"{'cupu': 'cupu', 'persija': 'persija', 'mah': 'mah'}",2,2,0.649,,,,,,,,,
persija cuma bisa mencari ribut saja kalau lagi main di lapangan . main nya tidak jago sama sekali .,2,persija cuma bisa mencari ribut saja kalau lagi main di lapangan main nya tidak jago sama sekali,1.0000001192092896,2,[5.000e-04 5.000e-04 9.991e-01],2,[7.000e-04 4.000e-04 9.989e-01],"{'ribut': 'ribut', 'jago': 'jago', 'mencari': 'mencari', 'main': 'main', 'persija': 'persija'}",2,2,0.6567,,,,,,,,,
memang masih zaman ya ngomong pakai kode-kodean ? tidak suka banget gue sama orang yang kayak gitu .,2,memang masih era ya ngomong pakai tidak suka banget saya sama orang yang kayak gitu,0.9581657648086548,2,[6.000e-04 6.000e-04 9.988e-01],2,[7.00e-04 3.00e-04 9.99e-01],"{'pakai': 'pakai', 'gue': 'saya', 'ngomong': 'ngomong', 'zaman': 'era', 'banget': 'banget', 'gitu': 'gitu', 'orang': 'orang', 'ya': 'ya'}",2,2,0.6471,,,,,,,,,
harus nya pop ditenggelamkan di indonesia karena cuma bikin anak muda lupa agama .,2,harus miliknya pop ditenggelamkan di Indonesia karena cuma bikin anak muda lupa agama,0.9799540042877196,2,[5.000e-04 7.000e-04 9.988e-01],2,[5.000e-04 4.000e-04 9.991e-01],"{'ditenggelamkan': 'ditenggelamkan', 'pop': 'pop', 'nya': 'miliknya', 'indonesia': 'Indonesia', 'anak': 'anak', 'lupa': 'lupa', 'muda': 'muda'}",2,2,0.6497,,,,,,,,,
"kagak ada faedah nya kenal kpop , yang ada mata kita dibutakan terus bikin kita muja-muja manusia .",2,kagak ada faedah miliknya kenal kpop yang ada mata kita dibutakan terus bikin kita manusia,0.9875413775444032,2,[5.00e-04 5.00e-04 9.99e-01],2,[6.000e-04 3.000e-04 9.991e-01],"{'dibutakan': 'dibutakan', 'kpop': 'kpop', 'kagak': 'kagak', 'faedah': 'faedah', 'nya': 'miliknya', 'kenal': 'kenal', 'mata': 'mata'}",2,2,0.6549,,,,,,,,,
entah kenapa gue enggak suka banget sama politisi yang bisa ngemis-ngemis suara rakyat dengan manfaatkan harga diri ulama .,2,entah kenapa saya enggak suka banget sama politisi yang bisa suara rakyat dengan manfaatkan harga diri ulama,0.9807557463645936,2,[9.000e-04 1.200e-03 9.979e-01],2,[8.000e-04 5.000e-04 9.987e-01],"{'politisi': 'politisi', 'banget': 'banget', 'harga': 'harga', 'suara': 'suara', 'suka': 'suka', 'gue': 'saya', 'rakyat': 'rakyat'}",2,2,0.6472,,,,,,,,,
"menyesal gue beli vivo , kamera nya tidak bagus .",2,menyesal saya beli vivo kamera miliknya tidak bagus,0.9352540373802184,2,[1.100e-03 4.000e-04 9.984e-01],2,[8.000e-04 3.000e-04 9.989e-01],"{'menyesal': 'menyesal', 'gue': 'saya', 'beli': 'beli', 'kamera': 'kamera', 'nya': 'miliknya'}",2,2,0.6401,,,,,,,,,
"sudah berkali-kali mencoba produk apple , tetap tidak suka .",2,sudah mencoba produk apple tetap tidak suka,0.974153220653534,2,[1.000e-03 8.000e-04 9.982e-01],2,[9.000e-04 3.000e-04 9.988e-01],"{'suka': 'suka', 'apple': 'apple', 'produk': 'produk'}",2,2,0.6335,,,,,,,,,
produk lokal memang cetek .,2,produk lokal memang cetek,1.0,2,[0.0012 0.0019 0.9969],2,[1.100e-03 9.000e-04 9.979e-01],{'produk': 'produk'},2,2,0.6074,,,,,,,,,
band di indonesia tidak berkualitas dah .,2,band di indonesia tidak berkualitas dah,1.0,2,[8.000e-04 5.000e-04 9.988e-01],2,[9.000e-04 3.000e-04 9.989e-01],"{'berkualitas': 'berkualitas', 'dah': 'dah', 'band': 'band'}",2,2,0.6398,,,,,,,,,
"kalau dibandingkan sama jepang , indonesia itu tidak ada apa-apa nya .",2,kalau dibandingkan sama Jepun indonesia itu tidak ada miliknya,0.9638744592666626,2,[1.200e-03 7.000e-04 9.981e-01],2,[1.100e-03 7.000e-04 9.982e-01],"{'jepang': 'Jepun', 'dibandingkan': 'dibandingkan', 'nya': 'miliknya'}",2,2,0.6436,,,,,,,,,
netijen mulut nya sampah semua . tidak berfaedah .,2,netijen mulut nya sampah semua tidak berfaedah,1.0,2,[7.000e-04 6.000e-04 9.988e-01],2,[7.000e-04 4.000e-04 9.989e-01],"{'netijen': 'netijen', 'berfaedah': 'berfaedah', 'mulut': 'mulut', 'sampah': 'sampah'}",2,2,0.6593,,,,,,,,,
menurut gue sih indonesia bakal susah bangkit kalau isi otak penduduk nya gitu-gitu aja .,2,menurut gue neraka Indonesia bakal keras bangkit kalau isi otak penduduk miliknya aja,0.8999456167221069,2,[9.000e-04 7.000e-04 9.984e-01],2,[6.000e-04 9.000e-04 9.986e-01],"{'susah': 'keras', 'indonesia': 'Indonesia', 'otak': 'otak', 'sih': 'neraka', 'aja': 'aja', 'penduduk': 'penduduk', 'nya': 'miliknya', 'bangkit': 'bangkit'}",2,2,0.6629,,,,,,,,,
"percuma 2019 ganti presiden , kayak makan buah simalakama . tidak ada untung nya .",2,percuma 2019 ganti presiden kayak makan buah simalakama tidak ada keuntungan miliknya,0.962910771369934,2,[4.000e-04 6.000e-04 9.989e-01],2,[7.000e-04 5.000e-04 9.987e-01],"{'untung': 'keuntungan', 'simalakama': 'simalakama', 'buah': 'buah', 'makan': 'makan', 'nya': 'miliknya', 'kayak': 'kayak'}",2,2,0.6771,,,,,,,,,
"kepemimpinan di indonesia mah cuma kayak panggung komedi , rakyat nya juga sama saja , cuma bisa nontonin saja . tidak ada yang baik",2,kepemimpinan di indonesia mah cuma kayak pentas komedi rakyat miliknya juga sama saja cuma bisa nontonin saja tidak ada yang baik,0.9771649241447448,2,[9.000e-04 3.000e-04 9.988e-01],2,[6.000e-04 3.000e-04 9.991e-01],"{'nontonin': 'nontonin', 'mah': 'mah', 'panggung': 'pentas', 'rakyat': 'rakyat', 'komedi': 'komedi', 'kepemimpinan': 'kepemimpinan', 'nya': 'miliknya'}",2,2,0.6619,,,,,,,,,
sandi uno tidak bertanggung jawab banget deh sama jakarta .,2,sandi uno tidak bertanggung jawab banget deh sama Jakarta,1.0000001192092896,2,[6.000e-04 6.000e-04 9.988e-01],2,[6.00e-04 3.00e-04 9.99e-01],"{'sandi': 'sandi', 'jakarta': 'Jakarta', 'deh': 'deh', 'banget': 'banget'}",2,2,0.6653,,,,,,,,,
"sebenarnya yang dicari sama para pejabat di indonesia hanyalah kekuasaan , bukan mensejahterakan rakyat . payah .",2,sebenarnya yang carilah sama para pejabat di indonesia hanyalah kekuasaan bukan mensejahterakan rakyat payah,0.9895198345184326,2,[7.000e-04 5.000e-04 9.988e-01],2,[6.00e-04 4.00e-04 9.99e-01],"{'mensejahterakan': 'mensejahterakan', 'dicari': 'carilah', 'payah': 'payah', 'pejabat': 'pejabat', 'rakyat': 'rakyat'}",2,2,0.6635,,,,,,,,,
"sumpah ya gue terganggu banget sama suara nya komentator bola di indonesia , malah bikin esmosi jiwa .",2,sumpah ya saya terganggu banget sama suara miliknya komentator bola di indonesia malah bikin esmosi jiwa,0.9657803773880004,2,[7.00e-04 4.00e-04 9.99e-01],2,[6.000e-04 3.000e-04 9.991e-01],"{'gue': 'saya', 'esmosi': 'esmosi', 'banget': 'banget', 'ya': 'ya', 'sumpah': 'sumpah', 'jiwa': 'jiwa', 'nya': 'miliknya', 'komentator': 'komentator', 'suara': 'suara'}",2,2,0.6508,,,,,,,,,
pemain persib main nya jelek .,2,pemain persib main miliknya jelek,0.779967188835144,2,[6.000e-04 9.000e-04 9.985e-01],2,[4.00e-04 6.00e-04 9.99e-01],"{'persib': 'persib', 'nya': 'miliknya', 'pemain': 'pemain'}",2,2,0.6349,,,,,,,,,
artis cowok pop banci semua .,2,artis cowok pop banci semua,1.0,2,[8.000e-04 3.800e-03 9.954e-01],2,[7.000e-04 1.600e-03 9.977e-01],"{'artis': 'artis', 'pop': 'pop'}",2,2,0.6412,,,,,,,,,
harga baju di ramayana tidak sebanding sama kualitas baju nya .,2,harga baju di ramayana tidak sebanding sama kualitas baju miliknya,0.9655892252922058,2,[4.900e-03 7.000e-04 9.943e-01],2,[5.300e-03 5.000e-04 9.941e-01],"{'baju': 'baju', 'ramayana': 'ramayana', 'sebanding': 'sebanding', 'harga': 'harga', 'nya': 'miliknya'}",2,2,0.6486,,,,,,,,,
model baju yang ada di matahari tidak sebagus model baju di ramayana .,2,model baju yang ada di matahari tidak sebagus model baju di ramayana,1.0000001192092896,2,[0.0474 0.076  0.8766],2,[0.019  0.0037 0.9773],"{'matahari': 'matahari', 'baju': 'baju', 'ramayana': 'ramayana', 'model': 'model'}",2,2,0.6511,,,,,,,,,
"sudah harga mahal , tidak enak pula makanan nya , tidak mau lagi deh ke restoran itu .",2,sudah harga mahal tidak enak pula makanan nya tidak mau lagi deh ke restoran itu,1.0000001192092896,2,[2.300e-03 3.000e-04 9.974e-01],2,[1.900e-03 2.000e-04 9.979e-01],"{'restoran': 'restoran', 'deh': 'deh', 'harga': 'harga', 'mahal': 'mahal', 'makanan': 'makanan'}",2,2,0.6455,,,,,,,,,
"anak muda zaman sekarang cuma mikirin tenar , enggak mikir buat masa depan .",2,anak muda era sekarang cuma mikirin tenar enggak fikir buat masa depan,0.932736039161682,2,[9.00e-04 1.10e-03 9.98e-01],2,[8.000e-04 7.000e-04 9.986e-01],"{'tenar': 'tenar', 'mikirin': 'mikirin', 'zaman': 'era', 'mikir': 'fikir'}",2,2,0.6374,,,,,,,,,
bodoh banget itu bocah tidak punya otak mengajak jokowi berantem .,2,bodoh banget itu bocah tidak punya otak mengajak jokowi berantem,1.0000001192092896,2,[5.000e-04 8.000e-04 9.988e-01],2,[5.000e-04 4.000e-04 9.991e-01],"{'berantem': 'berantem', 'bocah': 'bocah', 'otak': 'otak', 'banget': 'banget', 'mengajak': 'mengajak'}",2,2,0.4053,,,,,,,,,
sinyal xl jelek banget di sini .,2,sinyal xl jelek banget di sini,1.0,2,[7.000e-04 6.000e-04 9.986e-01],2,[6.00e-04 3.00e-04 9.99e-01],"{'xl': 'xl', 'banget': 'banget'}",2,2,0.4102,,,,,,,,,
"indosat bagus iklan nya doang , tapi kualitas nya nol .",2,indosat bagus iklan miliknya sahaja tapi kualitas miliknya nol,0.8180983066558838,2,[6.000e-04 5.000e-04 9.988e-01],2,[7.00e-04 3.00e-04 9.99e-01],"{'nol': 'nol', 'doang': 'sahaja', 'nya': 'miliknya', 'kualitas': 'kualitas', 'indosat': 'indosat', 'iklan': 'iklan'}",2,2,0.4168,,,,,,,,,
sumpah ya kesel banget melihat orang yang sok tahu kayak anies .,2,sumpah ya kesel banget melihat orang yang sok tahu kayak anies,1.0,2,[8.000e-04 5.000e-04 9.987e-01],2,[7.00e-04 3.00e-04 9.99e-01],"{'kesel': 'kesel', 'sumpah': 'sumpah', 'banget': 'banget', 'anies': 'anies', 'ya': 'ya', 'kayak': 'kayak'}",2,2,0.4228,,,,,,,,,
"barang-barang di informa biasa saja , tapi harga mahal banget .",2,di informa biasa saja tapi harga mahal banget,0.979841947555542,2,[1.800e-03 4.000e-04 9.978e-01],2,[1.300e-03 5.000e-04 9.982e-01],"{'harga': 'harga', 'informa': 'informa'}",2,2,0.4149,,,,,,,,,
"handphone samsung jelek , gampang rusak .",2,handphone samsung teruk gampang rusak,0.9438071250915528,2,[9.00e-04 1.10e-03 9.98e-01],2,[8.000e-04 1.000e-03 9.982e-01],"{'jelek': 'teruk', 'samsung': 'samsung', 'handphone': 'handphone', 'gampang': 'gampang'}",2,2,0.4173,,,,,,,,,
"hai prabowo , daripada malu mending tidak usah naik jadi presiden tahun ini .",2,hai prabowo daripada malu mending tidak usah naik jadi presiden tahun ini,1.0000001192092896,2,[4.000e-04 9.000e-04 9.987e-01],2,[4.00e-04 6.00e-04 9.99e-01],"{'mending': 'mending', 'prabowo': 'prabowo', 'hai': 'hai', 'malu': 'malu'}",2,2,0.4055,,,,,,,,,
"pengecut dia itu , cuma bisa nantangin dari belakang saja .",2,pengecut dia itu cuma bisa nantangin dari belakang saja,1.0000001192092896,2,[5.000e-04 7.000e-04 9.988e-01],2,[4.00e-04 5.00e-04 9.99e-01],{'pengecut': 'pengecut'},2,2,0.4144,,,,,,,,,
"aku tidak suka sama cowok yang bisa dance , tidak maco .",2,aku tidak suka sama cowok yang bisa dance tidak maco,1.0000001192092896,2,[1.800e-03 4.000e-04 9.977e-01],2,[3.300e-03 4.000e-04 9.963e-01],"{'suka': 'suka', 'cowok': 'cowok', 'dance': 'dance'}",2,2,0.4284,,,,,,,,,
"sebenarnya gue benci banget sih sama orang yang kalau lagi diajak ngobrol dia tidak mau lihat muka kita , tidak sopan .",2,sebenarnya saya benci banget neraka sama orang yang kalau lagi diajak ngobrol dia tidak mau lihat muka kita tidak sopan,0.9845489859580994,2,[7.000e-04 5.000e-04 9.988e-01],2,[5.00e-04 4.00e-04 9.99e-01],"{'benci': 'benci', 'sopan': 'sopan', 'diajak': 'diajak', 'sih': 'neraka', 'banget': 'banget', 'gue': 'saya', 'ngobrol': 'ngobrol', 'muka': 'muka'}",2,2,0.4325,,,,,,,,,
di antara mata kuliah yang ada gue paling tidak suka sama statistika .,2,di antara mata kuliah yang ada saya paling tidak suka sama statistika,0.9832162857055664,2,[1.400e-03 9.000e-04 9.977e-01],2,[1.000e-03 3.000e-04 9.987e-01],"{'suka': 'suka', 'kuliah': 'kuliah', 'mata': 'mata', 'gue': 'saya'}",2,2,0.4158,,,,,,,,,
orang yang pakai kacamata itu terlihat cupu .,2,orang yang pakai kacamata itu terlihat cupu,1.0,2,[7.000e-04 7.000e-04 9.986e-01],2,[7.000e-04 5.000e-04 9.988e-01],"{'cupu': 'cupu', 'orang': 'orang', 'kacamata': 'kacamata'}",2,2,0.4089,,,,,,,,,
"apa bagus nya ya itu acara l - men , jijik gue sih liat nya .",2,apa bagus miliknya ya itu program l men jijik saya neraka liat miliknya,0.897081732749939,2,[5.000e-04 4.000e-04 9.991e-01],2,[1.000e-03 4.000e-04 9.986e-01],"{'jijik': 'jijik', 'sih': 'neraka', 'liat': 'liat', 'gue': 'saya', 'l': 'l', 'nya': 'miliknya', 'acara': 'program', 'ya': 'ya'}",2,2,0.422,,,,,,,,,
sinetron di indonesia mana ada yang bagus .,2,sinetron di Indonesia mana ada yang bagus,1.0,2,[1.500e-03 7.000e-04 9.978e-01],2,[1.500e-03 3.000e-04 9.982e-01],"{'indonesia': 'Indonesia', 'sinetron': 'sinetron'}",2,2,0.4066,,,,,,,,,
"odol pepsodent menurut gue terlalu pedas , gue enggak suka .",2,odol pepsodent menurut saya terlalu pedas saya enggak suka,0.8519501090049744,2,[1.900e-03 6.000e-04 9.975e-01],2,[1.600e-03 3.000e-04 9.981e-01],"{'pepsodent': 'pepsodent', 'suka': 'suka', 'gue': 'saya', 'pedas': 'pedas'}",2,2,0.4114,,,,,,,,,
gue enggak suka anggun jadi duta shampoo .,2,saya enggak suka anggun jadi duta shampoo,0.951627790927887,2,[8.000e-04 2.000e-03 9.973e-01],2,[6.000e-04 6.000e-04 9.988e-01],"{'duta': 'duta', 'anggun': 'anggun', 'gue': 'saya'}",2,2,0.4099,,,,,,,,,
kesian sheila on 7 tenggelem sekarang .,2,kesian sheila on 7 tenggelem sekarang,1.0000001192092896,2,[4.000e-04 8.000e-04 9.988e-01],2,[6.000e-04 5.000e-04 9.989e-01],"{'kesian': 'kesian', 'tenggelem': 'tenggelem', 'sheila': 'sheila'}",2,2,0.4075,,,,,,,,,
"andhika kangen band apa kabar ya , sepertinya makin miskin saja sekarang .",2,andhika kangen band apa kabar ya sepertinya makin miskin saja sekarang,1.0,2,[0.0017 0.0026 0.9958],2,[0.0029 0.0015 0.9957],"{'ya': 'ya', 'andhika': 'andhika', 'kangen': 'kangen', 'band': 'band'}",2,2,0.4143,,,,,,,,,
semua program yang ada ya kuya nya tidak pernah berfaedah .,2,semua program yang ada ya kuya miliknya tidak pernah berfaedah,0.9819737672805786,2,[8.000e-04 7.000e-04 9.985e-01],2,[6.000e-04 6.000e-04 9.988e-01],"{'berfaedah': 'berfaedah', 'nya': 'miliknya', 'kuya': 'kuya', 'program': 'program'}",2,2,0.4069,,,,,,,,,
"harus nya orang indonesia itu banyak cari ilmu , bukan malah banyak cari masalah .",2,harus miliknya orang Indonesia itu banyak cari ilmu bukan malah banyak cari masalah,0.9898083209991456,2,[0.0013 0.0017 0.997 ],2,[0.0044 0.0012 0.9944],"{'nya': 'miliknya', 'indonesia': 'Indonesia', 'ilmu': 'ilmu', 'cari': 'cari'}",2,2,0.4158,,,,,,,,,
its tidak ada apa-apa nya kalau dibandingkan itb .,2,its tidak ada miliknya kalau dibandingkan itb,0.9294828176498412,2,[0.0035 0.001  0.9954],2,[0.0039 0.0014 0.9947],"{'dibandingkan': 'dibandingkan', 'nya': 'miliknya', 'itb': 'itb'}",2,2,0.4119,,,,,,,,,
"sekarang makin banyak orang yang nga ku islami , tapi akhlak kagak dijaga , selalu merasa jadi orang paling benar .",2,sekarang makin banyak orang yang tidak ku islami tapi akhlak kagak dijaga selalu merasa jadi orang paling benar,0.9824962019920348,2,[8.000e-04 1.000e-03 9.982e-01],2,[9.000e-04 6.000e-04 9.985e-01],"{'kagak': 'kagak', 'akhlak': 'akhlak', 'ku': 'ku', 'nga': 'tidak', 'islami': 'islami', 'dijaga': 'dijaga'}",2,2,0.4218,,,,,,,,,
gue enggak suka itu sama orang-orang yang pakai alasan agama buat menang di dunia politik .,2,saya enggak suka itu sama yang pakai alasan agama buat menang di dunia politik,0.9838696718215942,2,[0.0011 0.001  0.9979],2,[6.000e-04 4.000e-04 9.989e-01],"{'suka': 'suka', 'gue': 'saya', 'agama': 'agama', 'dunia': 'dunia', 'politik': 'politik', 'pakai': 'pakai'}",2,2,0.4188,,,,,,,,,
"kesal dah sama habib rizieq , malu - maluin saja bisa nya .",2,kesal dah sama habib rizieq malu maluin saja bisa nya,1.0000001192092896,2,[7.000e-04 7.000e-04 9.986e-01],2,[6.00e-04 4.00e-04 9.99e-01],"{'rizieq': 'rizieq', 'kesal': 'kesal', 'maluin': 'maluin', 'dah': 'dah', 'habib': 'habib'}",2,2,0.4101,,,,,,,,,
"tidak suka sama laptop merek acer , cepat rusak , kakak .",2,tidak suka sama laptop jenama acer cepat rusak kakak,0.9709064960479736,2,[1.300e-03 6.000e-04 9.981e-01],2,[1.400e-03 4.000e-04 9.982e-01],"{'rusak': 'rusak', 'merek': 'jenama', 'suka': 'suka', 'laptop': 'laptop', 'acer': 'acer'}",2,2,0.4132,,,,,,,,,
