label,tweet,perturbed_text,perturbed_semantic_sim,pred_label,pred_proba,perturbed_label,perturbed_proba,translated_word(s),adv_pred,adv_pred_on_orig,running_time(s),before_attack_acc,after_attack_acc,avg_semantic_sim,avg_running_time(s),adv_training,delta_acc,delta_adv,acc_adv_training_on_orig,best_epoch
4,AAAAAK SUKA BANGET. feel sehabis nonton sama kayak the greatest showman. ikut nyanyi pas dancing queen dan mamma mia. dan dancing queen yg ini jauuuuh lebih asik drpd yg versi meryl streep di film pertama hehe. RASANYA MAU BALIK NONTON LAGI,AAAAAK SUKA feel dopo guarda sama kayak the greatest ikut nyanyi pas dancing queen dan mamma dan dancing queen quale ini jauuuuh lebih Assorbito drpd quale versi meryl streep di film pertama RASANYA MAU BALIK NONTON LAGI,0.916732370853424,4,[1.50e-03 4.00e-04 6.10e-03 1.00e-03 9.91e-01],4,[0.0045 0.001  0.0386 0.0024 0.9535],"{'sehabis': 'dopo', 'asik': 'Assorbito', 'streep': 'streep', 'dancing': 'dancing', 'jauuuuh': 'jauuuuh', 'feel': 'feel', 'queen': 'queen', 'rasanya': 'rasanya', 'drpd': 'drpd', 'mau': 'mau', 'yg': 'quale', 'nonton': 'guarda', 'balik': 'ritorno', 'meryl': 'meryl', 'greatest': 'greatest'}",4,4,0.8312,,,,,,,,,
4,"Kuliner yang lagi hitz di Yogyakarta. Namanya ""ceplukan"". Jaman masih kecil tahun 1980-an suka mencari ceplukan di kebun. Setelah hampir 30 tahun, makan buah ini lagi. Viva la Ceplukan [URL]",Kuliner yang lagi hitz di Namanya Jaman masih kecil tahun suka mencari ceplukan di Setelah hampir 30 mangiare buah ini Viva la Ceplukan,0.9323095083236694,4,[5.900e-03 3.000e-04 6.000e-03 7.000e-04 9.871e-01],4,[0.0075 0.0013 0.0037 0.0016 0.9858],"{'la': 'la', 'makan': 'mangiare', 'kuliner': 'kuliner', 'viva': 'viva', 'namanya': 'namanya', 'ceplukan': 'ceplukan', 'jaman': 'jaman'}",4,4,0.8458,,,,,,,,,
4,"Saya serius, kalopun pak [USERNAME] nanti kalah, sy mending kalah sama yusril daripada sama prabowo Tapi kan gak mungkin kalah ya...hahaha [URL]",Saya kalopun pak nanti sy mending kalah sama yusril daripada sama prabowo Tapi kan gak mungkin kalah,0.9125785231590272,4,[0.0285 0.023  0.0027 0.0636 0.8822],3,[0.1093 0.0214 0.0019 0.8467 0.0206],{},3,4,0.7158,,,,,,,,,
1,"[USERNAME] Cuma mau nunjukkin ini, Kak.. Kalo linimasa aku yg begini kamu samain sama mereka yang tergugah isu-isu busuk politik, da aku bisa bilang apa lagii ~~ [URL]","[USERNAME] Cuma mau nunjukkin ini, Kak.. Kalo linimasa aku yg begini kamu samain sama mereka yang tergugah isu-isu busuk politik, da aku bisa bilang apa lagii ~~ [URL]",1.0,0,[9.881e-01 7.300e-03 1.100e-03 9.000e-04 2.600e-03],0,[9.881e-01 7.300e-03 1.100e-03 9.000e-04 2.600e-03],,0,0,0.2,,,,,,,,,
1,[USERNAME] [USERNAME] Kalo yg di Jakarta kan jago nyembunyiin buktinya dia punya perusahaan offshore yg bikin namanya muncul di Panama Paper... jadi harus jago banget untuk bisa temuin bukti,Kalo quale di Jakarta kan jago nyembunyiin buktinya dia punya perusahaan offshore quale bikin namanya apparire di Panama jadi harus jago banget untuk bisa temuin bukti,0.8845024704933167,1,[1.180e-02 9.768e-01 4.000e-04 7.900e-03 3.200e-03],1,[0.0449 0.8895 0.0018 0.0554 0.0084],"{'bukti': 'bukti', 'jago': 'jago', 'nyembunyiin': 'nyembunyiin', 'offshore': 'offshore', 'bikin': 'bikin', 'kalo': 'Se', 'muncul': 'apparire', 'yg': 'quale', 'perusahaan': 'perusahaan'}",1,1,0.7118,,,,,,,,,
0,"Yaampun aslii deh ga lagi ngopi malem2 -,- alhasil ga bisa tidur sampe jm 4 pagi trus jam /6 udah kebangun lagi dan ga bisa merem lagi sampe sekarang padahal mata berat tapi ga bisa diajak merem jugaaa",Yaampun aslii ok ga lagi ngopi malem2 alhasil ga bisa tidur sampe jm 4 mattina trus minerale udah kebangun lagi dan ga bisa merem lagi sampe sekarang padahal occhio berat tapi ga bisa diajak merem jugaaa,0.9492793679237366,0,[0.9713 0.0049 0.0036 0.0163 0.004 ],0,[0.9331 0.0108 0.0086 0.0364 0.0111],"{'yaampun': 'Cavolo', 'mata': 'occhio', 'berat': 'berat', 'jam': 'minerale', 'ga': 'ga', 'kebangun': 'kebangun', 'ngopi': 'ngopi', 'pagi': 'mattina', 'deh': 'ok', 'alhasil': 'alhasil', 'merem': 'merem', 'sampe': 'sampe', 'jugaaa': 'jugaaa'}",0,0,0.7722,,,,,,,,,
0,mau banget disposable cameranya karena emg dr dulu pengen punya aja tp blm smpt karena sayang duit,mau banget monouso cameranya karena emg dr dulu pallavolo punya aja tp blm smpt karena sayang duit,0.973776638507843,0,[0.5689 0.003  0.0632 0.0205 0.3443],0,[0.8505 0.0035 0.0094 0.0387 0.0979],"{'tp': 'tp', 'blm': 'blm', 'dr': 'dr', 'smpt': 'smpt', 'pengen': 'pallavolo', 'disposable': 'monouso'}",0,0,0.7461,,,,,,,,,
1,"Emang bener yaa ""Orang baik pasti sama yg baik "" Jahat ya sama yang jahat ""Tukang selingkuh ya sama yg tukang selingkuh juga, trus nikah sama2 di selingkuhin"" Jodoh itu cerminan diri, makanya banyakin ngaca",Emang bener si baik pasti sama yg baik Jahat ya sama yang malvagio selingkuh ya sama yg tukang selingkuh trus nikah sama2 di Jodoh itu cerminan makanya banyakin ngaca,0.9623128175735474,1,[0.205  0.5459 0.0056 0.1959 0.0478],1,[0.1317 0.7865 0.0021 0.0261 0.0537],"{'emang': 'infatti', 'jodoh': 'jodoh', 'cerminan': 'cerminan', 'nikah': 'nikah', 'jahat': 'malvagio', 'yaa': 'si'}",1,1,0.5311,,,,,,,,,
2,Cinta datang tanpa di rencanakan Cinta datang begitu saja Tidak pernah ada waktu dan tempat untuk cinta sejati Semuanya terjadi tnp sengaja. Dlm satu detak jantung Dalam satu irama Tapi bisa menghasilkan Moment yang penuh arti #keseleoCinta #EfekGaBisaTidur [URL],Cinta datang tanpa di rencanakan Cinta datang begitu saja Tidak pernah ada waktu dan tempat untuk amore sejati Semuanya terjadi tnp Dlm satu detak jantung Dalam satu irama Tapi bisa menghasilkan Moment yang penuh arti,0.9834725856781006,2,[1.700e-03 4.000e-04 9.956e-01 1.200e-03 1.100e-03],2,[1.300e-03 4.000e-04 9.963e-01 1.000e-03 1.000e-03],"{'irama': 'irama', 'dlm': 'dlm', 'tnp': 'tnp', 'detak': 'detak', 'tidak': 'tidak', 'cinta': 'amore', 'semuanya': 'semuanya', 'sejati': 'sejati', 'rencanakan': 'rencanakan', 'jantung': 'jantung'}",2,2,0.7101,,,,,,,,,
1,"Pasti pada banyak yg mikir ""apasi bel sok2 di update lagi, biar ikutan viral kan?"" Hm, gapapa kok kalian semua disini nggak retweet or reply this thread, cuma mau nunjukin aja kalo ya mau kita artis kek mau org biasa kek mau siapa kek ya emg berhak marah kalo dilecehin.",Pasti pada banyak yg mikir bel sok2 di update biar Seguire viral gapapa kok kalian semua disini nggak retweet or reply questo cuma mau mostrare aja kalo S mau kita artis torta mau org biasa torta mau siapa torta S emg berhak arrabbiato kalo,0.9098336696624756,1,[1.50e-03 9.97e-01 1.00e-04 8.00e-04 6.00e-04],1,[2.50e-03 9.96e-01 1.00e-04 7.00e-04 7.00e-04],"{'nunjukin': 'mostrare', 'marah': 'arrabbiato', 'retweet': 'retweet', 'nggak': 'nggak', 'reply': 'reply', 'gapapa': 'gapapa', 'ikutan': 'Seguire', 'emg': 'emg', 'aja': 'aja', 'biar': 'biar', 'ya': 'S', 'this': 'questo', 'viral': 'viral', 'artis': 'artis', 'berhak': 'berhak', 'kek': 'torta', 'pasti': 'certo'}",1,1,0.7709,,,,,,,,,
1,okay ternyata emosi saya sekarang bnr2 balik lagi kaya dulu ya alah kenapa jadi begini lagi yang tidak-bisa control emosi >_<,okay ternyata emosi saya sekarang bnr2 balik lagi kaya dulu ya alah kenapa jadi begini lagi yang tidak-bisa control emosi >_<,1.0,0,[9.701e-01 1.280e-02 1.000e-03 1.520e-02 8.000e-04],0,[9.701e-01 1.280e-02 1.000e-03 1.520e-02 8.000e-04],,3,3,0.14,,,,,,,,,
2,"Sudah waktunya memfokuskan niat kita serta dan meraih hati,, I love you sayangku dan mengizinkan getaran cinta itu untuk menghangatkan jiwa yang haus akan kasih dan sayang",Sudah waktunya memfokuskan niat kita serta dan meraih I amore you sayangku dan mengizinkan getaran amore itu untuk menghangatkan anime yang haus akan amore dan Metodo,0.8568931818008423,2,[1.600e-03 7.000e-04 9.948e-01 2.000e-03 9.000e-04],2,[2.300e-03 3.000e-04 9.918e-01 1.200e-03 4.400e-03],"{'niat': 'niat', 'sayang': 'Metodo', 'sudah': 'sudah', 'menghangatkan': 'menghangatkan', 'love': 'amore', 'memfokuskan': 'memfokuskan', 'kasih': 'amore', 'jiwa': 'anime', 'cinta': 'amore'}",2,2,0.7729,,,,,,,,,
2,seluruh hidup saya. saya dedikasikan dan saya peruntukkan sebagai contoh untuk dia. bahkan saya rela mengubur mimpi saya dalam dalam demi bisa memperjuangkan cita cita nya. sesayang itu. saya tidak mau dia merasakan sulitnya hidup seperti apa yang saya sudah lalui.,seluruh vita saya dedikasikan dan saya peruntukkan sebagai contoh untuk bahkan saya rela mengubur sognare saya dalam dalam demi bisa memperjuangkan cita cita sesayang saya tidak mau dia merasakan sulitnya vita seperti apa yang saya sudah,0.9367784261703492,2,[1.200e-03 6.000e-04 9.959e-01 1.700e-03 6.000e-04],2,[1.810e-02 8.000e-04 9.744e-01 3.900e-03 2.700e-03],"{'cita': 'cita', 'contoh': 'contoh', 'memperjuangkan': 'memperjuangkan', 'rela': 'rela', 'hidup': 'vita', 'mimpi': 'sognare'}",2,2,0.8385,,,,,,,,,
2,WOI PIYIK KU INI ASAI NANAMI SAYANG KU CINTA YAALLAH BANGGANYA DIRIKU PADA MU SAYANG YAALLAH DEEP VOICENYA BAGUS BNGT YAALLAH YAALLAH LUCU BNGT INI MANUSIA [URL],WOI PIYIK KU INI ASAI NANAMI SAYANG KU CINTA YAALLAH BANGGANYA DIRIKU PADA MU SAYANG YAALLAH DEEP VOICENYA BAGUS BNGT YAALLAH YAALLAH LUCU BNGT INI MANUSIA,0.9843385219573976,2,[7.000e-04 8.000e-04 9.959e-01 1.600e-03 1.000e-03],2,[7.000e-04 8.000e-04 9.959e-01 1.600e-03 1.000e-03],"{'ku': 'mio', 'deep': 'profondo', 'manusia': 'manusia', 'sayang': 'Metodo', 'lucu': 'divertente', 'bagus': 'Buono', 'ini': 'questo', 'mu': 'tuo', 'asai': 'asai', 'pada': 'Su', 'yaallah': 'yaallah', 'cinta': 'amore'}",2,2,0.8271,,,,,,,,,
0,"[USERNAME] aku merasa gagal menjadi teman, aku tadi cuman mau bohong tapi jawaban mu seperti itu, termakan sendiri aku, sedih wed, maaf yaa",aku merasa fallire menjadi aku tadi cuman mau bohong tapi jawaban mu seperti termakan sendiri sedih maaf yaa,0.9233610033988952,0,[0.9901 0.0034 0.0031 0.002  0.0013],0,[9.918e-01 3.900e-03 1.900e-03 9.000e-04 1.400e-03],"{'sedih': 'sedih', 'termakan': 'termakan', 'gagal': 'fallire', 'cuman': 'cuman'}",0,0,0.7588,,,,,,,,,
4,"Yakinlah ada sesuatu yang menantimu selepas banyak kesabaran (yang kau jalani), yang akan membuatmu terpana hingga kau lupa pedihnya rasa sakit - Ali Bin Abi Thalib-",Yakinlah ada sesuatu yang menantimu dopo banyak kesabaran kau yang akan membuatmu terpana hingga kau lupa pedihnya rasa malato Ali Bin Abi,0.9342495799064636,4,[0.1775 0.0017 0.1967 0.0314 0.5927],4,[0.1642 0.0015 0.074  0.0096 0.7508],"{'kau': 'kau', 'selepas': 'dopo', 'sakit': 'malato', 'abi': 'abi', 'lupa': 'lupa', 'bin': 'bin'}",2,4,1.3217,,,,,,,,,
3,minum obat kamu jangan sampai sakit ye awas saja kalau besok tidak-masuk,minum obat kamu jangan sampai malato ye awas saja kalau besok,0.9636287689208984,3,[0.0264 0.0042 0.002  0.9591 0.0083],3,[0.0434 0.0233 0.0026 0.9087 0.022 ],"{'ye': 'ye', 'besok': 'besok', 'sakit': 'malato'}",3,3,0.6129,,,,,,,,,
0,"Sebagai manusia aku bisa saja salah saat melihat manusia lain. Aku cuma sedang melihat diriku sendiri sebenernya. Jadi aku minta maaf ya shan, seperti yg biasa aku lakukan",Sebagai manusia aku bisa saja sbagliato saat melihat manusia Aku cuma sedang melihat diriku sendiri Jadi aku minta maaf S seperti yg biasa aku lakukan,0.948544144630432,0,[0.9731 0.0115 0.0075 0.0036 0.0043],0,[0.8794 0.1037 0.0045 0.0073 0.0052],"{'maaf': 'maaf', 'salah': 'sbagliato', 'diriku': 'diriku', 'lakukan': 'lakukan', 'ya': 'S', 'sebagai': 'sebagai'}",0,0,0.5515,,,,,,,,,
4,"[USERNAME] Iyaaa ya Mas mudah memberi gelar sm yg g sepaham, pdhl hidup memang lebih indah krn banyak warna dan perbedaan supaya kita didewasakan baik iman dan prilaku krn semua mahluk ciptaan Tuhan","[USERNAME] Iyaaa ya Mas mudah memberi gelar sm yg g sepaham, pdhl hidup memang lebih indah krn banyak warna dan perbedaan supaya kita didewasakan baik iman dan prilaku krn semua mahluk ciptaan Tuhan",1.0,0,[0.7793 0.1113 0.0036 0.021  0.0848],0,[0.7793 0.1113 0.0036 0.021  0.0848],,4,4,0.21,,,,,,,,,
1,saya kecewa ......atau kita dipaksa golput .....presiden RI kok takut sm FPI...@DivHumas_Polri [USERNAME] [USERNAME] [USERNAME] [USERNAME],saya kecewa kita dipaksa golput RI kok takut sm,0.6275817155838013,1,[5.380e-02 9.418e-01 3.000e-04 2.700e-03 1.400e-03],0,[0.6483 0.3258 0.0014 0.0221 0.0024],{'dipaksa': 'dipaksa'},1,1,0.7207,,,,,,,,,
0,"Saya terlalu sibuk menggalau hingga lupa kalo kemarin lusa oshimen pada zamannya berganti umur yang ke...?? Entahlah, akupun tak tau~ [USERNAME] [URL]",Saya terlalu sibuk agitare hingga lupa kalo kemarin lusa oshimen pada zamannya berganti umur yang akupun tak,0.8798398971557617,0,[0.9915 0.0011 0.0013 0.0018 0.0043],0,[9.922e-01 6.000e-04 1.500e-03 1.400e-03 4.300e-03],"{'oshimen': 'oshimen', 'menggalau': 'agitare', 'lusa': 'lusa', 'zamannya': 'zamannya', 'saya': 'io', 'lupa': 'lupa', 'akupun': 'akupun'}",0,0,0.7687,,,,,,,,,
0,petani dieng rugi akibat bun upas - mungkin sudah mulai harus di kencangkan kerjasama BMKG Dengan Dinas Pertanian untuk wilayah2 khusus seperti dieng supaya ada peringatan dini bun upas - apakah memungkinkan? [USERNAME],contadino dieng rugi akibat bun upas mungkin sudah mulai harus di kencangkan kerjasama BMKG Dengan Dinas Pertanian untuk wilayah2 khusus seperti dieng supaya ada peringatan dini bun upas apakah,0.974043071269989,0,[0.5285 0.1961 0.0012 0.2702 0.004 ],0,[0.5878 0.091  0.0012 0.3077 0.0123],"{'akibat': 'akibat', 'bun': 'bun', 'upas': 'upas', 'pertanian': 'agricoltura', 'dinas': 'dinas', 'kerjasama': 'kerjasama', 'kencangkan': 'kencangkan', 'petani': 'contadino'}",3,3,0.7533,,,,,,,,,
4,"Udah mandi mas, sampe berendem malah biar wangi ga ilang sampe sore :D",Udah mandi sampe berendem malah biar wangi ga ilang sampe pomeriggio,0.8636100888252258,4,[1.700e-03 4.000e-04 3.400e-03 6.000e-04 9.938e-01],4,[0.0159 0.0012 0.0105 0.0086 0.9638],"{'wangi': 'wangi', 'udah': 'già', 'sore': 'pomeriggio', 'berendem': 'berendem', 'biar': 'biar', 'ga': 'ga'}",4,4,0.7235,,,,,,,,,
3,"Duh beberapa hari ini kok rasanya seneng ya, kayak bakal terjadi sesuatu yg menyenangkan. Ini kalo realitanya ntr malah kebalikan kan sediiiihhhh.","Duh beberapa hari ini kok rasanya seneng ya, kayak bakal terjadi sesuatu yg menyenangkan. Ini kalo realitanya ntr malah kebalikan kan sediiiihhhh.",1.0,0,[0.977  0.0061 0.0019 0.0127 0.0023],0,[0.977  0.0061 0.0019 0.0127 0.0023],,0,0,0.22,,,,,,,,,
0,kadang pulang cerita ke anak isteri abis nonton konser a b c dan gratis krn sembari kerja. tapi... tiap anaknya nanya konser ina itu kelewatan. sedih. #yha.,kadang pulang cerita ke anak isteri abis nonton konser a b c dan gratuito krn sembari tiap anaknya nanya konser ina itu,0.9548346996307372,0,[9.96e-01 7.00e-04 1.00e-03 9.00e-04 1.40e-03],0,[0.5589 0.0014 0.0164 0.0158 0.4075],{'gratis': 'gratuito'},0,0,0.727,,,,,,,,,
4,"Klo udah denger gitu, meskipun tau itu adalah kalimat yg diulang2 tp efek menenangkannya slalu sama.. intinya kata Bapak, ""rumuse sabar dan tawakal, maka akan ada rezeki dari arah yg tdk di sangka2.. wes to percoyo ae, wes bismillah""",Klo già denger meskipun tau itu adalah kalimat quale diulang2 tp efek menenangkannya slalu intinya kata paziente dan maka akan ada rezeki dari direzione quale tdk di wes to percoyo wes,0.8733958601951599,4,[4.100e-03 4.000e-04 6.510e-02 2.400e-03 9.281e-01],4,[1.390e-02 9.000e-04 1.160e-02 1.050e-02 9.631e-01],"{'rezeki': 'rezeki', 'efek': 'efek', 'percoyo': 'percoyo', 'yg': 'quale', 'arah': 'direzione', 'menenangkannya': 'menenangkannya', 'tp': 'tp', 'wes': 'wes', 'sabar': 'paziente', 'udah': 'già', 'intinya': 'intinya'}",4,4,0.8576,,,,,,,,,
1,jujur aja cukup yah kegoblokan kegilaan gw hrs sadar .gw pgn segera keluar dari lingkaran setan hidup disini byk sodara dengki n jahat sm gw ga kuat gw ..n terutama sepupu sialan cln penghuni neraka si lina n lakinya n si lita jg najiiiis lo sialan,jujur aja cukup bene kegoblokan kegilaan gw minerale sadar pgn segera keluar dari lingkaran diavolo vita disini byk sodara dengki n malvagio sm gw ga kuat gw terutama sepupu sialan cln penghuni neraka si lina n lakinya n si lita jg najiiiis lo sialan,0.9423030614852904,1,[4.700e-03 9.937e-01 3.000e-04 9.000e-04 5.000e-04],1,[1.114e-01 8.846e-01 5.000e-04 2.000e-03 1.600e-03],"{'hidup': 'vita', 'sm': 'sm', 'yah': 'bene', 'lo': 'lo', 'gw': 'gw', 'penghuni': 'penghuni', 'sadar': 'sadar', 'neraka': 'neraka', 'jahat': 'malvagio', 'n': 'n', 'aja': 'aja', 'si': 'si', 'hrs': 'minerale', 'dengki': 'dengki', 'lita': 'lita', 'ga': 'ga', 'setan': 'diavolo', 'lina': 'lina'}",1,1,0.9484,,,,,,,,,
0,macetnya mantap #parkir,macetnya mantap,0.815492570400238,0,[0.9332 0.0228 0.0013 0.0054 0.0373],4,[5.80e-03 5.20e-03 8.00e-04 1.20e-03 9.87e-01],{'mantap': 'mantap'},4,0,0.6623,,,,,,,,,
4,"[USERNAME] Manusialah, polisi penjaga yang bertugas di sekitar makam Mantan presiden Mustafa Kemal nah karena tinggi dan kek patung saya tertarik foto hahaha",polisi penjaga yang bertugas di sekitar makam Mantan Presidente Mustafa Kemal nah karena tinggi dan kek patung saya tertarik foto Hahaha,0.9466639757156372,4,[4.900e-03 6.000e-04 3.300e-03 1.500e-03 9.897e-01],4,[0.0136 0.0016 0.0092 0.0063 0.9694],"{'foto': 'foto', 'mantan': 'mantan', 'kemal': 'kemal', 'makam': 'makam', 'hahaha': 'Hahaha', 'presiden': 'Presidente', 'bertugas': 'bertugas'}",4,4,0.7511,,,,,,,,,
1,"Kl ga kebukti ga perlu kabur tuh bangsat cabul, logika berpikir orang waras. Nah cabul imam pula dibela sampai mampus cm krn takut ga masuk surga lu? [URL]",Kl ga kebukti ga perlu kabur tuh bangsat logika berpikir orang Nah cabul imam pula dibela sampai mampus cm krn takut ga masuk surga,0.9639423489570618,1,[8.00e-04 9.98e-01 1.00e-04 9.00e-04 3.00e-04],1,[1.100e-03 9.964e-01 1.000e-04 2.100e-03 3.000e-04],"{'bangsat': 'bangsat', 'kebukti': 'kebukti', 'cm': 'cm', 'tuh': 'tuh', 'masuk': 'masuk', 'ga': 'ga', 'dibela': 'dibela', 'orang': 'orang', 'kabur': 'kabur', 'kl': 'kl', 'surga': 'surga'}",1,1,0.8027,,,,,,,,,
2,"Pacar yg baik adalah pacar yg nasehatin kamu gak pernah ngebentak, tp dgn lemah lembut & kasih sayang sambil tersenyum & menatap mata kamu",Pacar yg baik adalah fidanzato yg nasehatin kamu gak pernah tp dgn lemah lembut amore Metodo sambil tersenyum menatap occhio kamu,0.9371991157531738,2,[0.0016 0.0014 0.992  0.0031 0.0019],2,[1.100e-03 9.000e-04 9.947e-01 2.000e-03 1.200e-03],"{'sayang': 'Metodo', 'pacar': 'fidanzato', 'mata': 'occhio', 'kasih': 'amore', 'dgn': 'dgn', 'lembut': 'lembut', 'menatap': 'menatap', 'tp': 'tp'}",2,2,0.7284,,,,,,,,,
3,"[askmf] abis baca menfess ini, aku sbg calon anak rantau ngerasa takut, minder, kalo temen2 disana diam2 ngerasa kesal dengan logat aku/ karena aku masih sering nyampur bahasa :( [URL]",abis baca menfess aku sbg calon anak rantau ngerasa kalo temen2 disana diam2 ngerasa kesal dengan logat karena aku masih sering nyampur bahasa,0.947179079055786,3,[1.010e-02 1.100e-03 5.000e-04 9.878e-01 6.000e-04],0,[9.856e-01 8.700e-03 4.000e-04 3.200e-03 2.200e-03],{},0,3,0.7608,,,,,,,,,
1,"Hampir tiap hari Mbak kos suka ributin "" itu lo dua bodigardnya vela yg sukanya muterin halaman kosan "" -_- Mon maap ni ya mbak, temen w emang gada tau dirinya muterin halaman kos dg suara motor gede hampir tiap hari",Hampir tiap hari Mbak kos suka ributin itu lo dua bodigardnya vela yg sukanya muterin halaman pensione Mon maap ni S amico w infatti club tau dirinya muterin halaman kos scavare suara motor grande hampir tiap hari,0.9291898608207704,1,[1.018e-01 8.850e-01 8.000e-04 9.200e-03 3.200e-03],0,[0.4434 0.3589 0.0157 0.1267 0.0553],"{'ributin': 'ributin', 'bodigardnya': 'bodigardnya', 'emang': 'infatti', 'maap': 'maap', 'temen': 'amico', 'dg': 'scavare', 'kosan': 'pensione', 'ni': 'ni', 'gada': 'club', 'gede': 'grande', 'mon': 'mon', 'muterin': 'muterin', 'ya': 'S', 'kos': 'kos', 'halaman': 'halaman', 'sukanya': 'sukanya'}",1,1,0.9029,,,,,,,,,
2,"Alasan nama ria dan manusia bernama ria ini ada adalah tertawa walaupun dalam keadaan sedih sekalipun.kata 2 org tua itu.thanks God, i cintad them.",Alasan nama ria dan manusia bernama ria ini ada adalah tertawa walaupun dalam keadaan sedih 2 org tua i cintad,0.9493957757949828,2,[1.300e-03 7.000e-04 9.844e-01 1.400e-03 1.230e-02],2,[4.800e-03 3.000e-04 9.877e-01 1.000e-03 6.100e-03],"{'nama': 'nama', 'alasan': 'motivazione', 'bernama': 'bernama', 'ria': 'ria', 'i': 'i', 'org': 'org'}",2,2,0.7136,,,,,,,,,
4,"Gara gara lihat papa, om dan sepupunya tiap akhir pekan nobar bola, Nayla jadi suka bola juga, sedikiiiit tambah semangat pas nonton lagunya [USERNAME] ( [URL] pakai [USERNAME] #JADIBISA #RameinBola bareng mereka [URL]",Gara gara vedere om dan sepupunya tiap akhir pekan nobar Nayla jadi suka bola sedikiiiit tambah semangat pas nonton lagunya pakai bareng mereka,0.8029041290283203,4,[3.600e-03 4.000e-04 7.220e-02 1.100e-03 9.227e-01],4,[9.500e-03 6.000e-04 1.236e-01 3.000e-03 8.633e-01],"{'nobar': 'nobar', 'lagunya': 'lagunya', 'bareng': 'bareng', 'pas': 'pas', 'gara': 'gara', 'om': 'om', 'bola': 'bola', 'sedikiiiit': 'sedikiiiit', 'pakai': 'pakai', 'lihat': 'vedere'}",4,4,0.68,,,,,,,,,
2,"Lg ngobrol sama Kiya  : dek, doain mamah ya dek, supaya bisa blablabla. Dek Kiya bantu doa ya. : *Manggut-manggut, senyum"". Tulus bgt mukanya. Meski ga ngerti apa yg dimaksud, tp tiap bilang doain ya dek dia pasti senyum"" smbl peluk.",Lg ngobrol sama Kiya doain mamma S supaya bisa Dek Kiya auto doa Tulus grande Meski ga ngerti apa quale tp tiap bilang doain S dek dia pasti smbl,0.8710080981254578,2,[0.0035 0.0012 0.7592 0.0043 0.2319],4,[7.600e-03 6.000e-04 3.055e-01 2.900e-03 6.835e-01],"{'mamah': 'mamma', 'bantu': 'auto', 'ya': 'S', 'ga': 'ga', 'bilang': 'bilang', 'doa': 'doa', 'ngerti': 'ngerti', 'bgt': 'grande', 'dek': 'dek', 'tulus': 'sincero', 'tp': 'tp', 'yg': 'quale'}",2,4,0.8332,,,,,,,,,
2,"Dik, semoga kau paham. Mencinta tapi belum halal, merindu namun belum sah. Ini tidak mudah karena kau harus dimuliakan. Perhatikan sikapku, apakah aku memilih kita berangkulan atau menuai nyaman dengan bergandengan. Aku hanya mensyukuri tiap pertemuan dengan cara mencuri pandang.","Dik, semoga kau paham. Mencinta tapi belum halal, merindu namun belum sah. Ini tidak mudah karena kau harus dimuliakan. Perhatikan sikapku, apakah aku memilih kita berangkulan atau menuai nyaman dengan bergandengan. Aku hanya mensyukuri tiap pertemuan dengan cara mencuri pandang.",1.0,0,[0.9632 0.001  0.0304 0.0037 0.0018],0,[0.9632 0.001  0.0304 0.0037 0.0018],,0,0,0.27,,,,,,,,,
0,"[USERNAME] Gak perlu bang Karni, yg perlu di buka sekarang adalah kasus2 pelanggaran HAM seperti penculikan dan pembunuhan mahasiswa di era orde baru.","[USERNAME] Gak perlu bang Karni, yg perlu di buka sekarang adalah kasus2 pelanggaran HAM seperti penculikan dan pembunuhan mahasiswa di era orde baru.",1.0,1,[8.680e-02 9.062e-01 5.000e-04 3.300e-03 3.200e-03],1,[8.680e-02 9.062e-01 5.000e-04 3.300e-03 3.200e-03],,1,1,0.23,,,,,,,,,
0,"Yuk, akhirnya msk minggu awal bln Juni 2018. Ga terasa udh setengah thn aj. Ternyata bnyak target yg blm terealisasi sampai skr. Hrs belajar displin konsisten biar bisnis Oriflame makin lancar",akhirnya msk minggu awal mese Juni Ga terasa Gi setengah thn Ternyata bnyak target yg blm terealisasi sampai Hrs belajar displin konsisten biar bisnis Oriflame makin lancar,0.914415955543518,0,[0.896  0.0088 0.0042 0.0149 0.0761],0,[0.9402 0.008  0.0017 0.0105 0.0396],"{'terealisasi': 'terealisasi', 'hrs': 'minerale', 'bnyak': 'bnyak', 'blm': 'blm', 'oriflame': 'oriflame', 'msk': 'msk', 'displin': 'displin', 'bln': 'mese', 'biar': 'biar', 'target': 'target', 'udh': 'Gi', 'ternyata': 'ternyata'}",0,0,0.6612,,,,,,,,,
1,Ancoooree udah dapat no antrian eh salah lagi yg di kasih B seharusnya A macam mana jak pelayanannya nih ? Dari tgl 02 / 10 -07-2018 ngurus surat pindah aja susahnya minta ampun sampai sekarang belum kelar lagi mana no antriannya udh habis lagi tolong dengarkan keluhan kami !!! [URL],Ancoooree già dapat No antrian eh salah lagi quale di kasih B seharusnya A macam mana jak pelayanannya nih Dari tgl 02 10 ngurus surat pindah aja susahnya minta ampun sampai sekarang belum finito lagi mana No antriannya Gi habis lagi auto dengarkan keluhan kami,0.9350467920303344,1,[1.800e-03 9.973e-01 1.000e-04 4.000e-04 3.000e-04],1,[2.90e-03 9.96e-01 1.00e-04 5.00e-04 5.00e-04],"{'ancoooree': 'ancooree', 'antriannya': 'antriannya', 'pelayanannya': 'pelayanannya', 'habis': 'habis', 'yg': 'quale', 'a': 'a', 'kelar': 'finito', 'tolong': 'auto', 'no': 'No', 'b': 'b', 'udah': 'già', 'udh': 'Gi', 'dengarkan': 'dengarkan', 'dari': 'dari', 'antrian': 'antrian', 'jak': 'jak'}",1,1,1.1394,,,,,,,,,
2,"10 hari terakhir ramadhan, ada 1 malam yang sangat mulia dr seribu bulan, selamat datang Lailatul Qadar, kami orang yang beriman sangat merindukan kedatangan mu...",10 hari terakhir ada 1 malam yang sangat mulia dr seribu selamat datang Lailatul kami orang yang beriman sangat merindukan kedatangan,0.95308518409729,2,[0.0339 0.0012 0.7762 0.0107 0.178 ],4,[0.1359 0.0024 0.0302 0.0205 0.8111],"{'kedatangan': 'kedatangan', 'seribu': 'seribu'}",4,2,0.6527,,,,,,,,,
4,"Dear sender menfes ini, dm aku terbuka banget kok :') ayuk cerita ke aku.. Aku mau kamu berbagi juga sama aku, kamu nggk sendiri. Aku sayang kamu","Dear sender menfes ini, dm aku terbuka banget kok :') ayuk cerita ke aku.. Aku mau kamu berbagi juga sama aku, kamu nggk sendiri. Aku sayang kamu",1.0,2,[8.000e-04 8.000e-04 9.957e-01 1.600e-03 1.000e-03],2,[8.000e-04 8.000e-04 9.957e-01 1.600e-03 1.000e-03],,2,2,0.2,,,,,,,,,
2,"g ikut ospek jurusan ada berkahnya, brwl dr krn g ikut ospek krn skit (hoream) jd kenal-& deket ,btw doi org yg bkn jdi semngt kuliah , doi orgnya pinter,pejuang sngad,atlet,model,duta,hits dll pd intinya jauh w sm aing yg tdr ml wkwk, ily qam trs smngtt!!","g ikut ospek jurusan ada berkahnya, brwl dr krn g ikut ospek krn skit (hoream) jd kenal-& deket ,btw doi org yg bkn jdi semngt kuliah , doi orgnya pinter,pejuang sngad,atlet,model,duta,hits dll pd intinya jauh w sm aing yg tdr ml wkwk, ily qam trs smngtt!!",1.0,4,[1.10e-03 4.00e-04 2.10e-03 4.00e-04 9.96e-01],4,[1.10e-03 4.00e-04 2.10e-03 4.00e-04 9.96e-01],,4,4,0.25,,,,,,,,,
