label,tweet,perturbed_text,perturbed_semantic_sim,pred_label,pred_proba,perturbed_label,perturbed_proba,translated_word(s),adv_pred,adv_pred_on_orig,running_time(s),before_attack_acc,after_attack_acc,avg_semantic_sim,avg_running_time(s),adv_training,delta_acc,delta_adv,acc_adv_training_on_orig,best_epoch
3,"[USERNAME] min mau nanya misal ada kesalahan buku pajak harusnya ppn tp trnyata pph minyak bumi spt gmbr brikut, solusinya gmn?? [URL]",min mau nanya misal ada kesalahan buku pajak harusnya ppn tp trnyata pph minyak bumi piace gmbr solusinya,0.868863046169281,3,[0.0095 0.0256 0.001  0.962  0.0019],3,[1.020e-02 1.340e-02 7.000e-04 9.738e-01 1.900e-03],"{'trnyata': 'trnyata', 'spt': 'piace', 'ppn': 'ppn', 'solusinya': 'solusinya', 'kesalahan': 'kesalahan', 'gmbr': 'gmbr', 'pph': 'pph', 'min': 'min'}",3,3,0.439,,,,,,,,,
4,"[USERNAME] [USERNAME] Terima kaaih pak Kwik,, itu juga pemikiran sy secara pribadi, trm ksh sdh d'sampaikan pd forum. Dan bgitu jg hal'y dg yg d'sAmpaikn oleh ibu sarumpait.",Terima kaaih pak itu juga pemikiran sy secara tr ksh Gi pd Dan bgitu jg dg quale oleh ibu,0.7629315853118896,4,[1.400e-03 2.200e-03 8.000e-04 7.000e-04 9.949e-01],4,[8.700e-03 3.000e-04 4.500e-03 9.000e-04 9.856e-01],"{'yg': 'quale', 'jg': 'jg', 'sy': 'sy', 'bgitu': 'bgitu', 'ksh': 'ksh', 'trm': 'tr', 'sdh': 'Gi'}",4,4,0.3894,,,,,,,,,
1,Tapi bahaya juga sih Cal kalau gitu Amit2 karna kepolosan si ibu sieun kan disuruh motong hayam malah motong sapi Goreng bala bala ge teu bisa,Tapi bahaya juga sih Cal kalau gitu Amit2 karna kepolosan si ibu sieun kan disuruh motong hayam malah motong sapi Goreng bala bala ge teu bisa,1.0,3,[2.600e-03 3.400e-03 2.000e-04 9.933e-01 5.000e-04],3,[2.600e-03 3.400e-03 2.000e-04 9.933e-01 5.000e-04],,3,3,0.03,,,,,,,,,
1,"[USERNAME] tolong dijelaskan maksud dari "" Hal ini dibuktikan dengan penggunaan resi pada transaksi Anda yang telah digunakan pada transaksi lain (transaksi Anda dengan supplier Anda). "" saya rasa tidak mungkin ada double resi...",auto dijelaskan maksud dari Hal ini dibuktikan dengan penggunaan resi pada transaksi Anda yang telah digunakan pada transaksi lain Anda dengan supplier saya rasa tidak mungkin ada double,0.9583244323730468,1,[4.500e-03 9.836e-01 3.000e-04 1.120e-02 4.000e-04],1,[0.0141 0.904  0.0013 0.0749 0.0056],"{'tolong': 'auto', 'dibuktikan': 'dibuktikan', 'supplier': 'supplier', 'hal': 'hal', 'maksud': 'maksud', 'resi': 'resi', 'anda': 'anda'}",1,1,0.1632,,,,,,,,,
4,Si senyum ngeselin yg bisa bikin hepi.. haha.. bawaannya bahagia aja kalau udh liat nih anak perform :) ada aja kelakuannya yg bikin kangen beneran adek aneh yg ngeselin tapi ngangenin,Si senyum ngeselin yg bisa bikin hepi.. haha.. bawaannya bahagia aja kalau udh liat nih anak perform :) ada aja kelakuannya yg bikin kangen beneran adek aneh yg ngeselin tapi ngangenin,1.0,2,[0.0051 0.0025 0.817  0.0042 0.1713],2,[0.0051 0.0025 0.817  0.0042 0.1713],,2,2,0.03,,,,,,,,,
1,"Sebelah mana stereotyping-nya dari pernyataan saya? Coba ditunjukkan, siapa tahu saya salah bicara. Bagus dong kalau banyak yang mengecam. Semakin banyak makin terdengar suara untuk kebenaran, semakin bagus. Kalau benar tapi kalah keras sama yang salah, itu yang harus diatasi. [URL]",Sebelah mana dari pernyataan Coba siapa tahu saya salah Bagus dong kalau banyak yang Semakin banyak makin terdengar voce untuk semakin Kalau benar tapi perduto difficile sama yang itu yang harus,0.9540660977363586,1,[5.520e-02 9.338e-01 3.000e-04 3.300e-03 7.400e-03],3,[0.1944 0.1147 0.0029 0.609  0.079 ],"{'suara': 'voce', 'sebelah': 'sebelah', 'bagus': 'Buono', 'keras': 'difficile', 'kalah': 'perduto'}",3,1,0.1875,,,,,,,,,
2,"Jangan tanya sedang apa aku hari ini, karena yang kulakukan selalu sama. Sedang mencintaimu. Setiap hari",Jangan tanya sedang apa aku hari karena yang kulakukan selalu Sedang Setiap hari,0.9759069085121156,2,[0.0017 0.001  0.9935 0.0026 0.0011],0,[0.9243 0.0023 0.0068 0.0057 0.0609],{'sedang': 'sedang'},0,2,0.1631,,,,,,,,,
2,"Bucin, loving with my whole heart, cemburuan BAHAHAHA, suka protes, ngambekan (?), sukanya peluk peluk sama cium cium XOXO, kangenan banget lagi chat aja masih kangen. [URL]",amorevole with my whole gelosia suka ngambekan sukanya peluk peluk sama cium cium kangenan molto lagi Chiacchierare aja masih,0.8182584047317505,2,[1.000e-03 8.000e-04 9.952e-01 1.300e-03 1.700e-03],2,[1.30e-03 6.00e-04 9.96e-01 1.40e-03 7.00e-04],"{'cemburuan': 'gelosia', 'my': 'my', 'whole': 'whole', 'with': 'with', 'chat': 'Chiacchierare', 'suka': 'suka', 'loving': 'amorevole', 'aja': 'aja', 'banget': 'molto'}",2,2,0.4397,,,,,,,,,
1,"Ada yg lebih menggelikan ketimbang kasus sexual harassment yg menimpa Via Vallen: para politisi &amp partai politik memanfaatkannya sbg ""panggung pertunjukan"" dgn dalih pembelaan korban. #HilihKinthil","Ada yg lebih menggelikan ketimbang kasus sexual harassment yg menimpa Via Vallen: para politisi &amp partai politik memanfaatkannya sbg ""panggung pertunjukan"" dgn dalih pembelaan korban. #HilihKinthil",1.0,0,[0.7785 0.2024 0.0053 0.0083 0.0056],0,[0.7785 0.2024 0.0053 0.0083 0.0056],,1,1,0.14,,,,,,,,,
1,[USERNAME] [USERNAME] Hanya orang yg berotak tai seperti anda yg mengatakan jakarta sekarang lebih bagus ! Makanya menilai sesuatu itu harus jauh dari kepentingan diri sendiri !,Hanya orang quale cervello tai seperti anda quale mengatakan Giacarta sekarang lebih bagus Makanya menilai sesuatu itu harus jauh dari kepentingan diri sendiri,0.8531447052955627,1,[9.00e-04 9.98e-01 2.00e-04 5.00e-04 4.00e-04],1,[8.4e-03 9.9e-01 2.0e-04 8.0e-04 6.0e-04],"{'berotak': 'cervello', 'tai': 'tai', 'jakarta': 'Giacarta', 'orang': 'orang', 'makanya': 'Cos', 'yg': 'quale'}",1,1,0.4752,,,,,,,,,
4,"Baca buku ini diawal senyum, ditengah-tengah senyum miris, diakhir senyum pasrah. Nuhun bung [USERNAME]#bukugariswaktu #fiersabesari","Baca buku ini diawal senyum, ditengah-tengah senyum miris, diakhir senyum pasrah. Nuhun bung [USERNAME]#bukugariswaktu #fiersabesari",1.0,0,[0.96   0.0011 0.0056 0.0013 0.032 ],0,[0.96   0.0011 0.0056 0.0013 0.032 ],,0,0,0.14,,,,,,,,,
2,Wah aku mimpi kali ya.../kedip berkali-kali karena kaget letakin lengan di meja sambil numpu dagu/ sayang kok ga bilang sih kamu bisa masak? Aigoo pacar aku keren ,Wah aku sognare kali karena kaget letakin lengan di meja sambil numpu sayang kok ga bilang sih kamu bisa Aigoo fidanzato aku keren,0.9749820232391356,2,[0.0507 0.0032 0.7818 0.1121 0.0521],4,[0.0808 0.0031 0.2196 0.2507 0.4459],"{'lengan': 'lengan', 'sih': 'sih', 'ga': 'ga', 'bilang': 'bilang', 'pacar': 'fidanzato', 'letakin': 'letakin', 'mimpi': 'sognare', 'wah': 'wah', 'aigoo': 'aigoo'}",2,3,0.8366,,,,,,,,,
1,"Kaya gitu terus ya netijen, kalau ada kasus pelecehan seksual selalu aja korban yg disalahkan. Pdhl, posisinya korban lo. Sederhananya aja ya, ga ada orang yg mau jadi korban. Gue respect si, sm caranya #viaVallen seenggaknya si pelaku malu dan sbg peringatan jg buat yg lain.",Kaya gitu terus S kalau ada kasus pelecehan seksual selalu aja vitalità quale posisinya vitalità Sederhananya aja ga ada orang quale mau jadi Gue respect sm caranya almeno si pelaku imbarazzato dan sbg peringatan jg buat quale,0.8912532329559326,1,[5.00e-03 9.94e-01 2.00e-04 3.00e-04 5.00e-04],1,[4.420e-02 9.503e-01 5.000e-04 2.500e-03 2.600e-03],"{'respect': 'respect', 'aja': 'aja', 'ya': 'S', 'seenggaknya': 'almeno', 'orang': 'orang', 'yg': 'quale', 'gue': 'io', 'sm': 'sm', 'ga': 'ga', 'kaya': 'ricco', 'malu': 'imbarazzato', 'korban': 'vitalità', 'gitu': 'gitu', 'si': 'si'}",1,1,0.5884,,,,,,,,,
0,"[USERNAME] [USERNAME] Berarti Yusufk09 seringnya nonton penyanyi dangdut yg cuma ""jual"" goyangan atau busana seksi dibanding suara bagus",Berarti Yusufk09 seringnya guarda penyanyi dangdut quale cuma goyangan atau busana seksi dibanding voce Buono,0.7452625036239624,0,[0.7935 0.118  0.0013 0.0148 0.0724],0,[0.6711 0.0436 0.0088 0.0369 0.2394],"{'dibanding': 'dibanding', 'suara': 'voce', 'bagus': 'Buono', 'yg': 'quale', 'seksi': 'seksi', 'nonton': 'guarda', 'goyangan': 'goyangan'}",4,0,0.1552,,,,,,,,,
1,"aneh.... ada wanita dilecehin dan ngelawan, malah dibully... yang inilah itulah... tapi giliran dia atau ibunya, saudara perempuannya dilecehin.. ngamuknya kaya kesurupan setan se-neraka. dan yang bully korban banyaknya PEREMPUAN juga.. #ajaib #savewoman #SaveViaVallen",ada wanita dilecehin dan malah yang inilah tapi giliran dia atau saudara perempuannya ngamuknya ricco kesurupan diavolo dan yang prepotente korban banyaknya PEREMPUAN,0.903915286064148,1,[0.1451 0.8475 0.0009 0.0024 0.004 ],1,[2.255e-01 7.490e-01 6.000e-04 2.010e-02 4.800e-03],"{'bully': 'prepotente', 'ngamuknya': 'ngamuknya', 'setan': 'diavolo', 'kesurupan': 'kesurupan', 'banyaknya': 'banyaknya', 'kaya': 'ricco', 'perempuannya': 'perempuannya'}",1,1,0.1676,,,,,,,,,
1,"yang ingin aku sampaikan ini adalah, jangan pernah membiarkan seseorang menggunakan karyamu tanpa izin apalagi dalam bentuk bisnis/komersil. karena apapun bentuk karyamu adalah kamu si pemilik hak cipta tersebut. siapapun yang melanggarnya bisa dipidanakan berdasarkan UU ITE",yang ingin aku sampaikan ini jangan pernah membiarkan seseorang menggunakan karyamu tanpa izin apalagi dalam bentuk karena apapun bentuk karyamu adalah kamu si pemilik hak cipta siapapun yang melanggarnya bisa dipidanakan berdasarkan UU ITE,0.9904836416244508,1,[0.0954 0.7538 0.0037 0.0979 0.0492],1,[0.1255 0.6581 0.0032 0.1735 0.0397],"{'cipta': 'cipta', 'melanggarnya': 'melanggarnya', 'karyamu': 'karyamu', 'hak': 'hak', 'pemilik': 'pemilik', 'ite': 'esso', 'uu': 'uu', 'si': 'si'}",3,1,0.3092,,,,,,,,,
0,"Lagi belajar tentang putusan2 pak Artidjo sambil dengerin Chris Cornell. Menyangkut lembaga yudikatif biasanya teman diskusi saya cuma satu, sayang orangnya sudah pergi. [URL]",Lagi belajar tentang putusan2 pak Artidjo sambil dengerin Chris Menyangkut lembaga yudikatif biasanya amico diskusi saya cuma Metodo orangnya sudah,0.9219458103179932,0,[9.817e-01 9.000e-04 9.000e-04 2.000e-03 1.450e-02],0,[0.5925 0.0089 0.002  0.0229 0.3735],"{'diskusi': 'diskusi', 'sayang': 'Metodo', 'artidjo': 'artidjo', 'dengerin': 'dengerin', 'yudikatif': 'yudikatif', 'chris': 'Chris', 'teman': 'amico'}",0,0,1.2556,,,,,,,,,
0,"[USERNAME] Pernah dikirimin kue sma temen pake Jne, seminggu ga nyampe. trus diganti sma pihak Jne nya. dikirim lagi, seminggu (lagi) nyampe tapi basi kuenya sampe nyusut :( setelahnya kapok, gamau lagi pake Jne.","[USERNAME] Pernah dikirimin kue sma temen pake Jne, seminggu ga nyampe. trus diganti sma pihak Jne nya. dikirim lagi, seminggu (lagi) nyampe tapi basi kuenya sampe nyusut :( setelahnya kapok, gamau lagi pake Jne.",1.0,1,[7.500e-02 9.168e-01 5.000e-04 5.400e-03 2.300e-03],1,[7.500e-02 9.168e-01 5.000e-04 5.400e-03 2.300e-03],,1,1,0.03,,,,,,,,,
2,"Mama takut putri manisnya jatuh lalu terluka. Tapi sadarkah kamu? Bahwa papa dengan yakin akan membiarkanmu, menatapmu dan menjagamu mengayuh sepeda dengan seksama karena dia tau putri kecilnya PASTI BISA.",Mama takut putri manisnya jatuh lalu Tapi sadarkah Bahwa papà dengan yakin akan menatapmu dan menjagamu mengayuh bicicletta dengan seksama karena dia sapere putri kecilnya PASTI,0.9048882126808168,2,[0.006  0.0024 0.9409 0.0439 0.0068],2,[0.0065 0.0019 0.8449 0.1397 0.007 ],"{'papa': 'papà', 'mama': 'mama', 'putri': 'putri', 'tau': 'sapere', 'seksama': 'seksama', 'sepeda': 'bicicletta', 'menjagamu': 'menjagamu', 'pasti': 'certo', 'mengayuh': 'mengayuh', 'bahwa': 'bahwa'}",3,3,0.2632,,,,,,,,,
4,Oke. Mau cerita. Banyak. Euh. Jadi tadi barusan banget abis nonton film lima. Gratis. Aku lupa sponsornya siapa perempuan gerakan apa gitu. Kebetulan temenku punya 150 tiket gratis yang dibagiin di kota Bandung. Wey keren kan ya temenku,Mau Jadi tadi barusan banget finire guarda film Aku lupa sponsornya siapa perempuan gerakan apa Kebetulan temenku punya 150 tiket gratis yang Condividere di kota Wey freddo kan ya temenku,0.9429186582565308,4,[2.900e-03 5.000e-04 8.000e-04 5.000e-04 9.953e-01],4,[0.0155 0.001  0.001  0.0017 0.9808],"{'keren': 'freddo', 'kebetulan': 'kebetulan', 'wey': 'bene', 'dibagiin': 'Condividere', 'abis': 'finire', 'lupa': 'lupa', 'barusan': 'barusan', 'sponsornya': 'sponsornya', 'temenku': 'temenku', 'aku': 'io', 'nonton': 'guarda', 'film': 'film'}",4,4,1.0039,,,,,,,,,
0,[USERNAME] Iya nad. Ada drama drama cryingnya juga. Apalagi kalo laper... biasa makanan ada tersedia tinggal ambil. Kalo dikos musti cari makan sendiri pas gaada temen nah ini bisa bisa nangis. Jadi kangen ibuk hahaha LOL,Iya Ada drama drama cryingnya Apalagi Se biasa makanan ada tersedia ristabilire Kalo dikos dovere ricerca mangiare sendiri pas gaada amico nah ini bisa bisa Jadi kangen ibuk hahaha LOL,0.9384477734565736,0,[9.924e-01 6.000e-04 1.800e-03 1.200e-03 3.900e-03],4,[0.043  0.0014 0.0035 0.0015 0.9506],"{'iya': 'S', 'temen': 'amico', 'cari': 'ricerca', 'ibuk': 'ibuk', 'apalagi': 'apalagi', 'tinggal': 'ristabilire', 'kangen': 'kangen', 'makan': 'mangiare', 'kalo': 'Se', 'tersedia': 'tersedia', 'musti': 'dovere', 'cryingnya': 'cryingnya', 'drama': 'drama'}",0,0,0.2469,,,,,,,,,
0,"[USERNAME] Gaji 13 pns belum cair di kabupaten siak.... Padahal syamsuar sudah menang jadi gubernur.. Minus syam dari dulu selama menjabat siak, gaji telat atau tunjada telat","[USERNAME] Gaji 13 pns belum cair di kabupaten siak.... Padahal syamsuar sudah menang jadi gubernur.. Minus syam dari dulu selama menjabat siak, gaji telat atau tunjada telat",1.0,1,[1.900e-02 9.779e-01 3.000e-04 6.000e-04 2.100e-03],1,[1.900e-02 9.779e-01 3.000e-04 6.000e-04 2.100e-03],,1,1,0.13,,,,,,,,,
2,"Cinta sejati adalah ketika dia mencintai orang lain, dan kamu masih mampu tersenyum, sambil berkata: aku turut bahagia untukmu. Jika kita mencintai seseorang,:))~",Cinta sejati adalah ketika dia mencintai orang dan kamu masih mampu sambil aku turut bahagia Jika kita mencintai,0.9665312767028807,2,[1.000e-03 5.000e-04 9.962e-01 1.400e-03 9.000e-04],2,[1.700e-03 5.000e-04 9.955e-01 1.200e-03 1.100e-03],"{'mencintai': 'mencintai', 'bahagia': 'bahagia', 'jika': 'jika'}",2,2,0.3074,,,,,,,,,
3,"OH ULARRR... saya paling TAKUT dengan ULAR... Ya Allah, janganlah hantar tetamu ini dalam hidup ku... Sesungguhnya aku mampu sabar dengan MANUSIA KAKI BELIT tapi tak mampu sabar dengan belitan ULAR yg menggelikan",OH saya paling TAKUT dengan Ya janganlah hantar tetamu ini dalam vita Sesungguhnya aku mampu paziente dengan MANUSIA KAKI BELIT tapi tak mampu paziente dengan belitan ULAR quale menggelikan,0.8502095341682434,3,[1.200e-03 1.900e-03 1.400e-03 9.948e-01 7.000e-04],3,[0.0029 0.002  0.0021 0.9918 0.0012],"{'hidup': 'vita', 'yg': 'quale', 'menggelikan': 'menggelikan', 'ya': 'S', 'hantar': 'hantar', 'ular': 'ular', 'oh': 'oh', 'sesungguhnya': 'sesungguhnya', 'sabar': 'paziente'}",3,3,0.2793,,,,,,,,,
4,"[USERNAME] dulu beneran ada mahasiswa Teknik UI nembak pacarnya pas sahur di Kukusan Teknik Depok, diliput kru Katakan Cinta (dan belum pacaran mereka). Sekarang udah nikah dan punya anak. Pernah diceritain laman UI Shitposting/Divarposting juga.","[USERNAME] dulu beneran ada mahasiswa Teknik UI nembak pacarnya pas sahur di Kukusan Teknik Depok, diliput kru Katakan Cinta (dan belum pacaran mereka). Sekarang udah nikah dan punya anak. Pernah diceritain laman UI Shitposting/Divarposting juga.",1.0,0,[0.7414 0.0088 0.0103 0.0145 0.225 ],0,[0.7414 0.0088 0.0103 0.0145 0.225 ],,0,0,0.14,,,,,,,,,
2," Jika ingat diriMu, hati ini plong gitu ku akan mempetahankan dirimu dalam rasaku karena kau adalah........... Sejatiku...!!! penuh cinta",Jika ingat hati ini plong gitu mio akan mempetahankan dirimu dalam rasaku karena kau completare amore,0.904769778251648,2,[9.000e-04 6.000e-04 9.963e-01 1.400e-03 9.000e-04],2,[1.900e-03 7.000e-04 9.946e-01 1.600e-03 1.100e-03],"{'rasaku': 'rasaku', 'cinta': 'amore', 'plong': 'plong', 'penuh': 'completare', 'kau': 'kau', 'ku': 'mio'}",2,2,0.4355,,,,,,,,,
1,"Sebuah misteri: kenapa kalau ada perempuan korban pelecehan seksual yang speak up, yang paling ganas jari/mulutnya justru banyak perempuan juga?","Sebuah misteri: kenapa kalau ada perempuan korban pelecehan seksual yang speak up, yang paling ganas jari/mulutnya justru banyak perempuan juga?",1.0,0,[0.9371 0.0413 0.0055 0.0068 0.0093],0,[0.9371 0.0413 0.0055 0.0068 0.0093],,0,0,0.11,,,,,,,,,
1,"[USERNAME] Guru gw dulu juga ada yg mirip gini nih, malah sampe nyumpahin gw ga dapet kerja. Ya udah lah. Mau bales nanti malah dosa dia berkurang kan sayang *eh","[USERNAME] Guru gw dulu juga ada yg mirip gini nih, malah sampe nyumpahin gw ga dapet kerja. Ya udah lah. Mau bales nanti malah dosa dia berkurang kan sayang *eh",1.0,0,[0.9133 0.0022 0.062  0.0039 0.0187],0,[0.9133 0.0022 0.062  0.0039 0.0187],,0,0,0.13,,,,,,,,,
0,"[USERNAME] [USERNAME] [USERNAME] Ada ya wartawan spt itu, kangen Adam Malik walau masih kecil saat beliau ada. Jurnalisme itu ilmu yg wajib dipahami dulu oleh pelaku industri press. Ada byk kaidah jurnalistik yg tdk longgar, ketat dan baku. Dilu",Ada ya wartawan spt kangen Adam Malik walau masih kecil saat beliau Jurnalisme itu conoscenza quale wajib dipahami dulu oleh autore industri Ada byk kaidah giornalismo quale tdk ketat dan Dilu,0.8376407623291016,0,[9.781e-01 7.000e-04 4.800e-03 1.500e-03 1.480e-02],0,[0.7798 0.0014 0.0488 0.0039 0.1662],"{'yg': 'quale', 'beliau': 'beliau', 'industri': 'industri', 'ketat': 'ketat', 'ada': 'ada', 'ilmu': 'conoscenza', 'jurnalistik': 'giornalismo', 'dipahami': 'dipahami', 'pelaku': 'autore', 'dilu': 'dilu', 'malik': 'malik', 'kangen': 'kangen'}",0,0,0.8644,,,,,,,,,
1,"Itu buat siapapun, yg sering bilang kalo nggak mau kena "" sexual harassment "" jangan pakai baju sexy, pakai bikini dsb ! Please kita pake bikini ya sesuai tempat kok, toh ada juga yg pakai niqab, pakai seragam sekolah, pakai baju kantor dsb juga jadi korban",Itu buat yg sering bilang Se nggak mau kena sexual harassment jangan pakai baju pakai bikini eccetera Please kita pake bikini S sesuai tempat toh ada juga yg pakai pakai seragam pakai baju kantor eccetera juga jadi korban,0.9685015678405762,1,[1.330e-02 9.831e-01 3.000e-04 2.400e-03 8.000e-04],1,[4.400e-03 9.938e-01 1.000e-04 1.200e-03 4.000e-04],"{'bilang': 'bilang', 'itu': 'Quello', 'bikini': 'bikini', 'please': 'please', 'baju': 'baju', 'nggak': 'nggak', 'kantor': 'kantor', 'pakai': 'pakai', 'kalo': 'Se', 'ya': 'S', 'dsb': 'eccetera'}",1,1,0.6446,,,,,,,,,
0,cayo! go go! hahaha tidak-semangat sangat :( a jenuh gila belajar sendiri di kamar -_-,go hahaha sangat a jenuh gila belajar sendiri di telecamera,0.8202542066574097,0,[0.9253 0.0156 0.0109 0.0096 0.0386],0,[0.6249 0.1143 0.0021 0.0125 0.2462],"{'gila': 'gila', 'a': 'a', 'kamar': 'telecamera'}",0,0,0.4513,,,,,,,,,
1,"Jebakan kacung mu.HRS,imam besar ( bagi umat muslim).Tokoh agama.Prabowo mlkukan konsultasi keagamaan.Apanya yg turun kelas.Kelas bulu apa kelas bantam.Alkafirun jelas tdk paham,aplg politisi kelas ecek2.Modalnya fitnah maki2,nyinyir.Cuma itu. [URL]",Jebakan lacca besar bagi umat mlkukan konsultasi yg turun bulu apa classe jelas tdk politisi classe fitnah,0.8459231853485107,1,[9.000e-04 9.982e-01 2.000e-04 5.000e-04 3.000e-04],1,[1.110e-02 9.802e-01 5.000e-04 5.800e-03 2.400e-03],"{'kacung': 'lacca', 'fitnah': 'fitnah', 'mlkukan': 'mlkukan', 'bulu': 'bulu', 'jebakan': 'trappola', 'kelas': 'classe', 'turun': 'turun'}",1,1,0.5519,,,,,,,,,
3,[USERNAME] [USERNAME] masi bingung gue:(takut nanti ga dapet tiket:(((( kalo make jastip takutt tambahannya gede trs takut kena tipu juga:(((,masi bingung nanti ga avuto Se make jastip takutt tambahannya grande trs paura kena tipu,0.6728230714797974,3,[1.200e-03 1.800e-03 4.000e-04 9.961e-01 5.000e-04],3,[8.000e-04 1.100e-03 3.000e-04 9.973e-01 6.000e-04],"{'jastip': 'jastip', 'takutt': 'takutt', 'trs': 'trs', 'gede': 'grande', 'takut': 'paura', 'dapet': 'avuto', 'kalo': 'Se', 'ga': 'ga'}",3,3,0.512,,,,,,,,,
0,"Kadang suka miris liat jalan di daerah2 ""pelosok"" yg dibangun sama Pemerintah Pusat. Gak nyediain pedestrian pisan.",Kadang suka pietà liat Strada di daerah2 quale costruito sama Pemerintah Gak nyediain pedestrian,0.7570098638534546,0,[9.96e-01 1.90e-03 6.00e-04 6.00e-04 8.00e-04],0,[9.821e-01 1.220e-02 5.000e-04 1.400e-03 3.800e-03],"{'miris': 'pietà', 'dibangun': 'costruito', 'yg': 'quale', 'pedestrian': 'pedestrian', 'jalan': 'Strada', 'nyediain': 'nyediain'}",0,0,0.1205,,,,,,,,,
4,"Tapi walopun doi buka sekolah, isi video ignya tuh pengetahuan buat modelling semua. Wonder hasn't she think about all the pro model that could look into her profile instead and stole all the knowledge? Emang beda lah ya kalo orang humble","Tapi walopun doi buka sekolah, isi video ignya tuh pengetahuan buat modelling semua. Wonder hasn't she think about all the pro model that could look into her profile instead and stole all the knowledge? Emang beda lah ya kalo orang humble",1.0,0,[0.6011 0.3899 0.0008 0.0023 0.006 ],0,[0.6011 0.3899 0.0008 0.0023 0.006 ],,1,1,0.03,,,,,,,,,
4,"Saat itu, kami selalu optimis akan bisa bersaing dgn tim manapun, melihat persiapan dan panjangnya perjalanan yg sudah kami lalui. Terlebih melihat hasil pertandingan hari pertama dan kedua yang baru saja kami jalani.",Saat kami selalu optimis akan bisa bersaing dgn tim melihat persiapan dan panjangnya perjalanan yg sudah kami Terlebih melihat risultati pertandingan hari pertama dan kedua yang baru saja kami,0.9767807722091676,4,[3.840e-02 9.000e-04 6.500e-03 1.700e-02 9.372e-01],0,[0.7857 0.0042 0.0065 0.0587 0.1449],"{'hasil': 'risultati', 'terlebih': 'terlebih', 'perjalanan': 'perjalanan'}",4,4,0.163,,,,,,,,,
3,Jadi gue ga berani masuk dari gerbang rumah plz itu serem bgt diliatin ayam jago nya gede bgt,Jadi gue ga coraggioso masuk dari gerbang rumah plz itu allarmante grande diliatin ayam jago nya grande grande,0.8733369708061218,3,[6.000e-04 8.000e-04 7.000e-04 9.968e-01 1.000e-03],3,[0.0607 0.005  0.0017 0.9098 0.0228],"{'serem': 'allarmante', 'nya': 'nya', 'berani': 'coraggioso', 'gede': 'grande', 'plz': 'plz', 'diliatin': 'diliatin', 'bgt': 'grande', 'jadi': 'jadi', 'ga': 'ga'}",3,3,0.1255,,,,,,,,,
0,"Cemburu melihat dia tengah bahagia dan membahagiakan kekasihnya, itu rasa yang salah. Kamu cukup paham, beberapa perasaan terpaksa harus kau sudahi sendiri",Cemburu melihat dia tengah bahagia dan membahagiakan itu rasa yang Kamu cukup beberapa sensazione costretto harus kau sudahi sendiri,0.9405653476715088,0,[9.838e-01 1.310e-02 1.800e-03 8.000e-04 5.000e-04],0,[0.7639 0.2309 0.0017 0.0017 0.0018],"{'perasaan': 'sensazione', 'terpaksa': 'costretto', 'kau': 'kau', 'bahagia': 'bahagia'}",0,0,0.124,,,,,,,,,
0,"Di Dm Marco Simic pake kata-kata senonoh marah, tapi aku ngeDm udah lama minta kenalan aja gapernah dibalas, duh mbak Via Vallen mah gitu orangnya huhu","Di Dm Marco Simic pake kata-kata senonoh marah, tapi aku ngeDm udah lama minta kenalan aja gapernah dibalas, duh mbak Via Vallen mah gitu orangnya huhu",1.0,1,[8.100e-03 9.908e-01 2.000e-04 5.000e-04 4.000e-04],1,[8.100e-03 9.908e-01 2.000e-04 5.000e-04 4.000e-04],,1,1,0.03,,,,,,,,,
2,"Sebenernya gue sayang, di stiap kali berpapasan.",Sebenernya gue di stiap kali,0.8391698002815247,2,[1.500e-03 7.000e-04 9.948e-01 2.100e-03 8.000e-04],0,[0.7279 0.2387 0.0034 0.0108 0.0193],{},0,2,0.0942,,,,,,,,,
4,"keinget dulu smnggu sblum kompre tiap malam nangis trus seminggu sblum ukmmpd nangis cemas takut, gak tau apa2, minder sama kawan2skrng doa sudah terjawab, terimakasih yesusku","keinget dulu smnggu sblum kompre tiap malam nangis trus seminggu sblum ukmmpd nangis cemas takut, gak tau apa2, minder sama kawan2skrng doa sudah terjawab, terimakasih yesusku",1.0,3,[0.0462 0.0022 0.0427 0.8646 0.0443],3,[0.0462 0.0022 0.0427 0.8646 0.0443],,3,3,0.03,,,,,,,,,
1,[USERNAME] [USERNAME] Sy ga krj krn hrs merawat ibu sy yg sdh pikun hanya jualan di rmh krn km hanya ber2.kl kln bl tega merampok cashback cmn sbgai uang mkn km jg ibu n anak buat apa kalian puasa?,Sy ga krj krn hrs merawat ibu sy quale sdh pikun hanya jualan di rmh krn km hanya kln bl tega merampok cashback cmn sbgai uang mkn km jg ibu n bambino buat apa kalian,0.9166001677513124,1,[1.040e-02 9.882e-01 3.000e-04 5.000e-04 6.000e-04],0,[0.5605 0.433  0.0019 0.0018 0.0028],"{'pikun': 'pikun', 'km': 'km', 'n': 'n', 'krn': 'krn', 'anak': 'bambino', 'yg': 'quale', 'bl': 'bl'}",0,1,0.203,,,,,,,,,
4,[USERNAME] [USERNAME] Ini price list yang ada dari facebook nya mereka. Web nya di [URL] semoga membantu :)) Anyway ini myday yang biasanya sering karaoke disana [USERNAME] :)) [URL],Ini price list yang ada dari Facebook nya Web nya di auspicabilmente membantu Anyway ini myday yang biasanya sering karaoke disana,0.8498111963272095,4,[1.200e-03 2.000e-04 2.000e-03 4.000e-04 9.961e-01],4,[3.300e-03 9.000e-04 1.800e-03 9.000e-04 9.931e-01],"{'anyway': 'comunque', 'semoga': 'auspicabilmente', 'nya': 'nya', 'facebook': 'Facebook', 'web': 'web', 'list': 'list'}",4,4,0.4087,,,,,,,,,
0,"Bukan ku menghindar atau tidak bijak dalam menyikapi masalah, namu hanya saja ingin menengankan pikiran sejenak dan tak ingin mementingkan ego tersendiri~",Bukan mio menghindar atau tidak bijak dalam affrontare namu hanya saja ingin menengankan pikiran sejenak dan tak ingin mementingkan ego,0.953248918056488,0,[9.957e-01 9.000e-04 1.400e-03 1.300e-03 7.000e-04],0,[0.9874 0.0057 0.0011 0.0043 0.0015],"{'mementingkan': 'mementingkan', 'menyikapi': 'affrontare', 'menghindar': 'menghindar', 'namu': 'namu', 'ku': 'mio', 'bijak': 'bijak'}",0,0,0.4746,,,,,,,,,
0,"[USERNAME] ya gimana ya lin, coba deh mbok pikir aja km sbnre msh sayang bgt sama mantanmu trs dia jg smpe dtk ini msh memperlakukan km sama seperti pas dia msh jd pacar mu, kan jd memupuk rasa lagi nek gt :(",ya gimana ya coba deh mbok pensare aja km sbnre msh sayang bgt sama mantanmu trs dia jg smpe dtk ini msh memperlakukan km sama seperti pas dia msh jd pacar kan jd memupuk rasa lagi nek gt,0.9594133496284484,0,[9.247e-01 5.980e-02 5.000e-03 1.010e-02 4.000e-04],1,[0.2617 0.7256 0.0079 0.0039 0.0009],"{'km': 'km', 'memupuk': 'memupuk', 'pikir': 'pensare'}",1,1,0.2522,,,,,,,,,
