text,sentiment,perturbed_text,perturbed_semantic_sim,pred_label,pred_proba,perturbed_label,perturbed_proba,translated_word(s),adv_pred,adv_pred_on_orig,running_time(s),before_attack_acc,after_attack_acc,avg_semantic_sim,avg_running_time(s),adv_training,delta_acc,delta_adv,acc_adv_training_on_orig,best_epoch
"entah kenapa saya tidak suka melihat cara politisi mengemis suara dengan mengorbankan kemuliaan ulama . kalau alim yang punya track record di partai sih tidak masalah , ini kiai dengan ruf , sudah setua itu , harus lagi menerima caci maki dan tekanan . terlalu kejam saya rasa . kejam banget malah .",2,entah kenapa saya tidak suka melihat cara politisi mengemis suara dengan pengorbanan kemuliaan ulama kalau alim yang punya track record di pesta sih tidak masalah ini kiai dengan ruf sudah setua itu harus lagi menerima caci maki dan tekanan terlalu kejam saya rasa kejam banget malah,0.994346022605896,2,[9.000e-04 4.000e-04 9.987e-01],2,[1.400e-03 4.000e-04 9.982e-01],"{'ulama': 'ulama', 'mengorbankan': 'pengorbanan', 'menerima': 'menerima', 'ruf': 'ruf', 'suka': 'suka', 'mengemis': 'mengemis', 'alim': 'alim', 'suara': 'suara', 'banget': 'banget', 'tekanan': 'tekanan', 'record': 'record', 'partai': 'pesta', 'kemuliaan': 'kemuliaan', 'track': 'track', 'politisi': 'politisi', 'kejam': 'kejam', 'maki': 'maki'}",2,2,1.058,,,,,,,,,
"gua enggak suka cara pelatih timnas u16 yang melarang pemain nya diwawancara sama teman-teman media . di luar sana , justru pemain muda diajari public speaking baik di depan media maupun di depan rakyat . harus nya pelatih atau manager cukup membatasi apa yang tidak boleh dishare ke media .",2,saya enggak suka cara jurulatih timnas u16 yang melarang pemain miliknya diwawancara sama media di luar sana justru pemain muda diajari public speaking baik di depan media maupun di depan rakyat harus miliknya jurulatih atau manager cukup membatasi apa yang tidak boleh dishare ke media,0.9787161350250244,2,[0.0177 0.0149 0.9674],2,[0.0137 0.0053 0.981 ],"{'suka': 'suka', 'gua': 'saya', 'timnas': 'timnas', 'diajari': 'diajari', 'pemain': 'pemain', 'media': 'media', 'nya': 'miliknya', 'pelatih': 'jurulatih', 'rakyat': 'rakyat', 'diwawancara': 'diwawancara', 'dishare': 'dishare', 'muda': 'muda', 'membatasi': 'membatasi'}",2,2,0.9637,,,,,,,,,
"takdir politik ahy belum bisa ikut kontestasi pilpres 2019 - 2024 . walaupun ahy legowo , kami tetap kecewa .",2,takdir politik ahy belum bisa ikut kontestasi pilpres 2019 2024 walaupun ahy legowo kami tetap kecewa,1.0,2,[5.000e-04 1.300e-03 9.982e-01],2,[6.000e-04 1.100e-03 9.983e-01],"{'takdir': 'takdir', 'kontestasi': 'kontestasi', 'ahy': 'ahy', 'legowo': 'legowo', 'politik': 'politik'}",2,2,0.6756,,,,,,,,,
"yang mengira politik itu cuma soal dukung partai , tokoh atau kepentingan nya saja , pasti kemarin dan hari ini kecewa ketika ekspektasi nya tidak terpenuhi . politik itu sarana mewujudkan amanat pembukaan uud 1945 untuk bangsa ini . tokoh partai itu cuma alat saja .",2,yang mengira politik itu cuma soal dukung pesta tokoh atau kepentingan miliknya saja pasti kemarin dan hari ini kecewa ketika jangkakan miliknya tidak terpenuhi politik itu sarana mewujudkan amanat pembukaan uud 1945 untuk bangsa ini tokoh pesta itu cuma alat saja,0.9804869890213012,2,[0.0045 0.0043 0.9912],2,[1.000e-03 9.000e-04 9.981e-01],"{'kecewa': 'kecewa', 'terpenuhi': 'terpenuhi', 'politik': 'politik', 'ekspektasi': 'jangkakan', 'dukung': 'dukung', 'nya': 'miliknya', 'tokoh': 'tokoh', 'kepentingan': 'kepentingan', 'partai': 'pesta', 'pembukaan': 'pembukaan', 'mewujudkan': 'mewujudkan', 'alat': 'alat', 'uud': 'uud'}",2,2,0.9264,,,,,,,,,
saya kecewa sama waktu beliau berhentikan sebagai mendikbud . setelah saya tahu bagaimana kinerja nya baru paham mengapa dia diberhentikan . sekarang pun begitu . keputusan yang diambil jokowi pasti beralasan termasuk pemilihan wapres .,2,saya kecewa sama waktu dia berhenti sebagai mendikbud setelah saya tahu bagaimana kinerja miliknya baru paham mengapa dia diberhentikan sekarang pun begitu keputusan yang diambil jokowi pasti beralasan termasuk pemilihan wapres,0.9745206832885742,2,[0.0114 0.0026 0.9859],2,[0.009 0.001 0.99 ],"{'diberhentikan': 'diberhentikan', 'pemilihan': 'pemilihan', 'beliau': 'dia', 'nya': 'miliknya', 'wapres': 'wapres', 'kinerja': 'kinerja', 'mendikbud': 'mendikbud', 'berhentikan': 'berhenti', 'diambil': 'diambil', 'keputusan': 'keputusan'}",2,2,0.8374,,,,,,,,,
"udahlah kecewa jakarta dapet nya anies - sandi , terus gue harus kecewa dua kali dengan dapat prabowo - sandi lagi ? ogah amat .",2,udahlah kecewa Jakarta dapatkan miliknya anies sandi terus gue harus kecewa dua kali dengan dapat prabowo sandi lagi ogah amat,0.9762792587280272,2,[6.000e-04 5.000e-04 9.989e-01],2,[6.000e-04 3.000e-04 9.991e-01],"{'prabowo': 'prabowo', 'anies': 'anies', 'udahlah': 'udahlah', 'jakarta': 'Jakarta', 'ogah': 'ogah', 'dapet': 'dapatkan', 'sandi': 'sandi', 'kecewa': 'kecewa', 'nya': 'miliknya'}",2,2,0.7283,,,,,,,,,
"kecewa berat kepada pihak stasiun tv yang mengacak siaran nya karena rakyat jelata seperti kami tidak bisa melihat timnas u23 bermain . percuma kita tuan rumah kalau rakyat indonesia sendiri tidak bisa melihat di tv , salam buat pihak yang terkait semoga kalian semua puas .",2,kecewa berat kepada pihak stesen tv yang mengacak siaran miliknya karena rakyat jelata seperti kami tidak bisa melihat timnas u23 bermain percuma kita tuan rumah kalau rakyat Indonesia sendiri tidak bisa melihat di tv salam buat pihak yang terkait semoga kalian semua puas,0.9888440370559692,2,[0.1014 0.0023 0.8963],2,[2.42e-02 8.00e-04 9.75e-01],"{'kecewa': 'kecewa', 'berat': 'berat', 'bermain': 'bermain', 'nya': 'miliknya', 'stasiun': 'stesen', 'terkait': 'terkait', 'tv': 'tv', 'jelata': 'jelata', 'timnas': 'timnas', 'rakyat': 'rakyat', 'indonesia': 'Indonesia', 'mengacak': 'mengacak', 'rumah': 'rumah'}",2,2,0.9313,,,,,,,,,
pak kami orang kampung yang khusus orang sumatera pedalaman . kami sangat kecewa dengan hal penyiaran asian games . sebenarnya regulasi bisa diubah karena ini wilayah indonesia jadi apa pun yang berada diindonesia harus mengikutkan perintah dari saya,2,pak kami orang kampung yang khusus orang Sumatera pedalaman kami sangat kecewa dengan hal penyiaran asian permainan sebenarnya regulasi bisa diubah karena ini wilayah indonesia jadi apa pun yang berada diindonesia harus mengikutkan perintah dari saya,0.9932457804679872,2,[0.003  0.0012 0.9959],2,[2.600e-03 7.000e-04 9.966e-01],"{'kecewa': 'kecewa', 'pedalaman': 'pedalaman', 'kampung': 'kampung', 'sumatera': 'Sumatera', 'mengikutkan': 'mengikutkan', 'regulasi': 'regulasi', 'orang': 'orang', 'games': 'permainan', 'diindonesia': 'diindonesia', 'khusus': 'khusus', 'wilayah': 'wilayah', 'diubah': 'diubah'}",2,2,0.8702,,,,,,,,,
dukungan untuk asian games terbatas . ini status satu kampung aku yang merasa kecewa . ri nahrawi,2,dukungan untuk asian games terbatas ini status satu kampung aku yang merasa kecewa ri nahrawi,1.0,2,[5.000e-04 1.300e-03 9.982e-01],2,[6.000e-04 7.000e-04 9.987e-01],"{'kecewa': 'kecewa', 'terbatas': 'terbatas', 'kampung': 'kampung', 'status': 'status', 'nahrawi': 'nahrawi', 'dukungan': 'dukungan', 'asian': 'asian'}",2,2,0.6698,,,,,,,,,
"tugas tv sctv itu untuk menghibur rakyat indonesia , bukan malah membuat rakyat indonesia kecewa , jangan selalu uang yang kalian pikirkan pak .",2,Kewajipan tv sctv itu untuk menghibur rakyat Indonesia bukan malah membuat rakyat Indonesia kecewa jangan selalu uang yang kalian fikir pak,0.9877891540527344,2,[0.0056 0.0019 0.9925],2,[0.0103 0.0018 0.988 ],"{'kecewa': 'kecewa', 'uang': 'uang', 'sctv': 'sctv', 'tugas': 'Kewajipan', 'tv': 'tv', 'pikirkan': 'fikir', 'rakyat': 'rakyat', 'indonesia': 'Indonesia'}",2,2,0.7336,,,,,,,,,
"kami warga khusus sumatera , kalimantan , dan papua sangat kecewa dengan cara penyiaran asian games cabor sepak bola . jangan bagikan alasan bahwa itu adalah aturan dari oympic bila bola . itu adalah alasan basi memang kami bodoh apa !",2,kami warga khusus Sumatera Borneo dan papua sangat kecewa dengan cara penyiaran asian permainan cabor sepak bola jangan bagikan alasan bahwa itu adalah aturan dari oympic bila bola itu adalah alasan basi memang kami bodoh apa,0.9765787124633788,2,[6.000e-04 7.000e-04 9.986e-01],2,[7.000e-04 5.000e-04 9.987e-01],"{'kecewa': 'kecewa', 'asian': 'asian', 'games': 'permainan', 'bola': 'bola', 'oympic': 'oympic', 'bodoh': 'bodoh', 'kalimantan': 'Borneo', 'basi': 'basi', 'penyiaran': 'penyiaran', 'sepak': 'sepak', 'sumatera': 'Sumatera', 'alasan': 'alasan', 'khusus': 'khusus', 'cabor': 'cabor', 'aturan': 'aturan'}",2,2,0.8684,,,,,,,,,
"sebagai resmi broadcast , saya merasa kecewa dengan karena selain siaran yang di acak , iklan pop naik yang menutupi layar , juga tidak menayangkan pertandingan lainn nya . bahkan , menjelang asian games masih banyak sinetron reguler daripada tayangan asian games .",2,sebagai rasmi broadcast saya merasa kecewa dengan karena selain siaran yang di berkarang iklan pop naik yang menutupi layar juga tidak menayangkan persaingan lainn miliknya bahkan menjelang asian permainan masih banyak sinetron reguler daripada tayangan asian permainan,0.9434064626693726,2,[0.0044 0.001  0.9947],2,[2.900e-03 9.000e-04 9.963e-01],"{'kecewa': 'kecewa', 'acak': 'berkarang', 'resmi': 'rasmi', 'asian': 'asian', 'layar': 'layar', 'games': 'permainan', 'broadcast': 'broadcast', 'menjelang': 'menjelang', 'iklan': 'iklan', 'nya': 'miliknya', 'pertandingan': 'persaingan', 'pop': 'pop', 'siaran': 'siaran', 'lainn': 'lainn'}",2,2,0.8677,,,,,,,,,
"rakyat indonesia lebih kecewa , ini bukan settingan kayak sinetron . ini asli , rakyat indonesia kecewa tidak bisa nonton asian games . ingat , sctv bisa menjadi besar sekarang karena rakyat indonesia bukan india . atau sinetron tidak jelas .",2,rakyat Indonesia lebih kecewa ini bukan settingan kayak sinetron ini asli rakyat Indonesia kecewa tidak bisa menonton asian permainan ingat sctv bisa menjadi besar sekarang karena rakyat Indonesia bukan india atau sinetron tidak jelas,0.9913948774337769,2,[0.0075 0.0014 0.9911],2,[2.100e-03 4.000e-04 9.976e-01],"{'kecewa': 'kecewa', 'indonesia': 'Indonesia', 'india': 'india', 'kayak': 'kayak', 'asian': 'asian', 'rakyat': 'rakyat', 'nonton': 'menonton', 'asli': 'asli', 'games': 'permainan'}",2,2,0.8457,,,,,,,,,
saya secara pribadi tetap tidak setuju dengan semua jenis ajakan . apalagi untuk timnas yang main . kalau liga-liga top eropa apa yang lain silakan saya tidak menonton juga tidak mengapa . tapi ini timnas . kita tetap meminta ta pak dan pak nahrawi,2,saya secara pribadi tetap tidak setuju dengan semua jenis ajakan apalagi untuk timnas yang main kalau pada eropa apa yang lain silakan saya tidak menonton juga tidak mengapa tapi ini timnas kita tetap meminta ta pak dan pak nahrawi,0.9937559962272644,2,[0.0362 0.0105 0.9533],2,[0.0113 0.0033 0.9855],"{'setuju': 'setuju', 'pribadi': 'pribadi', 'eropa': 'eropa', 'timnas': 'timnas', 'ta': 'ta', 'top': 'pada', 'menonton': 'menonton', 'main': 'main', 'ajakan': 'ajakan'}",2,2,0.869,,,,,,,,,
"saya tidak peduli milo dan kokokrunch duo lebih mahal / murah mana , anak saya kecewa sarapan tidak sesuai keinginan nya",2,saya tidak peduli milo dan kokokrunch duo lebih mahal murah mana anak saya kecewa sarapan tidak sesuai keinginan nya,1.0,2,[1.100e-03 4.000e-04 9.985e-01],2,[1.000e-03 3.000e-04 9.987e-01],"{'mahal': 'mahal', 'anak': 'anak', 'peduli': 'peduli', 'murah': 'murah', 'sarapan': 'sarapan', 'kokokrunch': 'kokokrunch', 'kecewa': 'kecewa', 'sesuai': 'sesuai'}",2,2,0.7559,,,,,,,,,
"saya sebagai aktifis pecinta beruang indonesia apbi , dengan ini merasa kecewa kepada pt nestle . kenapa iklan nya sangat menipu .",2,saya sebagai aktifis pecinta beruang Indonesia apbi dengan ini merasa kecewa kepada pt nestle kenapa iklan nya sangat menipu,1.0,2,[2.000e-03 7.000e-04 9.973e-01],2,[1.400e-03 4.000e-04 9.982e-01],"{'kecewa': 'kecewa', 'apbi': 'apbi', 'aktifis': 'aktifis', 'pecinta': 'pecinta', 'beruang': 'beruang', 'indonesia': 'Indonesia', 'nestle': 'nestle', 'pt': 'pt'}",2,2,0.6998,,,,,,,,,
kecewa sama promo yang diadakan id dan sepertinya setengah-setengah sekali kasih promo ivoucher 50 ribu tiap beli 5box dancow 1 800 gr . huft . harus nya tidak usah kasih promo kalau tidak niat .,2,kecewa sama promo yang diadakan id dan sepertinya sekali cinta promo ivoucher 50 ribu tiap beli 5box dancow 1 800 gr huft harus miliknya tidak usah cinta promo kalau tidak niat,0.9370198249816896,2,[1.30e-03 6.00e-04 9.98e-01],2,[1.000e-03 5.000e-04 9.985e-01],"{'kecewa': 'kecewa', 'promo': 'promo', 'id': 'id', 'kasih': 'cinta', 'huft': 'huft', 'nya': 'miliknya', 'ivoucher': 'ivoucher', 'ribu': 'ribu', 'niat': 'niat', 'dancow': 'dancow', 'diadakan': 'diadakan'}",2,2,0.7858,,,,,,,,,
aku kecewa . tadi pergi kfc dapat wedges macam tidak niat dibuat nya . sudah begitu memberi mayones nya berantakan banget .,2,aku kecewa tadi pergi kfc dapat wedges macam tidak niat dibuat miliknya sudah begitu memberi mayones miliknya berantakan banget,0.9491316080093384,2,[1.000e-03 3.000e-04 9.986e-01],2,[6.000e-04 4.000e-04 9.991e-01],"{'berantakan': 'berantakan', 'wedges': 'wedges', 'kecewa': 'kecewa', 'banget': 'banget', 'nya': 'miliknya', 'niat': 'niat', 'pergi': 'pergi'}",2,2,0.7196,,,,,,,,,
kfc chizza apa banget . tidak jelas rasanya . rasanya ingin buntut kfc buat mengembalikan uang gue . kecewa .,2,kfc chizza apa banget tidak jelas rasanya rasanya ingin buntut kfc buat mengembalikan uang saya kecewa,0.9841681122779846,2,[8.000e-04 4.000e-04 9.988e-01],2,[8.000e-04 3.000e-04 9.989e-01],"{'kfc': 'kfc', 'buntut': 'buntut', 'gue': 'saya', 'kecewa': 'kecewa', 'uang': 'uang', 'chizza': 'chizza'}",2,2,0.6857,,,,,,,,,
"aku belajar satu perkara tentang pengharapan . kalau kita berharap pada tuhan , memang tak akan kecewa . kalau kita berharap pd kfc , barulah kecewa sangat .",2,aku belajar satu perkara tentang pengharapan kalau kita harapan pada tuhan memang tak akan kecewa kalau kita harapan pd kfc kemudian kecewa sangat,0.9728480577468872,2,[1.700e-03 9.000e-04 9.974e-01],2,[0.0105 0.0015 0.988 ],"{'pengharapan': 'pengharapan', 'barulah': 'kemudian', 'berharap': 'harapan', 'perkara': 'perkara', 'pd': 'pd', 'belajar': 'belajar', 'tuhan': 'tuhan'}",2,2,0.73,,,,,,,,,
"itu tadi saya cancel , soal nya kantor saya juga sudah tutup . semoga tidak kejadian seperti ini lagi , karena selama saya order di pd baru pertama kali menemukan hal yang seperti ini , kecewa sih .",2,itu tadi saya cancel soal miliknya pejabat saya juga sudah tutup semoga tidak kejadian seperti ini lagi karena selama saya order di pd baru pertama masa menemukan hal yang seperti ini kecewa neraka,0.9664195775985718,2,[1.500e-03 7.000e-04 9.979e-01],2,[1.000e-03 6.000e-04 9.985e-01],"{'kecewa': 'kecewa', 'pd': 'pd', 'kantor': 'pejabat', 'tutup': 'tutup', 'menemukan': 'menemukan', 'kali': 'masa', 'sih': 'neraka', 'order': 'order', 'nya': 'miliknya'}",2,2,0.7845,,,,,,,,,
dari sejujur nya saya sangat kecewa dengan kenyataan dari menangguhkan dengan alasan masalah kewangan berpunca dari kerajaan lama . cari la solusi baru bukan tangguh dan tanding jari . bagaimana nasib kami yang kurang mampu untuk memiliki sarjana dan pd ? kena korek duit tabung ?,2,dari sejujur miliknya saya sangat kecewa dengan kenyataan dari menangguhkan dengan alasan masalah kewangan berpunca dari kerajaan lama cari la solusi baru bukan tangguh dan gaduh jari bagaimana nasib kami yang kurang mampu untuk memiliki sarjana dan pd kena korek duit tabung,0.993112087249756,2,[7.000e-04 7.000e-04 9.987e-01],2,[6.00e-04 4.00e-04 9.99e-01],"{'korek': 'korek', 'pd': 'pd', 'menangguhkan': 'menangguhkan', 'kecewa': 'kecewa', 'sejujur': 'sejujur', 'kenyataan': 'kenyataan', 'tangguh': 'tangguh', 'sarjana': 'sarjana', 'nya': 'miliknya', 'memiliki': 'memiliki', 'kewangan': 'kewangan', 'duit': 'duit', 'alasan': 'alasan', 'nasib': 'nasib', 'kerajaan': 'kerajaan', 'kena': 'kena', 'berpunca': 'berpunca', 'tanding': 'gaduh'}",2,2,0.933,,,,,,,,,
gue paling suka cebong pada mengawal . ketua kpk ? wkwkkwk ahok mengurus laporan keuangan saja amburadul . tidak pernah dapat wtp . 5 tahun bos . sudahlah saya sudah terlanjur kecewa dengan dia .,2,saya paling suka cebong pada mengawal ketua kpk wkwkkwk ahok mengurus laporan keuangan saja amburadul tidak pernah dapat wtp 5 tahun bos sudahlah saya sudah terlanjur kecewa dengan dia,0.9900522232055664,2,[5.000e-04 3.000e-04 9.992e-01],2,[5.000e-04 3.000e-04 9.992e-01],"{'wkwkkwk': 'wkwkkwk', 'cebong': 'cebong', 'amburadul': 'amburadul', 'terlanjur': 'terlanjur', 'wtp': 'wtp', 'suka': 'suka', 'kpk': 'kpk', 'ahok': 'ahok', 'mengurus': 'mengurus', 'gue': 'saya', 'mengawal': 'mengawal', 'keuangan': 'keuangan', 'bos': 'bos'}",2,2,0.816,,,,,,,,,
"saya sih tidak suka tsb tapi dengan diperiksa nya atas laporan lama ini bukti nyata bahwa kpk itu alat politik , alat penguasa . bubarkan saja !",2,saya neraka tidak suka tsb tapi dengan diperiksa miliknya atas laporan lama ini bukti nyata bahwa kpk itu alat politik alat penguasa bubarkan saja,0.9815639853477478,2,[6.000e-04 5.000e-04 9.989e-01],2,[6.00e-04 4.00e-04 9.99e-01],"{'bubarkan': 'bubarkan', 'diperiksa': 'diperiksa', 'suka': 'suka', 'tsb': 'tsb', 'nya': 'miliknya', 'bukti': 'bukti', 'nyata': 'nyata', 'laporan': 'laporan', 'kpk': 'kpk', 'alat': 'alat', 'sih': 'neraka'}",2,2,0.7523,,,,,,,,,
"kenapa saya tidak suka sama elit-elit pks yang sekarang ? karena elit-elit yang sekarang adalah yang ngumpet di bawah meja saat elit-elit terdahulu zaman am berdarah2 pertahankan pks dari badai kpk . giliran mereka berkuasa , elit am malah disingkirkan .",2,kenapa saya tidak suka sama pks yang sekarang karena yang sekarang adalah yang ngumpet di bawah meja saat terdahulu era am berdarah2 pertahankan pks dari badai kpk giliran mereka berkuasa elit am malah disingkirkan,0.9800564646720886,2,[6.000e-04 9.000e-04 9.986e-01],2,[4.000e-04 5.000e-04 9.991e-01],"{'pks': 'pks', 'meja': 'meja', 'suka': 'suka', 'giliran': 'giliran', 'zaman': 'era', 'elit': 'elit', 'badai': 'badai', 'ngumpet': 'ngumpet', 'pertahankan': 'pertahankan', 'kpk': 'kpk', 'berkuasa': 'berkuasa'}",2,2,0.8694,,,,,,,,,
ini orang suka banget pidato sama . resmikan acara . tidak suka kerja . si wakil nya cuma cengeh-cengehan disamping . benar-benar badut,2,ini orang suka banget berkata sama resmikan program tidak suka kerja si wakil miliknya cuma disamping badut,0.9468645453453064,2,[7.00e-04 3.00e-04 9.99e-01],2,[6.000e-04 3.000e-04 9.991e-01],"{'orang': 'orang', 'wakil': 'wakil', 'suka': 'suka', 'si': 'si', 'pidato': 'berkata', 'kerja': 'kerja', 'badut': 'badut', 'nya': 'miliknya', 'acara': 'program', 'resmikan': 'resmikan'}",2,2,0.7638,,,,,,,,,
charger masih benar buat telepon genggam lain . cuma sama xiao mi saya suka tidak cocok . yang saya bawa tiap hari lebih cocok . padahal charger asus . malah charger ori xiaomi nya tidak enak,2,charger masih benar buat telepon genggam lain cuma sama xiao mi saya suka tidak mengikut yang saya bawa tiap hari lebih mengikut padahal charger asus malah charger ori xiaomi nya tidak baik,0.9875100255012512,2,[4.300e-03 7.000e-04 9.949e-01],2,[0.1616 0.0091 0.8292],"{'cocok': 'mengikut', 'enak': 'baik', 'telepon': 'telepon', 'suka': 'suka', 'mi': 'mi', 'xiao': 'xiao', 'charger': 'charger', 'ori': 'ori', 'bawa': 'bawa', 'asus': 'asus', 'xiaomi': 'xiaomi'}",2,2,0.8734,,,,,,,,,
"dulu aku sempat pengin ganti handphone juga . pertimbangan ku itu oppo f5 , vivo v7 , sama xiaomi mi a1 . mereka bertiga dari spesifikasi dan harga mirip mirip . tapi terus aku eliminasi xiaomi mi a1 , karena dia slot nya hybrid . aku tidak suka .",2,dulu aku sempat pengin ubah handphone juga pertimbangan ku itu oppo f5 vivo v7 sama xiaomi mi a1 mereka bertiga dari spesifikasi dan harga mirip mirip tapi terus aku eliminasi xiaomi mi a1 karena dia slot miliknya hybrid aku tidak suka,0.992257297039032,2,[0.0014 0.0016 0.997 ],2,[0.0013 0.0024 0.9963],"{'suka': 'suka', 'vivo': 'vivo', 'nya': 'miliknya', 'ku': 'ku', 'oppo': 'oppo', 'mi': 'mi', 'ganti': 'ubah', 'harga': 'harga', 'eliminasi': 'eliminasi', 'spesifikasi': 'spesifikasi', 'handphone': 'handphone', 'pertimbangan': 'pertimbangan', 'hybrid': 'hybrid', 'xiaomi': 'xiaomi', 'slot': 'slot'}",2,2,0.9685,,,,,,,,,
"menyesal tidak sih ganti handphone , dari iphone 7 ke samsung s8 ?: hmm , 75 % menyesal . kurang enak buat pakai s8 , dari segi camera lebih suka ip7 , dari segi performa juga ip7 , batre juga tidak beda jauh banget . lalu , s8 ini juga agak sering melar , padahal cuma buka instagram saja . ckck",2,menyesal tidak sih ubah handphone dari iphone 7 ke samsung s8 hmm 75 menyesal kurang baik buat pakai s8 dari aspek kamera lebih suka ip7 dari aspek performa juga ip7 batre juga tidak beda jauh banget lalu s8 ini juga agak sering melar padahal cuma buka instagram saja ckck,0.9884468913078308,2,[5.000e-03 5.000e-04 9.946e-01],2,[8.300e-03 5.000e-04 9.912e-01],"{'ckck': 'ckck', 'enak': 'baik', 'hmm': 'hmm', 'menyesal': 'menyesal', 'samsung': 'samsung', 'segi': 'aspek', 'pakai': 'pakai', 'handphone': 'handphone', 'melar': 'melar', 'iphone': 'iphone', 'beda': 'beda', 'banget': 'banget', 'instagram': 'instagram', 'ganti': 'ubah', 'buka': 'buka', 'camera': 'kamera'}",2,2,1.1208,,,,,,,,,
ada yang pakai samsung a8 tidak ? dan suara nya suka mati-mati begitu kalau tidak pakai headset . misalnya setel musik nanti sura nya kedengaran nya kayak pause2 1 detik begitu padahal masih jalan . agak sering itu aku . sebel deh .,2,ada yang pakai samsung a8 tidak dan suara miliknya suka begitu kalau tidak pakai headset misalnya setel musik nanti sura miliknya kedengaran miliknya kayak pause2 1 detik begitu padahal masih jalan agak sering itu aku sebel deh,0.9712915420532228,2,[1.500e-03 8.000e-04 9.976e-01],2,[2.700e-03 5.000e-04 9.968e-01],"{'kayak': 'kayak', 'nya': 'miliknya', 'deh': 'deh', 'samsung': 'samsung', 'musik': 'musik', 'pakai': 'pakai', 'kedengaran': 'kedengaran', 'sura': 'sura', 'jalan': 'jalan', 'setel': 'setel', 'suara': 'suara'}",2,2,0.8928,,,,,,,,,
saya sangat kecewa dengan pihak sales promotion toyota . saya menang hadiah samsung gear sport tetapi di kasih nya gear s2 yang jelas-jelas harga beda jauh . nama nya satria after sales promotion dia bilang sudah bersyukur saja nama nya juga hadiahlah kok begitu .,2,saya sangat kecewa dengan pihak jualan promotion toyota saya menang hadiah samsung gear sukan tetapi di kasih miliknya gear s2 yang harga beda jauh nama miliknya satria after jualan promotion dia katakan sudah bersyukur saja nama miliknya juga hadiahlah kok begitu,0.9175146818161012,2,[1.400e-03 8.000e-04 9.978e-01],2,[9.000e-04 6.000e-04 9.985e-01],"{'nya': 'miliknya', 'after': 'after', 'nama': 'nama', 'kecewa': 'kecewa', 'satria': 'satria', 'bilang': 'katakan', 'gear': 'gear', 'samsung': 'samsung', 'beda': 'beda', 'sales': 'jualan', 'hadiah': 'hadiah', 'toyota': 'toyota', 'sport': 'sukan', 'promotion': 'promotion'}",2,2,0.9082,,,,,,,,,
id my s8 eror . lagi . hang . atau apapun nama nya . selama 3 jam lebih ? kirain cuma hang biasa selama 1 atau 2 menit but ini adalah crazy . kecewa parah pokok nya .,2,id my s8 eror lagi hang atau apapun nama miliknya selama 3 jam lebih kirain cuma hang biasa selama 1 atau 2 menit tetapi ini adalah crazy kecewa parah pokok miliknya,0.9677417278289796,2,[9.000e-04 6.000e-04 9.984e-01],2,[5.00e-04 5.00e-04 9.99e-01],"{'kecewa': 'kecewa', 'parah': 'parah', 'pokok': 'pokok', 'eror': 'eror', 'nya': 'miliknya', 'id': 'id', 'menit': 'menit', 'kirain': 'kirain', 'hang': 'hang', 'apapun': 'apapun', 'but': 'tetapi', 'my': 'my'}",2,2,0.7981,,,,,,,,,
"kecewa sama iphone8 , kalah politik dengan samsung .. saat nya hijrah ke samsung iphone 8 iphone x",2,kecewa sama iphone8 kalah politik dengan samsung saat miliknya hijrah ke samsung iphone 8 iphone x,0.9775075316429138,2,[8.000e-04 6.000e-04 9.986e-01],2,[4.000e-04 1.000e-03 9.986e-01],"{'kecewa': 'kecewa', 'politik': 'politik', 'samsung': 'samsung', 'kalah': 'kalah', 'x': 'x', 'iphone': 'iphone', 'nya': 'miliknya'}",2,2,0.6925,,,,,,,,,
aku kecewa dengan iphone . aku pakai ip4s ini lama gila .,2,aku kecewa dengan iphone aku pakai ip4s ini lama gila,1.0,2,[6.000e-04 5.000e-04 9.989e-01],2,[6.000e-04 3.000e-04 9.991e-01],"{'pakai': 'pakai', 'kecewa': 'kecewa', 'gila': 'gila'}",2,2,0.6611,,,,,,,,,
cukuplah sekali aku pernah kecewa dengan lenovo .,2,cukuplah sekali aku pernah kecewa dengan lenovo,1.0,2,[1.900e-03 6.000e-04 9.975e-01],2,[2.400e-03 3.000e-04 9.972e-01],{'lenovo': 'lenovo'},2,2,0.6634,,,,,,,,,
kemarin banget dengar cerita ini . wajar dong kalau saya kecewa dengan samsung . saya merasa tertipu . saya tidak dapat apa yang dijanjikan di awal .,2,semalaman banget dengar cerita ini monasabah dong kalau saya kecewa dengan samsung saya merasa tertipu saya tidak dapat apa yang dijanjikan di awal,0.9866145849227904,2,[1.300e-03 5.000e-04 9.982e-01],2,[6.000e-04 3.000e-04 9.991e-01],"{'tertipu': 'tertipu', 'dijanjikan': 'dijanjikan', 'samsung': 'samsung', 'kecewa': 'kecewa', 'dengar': 'dengar', 'wajar': 'monasabah', 'kemarin': 'semalaman'}",2,2,0.7399,,,,,,,,,
aku sudah 2x pakai samsung 2x kecewa . aku menyesal . aku tidak ingin pakai handphone merek itu lagi !,2,aku sudah 2x pakai samsung 2x kecewa aku menyesal aku tidak ingin pakai handphone jenama itu lagi,0.9939361214637756,2,[9.000e-04 5.000e-04 9.986e-01],2,[1.400e-03 4.000e-04 9.982e-01],"{'merek': 'jenama', 'pakai': 'pakai', 'menyesal': 'menyesal', 'samsung': 'samsung', 'kecewa': 'kecewa'}",2,2,0.6897,,,,,,,,,
samsung galaxy s6 . standar fon samsung ini . bila sampai satu peringkat . dia akan lagi dijuragan sendiri nya . saya pengguna samsung yang kecewa .,2,samsung galaxy s6 standar fon samsung ini bila sampai satu peringkat dia akan lagi dijuragan sendiri nya saya pengguna samsung yang kecewa,1.0,2,[7.00e-04 3.00e-04 9.99e-01],2,[5.000e-04 3.000e-04 9.991e-01],"{'dijuragan': 'dijuragan', 'fon': 'fon', 'samsung': 'samsung', 'pengguna': 'pengguna', 'standar': 'standar'}",2,2,0.7001,,,,,,,,,
