text,sentiment,perturbed_text,perturbed_semantic_sim,pred_label,pred_proba,perturbed_label,perturbed_proba,translated_word(s),adv_pred,adv_pred_on_orig,running_time(s),before_attack_acc,after_attack_acc,avg_semantic_sim,avg_running_time(s),adv_training,delta_acc,delta_adv,acc_adv_training_on_orig,best_epoch
gue paling suka cebong pada mengawal . ketua kpk ? wkwkkwk ahok mengurus laporan keuangan saja amburadul . tidak pernah dapat wtp . 5 tahun bos . sudahlah saya sudah terlanjur kecewa dengan dia .,2,gue paling suka girino pada mengawal ketua kpk wkwkkwk ahok mengurus laporan keuangan saja amburadul tidak pernah dapat wtp 5 tahun bos sudahlah saya sudah terlanjur kecewa dengan dia,0.9953374862670898,2,[5.000e-04 3.000e-04 9.992e-01],2,[6.300e-03 3.000e-04 9.934e-01],"{'wkwkkwk': 'wkwkkwk', 'cebong': 'girino', 'amburadul': 'amburadul'}",2,2,0.8387,,,,,,,,,
"saya sih tidak suka tsb tapi dengan diperiksa nya atas laporan lama ini bukti nyata bahwa kpk itu alat politik , alat penguasa . bubarkan saja !",2,saya sih tidak suka tsb tapi dengan diperiksa nya atas laporan lama ini bukti nyata bahwa kpk itu alat politik alat penguasa disperdere saja,0.993332862854004,2,[6.000e-04 5.000e-04 9.989e-01],2,[7.000e-04 4.000e-04 9.989e-01],"{'bubarkan': 'disperdere', 'diperiksa': 'diperiksa'}",2,2,0.7143,,,,,,,,,
"kenapa saya tidak suka sama elit-elit pks yang sekarang ? karena elit-elit yang sekarang adalah yang ngumpet di bawah meja saat elit-elit terdahulu zaman am berdarah2 pertahankan pks dari badai kpk . giliran mereka berkuasa , elit am malah disingkirkan .",2,kenapa saya tidak suka sama pks yang sekarang karena yang sekarang adalah yang ngumpet di bawah meja saat terdahulu zaman am berdarah2 pertahankan pks dari badai kpk giliran mereka berkuasa elit am malah disingkirkan,0.9923861026763916,2,[6.000e-04 9.000e-04 9.986e-01],2,[6.000e-04 5.000e-04 9.989e-01],"{'pks': 'pks', 'meja': 'meja', 'suka': 'suka'}",2,2,0.8184,,,,,,,,,
ini orang suka banget pidato sama . resmikan acara . tidak suka kerja . si wakil nya cuma cengeh-cengehan disamping . benar-benar badut,2,ini orang suka banget pidato sama resmikan acara tidak suka kerja si wakil nya cuma disamping badut,0.9845991134643556,2,[7.00e-04 3.00e-04 9.99e-01],2,[7.000e-04 4.000e-04 9.989e-01],"{'orang': 'orang', 'wakil': 'wakil'}",2,2,0.6685,,,,,,,,,
charger masih benar buat telepon genggam lain . cuma sama xiao mi saya suka tidak cocok . yang saya bawa tiap hari lebih cocok . padahal charger asus . malah charger ori xiaomi nya tidak enak,2,charger masih benar buat telepon genggam lain cuma sama xiao mi saya suka tidak cocok yang saya bawa tiap hari lebih cocok padahal charger asus malah charger ori xiaomi nya tidak enak,1.0,2,[4.300e-03 7.000e-04 9.949e-01],2,[0.0057 0.001  0.9933],"{'cocok': 'cocok', 'enak': 'enak', 'telepon': 'telepon'}",2,2,0.744,,,,,,,,,
"dulu aku sempat pengin ganti handphone juga . pertimbangan ku itu oppo f5 , vivo v7 , sama xiaomi mi a1 . mereka bertiga dari spesifikasi dan harga mirip mirip . tapi terus aku eliminasi xiaomi mi a1 , karena dia slot nya hybrid . aku tidak suka .",2,dulu aku sempat pengin ganti handphone juga pertimbangan mio itu oppo f5 vivo v7 sama xiaomi mi a1 mereka bertiga dari spesifikasi dan harga mirip mirip tapi terus aku eliminasi xiaomi mi a1 karena dia slot nya hybrid aku tidak suka,0.9868407249450684,2,[0.0014 0.0016 0.997 ],2,[0.0015 0.0026 0.9959],"{'suka': 'suka', 'vivo': 'vivo', 'nya': 'nya', 'ku': 'mio'}",2,1,0.7985,,,,,,,,,
"menyesal tidak sih ganti handphone , dari iphone 7 ke samsung s8 ?: hmm , 75 % menyesal . kurang enak buat pakai s8 , dari segi camera lebih suka ip7 , dari segi performa juga ip7 , batre juga tidak beda jauh banget . lalu , s8 ini juga agak sering melar , padahal cuma buka instagram saja . ckck",2,menyesal tidak sih ganti handphone dari iphone 7 ke samsung s8 hmm 75 menyesal kurang enak buat pakai s8 dari segi camera lebih suka ip7 dari segi performa juga ip7 batre juga tidak beda jauh banget lalu s8 ini juga agak sering melar padahal cuma buka instagram saja ckck,1.0,2,[5.000e-03 5.000e-04 9.946e-01],2,[7.000e-03 4.000e-04 9.926e-01],"{'ckck': 'ckck', 'enak': 'enak'}",2,2,0.9132,,,,,,,,,
ada yang pakai samsung a8 tidak ? dan suara nya suka mati-mati begitu kalau tidak pakai headset . misalnya setel musik nanti sura nya kedengaran nya kayak pause2 1 detik begitu padahal masih jalan . agak sering itu aku . sebel deh .,2,ada yang pakai samsung a8 tidak dan suara nya suka begitu kalau tidak pakai headset misalnya setel musik nanti sura nya kedengaran nya kayak pause2 1 detik begitu padahal masih jalan agak sering itu aku sebel ok,0.9900825619697572,2,[1.500e-03 8.000e-04 9.976e-01],2,[7.700e-03 7.000e-04 9.916e-01],"{'kayak': 'kayak', 'nya': 'nya', 'deh': 'ok'}",2,1,0.7916,,,,,,,,,
saya sangat kecewa dengan pihak sales promotion toyota . saya menang hadiah samsung gear sport tetapi di kasih nya gear s2 yang jelas-jelas harga beda jauh . nama nya satria after sales promotion dia bilang sudah bersyukur saja nama nya juga hadiahlah kok begitu .,2,saya sangat kecewa dengan pihak sales promotion toyota saya menang hadiah samsung gear sport tetapi di kasih nya gear s2 yang harga beda jauh nama nya satria after sales promotion dia bilang sudah bersyukur saja nama nya juga hadiahlah kok begitu,0.9975414872169496,2,[1.400e-03 8.000e-04 9.978e-01],2,[1.000e-03 5.000e-04 9.985e-01],"{'nya': 'nya', 'after': 'after', 'nama': 'nama', 'kecewa': 'kecewa'}",2,2,0.6376,,,,,,,,,
id my s8 eror . lagi . hang . atau apapun nama nya . selama 3 jam lebih ? kirain cuma hang biasa selama 1 atau 2 menit but ini adalah crazy . kecewa parah pokok nya .,2,id my s8 errore lagi hang atau apapun nama nya selama 3 jam lebih kirain cuma hang biasa selama 1 atau 2 menit but ini adalah crazy kecewa parah albero nya,0.9810836315155028,2,[9.000e-04 6.000e-04 9.984e-01],2,[7.000e-04 6.000e-04 9.987e-01],"{'kecewa': 'kecewa', 'parah': 'parah', 'pokok': 'albero', 'eror': 'errore'}",2,2,0.5175,,,,,,,,,
"kecewa sama iphone8 , kalah politik dengan samsung .. saat nya hijrah ke samsung iphone 8 iphone x",2,kecewa sama iphone8 kalah politico dengan samsung saat nya hijrah ke samsung iphone 8 iphone x,0.9773628115653992,2,[8.000e-04 6.000e-04 9.986e-01],2,[7.000e-04 4.000e-04 9.989e-01],"{'kecewa': 'kecewa', 'politik': 'politico'}",2,2,0.4233,,,,,,,,,
aku kecewa dengan iphone . aku pakai ip4s ini lama gila .,2,aku kecewa dengan iphone aku pakai ip4s ini lama gila,1.0,2,[6.000e-04 5.000e-04 9.989e-01],2,[6.000e-04 3.000e-04 9.991e-01],{},2,2,0.4136,,,,,,,,,
cukuplah sekali aku pernah kecewa dengan lenovo .,2,cukuplah sekali aku pernah kecewa dengan lenovo,1.0,2,[1.900e-03 6.000e-04 9.975e-01],2,[2.400e-03 3.000e-04 9.972e-01],{'lenovo': 'lenovo'},2,2,0.4373,,,,,,,,,
kemarin banget dengar cerita ini . wajar dong kalau saya kecewa dengan samsung . saya merasa tertipu . saya tidak dapat apa yang dijanjikan di awal .,2,kemarin banget dengar cerita ini wajar dong kalau saya kecewa dengan samsung saya merasa tertipu saya tidak dapat apa yang dijanjikan di awal,1.0000001192092896,2,[1.300e-03 5.000e-04 9.982e-01],2,[8.00e-04 3.00e-04 9.99e-01],{'tertipu': 'tertipu'},2,2,0.4635,,,,,,,,,
aku sudah 2x pakai samsung 2x kecewa . aku menyesal . aku tidak ingin pakai handphone merek itu lagi !,2,aku sudah 2x pakai samsung 2x kecewa aku menyesal aku tidak ingin pakai handphone merek itu lagi,1.0000001192092896,2,[9.000e-04 5.000e-04 9.986e-01],2,[1.200e-03 4.000e-04 9.985e-01],{},2,2,0.4184,,,,,,,,,
samsung galaxy s6 . standar fon samsung ini . bila sampai satu peringkat . dia akan lagi dijuragan sendiri nya . saya pengguna samsung yang kecewa .,2,samsung galaxy s6 standar fon samsung ini bila sampai satu peringkat dia akan lagi dijuragan sendiri nya saya pengguna samsung yang kecewa,1.0,2,[7.00e-04 3.00e-04 9.99e-01],2,[5.000e-04 3.000e-04 9.991e-01],{'dijuragan': 'dijuragan'},2,2,0.478,,,,,,,,,
kecewa dengan specs desain galaxy s5 . tidak sesuai dengan harapan . terlalu biasa saja .,2,kecewa dengan specs desain galaxy s5 tidak sesuai dengan harapan terlalu biasa saja,1.0,2,[1.500e-03 4.000e-04 9.981e-01],2,[1.600e-03 2.000e-04 9.981e-01],{'kecewa': 'kecewa'},2,2,0.4467,,,,,,,,,
"kecewa banget sama id pusat servis pi . kan kita spent waktu untuk ke sini , tidak dikasih solusi . masa harus bolak balik .",2,kecewa banget sama id pusat servis pi kan kita spent waktu untuk ke sini tidak dikasih soluzione masa harus bolak balik,0.9826315641403198,2,[9.000e-04 6.000e-04 9.986e-01],2,[7.000e-04 4.000e-04 9.989e-01],"{'kecewa': 'kecewa', 'solusi': 'soluzione'}",2,2,0.4379,,,,,,,,,
"baru sadar , bahwa selama ini ternyata saya bukan apple penggemar . saya adalah umat stevejob yang kecewa karena apple kalah inovasi oleh samsung .",2,baru sadar bahwa selama ini ternyata saya bukan apple penggemar saya adalah umat stevejob yang kecewa karena apple kalah inovasi oleh samsung,1.0000001192092896,2,[0.0017 0.0014 0.9969],2,[0.0015 0.0011 0.9974],"{'kecewa': 'kecewa', 'apple': 'apple'}",2,1,0.4863,,,,,,,,,
"kecewa aku dengan desain s4 , samsung ketandusan ide ! kenapa bisa perusahaan besar itu keilangan akal . mungkin isi orang-orang nya hanya orang biasa saja .",2,kecewa aku dengan desain s4 samsung ketandusan ide kenapa bisa perusahaan besar itu keilangan akal mungkin isi nya hanya orang biasa saja,0.99185049533844,2,[1.300e-03 4.000e-04 9.983e-01],2,[9.000e-04 3.000e-04 9.989e-01],"{'orang': 'orang', 'kecewa': 'kecewa'}",2,2,0.5203,,,,,,,,,
samsung galaxy s saya sudah diluncurkan semalam . saya kecewa desain nya standar banget . ekspektasi saya cuma terwujud 70 % . percuma terbawa sampai mimpi .,2,samsung galaxy s saya sudah lanciato semalam saya kecewa desain nya standar banget ekspektasi saya cuma terwujud 70 percuma terbawa sampai mimpi,0.994062840938568,2,[1.000e-03 3.000e-04 9.987e-01],2,[1.000e-03 3.000e-04 9.987e-01],"{'kecewa': 'kecewa', 'diluncurkan': 'lanciato', 'ekspektasi': 'ekspektasi'}",2,2,0.5021,,,,,,,,,
hotel mau cek in aja ribet bersihkan kamar lama banget kecewa dah . ini pertama kalinya gue ke sana . terus langsung dikasih first impression yang tidak bagus .,2,hotel mau cek in aja ribet bersihkan kamar lama banget kecewa addio ini pertama kalinya gue ke sana terus langsung dati first impression yang tidak bagus,0.9869359731674194,2,[1.000e-03 3.000e-04 9.987e-01],2,[7.00e-04 3.00e-04 9.99e-01],"{'dah': 'addio', 'bersihkan': 'bersihkan', 'dikasih': 'dati'}",2,2,0.4977,,,,,,,,,
"sebagai indomie goreng mania , saya merasa kecewa kalau mendapati ternyata bumbu jebol di dalam kemasan , kudu bagaimana nek ngene ini ? gaduh . tidak profesional banget .",2,sebagai indomie goreng mania saya merasa kecewa kalau mendapati ternyata bumbu jebol di dalam kemasan kudu bagaimana nek ngene ini gaduh tidak professionale banget,0.9902042150497437,2,[1.100e-03 3.000e-04 9.986e-01],2,[1.900e-03 5.000e-04 9.976e-01],"{'kecewa': 'kecewa', 'profesional': 'professionale'}",2,0,0.5707,,,,,,,,,
"kecewa dengan kualitas barang dari depan kantor , chitato expired masih dijual untung aku masih baik . tadinya ingin lapor .",2,kecewa dengan kualitas barang dari depan kantor chitato expired masih dijual untung aku masih baik tadinya ingin lapor,1.0,2,[1.200e-03 9.000e-04 9.979e-01],2,[0.0018 0.0011 0.9971],{'barang': 'barang'},2,2,0.5121,,,,,,,,,
"kecewa berat . baru tahu pop mie goreng sudah discontinue ya ? why ???!!!! padahal itu enak banget , terbaik .",2,kecewa berat baru tahu pop mie goreng sudah discontinue ya why padahal itu enak banget terbaik,1.0000001192092896,2,[0.0207 0.0014 0.9779],2,[2.890e-02 8.000e-04 9.703e-01],"{'kecewa': 'kecewa', 'why': 'why'}",2,0,0.4142,,,,,,,,,
client kita komplain kami pun sangat kecewa . paling tidak bisa jujur jika tidak bisa tepat waktu untuk antar dari wtc ke indofood tower .,2,client kita komplain kami pun sangat kecewa paling tidak bisa jujur jika tidak bisa tepat waktu untuk antar dari wtc ke indofood tower,1.0,2,[2.20e-03 8.00e-04 9.97e-01],2,[2.000e-03 7.000e-04 9.973e-01],{'kecewa': 'kecewa'},2,2,0.4747,,,,,,,,,
selesai juga bikin surat pengunduran diri . dah ah tinggal tidur saja . besok pagi tinggal pergi ke gudang indofood sangat kecewa .,2,selesai juga bikin surat pengunduran diri dah ah tinggal tidur saja besok pagi tinggal pergi ke gudang indofood sangat kecewa,1.0000001192092896,2,[7.000e-04 4.000e-04 9.989e-01],2,[5.000e-04 3.000e-04 9.992e-01],"{'pengunduran': 'pengunduran', 'indofood': 'indofood'}",2,2,0.4345,,,,,,,,,
indofood tukang bohong -- dapat pulsa dari mi 20.000 tetapi tidak di tanggepin kecewa tidak mau beli produk indofood lagi ah . kecewa . kecewa .,2,indofood tukang bohong dapat pulsa dari mi tetapi tidak di tanggepin kecewa tidak mau beli produk indofood lagi ah kecewa kecewa,0.9729264378547668,2,[7.000e-04 3.000e-04 9.989e-01],2,[9.000e-04 4.000e-04 9.988e-01],"{'tanggepin': 'tanggepin', 'indofood': 'indofood'}",2,2,0.4567,,,,,,,,,
"sumpah aku sedih banget dan kagol , popmie favorit aku sudah tidak ada lagi kecewa indofood aku itu padahal hampir setiap hari makan itu .",2,sumpah aku sedih banget dan kagol popmie favorit aku sudah tidak ada lagi kecewa indofood aku itu padahal hampir setiap hari makan itu,1.0000001192092896,2,[6.700e-03 5.000e-04 9.928e-01],2,[1.210e-02 5.000e-04 9.874e-01],{'kecewa': 'kecewa'},2,2,0.5358,,,,,,,,,
"kecewa sama indofood , kata nya di sini tulisan nya sambal abc ekstra pedas tapi biro biro pedas , manis mah iya ini - . - tidak asik ah",2,kecewa sama indofood kata nya di sini tulisan nya sambal abc ekstra pedas tapi biro biro pedas manis mah iya ini tidak Assorbito ah,0.9726126194000244,2,[2.100e-03 3.000e-04 9.976e-01],2,[1.200e-03 3.000e-04 9.985e-01],"{'kecewa': 'kecewa', 'asik': 'Assorbito', 'pedas': 'pedas'}",2,0,0.5307,,,,,,,,,
dengan ini saya nyatakan kecewa dengan indofood ! masa di indomie soto saya bubuk cabai nya kosong ! hak saya dihilangkan !,2,dengan ini saya nyatakan kecewa dengan indofood masa di indomie soto saya bubuk cabai nya kosong hak saya dihilangkan,1.0,2,[1.100e-03 4.000e-04 9.984e-01],2,[9.000e-04 5.000e-04 9.985e-01],"{'kecewa': 'kecewa', 'indofood': 'indofood'}",2,2,0.4293,,,,,,,,,
"kecewa sama supir taxi masa menara indofood dibilang shangrila hotel , kalau memang tidak tahu ada baiknya tanya !",2,kecewa sama supir taxi masa menara indofood dibilang shangrila hotel kalau memang tidak tahu ada baiknya tanya,1.0000001192092896,2,[8.000e-04 6.000e-04 9.986e-01],2,[9.000e-04 5.000e-04 9.987e-01],{'kecewa': 'kecewa'},2,2,0.449,,,,,,,,,
"gimana ya antara kecewa atau sekadar deh sama r di indofood , karena pas rendang keluar itu heboh mampus enak nya enggak ketolongan . new varian noods din triliun capture dat magic .",2,"gimana ya antara kecewa atau sekadar deh sama r di indofood , karena pas rendang keluar itu heboh mampus enak nya enggak ketolongan . new varian noods din triliun capture dat magic .",1.0,0,[0.8483 0.0032 0.1485],0,[0.8483 0.0032 0.1485],,0,0,0.16,,,,,,,,,
"kecewa sama sales teh kahuripan . tawarkan produk maksa harus beli , sampai ngancem enggak bakal dikasih tiket / kupon mudik .",2,kecewa sama sales teh kahuripan tawarkan produk maksa harus beli sampai ngancem enggak bakal dikasih tiket kupon mudik,1.0,2,[6.000e-04 6.000e-04 9.988e-01],2,[5.000e-04 5.000e-04 9.991e-01],"{'kecewa': 'kecewa', 'ngancem': 'ngancem'}",2,2,0.4666,,,,,,,,,
saya sangat kecewa dengan klaim mobil saya . an . karpito . serena b 1764 toz . mohon penjelasan dari pihak bca karena hak dalam polis saya tidak dipenuh . jangan merugikan orang lain .,2,saya sangat kecewa dengan klaim mobil saya an karpito serena b 1764 toz mohon penjelasan dari pihak bca karena hak dalam polis saya tidak dipenuh jangan merugikan orang lain,1.0,2,[0.0011 0.0013 0.9976],2,[8.000e-04 8.000e-04 9.984e-01],"{'kecewa': 'kecewa', 'dipenuh': 'dipenuh', 'bca': 'bca'}",2,1,0.5271,,,,,,,,,
"kecewa dengan xl , sudah 2 bulan berturut-berturut gagal debet ke kartu kredit bca status kartu normal padahal bulan-bulan sebelumnya lancar . malah suruh datang ke gerai xl , buat apa ada pusat panggilan !",2,kecewa dengan xl sudah 2 bulan gagal debet ke kartu kredit bca status kartu normal padahal sebelumnya lancar malah suruh datang ke gerai xl buat apa ada pusat panggilan,0.9936112761497498,2,[0.0011 0.0016 0.9973],2,[7.000e-04 7.000e-04 9.986e-01],"{'xl': 'xl', 'kecewa': 'kecewa'}",2,1,0.5004,,,,,,,,,
"sampai saat ini benar-benar enjoy deh pakai . tapi tadi kita coba cash kembali 50 % sunday ya nonton bioskop , di xxi epicentrum cuma bisa pkk debit bca saja . tidak bisa pakai kartu lain . penonton kecewa deh . __sad__",2,sampai saat ini enjoy deh pakai tapi tadi kita coba cash kembali 50 sunday ya nonton bioskop di xxi epicentrum cuma bisa pkk debit bca saja tidak bisa pakai kartu lain penonton kecewa deh,0.986530303955078,2,[6.900e-03 7.000e-04 9.924e-01],2,[7.500e-03 8.000e-04 9.917e-01],"{'kecewa': 'kecewa', 'coba': 'coba', 'xxi': 'xxi'}",2,2,0.5605,,,,,,,,,
"sungguh kecewa dengan pelayanan bca , khusus nya baca finance wtc mg 2 . pelayanan ovet kredit yang sungguh mengecewakan . sudah hampir 1 bulan lebih belum ada kabar juga , bahkan saya sudah membayar 2x tagihan cicilan masih belum ada kabar juga . tanya ke marketing juga respon nya tidak ada .",2,sungguh kecewa dengan pelayanan bca khusus nya baca finance wtc mg 2 pelayanan ovet kredit yang sungguh deludente sudah hampir 1 bulan lebih belum ada kabar juga bahkan saya sudah membayar 2x tagihan piatto masih belum ada kabar juga tanya ke marketing juga respon nya tidak ada,0.9949840307235718,2,[8.000e-04 9.000e-04 9.983e-01],2,[7.000e-04 8.000e-04 9.985e-01],"{'mengecewakan': 'deludente', 'wtc': 'wtc', 'cicilan': 'piatto', 'bca': 'bca', 'ovet': 'ovet'}",2,2,0.9837,,,,,,,,,
sedang proses penukaran produk karena awam pertama kali urusan dengan blibli . maka pt bca tbk menyampaikan catatan ini serius . sangat kecewa keberatan karena tidak ada itikad baik .,2,sedang proses penukaran produk karena awam pertama kali urusan dengan blibli maka pt bca tbk menyampaikan catatan ini serius sangat kecewa keberatan karena tidak ada itikad baik,1.0,2,[1.000e-03 4.000e-04 9.985e-01],2,[1.000e-03 7.000e-04 9.983e-01],"{'kecewa': 'kecewa', 'itikad': 'itikad', 'blibli': 'blibli'}",2,2,0.6285,,,,,,,,,
seperti yang sudah saya mention sebelumnya pak romi . data saya diketahui semuanya . oh iya . jikalau tutup akun bagaimana ya ? dan meminta semua data saya yang di bca tidak tersimpan lagi . saya kecewa . ingin tutup akun bca saja biar tidak terjadi seperti ini lagi .,2,seperti yang sudah saya mention sebelumnya pak romi data saya diketahui semuanya oh iya jikalau tutup account bagaimana ya dan meminta semua data saya yang di bca tidak tersimpan lagi saya kecewa ingin tutup account bca saja biar tidak terjadi seperti ini lagi,0.9843995571136476,2,[8.000e-04 6.000e-04 9.986e-01],2,[0.0018 0.0014 0.9967],"{'kecewa': 'kecewa', 'akun': 'account'}",2,1,0.693,,,,,,,,,
"sebagai nasabah bank bca yang sudah lebih dari 10th , saya merasa kecewa . bca tidak dapat memberikan keamanan kepada nasabah nya . bagaimana bisa uang di rekening saya habis . terjadi transaksi berkali-kali di tanggal 19 20 mei kemarin yang bukan dilakukan oleh saya .",2,sebagai nasabah bank bca yang sudah lebih dari 10th saya merasa kecewa bca tidak dapat memberikan keamanan kepada nasabah nya bagaimana bisa uang di rekening saya habis terjadi transaksi di tanggal 19 20 mei kemarin yang bukan dilakukan oleh saya,0.997244358062744,2,[0.0014 0.0011 0.9976],2,[1.600e-03 7.000e-04 9.977e-01],"{'nasabah': 'nasabah', 'bca': 'bca'}",2,1,0.6092,,,,,,,,,
"apl ini sangat membantu sekali dengan memberikan kemudahan dalam pesan tiket to bepergian ke mana pun , sehingga saya tidak harus keluar lagi to mmbli tiket , semoga aplikasi ini selalu lncar ya setiap x melakukan pemesanan .",0,apl ini sangat membantu sekali dengan memberikan kemudahan dalam pesan tiket to bepergian ke mana pun sehingga saya tidak harus keluar lagi to mmbli tiket semoga aplikasi ini selalu ricerca ya setiap x melakukan pemesanan,0.9934742450714112,0,[0.9972 0.0012 0.0016],0,[0.9915 0.0048 0.0037],"{'lncar': 'ricerca', 'bepergian': 'bepergian', 'apl': 'apl'}",0,0,0.5685,,,,,,,,,
"dua kali sudah teman saya bookingkan tiket lewat aplikasi ini bagus-bagus saja . tidak sampai 2 mnit , kode booking nya langsung dikirimkan . mantap .",0,dua kali sudah teman saya bookingkan tiket lewat aplikasi ini saja tidak sampai 2 mnit kode booking nya langsung dikirimkan mantap,0.995966613292694,0,[0.9965 0.0015 0.002 ],0,[0.9925 0.0054 0.0022],"{'dikirimkan': 'dikirimkan', 'bookingkan': 'bookingkan'}",0,1,0.5027,,,,,,,,,
"alhamdulillahirrabil allamin , menggunakan aplikasi ini mudah . paling suka adalah penukaran poin sebagai pembayaran tiket bisa dilakukan dengan mudah , simpel dan terpercaya .",0,alhamdulillahirrabil allamin menggunakan aplikasi ini mudah paling suka adalah penukaran poin sebagai pembayaran tiket bisa dilakukan dengan mudah simpel dan terpercaya,1.0,0,[9.988e-01 6.000e-04 6.000e-04],0,[9.982e-01 9.000e-04 9.000e-04],"{'alhamdulillahirrabil': 'alhamdulillahirrabil', 'suka': 'suka'}",0,1,0.5354,,,,,,,,,
sempat agak takut pesan tiket pesawat di sini karena ulasan yang lain . tapi ingat teman pernah beli di sini lancar saja . akhirnya memesan pas banget di tfansfer cuma hitungan detik e tiket dikirim terima kasih lo . terima kasih promo nya lumayan . jadi lumayan untung .,0,sempat agak takut pesan biglieto pesawat di sini karena ulasan yang lain tapi ingat teman pernah beli di sini lancar saja akhirnya memesan pas molto di tfansfer cuma hitungan detik e biglieto dikirim terima kasih lo terima kasih promo nya lumayan jadi lumayan untung,0.9780735969543456,0,[9.981e-01 7.000e-04 1.200e-03],0,[0.9956 0.0019 0.0025],"{'pesawat': 'pesawat', 'pesan': 'pesan', 'tiket': 'biglieto', 'banget': 'molto'}",0,0,0.6253,,,,,,,,,
aplikasi yang sangat membantu dalam setiap perjalan saya . memuaskan pokok nya . segera coba .,0,aplikasi yang sangat membantu dalam setiap perjalan saya memuaskan pokok nya segera coba,1.0,0,[9.987e-01 6.000e-04 8.000e-04],0,[9.98e-01 8.00e-04 1.30e-03],{'memuaskan': 'memuaskan'},0,1,0.4245,,,,,,,,,
"menyenangkan menggunakan aplikasi ini . selain sangat lengkap , aplikasi ini juga sangat rinci . yang paling menyenangkan adalah banyak promo nya .",0,menyenangkan menggunakan aplikasi ini selain sangat lengkap aplikasi ini juga sangat rinci yang paling menyenangkan adalah banyak promo nya,1.0000001192092896,0,[0.998 0.001 0.001],0,[0.9972 0.0011 0.0017],{'menyenangkan': 'menyenangkan'},0,1,0.4338,,,,,,,,,
dari dulu pas liburan saya selalu memesan hotel pakai tiket.com . untuk gaji yang saat-saat an seperti saya dan bisa dapat hotel bintang 5 cup ! wow banget enggak iniihh . apalagi ada tonight deals kita bisa dapatkan diskon sampai 50 % kalau pesan hotel di atas jam 6 malam . sudah pasti makin nikmat pas liburan ditambah lagi bisa istirahat di hotel bintang 5 yang nyaman dengan harga yang murah . terima kasih tiket.com .,0,dari dulu pas liburan saya selalu ordine hotel pakai untuk stipendi yang un seperti saya dan bisa dapat hotel bintang 5 cup wow banget enggak iniihh apalagi ada tonight deals kita bisa dapatkan diskon sampai 50 kalau pesan hotel di atas jam 6 malam sudah pasti makin nikmat pas liburan ditambah lagi bisa riposo di hotel bintang 5 yang comodo dengan harga yang murah terima kasih,0.985125720500946,0,[9.988e-01 4.000e-04 8.000e-04],0,[0.9941 0.0018 0.0041],"{'gaji': 'stipendi', 'murah': 'murah', 'terima': 'terima', 'nyaman': 'comodo', 'memesan': 'ordine', 'an': 'un', 'istirahat': 'riposo'}",0,0,0.7851,,,,,,,,,
sumpah . suka banget . sudah limit nya lama . bonus tixpoint nya luar binasaah . tiket ke jakarta bisa dapat diskon 150 ribu .,0,sumpah suka molto sudah limit nya lama bonus tixpoint nya luar binasaah tiket ke jakarta bisa dapat diskon 150 ribu,0.98112291097641,0,[9.989e-01 3.000e-04 8.000e-04],0,[9.959e-01 8.000e-04 3.300e-03],"{'suka': 'suka', 'banget': 'molto'}",0,0,0.4713,,,,,,,,,
mantap . paling murah dan banyak bonus nya . apa ini bagus banget proses nya cepat saya kasi bintang 5 . aku makin suka kamu .,0,mantap paling murah dan banyak bonus nya apa ini bagus banget proses nya cepat saya kasi bintang 5 aku makin suka kamu,1.0,0,[9.985e-01 4.000e-04 1.100e-03],0,[9.971e-01 6.000e-04 2.300e-03],"{'cepat': 'cepat', 'murah': 'murah'}",0,0,0.4703,,,,,,,,,
"bisa memilih penerbangan . selain itu , cukup mudah dalam bertransaksi . lengkap aplikasi nya !",0,bisa memilih penerbangan selain itu cukup mudah dalam bertransaksi lengkap aplikasi nya,1.0,0,[9.988e-01 7.000e-04 5.000e-04],0,[0.9961 0.0022 0.0017],{'bertransaksi': 'bertransaksi'},0,1,0.4509,,,,,,,,,
banyak promo dan aplikasi mudah digunakan . proses sangat cepat . dan juga aplikasi nya bagus dan tidak rumit .,0,banyak promo dan aplikasi mudah digunakan proses sangat cepat dan juga aplikasi nya Buono dan tidak rumit,0.9866275191307068,0,[9.989e-01 6.000e-04 6.000e-04],0,[9.982e-01 8.000e-04 1.000e-03],{'bagus': 'Buono'},0,0,0.4531,,,,,,,,,
"saya suka beli tiket di tiket.com . oke banget , sangat membantu , respon nya cepat . yang pasti sangat memudahkan traveling saya .",0,saya suka acquirente tiket di oke banget sangat membantu respon nya cepat yang pasti sangat memudahkan traveling saya,0.9830479621887208,0,[9.979e-01 8.000e-04 1.300e-03],0,[9.974e-01 7.000e-04 1.900e-03],"{'beli': 'acquirente', 'suka': 'suka'}",0,0,0.4489,,,,,,,,,
"tiket.com sangat terpercaya . harga murah . lancar , praktis , efektif , dan efisien .",0,sangat terpercaya harga murah lancar praktis efektif dan efisien,0.9725608825683594,0,[9.985e-01 6.000e-04 9.000e-04],0,[9.977e-01 9.000e-04 1.400e-03],{'murah': 'murah'},0,0,0.4516,,,,,,,,,
