text,sentiment,perturbed_text,perturbed_semantic_sim,pred_label,pred_proba,perturbed_label,perturbed_proba,translated_word(s),adv_pred,adv_pred_on_orig,running_time(s),before_attack_acc,after_attack_acc,avg_semantic_sim,avg_running_time(s),adv_training,delta_acc,delta_adv,acc_adv_training_on_orig,best_epoch
haha . yang baru-baru sih sudah tidak begitu terlihat absurd nya . yang rog baru malah logo mata doang keren jadi nya . lenovo legion yang baru malah lebih-lebih lagi elegan nya . kalau saya pribadi sih suka .,0,haha yang sih sudah tidak begitu terlihat absurd nya yang rog baru malah logo mata doang keren jadi nya lenovo legion yang baru malah lagi elegan nya kalau saya pribadi sih suka,0.995356261730194,0,[9.969e-01 7.000e-04 2.500e-03],0,[9.95e-01 9.00e-04 4.10e-03],"{'absurd': 'absurd', 'suka': 'suka', 'nya': 'nya'}",0,0,0.7571,,,,,,,,,
"buat gue kece banget lenovo itu . saking kece nya , layar laptop lenovo yoga 920 bisa ditekuk 360 derajat ! keren banget . memang benar sih , kadang different adalah lebih baik .",0,buat gue kece molto lenovo itu saking kece nya layar laptop lenovo yoga 920 bisa ditekuk 360 derajat freddo molto memang benar sih kadang different adalah lebih baik,0.94456285238266,0,[0.9969 0.0013 0.0018],0,[9.972e-01 8.000e-04 2.000e-03],"{'keren': 'freddo', 'lenovo': 'lenovo', 'banget': 'molto', 'nya': 'nya'}",0,1,0.7367,,,,,,,,,
"ultra milk ini luv banget ya . sekali nya ngeluarin flavor baru , dua-dua nya favorit ku . tapi ku lebih sayang sama yang karamel sih .",0,ultra milk ini luv molto S sekali nya ngeluarin flavor baru nya favorit ku tapi ku lebih sayang sama yang karamel sih,0.973336696624756,0,[9.986e-01 8.000e-04 6.000e-04],0,[0.9967 0.0012 0.002 ],"{'banget': 'molto', 'favorit': 'favorit', 'ya': 'S'}",0,1,0.6861,,,,,,,,,
big cola itu enak banget . aku suka . dia tidak jauh beda enak nya dengan minuman cola lain . ditambah dia itu harga nya lebih murah . luv banget buat orang yang suka cola kayak aku .,0,big cola itu enak molto aku suka dia tidak jauh beda enak nya dengan minuman cola lain ditambah dia itu prezzo nya lebih murah amore molto buat orang yang suka cola kayak aku,0.967125415802002,0,[9.992e-01 3.000e-04 5.000e-04],0,[9.988e-01 4.000e-04 8.000e-04],"{'luv': 'amore', 'banget': 'molto', 'harga': 'prezzo', 'ditambah': 'ditambah'}",0,0,0.7361,,,,,,,,,
"dulu saya haus , setelah ke indomaret dan membeli big cola haus saya hilang , gila rasanya enak banget . sejak saat itu jadi keterusan suka minumkan big cola .",0,dulu saya assetato setelah ke indomaret dan membeli big cola assetato saya hilang gila rasanya enak molto sejak saat itu jadi keterusan suka minumkan big cola,0.9216327667236328,0,[9.983e-01 6.000e-04 1.100e-03],0,[0.9909 0.0055 0.0036],"{'haus': 'assetato', 'banget': 'molto', 'enak': 'enak'}",0,0,0.7158,,,,,,,,,
"bca keren banget sih pelayanan nya . selain itu , dia mikirin karyawan nya banget . setiap hari saja karyawan nya dapat cemilan popcorn . salut sama pemimpinan nya . bukan cuma mikirin kenyamanan pelanggan , tapi juga karyawan .",0,bca keren molto sih pelayanan nya selain itu dia mikirin sospeso nya molto setiap hari saja sospeso nya dapat cemilan popcorn salut sama pemimpinan nya bukan cuma mikirin kenyamanan pelanggan tapi juga sospeso,0.9622555375099182,0,[9.986e-01 4.000e-04 1.000e-03],0,[0.9939 0.0012 0.0049],"{'pelayanan': 'pelayanan', 'karyawan': 'sospeso', 'banget': 'molto', 'nya': 'nya'}",0,0,0.8858,,,,,,,,,
sumpah big cola jauh banget lebih enak daripada coca cola ! tidak terlalu manis dan tidak menyisakan pait di mulut seperti coke zero . wkwk norak ya gue baru mencoba . tapi asli enak banget .,0,sumpah big cola jauh banget lebih enak daripada coca cola tidak terlalu dolce dan tidak menyisakan pait di mulut seperti coke zero wkwk norak ya gue baru Tentativo tapi asli enak banget,0.9843331575393676,0,[9.979e-01 3.000e-04 1.800e-03],0,[9.588e-01 9.000e-04 4.030e-02],"{'enak': 'enak', 'mencoba': 'Tentativo', 'asli': 'asli', 'manis': 'dolce'}",0,0,0.8099,,,,,,,,,
aku sayang banget sama susu ultramilk . rasanya tiap ke indomaret tidak pernah tidak beli susu itu . enak . ketagihan .,0,aku sayang banget sama susu ultramilk rasanya tiap ke indomaret tidak pernah tidak beli susu itu enak ketagihan,1.0000001192092896,0,[9.988e-01 5.000e-04 7.000e-04],0,[9.988e-01 5.000e-04 7.000e-04],{'ultramilk': 'ultramilk'},0,1,0.6921,,,,,,,,,
oppo f7 menurut gue mantap banget sih . mulai dari kamera depan nya yang bersih . terus layar nya penuh display pakai gorilla glass 5 . lalu kamera belakang nya naik tingkat banget dari yang sebelumnya . tidak menyesal gue beli ini hp .,0,oppo f7 menurut gue mantap molto sih mulai dari telecamera depan nya yang Pulire terus layar nya penuh display pakai gorilla glass 5 lalu telecamera belakang nya naik tingkat molto dari yang sebelumnya tidak rimpiangere gue beli ini hp,0.962157905101776,0,[9.988e-01 4.000e-04 9.000e-04],0,[0.9951 0.0011 0.0038],"{'menyesal': 'rimpiangere', 'tingkat': 'tingkat', 'bersih': 'Pulire', 'kamera': 'telecamera', 'banget': 'molto'}",0,0,0.8591,,,,,,,,,
sarapan nya enak dan pilihan nya lumayan banyak . kamar baik . ac - nya juga dingin . hotel aston gue rekomendasikan sih buat kalian-kalian yang mau menginap di hotel .,0,sarapan nya enak dan pilihan nya lumayan banyak telecamera baik ac nya juga dingin hotel aston gue rekomendasikan sih buat yang mau menginap di hotel,0.9903085231781006,0,[9.991e-01 4.000e-04 5.000e-04],0,[9.987e-01 6.000e-04 7.000e-04],"{'menginap': 'menginap', 'kamar': 'telecamera', 'nya': 'nya'}",0,0,0.8253,,,,,,,,,
"ini , ya , menurut gue tentang hotel aston itu , pertama staf hotel tanggap , cepat dan ramah . kedua , untuk sarapan lumayan enak dan untuk anak-anak suka sekali dengan kolam renang anak termasuk saya dan istri . ketiga yang pasti bersih .",0,ini ya menurut gue tentang hotel aston itu pertama staf hotel tanggap cepat dan ramah kedua untuk sarapan lumayan enak dan untuk suka sekali dengan kolam renang bambino termasuk saya dan istri ketiga yang pasti bersih,0.9924549460411072,0,[9.982e-01 8.000e-04 1.000e-03],0,[0.9977 0.001  0.0012],"{'suka': 'suka', 'staf': 'staf', 'anak': 'bambino'}",0,0,0.856,,,,,,,,,
kolam renang di hotel aston bikin tidak mau berenti berenang . nyaman banget . air nya bersih . tempat bilas nya nyaman .,0,kolam renang di hotel aston bikin tidak mau berenti berenang comodo molto air nya bersih tempat bilas nya comodo,0.8489066362380981,0,[9.987e-01 5.000e-04 8.000e-04],0,[9.987e-01 6.000e-04 7.000e-04],"{'berenti': 'berenti', 'banget': 'molto', 'nyaman': 'comodo'}",0,0,0.7053,,,,,,,,,
wah keren ya persiapan bni . saya juga mendukung . semoga bisa berjalan lancar .,0,wah keren ya persiapan bni saya juga mendukung semoga bisa berjalan lancar,1.0000001192092896,0,[0.9902 0.0078 0.0019],0,[0.9899 0.0061 0.004 ],{'mendukung': 'mendukung'},0,1,0.762,,,,,,,,,
lebih enak lagi kalau nasi padang oreo momogi chocolatos . terus semua itu di campur di aduk pakai tangan ? baru dimakan . enak banget .,0,lebih enak lagi kalau nasi campo oreo momogi chocolatos terus semua itu di mescolare di aduk pakai tangan baru dimakan enak banget,0.974856972694397,0,[9.992e-01 4.000e-04 5.000e-04],0,[9.98e-01 9.00e-04 1.20e-03],"{'padang': 'campo', 'campur': 'mescolare'}",0,1,0.7739,,,,,,,,,
sudah lama tidak minum ultra milk rasa stroberi . pas sekarang minum merasa enak sekali tidak tahu kenapa . ketagihan . rasanya ingin beli sekardus gede buat diminum sendiri .,0,sudah lama tidak minum ultra milk rasa stroberi pas sekarang minum merasa enak sekali tidak tahu kenapa ketagihan rasanya ingin beli sekardus gede buat diminum sendiri,1.0,0,[0.9972 0.001  0.0019],0,[0.994  0.0018 0.0042],"{'ketagihan': 'ketagihan', 'enak': 'enak'}",0,1,0.7299,,,,,,,,,
"go jek makin sini makin keren deh . semoga makin baik ya dalam pelayanan dan aplikasi nya ya go car , go jek , dan go go lainnya . chiiiiirrs .",0,go jek makin sini makin keren deh semoga makin baik ya dalam pelayanan dan aplikasi nya ya go car go jek dan go go lainnya chiiiiirrs,1.0000001192092896,0,[9.98e-01 6.00e-04 1.40e-03],0,[9.959e-01 8.000e-04 3.400e-03],"{'car': 'car', 'nya': 'nya', 'pelayanan': 'pelayanan'}",0,1,0.7282,,,,,,,,,
"go jek . kalian harus tetap ada , karena kami bukan sekadar butuh angkutan . kami juga butuh pelayanan yang prima seperti biasanya . saya sangat mendukung kalian .",0,go jek kalian harus tetap ada karena kami bukan sekadar butuh angkutan kami juga butuh pelayanan yang prima seperti biasanya saya sangat mendukung kalian,1.0,0,[0.9944 0.0021 0.0035],0,[9.952e-01 8.000e-04 4.000e-03],{'mendukung': 'mendukung'},0,1,0.8011,,,,,,,,,
saya senang di bali bagus pelayanan go-jek - nya . sangat terbantu dengan keberadaan nya . memang harus ada terus supaya pelayanan nya semakin memuaskan .,0,saya senang di bali Buono pelayanan nya sangat terbantu dengan keberadaan nya memang harus ada terus supaya pelayanan nya semakin memuaskan,0.9808974266052246,0,[9.989e-01 4.000e-04 6.000e-04],0,[9.983e-01 4.000e-04 1.200e-03],"{'bagus': 'Buono', 'nya': 'nya'}",0,0,0.7205,,,,,,,,,
kalau driver go jek tidak pelayanan prima meminta bungkus acar untuk mengambil saos tambahan hilang nafsu makan saya . bravo driver go jek .,0,kalau driver go jek tidak pelayanan prima meminta bungkus acar untuk mengambil saos tambahan hilang nafsu makan saya . bravo driver go jek .,1.0,2,[0.4934 0.004  0.5026],2,[0.4934 0.004  0.5026],,0,0,0.28,,,,,,,,,
banyak alasan saya bisa merasa puas dengan pelayanan go jek . go jek tidak pernah lepas dari tanggung jawab . itu adalah nilai plus yang belum tentu dimiliki oleh perusahaan yang lain .,0,banyak alasan saya bisa merasa puas dengan pelayanan go jek go jek tidak pernah lepas dari tanggung jawab itu adalah nilai plus yang belum tentu dimiliki oleh perusahaan yang lain,1.0000001192092896,0,[0.9972 0.0012 0.0015],0,[9.98e-01 7.00e-04 1.30e-03],"{'dimiliki': 'dimiliki', 'pelayanan': 'pelayanan'}",0,0,0.9049,,,,,,,,,
go jek selalu jadi inspirasi untuk perusahaan-perusahaan di indonesia . pelayanan nya bravo . selalu berkembang setiap waktu dan memberi kemudahan bagi pelanggan .,0,go jek selalu jadi inspirasi untuk di indonesia pelayanan nya Bravo selalu berkembang setiap waktu dan memberi kemudahan bagi pelanggan,0.9916524291038512,0,[9.989e-01 4.000e-04 6.000e-04],0,[9.982e-01 7.000e-04 1.100e-03],"{'inspirasi': 'inspirasi', 'bravo': 'Bravo'}",0,0,0.7564,,,,,,,,,
suka sama hotel ibis . dia selalu bikin inovasi buat menjaga kenyamanan pelanggan . selalu konsisten juga memberi pelayanan yang terbaik untuk tamu .,0,suka sama hotel ibis dia selalu bikin inovasi buat menjaga kenyamanan pelanggan selalu konsisten juga memberi pelayanan yang terbaik untuk tamu,1.0000001192092896,0,[9.989e-01 4.000e-04 7.000e-04],0,[9.985e-01 5.000e-04 1.000e-03],"{'suka': 'suka', 'menjaga': 'menjaga'}",0,0,0.7597,,,,,,,,,
"kepada yang terhormat ibu dari ayi djembarsari . selamat menunaikan tugas , bu , sebagai dirut rshs . semoga pelayanan rshs semakin baik . saya bangga kepada ibu .",0,kepada yang terhormat ibu dari ayi djembarsari selamat menunaikan tugas bu sebagai dirut rshs semoga pelayanan rshs semakin baik saya orgoglioso kepada ibu,0.9917514324188232,0,[0.9755 0.0193 0.0052],0,[0.9845 0.012  0.0034],"{'bangga': 'orgoglioso', 'djembarsari': 'djembarsari'}",0,1,0.7646,,,,,,,,,
terima kasih atas saran yang kamu berikan kak . kami akan selalu berusaha untuk meningkatkan pelayanan kami untuk pengalaman belanja yang lebih menyenangkan ya .,0,terima kasih atas saran yang kamu berikan kak kami akan selalu berusaha untuk meningkatkan pelayanan kami untuk Esperienza belanja yang lebih menyenangkan ya,0.9891754388809204,0,[0.7586 0.2307 0.0108],0,[0.8691 0.1174 0.0135],"{'pengalaman': 'Esperienza', 'berusaha': 'berusaha'}",0,1,0.6848,,,,,,,,,
"hai kak , terima kasih atas masukan kamu ya . saran kamu sangat berharga bagi kami . kami akan berupaya meningkatkan performa aplikasi dan pelayanan kami untuk pengalaman jual - beli yang selalu menyenangkan untuk kamu dan semua sobat shopee ya kak :",0,hai kak terima kasih atas masukan kamu ya saran kamu sangat berharga bagi kami kami akan berupaya meningkatkan performa aplikasi dan pelayanan kami untuk pengalaman jual beli yang selalu menyenangkan untuk kamu dan semua sobat shopee ya kak,1.0,0,[0.9095 0.0834 0.0071],0,[0.9417 0.0498 0.0085],"{'menyenangkan': 'menyenangkan', 'shopee': 'shopee', 'sobat': 'sobat', 'jual': 'jual'}",0,1,0.8745,,,,,,,,,
"keleveru terbaik memang , dari kualitas , kuantitas , pelayanan pun terbaik . tidak salah pilih aku .",0,keleveru terbaik memang dari kualitas kuantitas pelayanan pun terbaik tidak salah scegliere aku,0.981946587562561,0,[9.983e-01 5.000e-04 1.200e-03],0,[0.9927 0.0015 0.0058],{'pilih': 'scegliere'},0,0,0.6915,,,,,,,,,
cocok banget gue pakai shope . sudah mana ongkos kirim gratis . pengiriman juga aman dan lancar .,0,cocok molto io pakai shope sudah mana ongkos kirim gratis pengiriman juga aman dan lancar,0.9098786115646362,0,[9.98e-01 8.00e-04 1.20e-03],0,[0.9967 0.001  0.0022],"{'banget': 'molto', 'gue': 'io'}",0,0,0.682,,,,,,,,,
"alhamdulillah selama beli di lazada tidak pernah bermasalah . barang-barang nya lebih lucu-lucu . pelayanan juga lebih baik dari yang lain . sudah deh kalau beli apa-apa , aku mau beli di lazada saja .",0,alhamdulillah selama acquirente di lazada tidak pernah bermasalah nya lebih pelayanan juga lebih baik dari yang lain sudah deh kalau acquirente aku mau acquirente di lazada saja,0.9410638213157654,0,[0.9959 0.001  0.0031],0,[0.9929 0.0011 0.006 ],{'beli': 'acquirente'},0,0,0.8101,,,,,,,,,
"karena shopee bukan barang shope , dia itu tempat belanjaan aku yang paling luar biasa ! pelayanan nya oke punya , disko nya banjir !",0,karena shopee bukan barang shope dia itu tempat belanjaan aku yang paling luar biasa pelayanan nya oke punya disko nya banjir,1.0000001192092896,0,[9.987e-01 4.000e-04 9.000e-04],0,[9.969e-01 8.000e-04 2.200e-03],"{'pelayanan': 'pelayanan', 'belanjaan': 'belanjaan'}",0,0,0.743,,,,,,,,,
"harus belanja di shopee karena shopee itu memberikan bukti pelayanan yang baik , bukan sekadar janji doang , seperti mantan itu",0,"harus belanja di shopee karena shopee itu memberikan bukti pelayanan yang baik , bukan sekadar janji doang , seperti mantan itu",1.0,2,[0.2341 0.0133 0.7525],2,[0.2341 0.0133 0.7525],,1,1,0.22,,,,,,,,,
harus belanja di shopee karena pelayanan dari shope itu benar benar memuaskan pelanggan dan takkan mengecewakan .,0,harus belanja di shopee karena pelayanan dari shope itu benar benar memuaskan pelanggan dan takkan deludente,0.9872483015060424,0,[9.986e-01 5.000e-04 8.000e-04],0,[9.96e-01 9.00e-04 3.00e-03],{'mengecewakan': 'deludente'},0,0,0.6686,,,,,,,,,
karena hanya shope yang pelayanan nya memuaskan . diskon besar-besaran . barang nya juga pasti nya bermerek . mantap .,0,karena hanya shope yang pelayanan nya memuaskan diskon barang nya juga pasti nya bermerek mantap,0.9920081496238708,0,[9.987e-01 5.000e-04 8.000e-04],0,[9.984e-01 5.000e-04 1.100e-03],"{'bermerek': 'bermerek', 'mantap': 'mantap'}",0,0,0.7042,,,,,,,,,
shopee tidak pernah mengecewakan pelanggan selalu memberikan yang terbaik dalam pelayanan . pokok nya shopee selalu memberikan pelayanan dengan baik .,0,shopee tidak pernah deludente pelanggan selalu memberikan yang terbaik dalam pelayanan pokok nya shopee selalu memberikan pelayanan dengan baik,0.9853304624557496,0,[9.988e-01 5.000e-04 7.000e-04],0,[9.974e-01 7.000e-04 1.900e-03],{'mengecewakan': 'deludente'},0,0,0.7294,,,,,,,,,
"shopee itu pusat pembelanjaan online terpercaya dengan pelayanan yang memuaskan . yang paling menarik adalah pemberian diskon yang besar-besaran . aku suka , aku suka .",0,shopee itu pusat pembelanjaan online terpercaya dengan pelayanan yang memuaskan yang paling menarik adalah pemberian diskon yang aku suka aku suka,0.996188223361969,0,[9.985e-01 7.000e-04 9.000e-04],0,[9.983e-01 7.000e-04 1.000e-03],"{'pemberian': 'pemberian', 'memuaskan': 'memuaskan'}",0,0,0.7353,,,,,,,,,
kalau ada permasalahan di toko pedia bisa langsung terselesaikan dengan mudah dan cepat . pelayanan nya juga jelas . pusat panggilan yang harus dihubungi juga selalu aktif . memuaskan !,0,kalau ada permasalahan di toko pedia bisa langsung terselesaikan dengan mudah dan cepat pelayanan nya juga jelas pusat panggilan yang harus dihubungi juga selalu aktif memuaskan,1.0,0,[0.9971 0.0014 0.0015],0,[0.9969 0.0017 0.0015],"{'mudah': 'mudah', 'nya': 'nya'}",0,1,0.7474,,,,,,,,,
marketplace pilihan gue ya tokopedia - lah . toko pedia itu selalu berusaha memberi pelayanan terbaik buat semua pengguna nya . kalau ada keluhan juga pasti langsung ditanggapi . salut .,0,marketplace pilihan gue S tokopedia lah trattativa pedia itu selalu berusaha memberi pelayanan terbaik buat semua pengguna nya kalau ada keluhan juga pasti langsung ditanggapi salut,0.9840271472930908,0,[9.979e-01 8.000e-04 1.300e-03],0,[9.973e-01 9.000e-04 1.800e-03],"{'ya': 'S', 'toko': 'trattativa', 'pedia': 'pedia'}",0,0,0.7975,,,,,,,,,
"senang sekali gue dengan pelayanan komplain di , di saat penjual tidak menggubris , tokopedia memberikan solusi dengan cepat , pasti nya dengan investigasi yang tidak berlarut-larut . ya walau harus berakhir dengan pengembalian dana dana . jadi gue tidak pernah bosan buat belanja di tokopedia .",0,senang sekali gue dengan pelayanan komplain di di saat penjual tidak menggubris tokopedia memberikan solusi dengan cepat pasti nya dengan investigasi yang tidak ya walau harus berakhir dengan pengembalian dana dana jadi gue tidak pernah bosan buat belanja di tokopedia,0.9974886178970336,0,[9.979e-01 8.000e-04 1.300e-03],0,[9.98e-01 6.00e-04 1.40e-03],"{'bosan': 'bosan', 'belanja': 'belanja', 'nya': 'nya'}",0,0,0.8243,,,,,,,,,
terima kasih atas tanggapan dari 2 keluhan yang saya alami mengenai hilang nya kuota data saya . terima kasih xl karena sudah betul-betul menanggapi dan memberikan solusi yang sangat memuaskan atas keluhan-keluhan saya . saya jadi merasa sangat terbantu,0,terima kasih atas tanggapan dari 2 keluhan yang saya alami mengenai hilang nya kuota data saya terima kasih xl karena sudah menanggapi dan memberikan solusi yang sangat memuaskan atas saya saya jadi merasa sangat terbantu,0.995026171207428,0,[0.983  0.0104 0.0066],0,[0.9854 0.0087 0.0059],"{'menanggapi': 'menanggapi', 'xl': 'xl', 'memuaskan': 'memuaskan'}",0,1,0.7833,,,,,,,,,
"kemarin itu pertama kalinya mencoba fatmilo yang white milo . demi apa pun itu enak banget sih ampun aku itu tidak bisa berkata-berkata lagi ! enak banget , selera gue bangetlah !",0,kemarin itu pertama kalinya Tentativo fatmilo yang white milo demi apa pun itu enak molto sih ampun aku itu tidak bisa lagi enak molto selera gue bangetlah,0.9729534983634948,0,[9.976e-01 5.000e-04 1.800e-03],0,[9.95e-01 7.00e-04 4.40e-03],"{'bangetlah': 'bangetlah', 'mencoba': 'Tentativo', 'banget': 'molto'}",0,0,0.7297,,,,,,,,,
"satu hal yang gue suka banget dari masjid agung sunda kelapa adalah surga jajanan kaki lima di luar masjid . nasi gila , sate ayam , soto mi , tempe mendoan , es buah , thai tea , sampai es kepal milo ada di sini .",0,satu hal yang io suka molto dari moschea agung sunda kelapa adalah surga jajanan kaki lima di luar moschea nasi gila sate ayam soto mi tempe mendoan es buah thai tea sampai es kepal milo ada di sini,0.9497635960578918,0,[9.981e-01 1.200e-03 7.000e-04],0,[0.9966 0.0021 0.0013],"{'kelapa': 'kelapa', 'banget': 'molto', 'masjid': 'moschea', 'suka': 'suka', 'gue': 'io'}",0,1,0.8305,,,,,,,,,
"ada yang suka makanin milo bubuk langsung dari saset nya tidak ? iya , sama . memang enak banget gimana gitu sih rasanya . gue bisa setelah lima bungkus sendiri .",0,ada yang suka makanin milo bubuk langsung dari saset nya tidak iya sama memang enak molto gimana gitu sih rasanya gue bisa setelah lima bungkus sendiri,0.992708384990692,0,[9.99e-01 5.00e-04 5.00e-04],0,[0.986 0.003 0.011],"{'banget': 'molto', 'enak': 'enak', 'bungkus': 'bungkus'}",0,1,0.7126,,,,,,,,,
terima kasih kembali . oh iya garuda dan traveloka cepat respons . mantap dan keren .,0,terima kasih kembali oh iya garuda dan traveloka cepat respons mantap dan keren,1.0000001192092896,0,[0.998  0.0011 0.001 ],0,[0.9967 0.0016 0.0017],"{'cepat': 'cepat', 'oh': 'oh'}",0,1,0.7392,,,,,,,,,
"mantap banget ikut kontribusi di google local guides . kemarin dapat voucher diskon traveloka , terus ini dapat tokocash tokopedia lagi . aku senang .",0,mantap banget ikut kontribusi di google local guides kemarin dapat voucher diskon traveloka terus ini dapat Tokocash tokopedia lagi aku senang,1.0,0,[0.9963 0.0016 0.0021],0,[0.9961 0.0014 0.0025],"{'mantap': 'mantap', 'tokocash': 'Tokocash'}",0,1,0.7364,,,,,,,,,
"wuih , ada yang baru di aplikasi nih . sekarang bisa pesan tiket bus ? mantap !",0,wuih ada yang baru di applicazione nih sekarang bisa pesan tiket bus mantap,0.9822698831558228,0,[0.9769 0.0121 0.0111],0,[0.9719 0.0212 0.0069],{'aplikasi': 'applicazione'},1,1,0.7405,,,,,,,,,
"barusan memesan pesawat via traveloka , seperti biasanya . kadang pakai , kadang booking.com , kadang agoda . mana yang paling asyik aja . hidup jadi lebih mudah . mantap traveloka .",0,barusan memesan pesawat via traveloka seperti biasanya kadang pakai kadang kadang agoda mana yang paling asyik aja vita jadi lebih mudah mantap traveloka,0.9477086067199708,0,[9.985e-01 6.000e-04 9.000e-04],0,[0.9944 0.0017 0.0039],"{'mantap': 'mantap', 'hidup': 'vita', 'traveloka': 'traveloka'}",0,1,0.742,,,,,,,,,
"terima kasih , pelayanan mantap nih . pengembalian dana cair kurang dari 12 jam ! rekomendasi banget traveloka !",0,terima kasih pelayanan mantap nih pengembalian dana cair kurang dari 12 jam rekomendasi banget traveloka,1.0,0,[0.9974 0.0013 0.0014],0,[0.9967 0.0014 0.0019],"{'traveloka': 'traveloka', 'rekomendasi': 'rekomendasi'}",0,0,0.6852,,,,,,,,,
mantap . terima kasih atas proses pengembalian dana yang cepat . waktu maksimal 90 hari tapi baru satu hari sudah ditransfer . 2 thumbsup,0,mantap terima kasih atas proses pengembalian dana yang cepat waktu maksimal 90 hari tapi baru satu hari sudah ditransfer 2 thumbsup,1.0000001192092896,0,[0.9926 0.0029 0.0045],0,[0.9935 0.0022 0.0043],"{'thumbsup': 'thumbsup', 'mantap': 'mantap'}",0,1,0.7384,,,,,,,,,
"saya tambah setia ini sama traveloka , sekarang pilihan maskapai nya makin banyak . payment nya mudah . selaint itu , harga nya murah dari yang lain . mantap",0,saya tambah setia ini sama traveloka sekarang pilihan maskapai nya makin banyak payment nya mudah selaint itu harga nya murah dari yang lain mantap,1.0000001192092896,0,[9.991e-01 3.000e-04 5.000e-04],0,[9.987e-01 4.000e-04 9.000e-04],"{'nya': 'nya', 'murah': 'murah'}",0,0,0.7008,,,,,,,,,
"makin mantap sekarang , sudah ada menu pesan hotel lengkap dengan rating - nya . semoga makin sering ada promo ya . pasti saya pantengin terus",0,makin mantap sekarang sudah ada menu pesan hotel lengkap dengan rating nya semoga makin sering ada promo ya pasti saya pantengin terus,1.0000001192092896,0,[0.9969 0.0013 0.0018],0,[0.9917 0.0024 0.0059],"{'promo': 'promo', 'mantap': 'mantap'}",0,1,0.7333,,,,,,,,,
e - tiket sudah saya terima . mantap ! reservasi cepat harga murah ! nomor 1 tiketing online indonesia .,0,e biglieto sudah saya terima mantap reservasi cepat harga murah nomor 1 tiketing online indonesia,0.9771555066108704,0,[9.983e-01 1.100e-03 6.000e-04],0,[0.9962 0.0023 0.0015],"{'mantap': 'mantap', 'tiket': 'biglieto'}",0,0,0.7629,,,,,,,,,
"hari ini iseng mencoba versi beta nya , mantap search engine nya . tidak pusing lagi kalau mau cari tiket murah dan waktu penerbangan : memudahkan aku .",0,hari ini iseng mencoba versi beta nya mantap search engine nya tidak pusing lagi kalau mau cari tiket murah dan waktu penerbangan memudahkan aku,1.0,0,[0.9972 0.0013 0.0015],0,[0.9966 0.0016 0.0018],"{'mantap': 'mantap', 'memudahkan': 'memudahkan', 'murah': 'murah'}",0,0,0.8277,,,,,,,,,
"keren air asia . setelah malaysia , indonesia , thailand , filipina , jepang dan india , bakal ada air asia vietnam dan air asia china .",0,keren air asia setelah malaysia indonesia thailand filipina jepang dan india bakal ada air asia vietnam dan air asia china,1.0,0,[0.9413 0.0321 0.0267],1,[0.2943 0.5272 0.1785],{'jepang': 'jepang'},0,1,0.7661,,,,,,,,,
air asia ini keren banget . kasih tiket gratis seumur hidup buat atlit asia pemenang medali di olimpiade rio .,0,air asia ini freddo molto kasih tiket gratis seumur hidup buat atlit asia pemenang medali di olimpiade rio,0.9477708339691162,0,[0.993  0.0032 0.0038],1,[0.0482 0.9377 0.0142],"{'banget': 'molto', 'keren': 'freddo', 'air': 'air'}",0,1,0.7601,,,,,,,,,
top deh hari ini lion air cengkareng balikpapan on time sekali . mantap harus nya sepeti ini terus . sangat memuaskan .,0,top deh hari ini Leone air cengkareng balikpapan on time sekali mantap harus nya sepeti ini terus sangat memuaskan,0.940230906009674,0,[9.989e-01 4.000e-04 8.000e-04],0,[9.982e-01 5.000e-04 1.300e-03],"{'cengkareng': 'cengkareng', 'lion': 'Leone'}",0,0,0.7173,,,,,,,,,
"bu memang mantap . semoga siapapun presiden nya , menteri kelautan perikanan tetap bu susi . amin .",0,bu memang mantap semoga siapapun presiden nya menteri kelautan perikanan tetap bu susi amin,1.0000001192092896,0,[0.9956 0.0017 0.0027],0,[0.9933 0.002  0.0046],"{'mantap': 'mantap', 'perikanan': 'perikanan'}",0,1,0.6454,,,,,,,,,
"mantap bu saya juga akan ikut ke pantai bu . biar laut kita bersih , kalau kotor nanti malah ditenggelamkan dengan bu susi . hehehe .",0,mantap bu saya juga akan ikut ke pantai bu biar laut kita bersih kalau kotor nanti malah ditenggelamkan dengan bu susi hehehe,1.0,0,[0.8137 0.0124 0.1739],2,[0.2289 0.0028 0.7683],{'ditenggelamkan': 'ditenggelamkan'},0,1,0.6825,,,,,,,,,
