text,sentiment,perturbed_text,perturbed_semantic_sim,pred_label,pred_proba,perturbed_label,perturbed_proba,translated_word(s),adv_pred,adv_pred_on_orig,running_time(s),before_attack_acc,after_attack_acc,avg_semantic_sim,avg_running_time(s),adv_training,delta_acc,delta_adv,acc_adv_training_on_orig,best_epoch
"di usia 57 tahun , saat nya gerakan pramuka di tanah air menjawab tantangan zaman baru . anggota pramuka harus dididik bukan hanya bahasa morse , tetapi juga pengetahuan digital seperti coding , artificial intelligence , advance robotic , dan internet of things .",1,di usia 57 tahun saat nya mozione pramuka di tanah air menjawab tantangan zaman baru membro pramuka harus dididik bukan hanya linguaggio morse tetapi juga pengetahuan digital seperti coding artificial intelligence advance robotic dan internet of things,0.9772151708602904,1,[0.0064 0.9884 0.0052],1,[0.0042 0.9879 0.0079],"{'anggota': 'membro', 'gerakan': 'mozione', 'pengetahuan': 'pengetahuan', 'bahasa': 'linguaggio'}",1,1,0.8611,,,,,,,,,
"dalam paparan nya , menkeu smi menekankan penting nya menjaga integritas taxmin sebagai penyalur utama informasi perpajakan agar menyampaikan informasi yang baik dan benar kepada masyarakat melalui media sosial yang dimiliki nya .",1,dalam paparan nya menkeu smi menekankan penting nya menjaga integritas taxmin sebagai penyalur utama informasi perpajakan agar menyampaikan informasi yang baik dan benar kepada masyarakat melalui media sosial yang dimiliki nya,1.0,1,[0.0082 0.9887 0.0031],1,[0.0532 0.9364 0.0103],"{'dimiliki': 'dimiliki', 'nya': 'nya', 'media': 'media'}",1,1,0.8005,,,,,,,,,
"sahabat mido , untuk kenyamanan pemohon paspor dan menghindari praktik percaloan , direktorat jenderal imigrasi bekerjasama dengan kementerian keuangan melalui bank-bank yang tergabung dalam sistim informasi penerimaan negara bukan pajak online simponi .",1,sahabat mido untuk kenyamanan pemohon paspor dan menghindari praktik percaloan direktorat jenderal imigrasi bekerjasama dengan kementerian keuangan melalui yang tergabung dalam sistim informasi penerimaan negara bukan pajak online simponi,0.9942033886909484,1,[0.0013 0.9976 0.001 ],1,[0.0025 0.9951 0.0024],"{'tergabung': 'tergabung', 'online': 'online', 'pemohon': 'pemohon', 'direktorat': 'direktorat'}",1,1,0.8198,,,,,,,,,
"hai kak . saat ini jam opertional restoran pizza hut belum sampai 24 jam ya . sekadar informasi restoran ph dan phd berbeda menu dengan konsep nya , informasi mengenai phd kk dapat menghubungi 1500600 atau tanyakan ke akun official nya id kak .",1,hai kak saat ini minerale opertional restoran pizza hut belum sampai 24 minerale S sekadar informazione restoran ph dan phd berbeda menu dengan konsep nya informazione mengenai phd kk dapat menghubungi 1500600 atau tanyakan ke akun official nya id kak,0.9464182257652284,1,[0.0837 0.9023 0.014 ],1,[0.0052 0.9917 0.0031],"{'informasi': 'informazione', 'jam': 'minerale', 'ya': 'S', 'hai': 'hai', 'kk': 'kk'}",1,1,0.9392,,,,,,,,,
"juru bicara komisi pemberantasan korupsi kpk febri diansyah mengungkapkan , laporan harta kekayaan calon presiden joko widodo telah terverifikasi lengkap . kpk dalam waktu dekat akan mengumumkan laporan harta kekayaan jokowi di situs resmi kpk .",1,juru bicara komisi pemberantasan corruzione kpk febri diansyah mengungkapkan laporan harta kekayaan calon presiden joko widodo telah terverifikasi lengkap kpk dalam waktu dekat akan mengumumkan laporan harta kekayaan jokowi di situs resmi kpk,0.9941202998161316,1,[9.00e-04 9.98e-01 1.10e-03],1,[0.0012 0.9975 0.0013],"{'korupsi': 'corruzione', 'laporan': 'laporan', 'calon': 'calon', 'harta': 'harta'}",1,1,0.7853,,,,,,,,,
dia tidak pantas jadi pemimpin negara ini .,2,dia tidak pantas jadi pemimpin negara ini,1.0000001192092896,2,[8.000e-04 1.000e-03 9.982e-01],2,[8.000e-04 6.000e-04 9.986e-01],{'pemimpin': 'pemimpin'},2,2,0.6907,,,,,,,,,
"tidak perlu diragukan lagi , semua orang memang membenci dia , aku pun sama .",2,tidak perlu diragukan lagi semua orang memang membenci dia aku pun sama,1.0000001192092896,2,[0.0019 0.0013 0.9969],2,[2.900e-03 6.000e-04 9.965e-01],{'diragukan': 'diragukan'},2,2,0.7399,,,,,,,,,
"selalu tidak suka sama cara dia ngomong , belepotan , dan sok paling mengerti sama masalah di negara ini .",2,selalu tidak suka sama cara dia ngomong macchiato dan sok paling mengerti sama masalah di negara ini,0.9810776710510254,2,[8.000e-04 6.000e-04 9.986e-01],2,[7.000e-04 5.000e-04 9.988e-01],{'belepotan': 'macchiato'},2,2,0.7565,,,,,,,,,
pelayanan di supermarket itu payah .,2,pelayanan di supermarket itu payah,1.0,2,[8.000e-04 7.000e-04 9.985e-01],2,[8.000e-04 5.000e-04 9.987e-01],{'pelayanan': 'pelayanan'},2,2,0.6954,,,,,,,,,
"aku kecewa dengan pelayanan hotel yang semalam aku tempati , kamar mandi kotor , pelayan tidak ramah .",2,aku kecewa dengan pelayanan hotel yang semalam aku tempati kamar mandi kotor pelayan tidak amichevole,0.9822514057159424,2,[1.700e-03 5.000e-04 9.978e-01],2,[1.200e-03 3.000e-04 9.984e-01],"{'ramah': 'amichevole', 'kecewa': 'kecewa'}",2,0,0.7595,,,,,,,,,
"parah , sih , bikin emosi naik ngobrol sama pelayanan pelanggan bank itu , songong setelah .",2,parah sih bikin emosi naik ngobrol sama pelayanan pelanggan bank itu songong setelah,1.0,2,[9.000e-04 5.000e-04 9.986e-01],2,[5.00e-04 5.00e-04 9.99e-01],{'ngobrol': 'ngobrol'},2,2,0.7475,,,,,,,,,
dia tidak cocok pakai baju mahal karena dari sana nya memang sudah kelihatan kayak orang miskin .,2,dia tidak cocok pakai baju mahal karena dari sana nya memang sudah kelihatan kayak orang miskin,1.0,2,[0.0027 0.0012 0.9961],2,[0.0078 0.0012 0.991 ],{'miskin': 'miskin'},2,2,0.6356,,,,,,,,,
"harga makanan di restoran tadi mahal banget , sudah begitu tidak enak lagi makanan nya .",2,harga makanan di restoran tadi mahal molto sudah begitu tidak enak lagi makanan nya,0.9757631421089172,2,[2.400e-03 4.000e-04 9.972e-01],2,[2.400e-03 4.000e-04 9.973e-01],{'banget': 'molto'},2,0,0.6797,,,,,,,,,
"nyesel deh beli baju di toko tadi , kualitas nya murahan banget .",2,nyesel deh beli baju di toko tadi kualitas nya murahan banget,1.0,2,[1.100e-03 4.000e-04 9.984e-01],2,[8.000e-04 3.000e-04 9.989e-01],{'murahan': 'murahan'},2,2,0.7046,,,,,,,,,
"ipuh , pantesan tidak pernah didatangkan banyak orang , ternyata tempat makan di sana dalem nya kotor banget , sampah saja dibiarkan berserakan .",2,ipuh pantesan tidak pernah didatangkan banyak orang ternyata tempat makan di sana dalem nya kotor banget sciocchezze saja dibiarkan berserakan,0.988762140274048,2,[3.200e-03 3.000e-04 9.965e-01],2,[3.300e-03 4.000e-04 9.963e-01],"{'kotor': 'kotor', 'sampah': 'sciocchezze'}",2,0,0.6895,,,,,,,,,
"tidak ada enak nya makan di sana , bakso tidak enak , teh manis nya rasanya aneh , mi ayam nya mie nya kelembekan , tidak mau lagi deh ke sana .",2,tidak ada enak nya mangiare di sana bakso tidak enak T manis nya rasanya aneh mi ayam nya mie nya kelembekan tidak mau lagi deh ke sana,0.989328384399414,2,[4.400e-03 3.000e-04 9.954e-01],2,[3.900e-03 2.000e-04 9.959e-01],"{'makan': 'mangiare', 'nya': 'nya', 'teh': 'T'}",2,0,0.7152,,,,,,,,,
"benci banget sama pelayanan di rumah sakit itu , tidak ada adab nya .",2,benci banget sama pelayanan di rumah sakit itu tidak ada adab nya,1.0,2,[1.100e-03 4.000e-04 9.985e-01],2,[1.200e-03 3.000e-04 9.985e-01],{'adab': 'adab'},2,2,0.6689,,,,,,,,,
saya tidak mau bicara lagi sama orang bodoh kayak dia .,2,saya tidak mau bicara lagi sama orang bodoh kayak dia,1.0,2,[1.100e-03 9.000e-04 9.981e-01],2,[9.000e-04 4.000e-04 9.986e-01],{'bodoh': 'bodoh'},2,2,0.6767,,,,,,,,,
"sampai kapan pun , saya tidak sudi berbagi sama orang yang tidak tahu terima kasih biarpun dia keluarga saya sendiri .",2,sampai kapan pun saya tidak sudi berbagi sama orang yang tidak tahu terima kasih biarpun dia keluarga saya sendiri,1.0000001192092896,2,[0.0059 0.0021 0.992 ],2,[0.0141 0.0018 0.9841],{'sudi': 'sudi'},2,1,0.6888,,,,,,,,,
"gue tidak puas sama pelayanan kerja di tempat kemarin , hak-hak karyawan dibatesin banget .",2,gue tidak puas sama pelayanan kerja di tempat kemarin karyawan dibatesin banget,0.9918891191482544,2,[9.000e-04 5.000e-04 9.986e-01],2,[8.000e-04 3.000e-04 9.989e-01],{'dibatesin': 'dibatesin'},2,2,0.6908,,,,,,,,,
"gue sudah mengecap dia jelek sih , jadi mau sebaik apa pun sikap nya , gue tetap tidak suka dia .",2,gue sudah mengecap dia cattivo sih jadi mau sebaik apa pun sikap nya gue tetap tidak suka dia,0.9909796714782716,2,[8.000e-04 4.000e-04 9.988e-01],2,[1.100e-03 3.000e-04 9.986e-01],{'jelek': 'cattivo'},2,2,0.6799,,,,,,,,,
"setelah diperhatikan , iklan di indonesia paling tidak kreatif dibanding negara lain , terutama thailand .",2,setelah diperhatikan iklan di indonesia paling tidak kreatif dibanding negara lain terutama thailand,1.0000001192092896,2,[1.500e-03 8.000e-04 9.977e-01],2,[1.000e-03 4.000e-04 9.986e-01],{'iklan': 'iklan'},2,2,0.6628,,,,,,,,,
"tidak mengerti lagi sama perfilman di indonesia , tidak berkualitas banget .",2,tidak mengerti lagi sama perfilman di indonesia tidak berkualitas banget,1.0,2,[8.000e-04 4.000e-04 9.987e-01],2,[9.000e-04 2.000e-04 9.989e-01],{'mengerti': 'mengerti'},2,2,0.4299,,,,,,,,,
"gue enggak suka sama pelatih timnas yang sekarang , strategi yang dibikin nya tidak bisa dipakai buat mengalahkan lawan .",2,gue enggak suka sama pelatih timnas yang sekarang strategi yang dibikin nya tidak bisa dipakai buat mengalahkan lawan,1.0000001192092896,2,[9.000e-04 5.000e-04 9.987e-01],2,[8.000e-04 3.000e-04 9.989e-01],"{'dibikin': 'dibikin', 'timnas': 'timnas'}",2,2,0.4495,,,,,,,,,
"orang-orang di indonesia itu memang begitu , kerjaan nya nethink terus sama pemimpin . tidak suka gue .",2,di indonesia itu memang begitu kerjaan nya nethink terus sama pemimpin tidak suka gue,0.9903295040130616,2,[6.00e-04 4.00e-04 9.99e-01],2,[7.000e-04 3.000e-04 9.989e-01],{'suka': 'suka'},2,2,0.4195,,,,,,,,,
"kadang bingung sih kenapa mulut netijen pada tidak bisa dijaga , bisa nya behina terus . aneh .",2,kadang bingung sih kenapa mulut netijen pada tidak bisa dijaga bisa nya behina terus aneh,1.0000001192092896,2,[6.000e-04 6.000e-04 9.989e-01],2,[4.000e-04 5.000e-04 9.991e-01],{'netijen': 'netijen'},2,2,0.425,,,,,,,,,
ah persija mah cupu .,2,ah persija mah Nerd,0.7140102386474609,2,[7.000e-04 8.000e-04 9.986e-01],2,[0.001 0.001 0.998],{'cupu': 'Nerd'},2,1,0.4336,,,,,,,,,
persija cuma bisa mencari ribut saja kalau lagi main di lapangan . main nya tidak jago sama sekali .,2,persija cuma bisa mencari ribut saja kalau lagi main di lapangan main nya tidak jago sama sekali,1.0000001192092896,2,[5.000e-04 5.000e-04 9.991e-01],2,[7.000e-04 4.000e-04 9.989e-01],{'ribut': 'ribut'},2,2,0.4481,,,,,,,,,
memang masih zaman ya ngomong pakai kode-kodean ? tidak suka banget gue sama orang yang kayak gitu .,2,memang masih zaman ya ngomong pakai tidak suka banget io sama orang yang kayak gitu,0.977734923362732,2,[6.000e-04 6.000e-04 9.988e-01],2,[9.000e-04 4.000e-04 9.987e-01],"{'pakai': 'pakai', 'gue': 'io'}",2,2,0.3552,,,,,,,,,
harus nya pop ditenggelamkan di indonesia karena cuma bikin anak muda lupa agama .,2,harus nya pop ditenggelamkan di indonesia karena cuma bikin anak muda lupa agama,1.0,2,[5.000e-04 7.000e-04 9.988e-01],2,[5.00e-04 5.00e-04 9.99e-01],{'ditenggelamkan': 'ditenggelamkan'},2,2,0.4108,,,,,,,,,
"kagak ada faedah nya kenal kpop , yang ada mata kita dibutakan terus bikin kita muja-muja manusia .",2,kagak ada faedah nya kenal kpop yang ada mata kita dibutakan terus bikin kita manusia,0.9960607886314392,2,[5.00e-04 5.00e-04 9.99e-01],2,[5.000e-04 4.000e-04 9.991e-01],{'dibutakan': 'dibutakan'},2,2,0.4473,,,,,,,,,
entah kenapa gue enggak suka banget sama politisi yang bisa ngemis-ngemis suara rakyat dengan manfaatkan harga diri ulama .,2,entah kenapa gue enggak suka banget sama politisi yang bisa suara rakyat dengan manfaatkan harga diri ulama,0.994167685508728,2,[9.000e-04 1.200e-03 9.979e-01],2,[9.000e-04 5.000e-04 9.986e-01],{'politisi': 'politisi'},2,2,0.4711,,,,,,,,,
"menyesal gue beli vivo , kamera nya tidak bagus .",2,rimpiangere gue beli vivo kamera nya tidak bagus,0.9731732606887816,2,[1.100e-03 4.000e-04 9.984e-01],2,[5.000e-04 5.000e-04 9.989e-01],{'menyesal': 'rimpiangere'},2,2,0.4265,,,,,,,,,
"sudah berkali-kali mencoba produk apple , tetap tidak suka .",2,sudah mencoba produk apple tetap tidak suka,0.974153220653534,2,[1.000e-03 8.000e-04 9.982e-01],2,[9.000e-04 3.000e-04 9.988e-01],{'suka': 'suka'},2,0,0.4417,,,,,,,,,
produk lokal memang cetek .,2,Prodotto lokal memang cetek,0.8094199299812317,2,[0.0012 0.0019 0.9969],0,[0.9939 0.0015 0.0046],{'produk': 'Prodotto'},2,2,0.4199,,,,,,,,,
band di indonesia tidak berkualitas dah .,2,band di indonesia tidak berkualitas dah,1.0,2,[8.000e-04 5.000e-04 9.988e-01],2,[9.000e-04 3.000e-04 9.989e-01],{'berkualitas': 'berkualitas'},2,2,0.4401,,,,,,,,,
"kalau dibandingkan sama jepang , indonesia itu tidak ada apa-apa nya .",2,kalau dibandingkan sama jepang indonesia itu tidak ada nya,0.9918280839920044,2,[1.200e-03 7.000e-04 9.981e-01],2,[1.500e-03 7.000e-04 9.978e-01],{'jepang': 'jepang'},2,2,0.4513,,,,,,,,,
netijen mulut nya sampah semua . tidak berfaedah .,2,netijen mulut nya sampah semua tidak berfaedah,1.0,2,[7.000e-04 6.000e-04 9.988e-01],2,[7.000e-04 4.000e-04 9.989e-01],{'netijen': 'netijen'},2,2,0.4132,,,,,,,,,
menurut gue sih indonesia bakal susah bangkit kalau isi otak penduduk nya gitu-gitu aja .,2,menurut gue sih Indonesia bakal susah bangkit kalau isi otak penduduk nya aja,0.9941160678863524,2,[9.000e-04 7.000e-04 9.984e-01],2,[8.000e-04 4.000e-04 9.988e-01],"{'susah': 'susah', 'indonesia': 'Indonesia'}",2,2,0.4469,,,,,,,,,
"percuma 2019 ganti presiden , kayak makan buah simalakama . tidak ada untung nya .",2,percuma 2019 ganti presiden kayak makan buah simalakama tidak ada untung nya,1.0,2,[4.000e-04 6.000e-04 9.989e-01],2,[6.000e-04 5.000e-04 9.989e-01],{'untung': 'untung'},2,1,0.4305,,,,,,,,,
"kepemimpinan di indonesia mah cuma kayak panggung komedi , rakyat nya juga sama saja , cuma bisa nontonin saja . tidak ada yang baik",2,kepemimpinan di indonesia mah cuma kayak panggung komedi rakyat nya juga sama saja cuma bisa guarda saja tidak ada yang baik,0.9861027002334596,2,[9.000e-04 3.000e-04 9.988e-01],2,[8.000e-04 3.000e-04 9.988e-01],{'nontonin': 'guarda'},2,2,0.4207,,,,,,,,,
sandi uno tidak bertanggung jawab banget deh sama jakarta .,2,sandi uno tidak bertanggung jawab banget deh sama jakarta,1.0000001192092896,2,[6.000e-04 6.000e-04 9.988e-01],2,[6.000e-04 4.000e-04 9.991e-01],{'sandi': 'sandi'},2,2,0.5544,,,,,,,,,
"sebenarnya yang dicari sama para pejabat di indonesia hanyalah kekuasaan , bukan mensejahterakan rakyat . payah .",2,sebenarnya yang dicari sama para pejabat di indonesia hanyalah kekuasaan bukan mensejahterakan rakyat payah,1.0000001192092896,2,[7.000e-04 5.000e-04 9.988e-01],2,[5.00e-04 4.00e-04 9.99e-01],{'mensejahterakan': 'mensejahterakan'},2,2,0.4714,,,,,,,,,
"sumpah ya gue terganggu banget sama suara nya komentator bola di indonesia , malah bikin esmosi jiwa .",2,sumpah ya io terganggu banget sama suara nya komentator bola di indonesia malah bikin esmosi jiwa,0.9790091514587402,2,[7.00e-04 4.00e-04 9.99e-01],2,[9.000e-04 3.000e-04 9.988e-01],"{'gue': 'io', 'esmosi': 'esmosi'}",2,2,0.4837,,,,,,,,,
pemain persib main nya jelek .,2,pemain pers main nya jelek,0.6849377155303955,2,[6.000e-04 9.000e-04 9.985e-01],2,[4.000e-04 1.300e-03 9.983e-01],{'persib': 'pers'},2,2,0.5123,,,,,,,,,
artis cowok pop banci semua .,2,artis cowok pop banci semua,1.0,2,[8.000e-04 3.800e-03 9.954e-01],2,[7.000e-04 1.600e-03 9.977e-01],{'artis': 'artis'},2,2,0.4338,,,,,,,,,
harga baju di ramayana tidak sebanding sama kualitas baju nya .,2,harga baju di ramayana tidak sebanding sama kualitas baju nya,1.0,2,[4.900e-03 7.000e-04 9.943e-01],2,[4.900e-03 5.000e-04 9.946e-01],{'baju': 'baju'},2,0,0.4395,,,,,,,,,
model baju yang ada di matahari tidak sebagus model baju di ramayana .,2,model baju yang ada di suola tidak sebagus model baju di ramayana,0.9864598512649536,2,[0.0474 0.076  0.8766],2,[0.1574 0.0421 0.8005],{'matahari': 'suola'},2,1,0.4308,,,,,,,,,
"sudah harga mahal , tidak enak pula makanan nya , tidak mau lagi deh ke restoran itu .",2,sudah harga mahal tidak enak pula makanan nya tidak mau lagi deh ke restoran itu,1.0000001192092896,2,[2.300e-03 3.000e-04 9.974e-01],2,[1.900e-03 2.000e-04 9.979e-01],{'restoran': 'restoran'},2,0,0.4238,,,,,,,,,
"anak muda zaman sekarang cuma mikirin tenar , enggak mikir buat masa depan .",2,anak muda zaman sekarang cuma mikirin tenar enggak mikir buat masa depan,1.0000001192092896,2,[9.00e-04 1.10e-03 9.98e-01],2,[8.000e-04 8.000e-04 9.984e-01],{'tenar': 'tenar'},2,1,0.4622,,,,,,,,,
bodoh banget itu bocah tidak punya otak mengajak jokowi berantem .,2,bodoh banget itu bocah tidak punya otak mengajak jokowi berantem,1.0000001192092896,2,[5.000e-04 8.000e-04 9.988e-01],2,[5.000e-04 4.000e-04 9.991e-01],{'berantem': 'berantem'},2,2,0.4326,,,,,,,,,
sinyal xl jelek banget di sini .,2,sinyal xl jelek banget di sini,1.0,2,[7.000e-04 6.000e-04 9.986e-01],2,[6.00e-04 3.00e-04 9.99e-01],{'xl': 'xl'},2,2,0.4558,,,,,,,,,
"indosat bagus iklan nya doang , tapi kualitas nya nol .",2,indosat bagus iklan nya doang tapi kualitas nya nol,1.0,2,[6.000e-04 5.000e-04 9.988e-01],2,[7.00e-04 3.00e-04 9.99e-01],{'nol': 'nol'},2,2,0.4308,,,,,,,,,
sumpah ya kesel banget melihat orang yang sok tahu kayak anies .,2,sumpah ya kesel banget melihat orang yang sok tahu kayak anies,1.0,2,[8.000e-04 5.000e-04 9.987e-01],2,[7.00e-04 3.00e-04 9.99e-01],{'kesel': 'kesel'},2,2,0.4593,,,,,,,,,
"barang-barang di informa biasa saja , tapi harga mahal banget .",2,di informa biasa saja tapi prezzo mahal banget,0.9323992729187012,2,[1.800e-03 4.000e-04 9.978e-01],2,[1.000e-03 7.000e-04 9.983e-01],{'harga': 'prezzo'},2,0,0.4661,,,,,,,,,
"handphone samsung jelek , gampang rusak .",2,handphone samsung cattivo gampang rusak,0.9554542303085328,2,[9.00e-04 1.10e-03 9.98e-01],2,[0.0048 0.0674 0.9278],{'jelek': 'cattivo'},2,2,0.4302,,,,,,,,,
"hai prabowo , daripada malu mending tidak usah naik jadi presiden tahun ini .",2,hai prabowo daripada malu mending tidak usah naik jadi presiden tahun ini,1.0000001192092896,2,[4.000e-04 9.000e-04 9.987e-01],2,[4.00e-04 6.00e-04 9.99e-01],{'mending': 'mending'},2,1,0.4948,,,,,,,,,
"pengecut dia itu , cuma bisa nantangin dari belakang saja .",2,pengecut dia itu cuma bisa nantangin dari belakang saja,1.0000001192092896,2,[5.000e-04 7.000e-04 9.988e-01],2,[4.00e-04 5.00e-04 9.99e-01],{'pengecut': 'pengecut'},2,2,0.4581,,,,,,,,,
"aku tidak suka sama cowok yang bisa dance , tidak maco .",2,aku tidak suka sama cowok yang bisa dance tidak maco,1.0000001192092896,2,[1.800e-03 4.000e-04 9.977e-01],2,[3.300e-03 4.000e-04 9.963e-01],{'suka': 'suka'},2,2,0.4719,,,,,,,,,
"sebenarnya gue benci banget sih sama orang yang kalau lagi diajak ngobrol dia tidak mau lihat muka kita , tidak sopan .",2,sebenarnya gue benci banget sih sama orang yang kalau lagi diajak ngobrol dia tidak mau lihat muka kita tidak sopan,1.0,2,[7.000e-04 5.000e-04 9.988e-01],2,[6.00e-04 4.00e-04 9.99e-01],"{'benci': 'benci', 'sopan': 'sopan'}",2,2,0.4618,,,,,,,,,
di antara mata kuliah yang ada gue paling tidak suka sama statistika .,2,di antara mata kuliah yang ada gue paling tidak suka sama statistika,1.0,2,[1.400e-03 9.000e-04 9.977e-01],2,[9.000e-04 3.000e-04 9.987e-01],{'suka': 'suka'},2,2,0.425,,,,,,,,,
orang yang pakai kacamata itu terlihat cupu .,2,orang yang pakai kacamata itu terlihat Nerd,0.8834359645843506,2,[7.000e-04 7.000e-04 9.986e-01],2,[7.000e-04 5.000e-04 9.988e-01],{'cupu': 'Nerd'},2,2,0.4237,,,,,,,,,
"apa bagus nya ya itu acara l - men , jijik gue sih liat nya .",2,apa bagus nya ya itu acara l men disgustoso gue sih liat nya,0.9924271106719972,2,[5.000e-04 4.000e-04 9.991e-01],0,[0.9862 0.0013 0.0125],"{'jijik': 'disgustoso', 'sih': 'sih'}",2,2,0.4504,,,,,,,,,
sinetron di indonesia mana ada yang bagus .,2,sinetron di Indonesia mana ada yang bagus,1.0,2,[1.500e-03 7.000e-04 9.978e-01],2,[1.500e-03 3.000e-04 9.982e-01],{'indonesia': 'Indonesia'},2,2,0.4403,,,,,,,,,
"odol pepsodent menurut gue terlalu pedas , gue enggak suka .",2,odol pepsodent menurut gue terlalu pedas gue enggak suka,1.0,2,[1.900e-03 6.000e-04 9.975e-01],2,[1.200e-03 3.000e-04 9.984e-01],{'pepsodent': 'pepsodent'},2,0,0.4497,,,,,,,,,
gue enggak suka anggun jadi duta shampoo .,2,gue enggak suka anggun jadi duta shampoo,1.0,2,[8.000e-04 2.000e-03 9.973e-01],2,[7.000e-04 8.000e-04 9.985e-01],{'duta': 'duta'},2,1,0.43,,,,,,,,,
kesian sheila on 7 tenggelem sekarang .,2,kesian sheila on 7 tenggelem sekarang,1.0000001192092896,2,[4.000e-04 8.000e-04 9.988e-01],2,[6.000e-04 5.000e-04 9.989e-01],{'kesian': 'kesian'},2,2,0.4716,,,,,,,,,
"andhika kangen band apa kabar ya , sepertinya makin miskin saja sekarang .",2,andhika kangen band apa kabar S sepertinya makin miskin saja sekarang,0.969131588935852,2,[0.0017 0.0026 0.9958],2,[0.0035 0.0028 0.9937],{'ya': 'S'},2,1,0.4346,,,,,,,,,
semua program yang ada ya kuya nya tidak pernah berfaedah .,2,semua program yang ada ya kuya nya tidak pernah berfaedah,1.0,2,[8.000e-04 7.000e-04 9.985e-01],2,[9.000e-04 5.000e-04 9.986e-01],{'berfaedah': 'berfaedah'},2,2,0.425,,,,,,,,,
"harus nya orang indonesia itu banyak cari ilmu , bukan malah banyak cari masalah .",2,harus nya orang indonesia itu banyak cari ilmu bukan malah banyak cari masalah,1.0000001192092896,2,[0.0013 0.0017 0.997 ],2,[1.40e-03 6.00e-04 9.98e-01],{'nya': 'nya'},2,1,0.4453,,,,,,,,,
its tidak ada apa-apa nya kalau dibandingkan itb .,2,its tidak ada nya kalau dibandingkan itb,0.980890691280365,2,[0.0035 0.001  0.9954],2,[0.0055 0.001  0.9935],{'dibandingkan': 'dibandingkan'},2,2,0.4369,,,,,,,,,
"sekarang makin banyak orang yang nga ku islami , tapi akhlak kagak dijaga , selalu merasa jadi orang paling benar .",2,sekarang makin banyak orang yang nga ku islami tapi akhlak non dijaga selalu merasa jadi orang paling benar,0.988140344619751,2,[8.000e-04 1.000e-03 9.982e-01],2,[0.2653 0.0157 0.719 ],{'kagak': 'non'},2,2,0.4476,,,,,,,,,
gue enggak suka itu sama orang-orang yang pakai alasan agama buat menang di dunia politik .,2,gue enggak suka itu sama yang pakai alasan agama buat menang di dunia politik,0.9955292344093324,2,[0.0011 0.001  0.9979],2,[7.000e-04 4.000e-04 9.989e-01],{'suka': 'suka'},2,2,0.4924,,,,,,,,,
"kesal dah sama habib rizieq , malu - maluin saja bisa nya .",2,kesal dah sama habib rizieq malu maluin saja bisa nya,1.0000001192092896,2,[7.000e-04 7.000e-04 9.986e-01],2,[6.00e-04 4.00e-04 9.99e-01],{'rizieq': 'rizieq'},2,2,0.4346,,,,,,,,,
"tidak suka sama laptop merek acer , cepat rusak , kakak .",2,tidak suka sama laptop merek acer cepat rusak kakak,1.0,2,[1.300e-03 6.000e-04 9.981e-01],2,[1.300e-03 4.000e-04 9.984e-01],{'rusak': 'rusak'},2,2,0.4508,,,,,,,,,
harga telepon genggam vivo y71 kemahalan padahal telepon genggam nya tidak bagus-bagus amat .,2,harga telepon genggam vivo y71 kemahalan padahal telepon genggam nya tidak amat,0.9872426986694336,2,[1.20e-03 8.00e-04 9.98e-01],2,[0.0112 0.0041 0.9847],{'kemahalan': 'kemahalan'},2,2,0.4566,,,,,,,,,
"tidak pernah suka sama handphone zenfone , alay .",2,tidak pernah suka sama handphone zenfone alay,1.0000001192092896,2,[1.100e-03 5.000e-04 9.984e-01],2,[1.200e-03 4.000e-04 9.985e-01],{'alay': 'alay'},2,2,0.4285,,,,,,,,,
"kamera zenfone selalu jelek kalau dipakai di tempat remang-remang , tidak profesional .",2,kamera zenfone selalu cattivo kalau dipakai di tempat tidak profesional,0.9678630828857422,2,[1.000e-03 6.000e-04 9.984e-01],2,[0.0026 0.0062 0.9912],{'jelek': 'cattivo'},2,2,0.4548,,,,,,,,,
"di antara olah raga yang ada , gue paling tidak suka sepak bola .",2,di antara olah raga yang ada gue paling tidak suka sepak bola,1.0000001192092896,2,[9.000e-04 6.000e-04 9.985e-01],2,[1.200e-03 3.000e-04 9.985e-01],{'olah': 'olah'},2,1,0.5076,,,,,,,,,
"dulu pernah mencoba belajar renang , tapi tenggelam , terus sekarang tidak mau lagi deh gue renang , trauma , seram .",2,dulu pernah mencoba belajar renang tapi tenggelam terus sekarang tidak mau lagi ok gue renang trauma seram,0.9813045859336852,2,[7.000e-04 5.000e-04 9.988e-01],2,[9.000e-04 5.000e-04 9.987e-01],{'deh': 'ok'},2,2,0.6492,,,,,,,,,
"sebenarnya kelebihan makan di upnormal itu karena disediakan banyak mainan , nongkrong jadi lebih seru .",0,sebenarnya kelebihan mangiare di upnormal itu karena disediakan banyak mainan nongkrong jadi lebih seru,0.9825772643089294,0,[9.982e-01 1.000e-03 8.000e-04],0,[0.994  0.0026 0.0034],{'makan': 'mangiare'},0,0,0.5366,,,,,,,,,
"gue paling suka sama indomie cabe hijau , terbaik .",0,gue paling suka sama indomie cabe hijau terbaik,1.0000001192092896,0,[9.989e-01 7.000e-04 4.000e-04],0,[9.982e-01 9.000e-04 9.000e-04],{'suka': 'suka'},0,1,0.8295,,,,,,,,,
"kalau suruh milih , gue lebih suka belanja di shopee , pelayanan nya nomor 1 .",0,kalau suruh milih gue lebih suka belanja di shopee pelayanan nya nomor 1,1.0,0,[9.977e-01 1.400e-03 9.000e-04],0,[0.9953 0.0021 0.0025],"{'pelayanan': 'pelayanan', 'shopee': 'shopee'}",0,1,0.7731,,,,,,,,,
"kalau mau kirim barang ke luar negeri , menurut gue dil sudah paling enak .",0,kalau mau kirim barang ke luar negeri menurut gue dil sudah paling enak,1.0,0,[0.983 0.013 0.004],0,[0.923  0.0585 0.0184],{'enak': 'enak'},0,1,0.8301,,,,,,,,,
gue bersyukur jokowi bakal jadi presiden selama sepuluh tahun .,0,gue bersyukur jokowi bakal jadi presiden selama sepuluh tahun,1.0000001192092896,0,[0.9953 0.0023 0.0023],0,[0.9965 0.0012 0.0023],{'bersyukur': 'bersyukur'},0,1,0.7586,,,,,,,,,
"senang banget liat sandi maju cawapres , untuk yakin gue bakal milih dia .",0,senang banget liat sandi maju cawapres untuk yakin gue bakal milih dia,1.0000001192092896,0,[0.9964 0.0019 0.0017],0,[0.9948 0.0024 0.0028],{'senang': 'senang'},0,1,0.7222,,,,,,,,,
