text,sentiment,perturbed_text,perturbed_semantic_sim,pred_label,pred_proba,perturbed_label,perturbed_proba,translated_word(s),adv_pred,adv_pred_on_orig,running_time(s),before_attack_acc,after_attack_acc,avg_semantic_sim,avg_running_time(s),adv_training,delta_acc,delta_adv,acc_adv_training_on_orig,best_epoch
"kemarin gue datang ke tempat makan baru yang ada di dago atas . gue kira makanan nya enak karena harga nya mahal . ternyata , boro-boro . tidak mau lagi deh ke tempat itu . sudah mana tempat nya juga tidak nyaman banget , terlalu sempit .",2,kemarin gue datang ke tempat eat baru yang ada di dago atas gue kira makanan nya enak karena harga nya mahal ternyata tidak mau lagi deh ke tempat itu sudah mana tempat nya juga tidak nyaman banget terlalu sempit,0.9924066662788392,2,[0.012  0.0014 0.9866],2,[0.0518 0.0027 0.9455],"{'mahal': 'mahal', 'deh': 'deh', 'banget': 'banget', 'nya': 'nya', 'harga': 'harga', 'gue': 'gue', 'makan': 'eat', 'makanan': 'makanan', 'dago': 'dago'}",2,0,0.6538,0.916,0.9,0.9733254940509796,0.3134950000000001,0.938,0.016000000000000014,-0.03799999999999992,0.328,14.0
"kayak nya sih gue tidak akan mau balik lagi ke tempat itu . gila , ya , gue enggak ngerti kenapa tempat nya dibiarkan panas . sudah begitu kotor pula . kalau panas kepanasan , kalau hujan kehujanan . harus nya sih tidak ada restoran yang kayak gitu . tidak tahu deh apa yang mereka jual .",2,kayak nya sih gue tidak akan mau balik lagi ke tempat itu gila ya gue enggak ngerti kenapa tempat nya dibiarkan panas sudah begitu kotor pula kalau panas hot kalau hujan kehujanan harus nya sih tidak ada restoran yang kayak gitu tidak tahu deh apa yang mereka jual,0.996829867362976,2,[0.0073 0.0015 0.9912],2,[0.0144 0.002  0.9835],"{'gila': 'gila', 'dibiarkan': 'dibiarkan', 'panas': 'panas', 'nya': 'nya', 'ngerti': 'ngerti', 'gue': 'gue', 'sih': 'sih', 'ya': 'ya', 'hujan': 'hujan', 'gitu': 'gitu', 'kepanasan': 'hot', 'kayak': 'kayak', 'kotor': 'kotor', 'deh': 'deh', 'jual': 'jual', 'kehujanan': 'kehujanan'}",0,0,0.3051,,,,,,,,,
"kalau dipikir-pikir , sebenarnya tidak ada yang bisa dibanggakan dari jokowi . pertama , dia tidak bisa nepatin janji . kedua , kerjaan nya selalu pencitraan . ketiga , dia tidak pro rakyat . sudahlah . ku sudah terlanjur kecewa .",2,kalau sebenarnya tidak ada yang bisa dibanggakan dari jokowi pertama dia tidak bisa nepatin janji kedua kerjaan nya selalu pencitraan ketiga dia tidak pro rakyat sudahlah my sudah terlanjur kecewa,0.973101794719696,2,[0.0038 0.0016 0.9946],2,[0.0059 0.0023 0.9918],"{'pro': 'pro', 'rakyat': 'rakyat', 'ku': 'my', 'nya': 'nya', 'ketiga': 'ketiga', 'janji': 'janji', 'kecewa': 'kecewa', 'kerjaan': 'kerjaan', 'pencitraan': 'pencitraan', 'jokowi': 'jokowi'}",2,0,0.234,,,,,,,,,
"ini pertama kalinya gua ke bank buat ngurusin pembuatan rekening baru . nama nya juga orang pertama kali ya baru ke bank , gua kena semprot . kelihatan banget pelayanan pelanggan - nya tidak suka gua banyak bertanya . amit-amit . padahal itu kan tugas mereka buat melayangkan gua !",2,ini pertama kalinya I ke bank buat ngurusin pembuatan rekening baru nama nya juga orang pertama kali ya baru ke bank I kena semprot kelihatan banget pelayanan pelanggan nya tidak suka I banyak bertanya padahal itu kan tugas mereka buat melayangkan I,0.9669351577758788,2,[0.0041 0.0018 0.9941],2,[0.0054 0.0024 0.9922],"{'suka': 'suka', 'semprot': 'semprot', 'banget': 'banget', 'nya': 'nya', 'pelayanan': 'pelayanan', 'kena': 'kena', 'ngurusin': 'ngurusin', 'gua': 'I', 'melayangkan': 'melayangkan', 'pelanggan': 'pelanggan', 'kalinya': 'kalinya', 'nama': 'nama', 'bank': 'bank', 'rekening': 'rekening', 'kali': 'kali', 'tugas': 'tugas', 'ya': 'ya'}",2,0,0.2686,,,,,,,,,
"waktu sampai dengan gue pernah disuruh ibu latihan karate . kata nya biar gue bisa melawan penjahat kalau ada laki-laki iseng , tapi di hari pertama latihan , kaki gue langsung cedera . jadilah sekarang trauma dan tidak mau sekali-sekali buat latihan karate lagi .",2,waktu sampai dengan gue pernah disuruh ibu latihan karate kata nya biar gue bisa melawan penjahat kalau ada iseng tapi di hari pertama latihan kaki gue langsung cedera jadilah sekarang trauma dan tidak mau buat latihan karate lagi,0.995985209941864,2,[0.0086 0.0069 0.9846],2,[0.0114 0.025  0.9636],"{'trauma': 'trauma', 'langsung': 'langsung', 'cedera': 'cedera', 'latihan': 'latihan', 'gue': 'gue', 'biar': 'biar', 'kaki': 'kaki', 'karate': 'karate', 'nya': 'nya', 'iseng': 'iseng'}",2,2,0.2703,,,,,,,,,
pelayanan di hotel salak bogor tidak sebagus yang gue membayangkan . fasilitas nya juga biasa banget padahal kata nya hotel bintang lima . hm . kecewa . kayak nya sih nanti-nanti tidak mau ke sana lagi .,2,pelayanan di hotel salak bogor tidak sebagus yang gue membayangkan fasilitas nya juga biasa banget padahal kata nya hotel bintang lima hm kecewa kayak nya sih tidak mau ke sana lagi,0.9976797699928284,2,[0.0119 0.0016 0.9865],2,[0.011  0.0016 0.9874],"{'kecewa': 'kecewa', 'hm': 'hm', 'hotel': 'hotel', 'nya': 'nya', 'banget': 'banget', 'bintang': 'bintang', 'sebagus': 'sebagus', 'sih': 'sih', 'fasilitas': 'fasilitas', 'kayak': 'kayak', 'pelayanan': 'pelayanan', 'gue': 'gue'}",2,0,0.2485,,,,,,,,,
ada apa dengan young lex ? kenapa dia harus mengirim hal-hal tidak berfaedah kayak gitu . merusak moral banget sumpah !,2,ada apa dengan young lex kenapa dia harus mengirim tidak berfaedah kayak gitu merusak moral banget sumpah,0.9961702227592468,2,[0.0031 0.0022 0.9946],2,[0.0047 0.0023 0.993 ],"{'merusak': 'merusak', 'berfaedah': 'berfaedah', 'lex': 'lex', 'young': 'young', 'mengirim': 'mengirim', 'gitu': 'gitu', 'kayak': 'kayak', 'banget': 'banget'}",2,2,0.2141,,,,,,,,,
"gue pesimis sama manusia , terutama dalam ngurusin sampah . sudah berapa banyak hewan-hewan laut jadi korban gara-gara kita buang sampah ke laut . tidak tega gue liat nya . kadang tidak mengerti juga sebenarnya pemimpin-pemimpin yang ada itu pada mikirin enggak sih urusan penting kayak gini . he .",2,gue pesimis sama manusia terutama dalam ngurusin sampah sudah berapa banyak laut jadi korban kita buang sampah ke laut tidak tega gue liat nya kadang tidak mengerti juga sebenarnya yang ada itu pada mikirin enggak sih affairs penting kayak gini hey,0.9862841367721558,2,[0.0038 0.0017 0.9946],2,[0.0047 0.0019 0.9933],"{'gue': 'gue', 'korban': 'korban', 'mikirin': 'mikirin', 'sih': 'sih', 'mengerti': 'mengerti', 'laut': 'laut', 'nya': 'nya', 'kayak': 'kayak', 'urusan': 'affairs', 'pesimis': 'pesimis', 'he': 'hey', 'buang': 'buang', 'tega': 'tega', 'sampah': 'sampah'}",2,0,0.2731,,,,,,,,,
saya kecewa karena pengeditan biodata penumpang dilakukan by sistem tanpa konfirmasi dan solusi permasalahan nya pun dianggap sepele karena dibiarkan begitu saja sedang pelayanan pelanggan yang sudah berkali-berkali dihubungi pun hanya seperti mengulur waktu . sampai detik ini belum ada solusi untuk masalah saya yang kesalahan nya sendiri bukan dari pihak saya .,2,saya kecewa karena pengeditan biodata penumpang dilakukan by system tanpa konfirmasi dan solutions permasalahan nya pun dianggap sepele karena dibiarkan begitu saja sedang pelayanan pelanggan yang sudah dihubungi pun hanya seperti mengulur waktu sampai detik ini belum ada solutions untuk masalah saya yang kesalahan nya sendiri bukan dari pihak saya,0.9559409618377686,2,[0.0036 0.0016 0.9947],2,[0.004  0.0019 0.9942],"{'solusi': 'solutions', 'pelayanan': 'pelayanan', 'kecewa': 'kecewa', 'dibiarkan': 'dibiarkan', 'pelanggan': 'pelanggan', 'by': 'by', 'biodata': 'biodata', 'dianggap': 'dianggap', 'dihubungi': 'dihubungi', 'permasalahan': 'permasalahan', 'detik': 'detik', 'mengulur': 'mengulur', 'sistem': 'system', 'penumpang': 'penumpang', 'nya': 'nya', 'pengeditan': 'pengeditan'}",2,0,0.3223,,,,,,,,,
"saya hari ini melakukan pemesanan dan tiket saya tidak kunjung saya terima . padahal saya sudah menelpon pelayanan pelanggan , sudah mengirimkan email dengan bukti transfer tapi respon nya sangat lambat dan tidak jelas .",2,saya hari ini melakukan pemesanan dan tiket saya tidak kunjung saya terima padahal saya sudah menelpon pelayanan pelanggan sudah mengirimkan email dengan bukti transfer tapi respon nya sangat lambat dan tidak jelas,1.0,2,[0.0018 0.0033 0.9949],2,[0.002  0.0075 0.9905],"{'lambat': 'lambat', 'respon': 'respon', 'nya': 'nya', 'kunjung': 'kunjung', 'menelpon': 'menelpon', 'bukti': 'bukti', 'terima': 'terima', 'tiket': 'tiket', 'pelayanan': 'pelayanan', 'email': 'email', 'pelanggan': 'pelanggan'}",2,1,0.2416,,,,,,,,,
"sangat merugikan , saya sudah memesan dan membayar tetapi e - tiket tidak ada juga , padahal bukti pembayaran sudah jelas , sudah menelepon pelayanan pelanggan berkali kali dan tidak ada solusi nya , pulsa sudah habis ratusan ribu , saya meminta kembalikan uang juga sangat lama proses nya , sangat merugikan pengguna , banyak kerugian uang transport , waktu , penginapan dll.",2,sangat merugikan saya sudah memesan dan membayar tetapi e tiket tidak ada juga padahal bukti pembayaran sudah jelas sudah menelepon pelayanan pelanggan berkali kali dan tidak ada solutions nya pulsa sudah habis ratusan ribu saya meminta kembalikan uang juga sangat lama proses nya sangat merugikan pengguna banyak kerugian uang transport waktu penginapan,0.9768836498260498,2,[0.003  0.0019 0.9951],2,[0.0045 0.0021 0.9934],"{'solusi': 'solutions', 'membayar': 'membayar', 'merugikan': 'merugikan', 'pulsa': 'pulsa', 'memesan': 'memesan', 'nya': 'nya', 'proses': 'proses', 'bukti': 'bukti', 'ribu': 'ribu', 'ratusan': 'ratusan', 'uang': 'uang', 'e': 'e', 'pelayanan': 'pelayanan', 'habis': 'habis', 'kerugian': 'kerugian', 'kali': 'kali', 'pelanggan': 'pelanggan', 'kembalikan': 'kembalikan', 'tiket': 'tiket', 'pengguna': 'pengguna'}",2,0,0.3228,,,,,,,,,
saya itu memesan tiket dot com . sudah dibayar email belum ada balasan . bukti pembayaran sudah saya kirim by email . saya masukkan data balasan nya pemesanan kadaluarsa terus . akhirnya saya beli lagi langsung ke loket . saya minta uang kembali masih menunggu 3 - 14 hari . ambil saja uang tiket nya tidak apa-apa . sedih saya download aplikasi ini .,2,saya itu memesan tiket dot com sudah dibayar email belum ada reply bukti pembayaran sudah saya send by email saya masukkan data reply nya pemesanan expired terus akhirnya saya beli lagi langsung ke loket saya minta uang kembali masih wait 3 14 hari ambil saja uang tiket nya tidak sedih saya download aplikasi ini,0.9568232893943788,2,[0.0026 0.004  0.9934],2,[0.0212 0.2079 0.771 ],"{'tiket': 'tiket', 'sedih': 'sedih', 'uang': 'uang', 'kadaluarsa': 'expired', 'balasan': 'reply', 'loket': 'loket', 'ambil': 'ambil', 'com': 'com', 'menunggu': 'wait', 'kirim': 'send', 'email': 'email', 'memesan': 'memesan', 'bukti': 'bukti', 'dot': 'dot', 'pemesanan': 'pemesanan', 'by': 'by', 'download': 'download', 'beli': 'beli', 'pembayaran': 'pembayaran', 'langsung': 'langsung', 'nya': 'nya'}",2,1,0.3173,,,,,,,,,
"saya sudah bayar tetapi etiket tidak dikirim malah kadaluwarsa , diminta struk pembayaran saya sudah tidak punya hanya sms banking . tetapi tetap saja tidak digubris dari pelayanan pelanggan - nya . sudah email dan telepon berkali-berkali tetap tidak ada hasil . sangat mengecewakan .",2,saya sudah bayar tetapi etiket tidak dikirim malah kadaluwarsa diminta struk pembayaran saya sudah tidak punya hanya sms banking tetapi tetap saja tidak digubris dari pelayanan pelanggan nya sudah email dan telepon tetap tidak ada results sangat mengecewakan,0.9885287880897522,2,[0.0024 0.0021 0.9955],2,[0.0035 0.0025 0.994 ],"{'telepon': 'telepon', 'pelayanan': 'pelayanan', 'mengecewakan': 'mengecewakan', 'hasil': 'results', 'nya': 'nya', 'pelanggan': 'pelanggan', 'email': 'email', 'sms': 'sms', 'pembayaran': 'pembayaran', 'banking': 'banking', 'kadaluwarsa': 'kadaluwarsa', 'digubris': 'digubris'}",2,0,0.2717,,,,,,,,,
"saya mesan tiket tapi tidak dikonformasi dan proses pengembalian uang yang tidak jelas dan belum ada sampai sekarang , pelayanan nya yang sangat buruk dan saran saya jangan pesan di sini , sangat mengecewakan .",2,saya mesan tiket tapi tidak dikonformasi dan proses pengembalian uang yang tidak jelas dan belum ada sampai sekarang pelayanan nya yang sangat buruk dan saran saya jangan pesan di sini sangat mengecewakan,1.0,2,[0.0041 0.0015 0.9943],2,[0.0061 0.0015 0.9924],"{'buruk': 'buruk', 'proses': 'proses', 'uang': 'uang', 'tiket': 'tiket', 'pelayanan': 'pelayanan', 'nya': 'nya', 'pengembalian': 'pengembalian', 'mesan': 'mesan', 'saran': 'saran'}",2,0,0.2476,,,,,,,,,
"sangat kecewa dengan aplikasi ini , sudah ditransfer tetapi etiket tidak dikirim saya coba telepon call centre seharian tetapi sibuk terus call genre nya , mending pakai traveloka adalah untuk pesanan selanjutnya .",2,sangat kecewa dengan aplikasi ini sudah ditransfer tetapi etiket tidak dikirim saya coba telepon call centre seharian tetapi sibuk terus call genre nya Better pakai traveloka adalah untuk pesanan selanjutnya,0.984319508075714,2,[0.0045 0.003  0.9925],2,[0.0075 0.0072 0.9853],"{'kecewa': 'kecewa', 'sibuk': 'sibuk', 'etiket': 'etiket', 'dikirim': 'dikirim', 'genre': 'genre', 'telepon': 'telepon', 'centre': 'centre', 'call': 'call', 'aplikasi': 'aplikasi', 'pakai': 'pakai', 'nya': 'nya', 'mending': 'Better', 'seharian': 'seharian'}",2,0,0.251,,,,,,,,,
melihat komen nya 90 % negatif jadi pikir-pikir buat mencari tiket kereta di sini . mending aplikasi yang lain saja yang sudah terbukti bagus bertahun-bertahun .,2,melihat komen nya 90 negatif jadi buat mencari tiket kereta di sini Better aplikasi yang lain saja yang sudah terbukti bagus,0.9769117832183838,2,[0.0166 0.0111 0.9723],2,[0.2545 0.0891 0.6565],"{'komen': 'komen', 'nya': 'nya', 'mending': 'Better', 'aplikasi': 'aplikasi', 'mencari': 'mencari', 'kereta': 'kereta', 'tiket': 'tiket'}",2,1,0.2265,,,,,,,,,
aplikasi tukang bohong . promo gratis makan tidak terjadi . komplain ke pelayanan pelanggan dengan email tidak ditanggapi . komplain by phone hanya dicatat saja tidak ada tindak lanjut . sangat tidak direkomendasikan untuk siapa pun .,2,aplikasi tukang bohong promo gratis eat tidak terjadi komplain ke pelayanan pelanggan dengan email tidak ditanggapi komplain by phone hanya dicatat saja tidak ada tindak lanjut sangat tidak direkomendasikan untuk siapa pun,0.9856876730918884,2,[0.0048 0.0018 0.9934],2,[0.0061 0.0021 0.9919],"{'makan': 'eat', 'bohong': 'bohong', 'ditanggapi': 'ditanggapi', 'by': 'by', 'pelanggan': 'pelanggan', 'phone': 'phone', 'tindak': 'tindak', 'gratis': 'gratis', 'email': 'email', 'pelayanan': 'pelayanan', 'tukang': 'tukang', 'promo': 'promo', 'aplikasi': 'aplikasi'}",2,0,0.2552,,,,,,,,,
kata nya dapat promo 100 ribu . tapi setelah di bayar di atm - nya ternyata harga normal . sudah saya kirim email tapi tidak ada balasan . mengecewakan .,2,kata nya dapat promo 100 ribu tapi setelah di bayar di atm nya ternyata harga normal sudah saya kirim email tapi tidak ada balasan mengecewakan,1.0,2,[0.0031 0.0028 0.9941],0,[0.8456 0.058  0.0964],{'atm': 'atm'},2,0,0.2423,,,,,,,,,
"saya sudah bayar untuk hotel tapi etiket tidak terbit , saya sudah kirim email bukti pembayaran nya tapi tetap tidak ada mengikuti naik - nya . sampai hari h mau cek - in ini . sudah menghubungi bolak balik pelayanan pelanggan sama saja ngulang-ngulang informasi dari awal . dijanjikan akan ditelpon tapi tidak dihubungi juga sampai sekarang . saya mau laporkan polisi . menyebalkan .",2,saya sudah bayar untuk hotel tapi etiket tidak terbit saya sudah send email bukti pembayaran nya tapi tetap tidak ada mengikuti naik nya sampai hari h mau cek in ini sudah menghubungi bolak balik pelayanan pelanggan sama saja information dari awal dijanjikan akan called tapi tidak dihubungi juga sampai sekarang saya mau laporkan police menyebalkan,0.9815161228179932,2,[0.0028 0.0026 0.9946],2,[0.0039 0.0064 0.9897],"{'menyebalkan': 'menyebalkan', 'laporkan': 'laporkan', 'ditelpon': 'called', 'dijanjikan': 'dijanjikan', 'bolak': 'bolak', 'pelayanan': 'pelayanan', 'dihubungi': 'dihubungi', 'pelanggan': 'pelanggan', 'polisi': 'police', 'menghubungi': 'menghubungi', 'informasi': 'information', 'bayar': 'bayar', 'terbit': 'terbit', 'bukti': 'bukti', 'in': 'in', 'cek': 'cek', 'kirim': 'send', 'h': 'h', 'etiket': 'etiket', 'mengikuti': 'mengikuti'}",2,0,0.3308,,,,,,,,,
"saya kecewa karena saya sudah transfer dan belum dikonfirmasi saya telepon malah pelanggan sibuk terus , aduh kecewa nih gue .",2,saya kecewa karena saya sudah transfer dan belum dikonfirmasi saya telepon malah pelanggan sibuk terus aduh kecewa nih gue,1.0,2,[0.0019 0.002  0.996 ],2,[0.0025 0.002  0.9955],"{'dikonfirmasi': 'dikonfirmasi', 'kecewa': 'kecewa', 'telepon': 'telepon', 'transfer': 'transfer', 'aduh': 'aduh', 'pelanggan': 'pelanggan', 'sibuk': 'sibuk'}",2,2,0.2232,,,,,,,,,
saya sudah transfer ratusan ribu dan sesuai nominal transfer . tapi tiket belum muncul juga . harus diwaspadai ini aplikasi ini . bahaya .,2,saya sudah transfer ratusan ribu dan sesuai nominal transfer tapi tiket belum muncul juga harus diwaspadai ini aplikasi ini bahaya,1.0,2,[0.0024 0.0053 0.9923],2,[0.0029 0.0148 0.9823],"{'bahaya': 'bahaya', 'diwaspadai': 'diwaspadai', 'aplikasi': 'aplikasi', 'muncul': 'muncul', 'tiket': 'tiket', 'ratusan': 'ratusan', 'ribu': 'ribu', 'sesuai': 'sesuai'}",2,1,0.2258,,,,,,,,,
"pelayanan pelanggan tidak respon , komentar disuruh email , email saya tidak ditanggapi , sudah beberapa hari yang lalu , sampai sekarang tidak ada respon . menyusahkan saja .",2,pelayanan pelanggan tidak respon komentar disuruh email email saya tidak ditanggapi sudah beberapa hari yang lalu sampai sekarang tidak ada respon menyusahkan saja,1.0,2,[0.0021 0.0021 0.9958],2,[0.0022 0.0019 0.9958],"{'menyusahkan': 'menyusahkan', 'pelayanan': 'pelayanan', 'disuruh': 'disuruh', 'ditanggapi': 'ditanggapi', 'email': 'email', 'respon': 'respon'}",2,0,0.2321,,,,,,,,,
tolong untuk pelayana nya diperjelas ya . sudah pesan tiket sudah dibayar tetapi dengan alasan bank bermasalah dan tidak ada pertanggungjawaban untuk memulangkan uang saja harus sampai ditelpon lagi . dikirim by email untuk komponen tidak direspon . kecewa .,2,tolong untuk pelayana nya diperjelas ya sudah pesan tiket sudah dibayar tetapi dengan alasan bank bermasalah dan tidak ada pertanggungjawaban untuk memulangkan uang saja harus sampai called lagi dikirim by email untuk komponen tidak direspon kecewa,0.9930150508880616,2,[0.0034 0.0065 0.9901],2,[0.0076 0.0453 0.9471],"{'kecewa': 'kecewa', 'pertanggungjawaban': 'pertanggungjawaban', 'direspon': 'direspon', 'bermasalah': 'bermasalah', 'komponen': 'komponen', 'diperjelas': 'diperjelas', 'ditelpon': 'called', 'ya': 'ya', 'uang': 'uang', 'nya': 'nya', 'pesan': 'pesan', 'alasan': 'alasan', 'by': 'by', 'pelayana': 'pelayana', 'bank': 'bank', 'dibayar': 'dibayar'}",2,1,0.2792,,,,,,,,,
"luar biasa kecewa sangat dengan aplikasi ini , saya sudah hubungi pusat panggilan untuk cek pemesanan saya karena saya sudah bayar dan tidak muncul e - tiket nya , bahkan saya sudah kirim bukti transaksi nya ke e-mail , hingga saat ini tidak ada pihak pusat panggilan yang menghubungi , kecewa .",2,luar biasa kecewa sangat dengan aplikasi ini saya sudah hubungi center panggilan untuk cek pemesanan saya karena saya sudah bayar dan tidak muncul e tiket nya bahkan saya sudah send bukti transactions nya ke hingga saat ini tidak ada pihak center panggilan yang menghubungi kecewa,0.9415541887283324,2,[0.0027 0.0032 0.9941],2,[0.0045 0.0072 0.9883],"{'kecewa': 'kecewa', 'panggilan': 'panggilan', 'pusat': 'center', 'menghubungi': 'menghubungi', 'hubungi': 'hubungi', 'cek': 'cek', 'bayar': 'bayar', 'pemesanan': 'pemesanan', 'nya': 'nya', 'aplikasi': 'aplikasi', 'bukti': 'bukti', 'kirim': 'send', 'transaksi': 'transactions'}",2,0,0.3036,,,,,,,,,
"sangat mengecewakan , saya pesan tiket dan sudah saya bayar , padahal waktu itu belum kadaluarsa pas saya transfer , tapi sampai sekarang belum dikasih kode bokong nya , malah dikasih notifikasi sudah kadaluarsa , lalu uang nya lari nya ke mana , pas saya hubungi lewat email hanya ditanggapi sekali saja .",2,sangat mengecewakan saya pesan tiket dan sudah saya bayar padahal waktu itu belum expired pas saya transfer tapi sampai sekarang belum dikasih kode bokong nya malah dikasih notifications sudah expired lalu uang nya lari nya ke mana pas saya hubungi lewat email hanya ditanggapi sekali saja,0.9458518624305724,2,[0.0027 0.0017 0.9955],2,[0.0028 0.0026 0.9946],"{'mengecewakan': 'mengecewakan', 'lari': 'lari', 'bokong': 'bokong', 'dikasih': 'dikasih', 'notifikasi': 'notifications', 'kadaluarsa': 'expired', 'ditanggapi': 'ditanggapi', 'uang': 'uang', 'hubungi': 'hubungi', 'kode': 'kode', 'nya': 'nya', 'pas': 'pas', 'pesan': 'pesan', 'transfer': 'transfer'}",2,0,0.3014,,,,,,,,,
tolong jangan order tiket pakai aplikasi ini kalau tidak mau kecewa . benci banget . sudah transfer etiket tidak dikirim-kirim malah pesanan dibatalkan . telpon pelayanan pelanggan juga tidak diangkat . di-email tidak dibalas .,2,tolong jangan order tiket pakai aplikasi ini kalau tidak mau kecewa hate banget sudah transfer etiket tidak malah pesanan dibatalkan telpon pelayanan pelanggan juga tidak lifted tidak dibalas,0.9677797555923462,2,[0.0026 0.0016 0.9958],2,[0.0036 0.002  0.9944],"{'benci': 'hate', 'diangkat': 'lifted', 'pelayanan': 'pelayanan', 'dibatalkan': 'dibatalkan', 'telpon': 'telpon', 'dibalas': 'dibalas', 'pesanan': 'pesanan', 'banget': 'banget', 'order': 'order', 'pelanggan': 'pelanggan', 'kecewa': 'kecewa', 'tolong': 'tolong', 'etiket': 'etiket'}",2,0,0.2395,,,,,,,,,
saya pesan tiket pesawat dan sudah melakukan pembayaran sesuai instruksi namun sudah lebih dari 4 jam belum ada terbit e - tiket malahan status pesanan saya malah jadi pemesanan kadaluarsa . komplain sudah saya lakukan melalui email dan telpon pelayanan pelanggan sampai sekarang belum ada penyelesaian yang berarti . ini sangat merugikan .,2,saya pesan tiket pesawat dan sudah melakukan pembayaran sesuai instruksi namun sudah lebih dari 4 jam belum ada terbit e tiket malahan status pesanan saya malah jadi pemesanan expired komplain sudah saya lakukan melalui email dan telpon pelayanan pelanggan sampai sekarang belum ada penyelesaian yang berarti ini sangat merugikan,0.986022174358368,2,[0.0022 0.0036 0.9941],2,[0.003  0.0053 0.9917],"{'komplain': 'komplain', 'penyelesaian': 'penyelesaian', 'kadaluarsa': 'expired', 'pemesanan': 'pemesanan', 'merugikan': 'merugikan', 'pelayanan': 'pelayanan', 'telpon': 'telpon', 'status': 'status', 'email': 'email', 'pelanggan': 'pelanggan', 'lakukan': 'lakukan', 'pesanan': 'pesanan', 'jam': 'jam', 'pembayaran': 'pembayaran', 'sesuai': 'sesuai', 'pesan': 'pesan', 'tiket': 'tiket'}",2,0,0.3157,,,,,,,,,
"saya pesan ticket sampai sekarang tidak ada konformasi nya . uang sudah ditransfer , kalau seperti itu kembalikan uang nya , tai sekali , telepon pusat panggilan habis pulsa hampir 200 . tidak ada . kembalikan uang saya . jangan pernah kalian pesan tiket di sini . menyesal",2,saya pesan ticket sampai sekarang tidak ada konformasi nya uang sudah ditransfer kalau seperti itu kembalikan uang nya tai sekali telepon center panggilan habis pulsa hampir 200 tidak ada kembalikan uang saya jangan pernah kalian pesan tiket di sini menyesal,0.9889315366744996,2,[0.0022 0.0024 0.9954],2,[0.0036 0.0021 0.9942],"{'menyesal': 'menyesal', 'pesan': 'pesan', 'uang': 'uang', 'kembalikan': 'kembalikan', 'pulsa': 'pulsa', 'nya': 'nya', 'konformasi': 'konformasi', 'tiket': 'tiket', 'habis': 'habis', 'pusat': 'center', 'tai': 'tai', 'telepon': 'telepon'}",2,0,0.2949,,,,,,,,,
pembayaran sudah dilakukan tetapi e - tiket tidak dikirim-dikirim malah dipesan diblang kadaluarsa . titip cs nya berkali-berkali jwaban nya tidak ada yang membantu dan tidak sinkron semua . sampai sekarang belum jelas pengembalian uang ataupun penggantian tiket . disarankan tidak usah memakai aplikasi ini .,2,pembayaran sudah dilakukan tetapi e tiket tidak malah dipesan diblang expired titip cs nya jwaban nya tidak ada yang membantu dan tidak sync semua sampai sekarang belum jelas pengembalian uang ataupun penggantian tiket disarankan tidak usah memakai aplikasi ini,0.9578166007995604,2,[0.0044 0.0032 0.9924],2,[0.0089 0.0075 0.9836],"{'membantu': 'membantu', 'sinkron': 'sync', 'pengembalian': 'pengembalian', 'kadaluarsa': 'expired', 'jwaban': 'jwaban', 'dipesan': 'dipesan', 'titip': 'titip', 'diblang': 'diblang', 'nya': 'nya', 'cs': 'cs', 'penggantian': 'penggantian', 'uang': 'uang', 'disarankan': 'disarankan', 'e': 'e', 'tiket': 'tiket'}",2,0,0.283,,,,,,,,,
"sangat mengecewakan ! di mana kalau pesan tiket sudah dibayar sudah dikasih bukti transfer itu langsung dikasih nomor e - tiket nya . ini kok tidak ada konfirmasi apa , sudah mendekati hari h tiba pesanan kadaluarsa . pelayanan sangat buruk ! pelayanan pelanggan - nya juga tidak sopan . segera kembalikan uang pengembalian dana tiket saya !",2,sangat mengecewakan di mana kalau pesan tiket sudah dibayar sudah dikasih bukti transfer itu langsung dikasih nomor e tiket nya ini kok tidak ada konfirmasi apa sudah mendekati hari h tiba pesanan expired pelayanan sangat buruk pelayanan pelanggan nya juga tidak sopan segera kembalikan uang pengembalian dana tiket saya,0.988993763923645,2,[0.0035 0.0017 0.9949],2,[0.0039 0.0017 0.9943],"{'kadaluarsa': 'expired', 'pesanan': 'pesanan', 'pelayanan': 'pelayanan', 'buruk': 'buruk', 'mendekati': 'mendekati', 'e': 'e', 'pesan': 'pesan', 'h': 'h', 'nomor': 'nomor', 'sopan': 'sopan', 'langsung': 'langsung', 'dikasih': 'dikasih', 'nya': 'nya', 'uang': 'uang', 'dibayar': 'dibayar', 'tiket': 'tiket', 'bukti': 'bukti', 'konfirmasi': 'konfirmasi', 'pengembalian': 'pengembalian', 'transfer': 'transfer', 'kembalikan': 'kembalikan'}",2,0,0.3138,,,,,,,,,
